title,summary
마더텅 수능기출 전국연합 학력평가 20분 미니모의고사 24회 고2 영어 영역 (2021년),"정기적인 미니 실전 테스트로 수능의 감(感)을 꾸준히 단련할 수 있다. 수능 영어 독해 전 유형(어법·어휘 포함)을 매일 골고루 풀고, 채점하고, 복습 가능하다. 최근 수능 및 교육청 학력평가 기출문제를 엄선, 전 유형을 아우르는 체계적인 문항으로 배치하였고, 지문 이해를 돕는 친절한 첨삭 해설을 수록했다."
쎄듀 수능 영어 절대유형 3142,"최신 수능 및 모의 기출 문제를 철저히 분석하여 유형별 3점 문항 전략을 제시한다. 그리고 높은 오답률의 요인이 되는 요소들(생소한 소재, 내용의 추상성, 구문 및 어휘 난이도, 비유적 표현)을 완벽 반영한 고품질의 실전 모의고사 10회분을 풀어볼 수 있다. 또한, 빈칸 추론, 무관 문장, 글의 순서, 문장 삽입, 요약문 완성, 2문항 장문 유형을 수록하여 고득점을 목표로 하는 수험생에게 적합한 교재이다."
EBS 수능 기출의 미래 사회탐구영역 사회.문화 (2021년),"All New! 두꺼운 분량을 벗어난 기출문제집. 연계와 기출을 가장 잘 아는 EBS가 만든 <수능 기출의 미래>이다. 2022학년도 수능과 교육과정에 딱 맞는 문항만을 엄선하고, 핵심만 깔끔하게 정리된 슬림한 해설을 제공한다. 핵심 문항, 고난도 킬러 문항의 해설은 더 자세하게 설명하였으며, 한 번 더 듣고 싶은 문항의 해설 강의는 문항코드 검색으로 쉽게 찾아볼 수 있다."
씨뮬 9th 수능기출 사설 최신 상반기 모의고사 영어 고3 (2021년),"모평, 학평, 이투스, 종로, 비상의 2020년 상반기에 실시된 모의고사를 실제 시험지의 크기와 느낌 그대로 독점 수록하여 실전처럼 테스트가 가능하다. 2022학년도 수능 체제에 맞춰 공통과목+선택과목으로 구성하여 새로운 수능에 적응할 수 있도록 구성하였으며, 선택과목 문제를 수록하여 학생들의 빈틈없는 학습이 가능하도록 구성하였다. 영어 해설은 답을 알려주는 데서 그치지 않고 정답의 이유와 오답의 이유를 꼼꼼히 짚어주어, 한 문제를 풀어도 자신의 실력에 도움이 될 수 있도록 구성했다."
마더텅 수능기출 20분 미니모의고사 24회 고3 국어 영역 (2021년),"매일 12문제씩, 20분 풀고 확인하는 기출 미니모의고사다. 정기적인 미니 실전 테스트로 수능의 감(感)을 꾸준히 단련할 수 있으며, 수능 국어 공통 영역(독서.문학)을 매일 골고루 학습할 수 있다. 최근 수능 및 학력평가 기출문제를 체계적으로 배치하였고, 전 지문, 모든 선지에 100% 첨삭 해설을 제공한다."
2022 수능대비 마더텅 수능기출문제집 기하 (2021년),"총 567문항, 60개의 유형을 단계적으로 배치하여 수능 준비에 최적화한 교재다. 28개년 (1994~2021학년도) 수능 · 모의평가 및 20개년(2001~2020년) 전국연합 학력평가 기출문제 중 새 교육과정에 맞는 기하 과목 범위 우수 문항을 수록했다."
Xistory 자이스토리 수능 국어 문법 실전 (2021년),"문법 영역을 가장 효율적으로 공부할 수 있도록 수능에 실제 출제되는 문법 개념 및 유형별로 단원을 구성하였고, 반드시 알아야 할 문법 개념만을 충실히 설명하였다. 2021학년도 수능·평가원 기출문제에 출제된 개념을 콕 집어 제시하고 출제 경향을 분석하여 수능·평가원의 출제 경향과 흐름을 파악할 수 있도록 하였으며, 그림, 사진, 도표 등을 풍부하게 활용하여 문법 개념을 쉽게 이해하고 머릿속에 시각적으로 각인하여 오래 기억되도록 하였다."
쎈기출 고등 수학 2 (2021년),"쎈기출은 최근 5개년(2021~2017) 수능, 모의평가 전 문항과 그 밖의 기출 우수 문항 등 꼭 필요한 기출 문제를 필요충분하게 선별하여 구성하였다. 문제를 개념, 문제 형태, 해결 전략 등 입체적으로 분석하여 유형으로 분류하고 유형별 명쾌한 해결법을 제시하여 수능 실전에 적용하기 쉽도록 하였다."
EBS 수능의 7대 함정 과학탐구영역 화학 1 (2021년용),"수능의 역사를 철저히 분석하여 수험생들이 자주 실수를 하고 출제자가 파 놓은 함정에 빠져 오답을 고르게 되는 대표적인 7가지 수능의 함정 유형을 선정하였다. 함정을 피하는 방법과 효과적인 대비법을 익혀 자신의 약점을 점검, 보완하고 성적을 향상할 수 있도록 구성하였다."
수능 기출의 바이블 국어 독서 (2021년),"2022학년도 예시문항+8개년 기출 연도별 구성으로, 시간 제한을 두고 회차별로 문제를 풀어봄으로써 평가원 문제의 출제 경향을 파악하고 자신의 실력을 점검할 수 있도록 하였다. 모든 기출 문제를 인문, 사회, 과학, 기술, 예술, 융합 등 6개의 영역으로 분류하고, 소주제별로 묶어 문제를 구성하였으며, 평가원.교육청 문항과 사관학교, 경찰대, LEET 시험에서 고난도 문제만을 선별하여 실전 모의고사 10회로 구성하였다."
100발 100중 고등 영어 기출문제집 B 1학기 기말고사 천재(이재영) (2021년용),"기출문제를 종합 분석하여 출제율이 높은 문제를 다량 수록하였다. 출제 경향과 출제율을 반영해 실전 문제 및 수능형, 서술형 문제까지 완벽 대비할 수 있다. 교과서의 모든 내용이 자연스럽게 각인되는 단계별 학습 설계이며, 수업이나 자기주도 학습을 통해 학습 내용을 완벽하게 습득할 수 있는 구성이다. 또한, 풍부한 예시문과 자세한 설명을 통해 부족한 학습 보충이 가능하다."
Xistory 자이스토리 수능 국어 화법·작문 실전 (2021년),"화법·작문 영역을 가장 효율적으로 공부할 수 있도록 수능에 실제 출제되는 화법과 작문의 유형별로 단원을 구성하였고, 반드시 알아야 할 내용만을 충실히 설명하였다. 2021학년도 수능·평가원 기출문제에 출제된 개념을 콕 집어 제시하고 출제 경향을 분석하여 수능·평가원의 출제 경향과 흐름을 파악할 수 있도록 하였으며, 자주 나오는 문제 유형의 풀이 순서를 제시하여 문제에 대한 접근과 이해를 돕도록 하였다."
홀수 국어 기출 훈련도구 문학 (2021년),"새롭게 바뀐 2022학년도 개정 수능 국어, 홀수 기출분석서로 혼자서도 완벽하게 대비할 수 있다! 개정 수능 국어를 완벽하게 대비할 수 있도록 평가원에서 제시한 2022학년도 예시문항 국어영역 전문항을 수록하고 자세하게 분석하여 최적화된 기출 분석 학습 방법을 제시하고 있다.

문학 개념어 및 간략한 문제 접근법을 담아 수능 국어의 기반을 탄탄하게 할 수 있으며, 이상적인 문학 지문 독해를 위한 3STEP 훈련을 통해 문학 지문 독해에 필요한 핵심 요소를 빠르게 파악할 수 있다. 또한 2만 2천개 이상의 수험생 질문을 반영하고 이에 대한 명쾌한 답변과 자세한 해설을 제공하였으며, 홀수만의 차별화된 심화 보충 해설로 혼자서도 완벽하게 기출 분석을 할 수 있도록 하였다."
메가스터디 수능기출분석서 영어영역 독해 (2021년),"메가스터디북스 수능 기출 분석서 독해는 2017학년도~2021학년도의 최신 5개년 수능, 6월, 9월 평가원 모의고사의 영어독해 기출문제 전 문항을 수록한 수능 기출문제집이다. 2단계 채점 학습, 유형별, 요인별 취약점 분석, 취약점별 집중 학습 과정을 통한 새로운 기출 학습 전략을 제시한다. 2단계 채점 학습으로 안다고 착각했거나 찍어서 맞힌 문제를 체크하고, 이를 토대로 나의 취약점을 집중 학습하여 실전에서 발휘되는 진짜 실력을 키울 수 있다.

* 메가스터디 수능기출분석서는 (구)빅데이터 수능기출문제집의 새 이름입니다."
짱 중요한 유형 미적분 (2021년),기본＋기출＋예상 3단계로 유형을 완벽 공략한다. 수능에 잘 나오는 중요한 유형만 모아 놓은 기출분석 교재이다.
포카칩 N제 수학 1 + 수학 2 + 미적분 220제 (2021년),"수학영역 고득점을 위해 적합한 난이도로 구성되어 있다. 단원 통합형 및 다양한 해법이 가능한 문항 위주로 구성되어 있다. 자신의 부족한 개념과 오개념을 확인할 수 있으며, 수학적 아름다움과 푸는 즐거움을 느낄 수 있다."
2021 한 장으로 보는 영문법 지도,"중고교 영문법 및 토익 영문법 일체 포함한 포스터 형식 교재이다. 영문법 주제들을 한 장에 담아 영문법의 '숲'을 볼 수 있도록 구성하였고, 벽에 붙여놓고 오며가며 자주 볼 수 있도록 설계되었다. 각 영문법 주제들의 연결 관계를 연구하여 특허를 출원하였으며, 2021 최신판으로 코로나, 조 바이든 등 키워드로 예문을 구성하였다."
100발 100중 고등 국어 기출문제집 B 1학기 기말고사 비상(박영민) (2021년용),"전국 고등학교의 내신 기출문제를 종합, 분석하여 핵심 적중 문제 다량 수록하였으며, 최신 출제 경향과 출제율을 100% 반영하여 등급을 가르는 서답형, 서술형 문제까지 완벽 대비할 수 있다. 또한 '지문 분석-확인 문제-기본 평가-심화 평가'로 이어지는 단계별 학습 설계로 내용을 완벽하게 습득할 수 있으며, 최종 점검 실전 모의고사도 담겨있다."
100발 100중 고등 수학 기출문제집 수학 1 (하) (2021년),"전국 고등학교 기출문제를 분석, 연구하여 다양한 유형과 난도의 문제들을 출제 비율과 빈도에 따라 중단원별로 구성한 새 교육과정에 맟춘 내신 1등급 대비 교재다. 교과서 개념을 체계적으로 정리하고 예제를 수록하여 개념 복습이 가능하도록 구성하였다. BEST 유형은 2단계에 걸쳐 쌍둥이로 구성하여 집중 학습이 가능하도록 하였다. 조건 또는 형태가 바뀌어 해결이 어려운 문제는 접근 방법을 제시한 특강 형식으로 구성하여 문제 해결을 가능하도록 하였다.

서술형 문제는 출제율이 높은 문제만을 선별하여 수록하였고, 채점 기준에 맞게 서술할 수 있도록 구성하였다. 실전 문제는 BEST 유형부터 BEST 유형에서 다루지 못한 출제율 높은 문제까지 수록하여 실전점검을 할 수 있도록 하였다. 실제 모의고사 문제를 변형문제와 함께 수록하여 실전에 대비할 수 있도록 하였다."
연계소문 - EBS수능특강 영어독해연습변형문제 915제,2022년 EBS 수능특강 영어독해연습 1강에서 Test3까지의 변형문제를 수록하였다. 2022학년도 학교 내신과 대학수학능력시험 영어과 시험을 철저히 대비할 수 있도록 도움을 주고자 입시영어연구회에서 수능출제 원리에 맞춰서 제작한 변형문제집이다.
2022 수능대비 마더텅 수능기출 모의고사 35회 세계지리 (2021년),"시험 당일 실제 상황과 동일한 환경에서 35번 반복 연습이 가능한 모의고사 문제집이다. 기출문제로 만들 수 있는 최다 구성으로, 5개년 수능 및 모의평가 15회 + 5개년 학력평가 20회, 700문항을 수록하였다. 수능 필수 개념 및 수능 완전 정복을 위한 [기출 OX 540제] 특별 부록을 실었다. 단원별 문항 분류표와 자가 진단을 위한 회차별 등급컷을 제공한다. 전 문항 정답률을 표기하였다."
써밋 N제 수학 2 (2021년),44테마와 124드릴 문제로 수학2를 완전 정복한다. 중요 빈출 테마 44개를 엄선하여 각 테마별로 고퀄 신작 드릴문항을 제시하였다. 준킬러문항 대비를 목표로 한 발상 판단의 근거 전달에 초점을 맞춘 신개념 문제집이다. [대표문항] → [접근원리해설] → [유사문항] 3단계 구성으로 발견적 추론 능력을 업그레이드한다.
EBS Final 실전모의고사 사회탐구영역 한국지리 (8절) (2021년),실제 수능과 동일한 배점과 난이도의 모의고사로 구성하였다. 실제 시험 시간에 맞춰 모의고사를 풀어 보며 실전 감각을 익히고 약점을 보완할 수 있다. 풀어 본 내용을 스스로 점검할 수 있도록 자세하고 친절한 해설을 수록하였다. 해설을 꼼꼼하게 확인하면 실력을 향상시킬 수 있다.
훈련도감 비문학 (2021년),"비문학(독서) ‘지문독해와 문제풀이’ 사고과정 훈련 문제집이다. 최신 출제코드에 적합한 평가원 11개년 기출문제로 훈련할 수 있다. 쉬운 문제에서 어려운 문제로 난이도순으로 되어 있어 중하위권도 실력 향상시키기에 적합하게 구성하였다. 점점 어려워지는 고난도 비문학 문제를 대비한 「고난도 긴 지문」과 「주제 통합」를 강화하였고, 시험장에서 문제푸는 사고과정을 보여 주는 실전적 지문독해와 문제분석식 해설을 실었다. 친절하고 자세한 지문분석과 문제해설집을 제공한다."
새로 바뀐 대입자기소개서 자연계열,"2022학년도 대학입학 제도 개편안이 발표되면서 많은 학생은 물론 학부모까지 곤혹스러워했다. ‘자기소개서’가 2024학년도에는 없어질 운명이라는 내용이 포함되었기 때문이다. 그러나 2021년 현재 고3, 고2인 학생은 어느 대학에 지원하느냐에 자기소개서 작성 여부가 달려 있다. 자신이 지원할 6개의 대학이 모두 자기소개서를 폐지하지 않았다면 결국 한 번은 작성해야 한다는 말이다. 2022학년도부터 새롭게 변경된 대입자소서 양식에 맞춰 어떻게 자기소개서를 작성해야 하는지 그 해답을 알려주는 책이다."
내신 꼭 수학1(B) 기말고사 (2021년),쉽다! 빠르다! 이제 곧 시험인데 수학 문제를 모두 풀어볼 시간이 부족하다면? 걱정하지 말고 내신 꼭 한 권만 풀어보면 된다. 출제율이 높은 기출 문제 위주로 구성하여 보다 효과적으로 내신 대비를 할 수 있도록 하였다.
고등학교 국어 내신 100점 기출문제집 신사고(민현식) (하) (2021년),"고등국어 내신100점 기출문제집은 고등 1학년 국어 내신대비 교재이다. 전국 고등학교 기출문제를 분석하고, 출제 유형별로 분류하여 가장 많이 출제된 문제들을 엄선, 수록한 100% 학교 기출문제집으로 편집, 출판하였다. 소단원 핵심정리 - 핵심 출제 유형 - 교과서 분석 노트 - 소단원 예상문제 - 단원 종합문제로 구성되어 있다."
일필휘지,"2022학년도부터 가천대에서 진행하는 약술형 논술고사는 기존의 대입 논술과는 성격이 다르다. 기존 논술고사가 400~1000자의 긴 서술형 답안을 요구하고 정해진 시험 범위가 없는 반면, 약술형 논술고사는 단답형의 답안을 서술하고 EBS 연계교재와 교과서 지문을 직접 활용하는 방식이다.

『일필휘지』는 EBS 연계교재의 지문 및 학교별 시험 출제범위를 분석하고 출제한 모의고사를 수록하여 약술형 논술 전형에 지원한 수험생들에게 도움을 주고자 한다."
P.I.R.A.M 피램 수능 국어 생각 워크북 독서편 (2021년),"수능 국어가 변했다. 유형이 변했고, 문제의 순서가 변했다. 나아가 더 깊은 이해력, 더 높은 사고력을 요구하고 있다. 너무나 어려워진 수능 국어, 여러분을 고득점으로 이끄는 것은 결국 '일관된 생각의 힘'이다. 어떤 '생각'을 해야 하는지, 어떻게 그 '생각'을 할 수 있는지 자세하게 알려준다."
EBSi 강의노트 사회탐구영역 큰★별샘 최태성의 개정 고급 한국사 전근대,강사가 직접 자신의 강의에 최적화하여 집필한 교재로 EBSi 사이트를 통해 강좌를 들으며 이용할 수 있다.
유형 + 내신 고쟁이 수학 (상) (2021년용),"학생부(내신)의 중요성 강조에 따라 2015 개정 교육과정에 맞는 내신 시험에 자주 출제되는 유형 훈련서이며 최근 4개년간 실제 고등학교 중간·기말고사에 출제된 500개 이상의 시험지를 분석하여 반영했다. 유형서+심화서 형태의 중상위권 교재이다.

교과서 수준의 기본 문항부터 다양한 형태의 최고난도 킬러 문항까지 단계별로 담아내었고 선수학습과의 연결을 통해 개념의 흐름을 보여주는 ‘개념 정리’ 를 수록하였다. 대표문항 풀이의 흐름을 보여주는 '스키마(schema)’를 수록하였으며 내신 기출은 물론, 수능/모평 기출문제까지 철저하게 분석하여 개정 교육과정에 맞게 반영하였다."
개념 + 유형 고등 수학(상) (2021년용),개념을 완벽하게 이해할 수 있는 [개념편]과 실전 문제를 유형별로 풀어볼 수 있는 [유형편]으로 이루어진 고등 수학 내신 기본서다.
개념원리 RPM 알피엠 고등 수학 미적분 (2021년용),다양한 문제를 유형별로 정리한 유형별 문제기본서다.
씨뮬 9th 기출 전국연합학력평가 3년간 모의고사 고1 영어 (2021년),"최신 3년간 전국연합학력평가 모의고사 12회를 구성하였다. 전국연합학력평가 모의고사를 실제 시험에 응시하듯 풀어보고 자신의 실전 능력을 진단할 수 있다. 또한, 최신 유형과 난이도를 반영한 씨뮬 모의고사로 2021년 학평과 내신을 동시에 대비할 수 있다. 과목별로 기출 문제를 푸는 가장 효과적인 방법을 제시하고 이를 적용하여 상세하게 설명하였으며, 문제 풀이 후 빠른정답과 등급컷을 바로 확인하여 실력 향상에 유용하다."
新수학의 바이블 수학 2 풀이집 (2021년용),"<新수학의 바이블 수학 2> 풀이집이다. 2015 개정 교육과정을 가장 확실하게 반영한 고등 수학 기본서로, 접근방법 -> 상세풀이 -> 보충설명 3단계의 체계적이고 자세한 풀이 방식으로 문제에 대한 접근 및 해결방법을 쉽게 이해할 수 있다."
新수학의 바이블 확률과 통계 (2021년용),"나의 예제를 숫자바꾸기(모방) -> 표현바꾸기(변형) -> 개념넓히기(응용) 3단계 유제로 학습하여 유형에 대한 적응력을 높일 수 있으며, 기본다지기 -> 실력다지기 수준별 연습 문제를 통해 기본에서 고난도까지 문제 해결력을 기를 수 있다. 또한, 접근방법 -> 상세풀이 -> 보충설명 3단계의 체계적이고 자세한 풀이 방식으로 문제에 대한 접근 및 해결방법을 쉽게 이해할 수 있다."
2021 마더텅 전국연합 학력평가 기출문제집 고1 영어 듣기 (2021년),"전국 영어듣기 능력평가와 전국연합 학력평가 대비를 위한 기출문제집이다. 총 23회, 2015~2020 6개년 고1 전국연합 학력평가 기출문제 391문항을 수록하였으며, 전 회차 문제지.딕테이션에 듣기 파일 QR코드를 제공한다. 해설에 영어 대본과 한글 해석이 함께 있는 편리한 구성으로 되어있다."
1등급 만들기 생활과 윤리 725제 (2021년용),"내신 1등급의 노하우를 빠르게 터득할 수 있도록 전국의 고등학교 기출 문제를 철저히 분석하여 만든 기출 분석 문제집이다. 시험에 꼭 나오는 핵심 개념을 선별하여 정리하였고, 시험에 자주 나오는 유형을 엄선하여 문제를 구성함으로써 내신 1등급을 문제없이 달성할 수 있도록 하였다."
2021 마더텅 전국연합 학력평가 기출문제집 고2 국어 문학,"중간.기말고사와 전국연합 학력평가 대비를 위한 기출문제집이다. 총 366문항, 2013~2020년 최신 8개년 전국연합 학력평가 우수 문항을 수록하였으며, 전 문항 모든 선지의 정.오답 풀이에 명확한 지문 근거를 제시하였다. 상세하고 친절한 어휘 풀이 및 관련 작품을 제시하였고, 수능 대비를 위한 고3 연계 지문을 수록하였다."
MAPL 마플교과서 수학 (하) (2021년용),"개념서와 문제집이 한 권으로 이루어진 단권화 교재다. 반복적인 문제의 흐름과 확인, 변형, 발전문제의 심화된 고난도 문제를 통해 수학의 힘을 기를 수 있다. 학교 내신뿐만 아니라 전국연합모의고사 대비, 평가원모의고사 및 수능을 대비하는 복합적인 사고력을 기를 수 있다."
경선식 영단어 초스피드 암기비법 수능 휴대용 암기장,"<경선식 영단어 초스피드 암기비법 - 수능>에 수록된 단어들을 '표제어-우리말뜻'으로만 정리한 휴대용 암기장이다. 최적의 어휘로 구성하였고, 연상법, 단어 뜻, 예문 개선으로 강력해진 암기효과를 볼 수 있다. 접두어 어근 + 해마학습법 파트는 별도로 구성하였다."
경선식 영숙어 초스피드 암기비법 수능,"2003년에 처음 출간된 후 300만명 이상의 학생들이 보아온 스테디셀러이다. <경선식 영숙어 초스피드 암기비법 수능>은 수능 수험생들을 위해 그동안 수능 시험에 출제되었던 모든 숙어와 모의고사 빈출 숙어들을 모아 최적의 숙어들만 공부하도록 하여 시간 낭비를 줄일 수 있다.

또한 전치사에 대한 막연한 두려움을 가지고 있는 대다수의 수험생들에게 전치사나 부사의 뜻과 쓰임을 이해하고 익숙하게 함으로써 숙어에 대한 자신감을 갖게 하고 또한 독해력도 한 차원 향상시킬 수 있도록 하였다"
EBS 국어 독해의 원리 현대시 (2021년용),"예비 고1~고2 학생들을 대상으로 문학 작품과 독서(비문학) 지문을 독해하는 방법을 정리한 교재다. 독해 방법을 6가지 원리로 정리, 작품과 지문을 독해할 때 필요한 요소들을 한 번에 학습할 수 있다. 현대시, 현대 소설, 고전 시가, 고전 산문, 독서(비문학) 5권으로 구성하여 영역별로 집중 학습이 가능하다. 원리 익히기'에서 원리를 익히고, '원리 다지기'에서 원리를 적용하여 학습하는 단계별 구성으로, 작품과 지문마다 세세한 설명과 풍부한 보충 자료들을 제공하여 깊이 있는 학습이 가능하다. 내신형 문제, 단답형 문제, 서술형 문제, 수능형 문제 등 다양한 유형의 문항을 배치하여 내신과 수능을 동시에 대비할 수 있다."
EBS 올림포스 현대문학 (2021년),"올림포스 현대문학은 문학 교과서에 실린 작품은 물론, 좀 낯설지만 꼭 알아 두어야 할 작품을 선정하여 작품이 주는 의미, 작가의 사상 등 문학 작품에 대한 종합적 감상 능력을 향상시키고 내신과 대학수학능력시험에 대비한 기초 소양을 다질 수 있도록 구성하였다. 문학 교과서 10종에 실린 문학 작품 중 문학사적으로 중요한 작품, 수록 빈도수가 높은 작품, 새롭게 수록된 작품을 자세히 다루었다."
1등급 만들기 생명과학 1 540제 (2021년용),"전국 고등학교의 기출 문제에서 뽑은 고빈출 유형 및 고난도, 통합형 문제를 수록하여 실제 시험에서의 문제 해결 능력을 기를 수 있도록 구성하였다."
2021 마더텅 전국연합 학력평가 기출문제집 고1 국어 독서 (2021년),"중간·기말고사와 전국연합 학력평가 대비를 위한 기출문제집으로, 전 지문, 모든 선지에 100% 첨삭 해설을 수록하였다. 총 421문항, 2017~2020년 전국연합 학력평가 전 문항 + 2014~2016년 전국연합 학력평가 고난도 문항을 선별하여 수록하였다. 전 문항 모든 선지의 정·오답 풀이에 명확한 지문 근거를 제시하였고, 지문 이해를 돕는 풍부한 시각 자료를 실었다. 각 지문별 문제 풀이 시간을 제시하여 실제 시험 시간 관리에 완벽 대비할 수 있다. 고3 연계 지문을 통한 수능 최적화 훈련이 가능하다."
2022 수능대비 마더텅 수능기출문제집 세계사 (2021년),"총 946문항을 6개의 단원으로 나누어 수록했다. 2021학년도 수능·모의평가, 2020년 학력평가 기출문제 전 문항과 2012~2019년 시행된 수능·모의평가·학력평가 기출문제를 선별하여 수록했다."
Reading Expert 4,"Reading Expert는 중고등학생을 대상으로 한 5단계 구성의 원서 독해 교재다. 단계별 학습으로 독해기술, 배경지식, 문장 구조, 어휘 등의 지식을 확장시킬 수 있으며, 이를 통해 독해 실력을 향상시킬 수 있다."
내신 100신 기출 예상 문제집 High School English 1 능률(김성곤 외) (2020년용),"2015 개정 교육과정 High School English Ⅰ (김성곤) 교과서의 중간.기말고사를 준비하는 학생들을 위한 내신 대비서이다. 내신에 나오는 교과서 어휘, 문법, 본문 핵심 내용을 정리하였고, 실제 내신 출제 경향을 반영한 기출 및 예상 문제를 수록하였으며, 내신 대비 종합 서술형 문항을 수록하였다."
