title,summary
떠나기 전 마지막 입맞춤,"<모든 날이 소중하다>와 <창작 면허 프로젝트>를 통해, 그림 그리기에 대한 열망은 있지만 선뜻 실천하지 못했던 수많은 잠재 예술가들에게 영감을 주었던 대니 그레고리의 책이다. 교통사고로 하반신 마비가 되는 끔찍한 일을 겪고도 웃음을 잃지 않았던 아내가 또 다른 사고로 세상을 떠난 후 1년 동안 저자가 기록한 그림일기를 묶었다.

25년을 함께해 온 아내의 비극적 죽음. 이 믿을 수 없는 거대한 절망 앞에서 무엇을 할 수 있을까? 쓰레기봉투를 사는 사소한 일부터 아내에게 작별을 고하고 아들을 돌보고 자신을 추스르는 일까지 그 무엇도 제대로 해낼 수 없을 것 같다. 대니 그레고리는 자신이 가장 잘 아는 방법으로 아내의 죽음을 애도하고 끝을 알 수 없는 슬픔을 견뎌 낸다. 바로 그림과 함께 쓴 일기다.

대니 그레고리의 개성 있는 글과 그림은 아내를 잃은 뒤 한 해 동안 저자의 인생에서 가장 어두웠던 순간이자 한편으로는 가장 밝게 빛났던 순간을 섬세하게 보여 준다. 이 내밀한 회고록에는 신체 일부가 절단된 것 같은 상실감과 공허함, 혼자 남은 삶에 대한 망막함, 가짜일지언정 아내의 흔적을 곁에 붙잡아 두고 싶은 애절함과 더불어 한편으로는 이 모든 감정의 구렁텅이와 괴로움에서 벗어나고 싶은 복잡한 심경이 시원스러울 만큼 솔직하게 드러나 있다."
CCM 우쿨렐레 쉬운 연주곡집,"우쿨렐레를 시작하는 사람들을 위한 3가지 타입의 차별화된 악보집이다. 한 권으로 우쿨렐레에서 표현할 수 있는 모든 방법을 배울 수 있는, 내용의 풍성함이 가장 큰 장점이다. 실력에 따라 단계별로 향상될 수 있도록 4단계로 정리하여 본인의 수준에 맞는 단계부터 연주하도록 하였다.

첨부된 CD는 멜로디가 포함된 음원(AR)과 멜로디가 포함되지 않은 음원(MR)이 함께 수록되어 있는데, 멜로디가 포함된 음원은 듣고 따라서 하는데 도움을 주기 위함이고, 멜로디가 포함되지 않은 음원은 공연이나 발표회 때 활용하면 좋을 것이다."
모래시계 1,"한국 드라마 역사에 한 획을 그은 드라마 [모래시계] 대본집이다. 방영 당시 최고 시청률 64.5%라는 경이적인 기록을 세우며 ‘귀가 시계’로 불릴 만큼 선풍적인 인기를 끈 드라마 [모래시계]는 1995년 1월 첫 방송을 한 이후 지금까지 시청률로나 작품성으로나 따라올 드라마가 없을 만큼 명작으로 손꼽히는 작품이다. 그 감동을 고스란히 담은 대본집은 폭풍우 같은 현대사의 질곡에서 벗어날 수 없는 주인공들의 이야기로 평생 잊히지 않을 감동을 선사한다.

드라마 [모래시계]는 1970~1980년대 대한민국의 회색빛 역사를 보여주는 작품이다. 아직까지도 왜곡된 인식이 남아 있는 광주민주화운동을 비롯하여 YH 사건, 불법 슬롯머신과 조직폭력배 사건 등 실제로 있었던 사실을 배경으로 하여 리얼리티를 더했으며, 그 속에서 희생된 사람들의 모습을 진실성 있게 전달한다.

실제로 조직폭력배를 찾아가 취재하고, 외신이 취재한 광주민주화운동 실제 모습을 그대로 묘사하는 등 완성도를 높이기 위해 노력한 송지나 작가의 열정이 대본에 고스란히 묻어난다. 단순히 암울한 현대사에 서 있었던 세 명의 인물만 조망하고 있는 것이 아니라 그 인물들을 통해 우리의 모습을 돌아볼 수 있게 해준다.

[모래시계] 작가판 대본집 1권에는 13부까지의 대본이 담겨 있으며, 2권에는 24부까지의 대본이 담겨 있다. 더불어 책 속에는 방송분에서 보지 못한 장면과 자세한 등장인물 소개, 그리고 드라마의 배경이 되는 대한민국 현대사에 대한 설명이 수록되어 있다."
12주 완성 클래식기타 고급 Viva 클래식기타,"<12주 완성 클래식기타 Viva! 클래식기타 고급> 교재는 독학할 때 도움이 되는 연습, 이제까지 보지 못했던 스킬들, 그리고 다양한 연주곡들로 이뤄져 있다. 손가락을 더 넓게 벌리기 위한 스케일 연습, 아구아도의 연습곡을 통한 모든 종류의 아르페지오 연습 등 기본기를 쌓기에 효과적인 연습들이 적절한 구성을 보여준다.

특히 유명한 연주자들도 매일 한다는 테크닉 연습법은 꾸준히 실력을 쌓기에 안성맞춤이다. 또한 4포지션부터 9포지션까지 지판을 두루 익혀 연주의 폭을 넓힐 수 있도록 하였고, 화음 아르페지오, 변칙 튜닝, 트레몰로 주법 등 다양한 클래식 기타 곡을 연주하기 위한 고급 테크닉들이 수록되어 있다.

연주곡으로는 많은 이들이 연주를 꿈꾸는 [로망스(Romance de Amor)]와 감미로운 [La grima], [The Hunter of City] 외에도 다양한 유명 곡들을 배우게 된다. 또한 음악 동영상 강의 전문 사이트 도약닷컴에서 연주곡을 직접 녹음한 예제 mp3 파일을 제공하고 있으니 연주 시 참고하면 큰 도움을 받을 수 있을 것이다."
한국 가요사 1,"20세기 한국 대중가요의 역사를 방대한 자료와 치밀한 고증으로 집대성한 책이다. 이 책은 지난 100년 동안 우리 대중가요계를 풍미하며 민중의 삶을 어루만져온 수많은 노래들, 그리고 작곡가, 작사가, 가수, 연주자 들의 잘 알려지지 않았던 생애와 음악 세계, 나아가 우리 민족과 그들의 노래가 함께 겪어온 정치 사회적 격동에 대해 더할 수 없이 풍성하고 생생한 필치로 그려내고 있다.

저자는 재일 한국인으로서 당시 국내에서도 거의 소실된 상태였던 음반, 가사집, 관련 문헌, 사진 등의 소중한 자료들을 차곡차곡 수집하기 시작했고, 그 결과 1988년에 해방 이전 시기를 다룬 <한국 가요> 1권을 일본 현지에서 출간할 수 있었다. 이 책은 이후 1992년에 국내에도 번역 출간되어 근현대 한국 대중가요 연구의 폭발적인 부흥에 핵심적인 기여를 한 바 있다.

20여 년의 세월이 흐른 2009년 저자는 1권의 대대적인 수정 증보판과 더불어 해방 이후 시기를 다룬 <한국 가요사>2권을 새로이 펴내게 되었다. 이로써 민요, 악극, 창가, 창극, 가곡, 오페라, 재즈, 트로트, 록, 소울, 포크, 발라드 등 지난 20세기 우리 노래의 거의 모든 장르를 다루며 그 노래들을 짓고 불렀던 수많은 음악인들의 방대한 역사가 처음으로 완성된 것이다.

<한국 가요사>1, 2권의 분량은 무려 1400쪽(200자 원고지 약 6000매)이 넘으며, 언급된 노래는 2366곡, 가사가 수록된 곡은 879곡, 음악인은 2084명에 이른다. 뿐만 아니라 오늘날 찾아보기 힘든 SP음반들과 당시의 공연 현장의 사진들이 빼곡하게 실려 있어 독자들에게 읽는 재미를 한층 더해줄 것이다."
영화는 좋은데 과학은 싫다고?,"과학적 사고방식이야말로 근대과학이 인류에게 기여한 중요한 업적이라는 것을 또한 과학적으로 생각하는 것이 얼마나 쉽고 재미있는 일인지를 보여주고 있는 책이다. 저자는 이 책에서 영화가 상기시키는 과학의 원리를 에세이 형식으로 풀어가고 있다.

이 책에서 영화는 과학의 높은 문턱에 우리를 편히 안내해주는 에스컬레이터이다. <로봇>에서 카오스를 설명하고, <태극기 휘날리며>에서 음향 효과에 대한 지식을 전달해 주며, <웰컴 투 동막골>에서는 팝콘의 과학이, <고양이의 보은>에서는 직립 인간의 진화 이야기가 튀어 나온다.

영화로 펼쳐내는 무한한 상상력의 세계에는 시대를 앞서가는 놀라운 비전과 창의적 과학 이야기가 담겨 있다. 저자는 영화를 사랑하는 젊은 물리학자의 참신한 시각으로 공상과학(SF) 영화를 넘어 쉽게 접할
수 있고 호평을 받은 한국과 외국의 다양한 범주의 영화들을 망라한다."
에드워드 사이드의 음악은 사회적이다,"음악이 왜, 어떻게 사회적인 의미를 갖게 되는가? 팔레스타인 출신의 세계적인 문예비평가이자 사상가인 에드워드 사이드가 이 책에서 일관되게 내세우는 주제는, '음악과 사회의 상호작용과 영향'이다. 음악이 사회를 세련되게 하고, 사회가 음악을 세련되게 한다는 것.

그 자신이 전문가 수준의 피아노 연주 실력을 보유한 사이드는, 음악 체험이란 지극히 개인적인 것인 동시에 공적으로 이루어지는 것이라 말한다. 따라서 음악을 대할 때는 늘 문화나 사회적인 맥락을 폭넓게 고려해야 한다는 것. 음악은 엄청나게 다양한 외적 요인이 복잡하게 얽혀 작용하고 있기 때문에 우리가 연주 또는 작곡을 할 수 있게 되는 것이며, 그러한 요인들의 대부분이 지극히 사회적이고 역사적이라는 설명이다.

사이드는 서양 클래식 음악에 대한 새로운 검토로부터 음악 이야기를 시작한다. 이어 음악이 사회에서 수행하는 역할이 놀랄 정도로 다양하기 때문에 좀더 큰 범주에서 탐구해야 한다고 주장한다. 음악을 철학적으로 사유한 아도르노의 음악 비평을 끌어다 쓰며 이데올로기를 설명하는 대목도 있다."
M. C. 에스헤르,"명화를 낱장으로 분리하여 액자에 넣을 수 있도록 제작한 화집, '포트폴리오 시리즈'. 각 권당 14점의 작품을 큼직한 판형(가로*세로 284*365mm)으로 싣고, 짤막한 작품 설명과 작가 연보를 곁들였다. 텍스트는 한글, 영어, 독일어, 프랑스어, 일본어 등 총 5개 국어로 실려 있다."
연전연패,"일본의 건축가 안도 타다오가 전하는 실패를 밑거름으로 삼아 성공한 건축가가 되기까지의 이야기. 콤페(설계 경기)를 통해 자신만의 건축을 관철시키기까지의 과정을 자세하게 소개하고 있다. 2000년 가을 도쿄 대학 대학원에서 실제로 진행했던 5회의 연속 강의를 토대로 쓰여졌다. 가장 일본적인 것을 세계적으로 승화시킨 그의 삶은 우리 건축의 현주소를 돌아보게 한다.

안도 타다오는 '도시 게릴라 주거'를 캐치프라이즈로 하고, 과밀 도시 안에서 극적으로 삶을 획득하는 공간을 내포해야만 한다고 주장한다. 또한 콤페에 도전하면 좌절하더라도 건축에 대한 자기의 자세와 의지를 확인하게 된다고 말한다. 그에게 콤페는 비록 실패하더라도 새로운 아이디어를 얻고 자신만의 건축을 모색하는 과정이기 때문이다.

또한 건축을 위해서는 반드시 과거의 훌륭한 건축을 보아야 한다고 지적한다. 책에서는 직접 그린 스케치 및 여러 사진을 통해 세계적으로 유명한 여러 건축물들의 콤페 상황과 설계 모형, 근현대 건축의 거장 및 작품을 소개하고 있다. 근현대 건축사를 돌아보는 데도 도움을 준다."
마침표가 아닌 느낌표의 예술,"드라마를 보고, 대중가요를 듣고, 헐리우드 블록버스터 영화를 보면서도 우리는 늘 문화를 고상한 것과 저급한 것으로 나누고 대중 예술을 저급한 축에 끼워놓는다.

이 책은 이제 대중예술에 대한 부정적인 자세를 긍정적인 자세로, 소극적인 자세를 적극적인 자세로 교정할 것을 제안한다. 말하자면 우리 의식에 팽배해 있는 문화의 이중성을 깨뜨리자는 것이다.

저자인 박성봉 교수의 '대중예술의 미학'이라는 강의는 딱딱한 틀을 깬 파격으로 학생들의 큰 인기를 끌고 있다. 이 책은 학문에서 소외된 대중예술을 미학적으로 접근하는 그의 독특한 시각을 강의가 아닌 활자로 만나게 해주는 기회가 될 것이다."
이정선 기타교실 3,"총 40곡의 연습곡을 수록하였고 앨범에 수록된 원곡 그대로 전주, 간주, 후주, 기타 애드립까지 악보로 옮겼고 모든 곡을 저자가 직접 편곡한 타브 악보로 표기하였다. 특집으로 듀엣 기타 해설과 함께 20곡의 연습곡을 수록하였고 변칙 튜닝 설명과 4곡의 연습곡과 유명한 팝송 18곡을 실어 기존 책과의 차별성을 두었다. 또한 저자가 직접 연주해주는 듀엣 기타 연습곡 11곡의 연주 영상을 QR코드를 통해 볼 수 있다."
영화 너의 췌장을 먹고 싶어 공식 가이드,"<너의 췌장을 먹고 싶어>라는, 많은 사람들에게 눈살을 찌푸리게 만드는 제목의 책이 2015년 일본에 발매되었다. 그러나 자극적인 제목과는 다르게 고등학생 남녀의 순수한 이야기를 다룬 감동적인 책이라는 사실이 알려지면서 오로지 입소문으로 일본에서 80만 부 이상 판매되며 코믹스화와 함께 실사 영화로 만들어진다.

2017년 청춘영화의 달인 츠키카와 쇼 감독이 메가폰을 잡고 일본의 떠오르는 신인 배우 하마베 미나미와 키타무라 타쿠미 주연으로 만들어진 영화 [너의 췌장을 먹고 싶어]. 개봉하자마자 일본 박스오피스 2위에 오르며 3억 엔 이상의 수익을 거둔다. 또한 작품성을 인정받아 2017 부산 국제 영화제 오픈시네마 공식 초청작으로 선정되었다. 보고 나면 누구나 울게 된다는 바로 그 영화, 그 비하인드 스토리를 <영화 너의 췌장을 먹고 싶어 공식 가이드>에서 확인할 수 있다."
여행사진 무작정 따라하기,"카메라와 함께 여행하며 일상을 기록하듯 여행을 기록하는 방법에 대해서 알아본다. 여행의 순간에서 만나게 되는 다양한 장소에 따라 여행의 추억을 조금 더 풍성하게 만들 수 있는 촬영 테크닉을 담았다. 또 복잡한 박물관에서 우아하게 촬영하는 방법이나 랜드마크를 효과적으로 촬영하는 방법, 여행에서 빼놓을 수 없는 음식 사진 촬영 팁을 담았다.

흑백 사진을 촬영하거나 여행지에서 만나는 사람들을 사진으로 남길 수 있는 인물 사진 촬영 팁을 담아 여행사진을 업그레이드할 수 있다. 여행지의 풍경이 작품 사진이 될 수 있는 촬영 팁과 지나칠 수 있는 거리 풍경을 찍는 스트리트 포토 촬영 팁까지 담겨 있다. 또 여행사진을 정리하고 나만의 여행기를 작성하는 방법도 함께 담았다."
건축마감상세도집,"철근콘크리트조.철골조 건축의 내외 마감의 실제를 기본적인 것부터 참신한 것까지 보기쉽게 상세도에 의해 철저하게 그림으로 설명하였다. 각각의 상세도 예에 관해 설계 및 시공상의 포인트의 해설을 곁들이고, 기본과 실제와의 콤비네이션을 겸비한 유니크한 내용을 제공한다."
웹소설 작가를 위한 장르 가이드 7 : 호러,"창작자를 위한 장르 개론서 '웹소설 작가를 위한 장르 가이드' 시리즈 6권. 공포는 인간이 느낄 수 있는 가장 원초적인 감정이다. 호러는 기이하고 무서운 이야기를 통해 이성과 합리성만으로는 설명되지 않는 세상을 보여줌으로써 사람의 감정을 자극하고, 매혹시킨다. 이 책에서는 호러 장르의 개념과 역사, 오컬트, 유령, 괴담 등 호러에서 다루는 소재 및 대표작들을 다루었다. 그리고 호러 작가인 김종일이 들려주는 작법 노하우와 부록으로 추천도서를 담았다."
스마트폰 사진찍기,"3인의 사진작가가 일상에서 찍는 사진, 인물사진에 아이디어를 담은 사진, 그리고 스마트폰 카메라를 일반 카메라처럼 설정하여 찍는 법 등을 소개하였다. 사진을 전혀 모르고 귀찮은 사람들에게도 간단한 설명과 사진만으로 좋은 사진을 촬영할 수 있도록 하였다."
내 마음의 정원을 가꾸는 52주,"아날로그적 감성을 살릴 수 있는 일상의 소소한 이야기, 스케줄을 적을 수 있는 만년 다이어리(날짜가 기입되어 있지 않아 사용자의 편의에 따라 원하는 기간 동안 사용 가능)와 아름다운 일러스트를 색색의 펜으로 칠할 수 있는 컬러링북을 한 권에 담았다.

색칠을 하다 보면 일상의 스트레스를 잊고 몰입의 즐거움을 느낄 수 있으며, 복잡한 머릿속은 어느덧 아름다운 정원처럼 평온해지는 것을 느낄 수 있다. 하루, 일주일, 일 년 52주 동안 계획한 스케줄들을 실행하고, 간단한 것부터 세밀한 일러스트까지 아름다운 작품을 완성해가면서 만족감과 성취감을 느낄 수 있다. 일상에 지친 현대인들에게 색다른 힐링 테라피가 될 것이다."
현대미술의 개념,"1900년경부터 1980년대까지 미술의 주요 개념과 전개 과정을 일반인들도 쉽게 이해할 수 있도록 핵심만을 추려 소개한 책으로, 1994년 출간된 <현대미술의 개념>을 본문 디자인과 표지 디자인을 새롭게 하여 현대적 감각에 맞게 다시 출판했다. 일반 대중들에게 유용한 교양서를 넘어 이 분야 전공자들에게도 깊이 있는 독서의 즐거움을 주고 지적인 일깨움을 주는 책이다.

1974년 처음 출판된 책으로, 영국과 미국의 탁월한 미술사학자와 비평가들 몇 명이 20세기의 서구 미술을 권위 있고 유익하며 함축적이고 비평적인 방법으로 기술해 현대미술의 다양한 조류에 대한 풍부한 정보와 비평적 관점을 동시에 갖춘 권위 있는 개설서라는 평가를 받아왔다.

이 책의 가장 큰 특징은 현대미술을 사조별로 그 분야의 권위 있는 전문가의 논문으로 정리했다는 점이다. 단순한 초보자용 개설서 혹은 미술 사조들을 교과서적으로 단조롭게 나열한 책은 아니며, 현대미술의 흐름에 대한 깊이 있는 통찰이나 해석까지 보여주는 전문 서적이라고 할 수 있다."
"요조, 기타 등등","싱어송라이터 요조의 첫 번째 에세이집. 그냥 에세이가 아니라, 어쿠스틱(Acoustic) 에세이다. 홍대 인디 뮤직의 아이콘 요조가 작가로서 '공식적'으로 선보이는 '첫 책' <요조, 기타 등등>은 노래를 따라 이야기가 흘러가고, 그 노래들을 연주할 수 있는 기타악보가 이어지는, 꽤 특별하고 흥미로운 에세이집이다.

큰 줄기는 제목 그대로 요조(Yozoh), 기타(Guitar), 등등(etc.). 요조가 직접 선곡한 30개의 노래를 따라가며 기타 치고 노래하는 그녀의 일상과 사랑, 추억, 작사작곡 뒷이야기, 그 외의 기타 등등한 사연들이 이어진다.

그리고 '아, 이 노래 나도 불러보고 싶다'는 생각이 들 즈음, 선물처럼 기타악보가 등장한다. 기타악보는 이 책의 배경음악이기도 하고, 하나의 축을 담당하는 테마 섹션이기도 하며, ""음악과 함께 쓸쓸한 이 계절을 씩씩하게 견뎌내자""는 요조의 메시지이기도 하다. 30개의 기타악보들은 요조가 직접 작사.작곡한 노래 15곡, 옥상달빛.김진표.에릭.재주소년.마이큐 등 다른 뮤지션들과 함께 부른 노래 5곡, 요조가 평소 즐겨 부르는 추천 노래 10곡으로 구성되었다.

대중적으로 큰 인기를 얻은 '좋아해', '하모니카 소리', '에구구구'부터, 뮤지션으로서 한층 깊고 단단해졌다는 평을 듣고 있는 2집 앨범 '나의 쓸모'의 수록곡들, 그리고 언제 들어도 좋은 유재하.장필순.양희은의 명곡과 팝송, 지금 우리가 주목해야할 인디 뮤지션 윤영배와 김대중의 노래 등을 만나볼 수 있다."
한글공감,"한글 타이포그래피의 거장으로 우리 시대를 살다 간 한글디자이너 고 김진평의 업적 가운데 하나인 한글 디자인을 소개한다. 이 책은 2005년 한국학술진흥재단의 연구 지원을 받아 이루어진 연구 보고서의 일부를 발췌, 보충하고 재정리한 것으로, 그의 제자인 유정숙 교수와 김지현 교수가 한글디자이너 김진평의 업적을 기리고 추모하는 마음으로 진행한 작은 연구이다.

우리나라의 젊은 후학과 전문인들이 한글 타이포그래피에 더 큰 관심을 두는 일 그리고 이전보다 발전한 한글 타이포그래피를 위해 올바른 방향을 제시하는 일은 생전에 한글디자이너 김진평이 늘 바라던 일이기도 했던 만큼, 이 책은 한글 타이포그래피를 사랑하는 많은 이들에게 그의 작업을 소개하여 한글 타이포그래피에 대한 폭넓은 이해와 관심 그리고 공감을 얻고자 한다."
미켈란젤로 부오나로티 2,"예술가의 전기 분야에서 역사적 사실에 근거하면서도 미술사와 미학적 감상에 충실한, 그에 더해 전기문학의 인생을 꿰뚫는 통찰력을 보여주는 책이다. 역자 정진국은 유럽의 책마을과 헌책방들을 구석구석 수차례 답사하면서 해당 분야에서 가장 뛰어나면서 대중성을 확보한 고전들 가운데 오랜 세월이 지나면서 우리 기억에서 잊혀진 책들을 발굴해내고 있다. 이 전기 역시 그런 작업에서 발견된 책.

파니니의 전기는 지금까지 출간된 어떤 미켈란젤로 전기보다 상세하며, 그 주변 인물을 샅샅이 조사했다는 점이 강점이다. 사건과 친구, 친지와 반목, 약점과 불운, 출세와 고백 등 그의 기질과 성격과 정신을 찾기 위해 주변 인물들을 제대로 동원함으로써 한 인물의 면모를 속속들이 파헤친다.

미켈란젤로와 그 시대에 관한 자료에서 출처가 명확한 것만 제시했지만 주변인물에 대해 새롭게 수집한 자료는 어마어마하게 방대하다. 파니니는 너무 지루하게 늘어지지 않고, 불필요한 군더더기나 현학을 피하고, 확고한 역사적 기초위에 근거하면서도 쉽게 읽히게 하려는 노력을 쏟았다."
음악치료 접근법,"이 책은 음악치료의 특정 분야에 국한되지 않고 각 장별로 그 분야의 전문가들이 나누어 집필한 음악치료 접근법 개론서다. 다양한 접근법을 신실하게 소개하기 위해 전문성을 가진 객원필자를 엄선하고 각 접근법별로 해당 전문가들의 감수를 마쳐 음악치료 개론서의 수준을 한 단계 높인 책이다.

역자 김영신 교수는 이 책의 원서의 6장인 노도프-로빈스 음악치료 접근법의 저자이기도 하며, 다양한 음악치료 접근법을 알기 쉽게 소개한 이 책이 음악치료 모델들의 특징과 유익에 관한 지식을 얻고자 하는 독자들은 물론 자신의 음악치료 철학을 확립하고자 하는 음악치료사와 학생들에게도 유용한 지침서가 되리라는 판단하에 번역, 출간하게 되었다.

대다수의 음악치료사가 자신의 음악치료 모델에는 익숙하지만 다른 음악치료 접근법이나 모델에 대해서는 거의 접해 보지 않은 경우가 많다. 음악치료가 더욱 발전하기 위해서는 다양한 음악치료 모델에 대한 이해를 기초로 하여 각 분야의 전문성을 더욱 향상시킬 필요가 있으며, 이에 각 음악치료 접근법과 모델의 다양성을 자세하게 소개하고 있는 이 책이 갖는 의의가 더욱 크다. 이 책은 음악치료가 보급된 지 10여 년이 지난 한국에서 음악치료 분야가 더욱 전문화되고 정체성을 찾는 데 기여할 수 있을 것이다.

* 원서: Introduction to Approaches in Music Therapy"
비주얼 스토리텔링,"괜찮은 아이디어를 흥미진진한 이야기로 바꾸는 비주얼 스토리텔링의 개념, 기술, 도구를 다루는 책이다.
이 책의 가장 큰 특징은 책과 영상을 동시에 활용할 수 있다는 것이다. 저자들이 직접 제작한 애니메이션을 보고 책을 읽으면 비주얼 스토리텔링의 원칙과 과정을 쉽게 이해할 수 있다. 각 장마다 학습목표와 핵심용어, 복습문제와 연습문제가 실려 있어 교재로 쓰기에도 적합하다."
