title,summary
EBS 수능특강 과학탐구영역 생명과학 1 (2020년),"새 교육과정 및 교과서 분석을 통한 핵심 내용을 제시함으로써 2021학년도 수능에 대비한 탄탄한 기초 확보를 도와준다. 최근 수능의 트렌드와 특징, 신유형을 잘 반영한 엄선된 수능형 연습 문제를 통해 2021학년도 수능을 완벽하게 대비할 수 있으며, 교육과정에 따른 체계적인 교과 내용 분석과 이를 최적화한 필수 실전 문제를 통해 실력 점검·실전 감각을 향상시킬 수 있다.

단원별로 확실한 개념 설명 및 적용 문제가 제공되어, 학습자 본인의 강·약점을 자연스럽게 파악하고, 이를 스스로 강화하고 보완하는 것이 가능하고, 한눈에 보는 정답 서비스, 영어영역 단어장부터 최고의 강사진이 함께하는 수능특강 강의까지 EBSi 홈페이지를 통해 제공된다."
EBS 수능특강 과학탐구영역 지구과학 1 (2020년),"새 교육과정 및 교과서 분석을 통한 핵심 내용을 제시함으로써 2021학년도 수능에 대비한 탄탄한 기초 확보를 도와준다. 최근 수능의 트렌드와 특징, 신유형을 잘 반영한 엄선된 수능형 연습 문제를 통해 2021학년도 수능을 완벽하게 대비할 수 있으며, 교육과정에 따른 체계적인 교과 내용 분석과 이를 최적화한 필수 실전 문제를 통해 실력 점검·실전 감각을 향상시킬 수 있다.

단원별로 확실한 개념 설명 및 적용 문제가 제공되어, 학습자 본인의 강·약점을 자연스럽게 파악하고, 이를 스스로 강화하고 보완하는 것이 가능하고, 한눈에 보는 정답 서비스, 영어영역 단어장부터 최고의 강사진이 함께하는 수능특강 강의까지 EBSi 홈페이지를 통해 제공된다."
매3비 - 매일 지문 3개씩 푸는 비문학 독서 수능 기출 (2020년),"단순히 기출 문제를 묶어 놓은 문제집이 아니다. 다 같은 기출이라도 제대로 공부하고 제대로 훈련할 수 있도록 매일 지문 3개씩을 풀게끔 가장 효과적인 학습법과 접목해 구성하였고, 복습 방법 및 채점법, 시간 관리까지 가능하도록 특수 편집하였다. 기출 문제도 어떻게 공부하느냐에 따라 그 학습 효과는 크게 달라지기 때문이다.

일반적인 정답 해설지가 아니다. 저자가 그동안 가장 많이 질문을 받았던 문제와 답지, 그리고 문제 해결력과 공부법까지 고려하여 왜 그 오답지에 답했고 무엇을 모르고, 어느 부분을 놓쳐 틀렸는지를, 그리고 2021학년도 수능 대비를 위해 꼭 새겨야 할 내용까지 학생들의 질문에 답하듯이 해설을 썼다.

특히 '2021 매3비'에서는 해설을 전면 업그레이드하면서, 학생들이 재질문한 내용 중 챙겨 보면 도움이 되는 'Q&A'를 강화하였고, 모르고 지나칠 수 있는 설명 속 어휘까지 '매3어휘 풀이'를 적용하여 쉽게 풀이하였으며, 지문 이해를 돕는 '독해력을 길러 주는 지문 분석' 에서는 최대한 도식화하고 도표화하여 문제 해결력과 독해력을 키울 수 있도록 하였다."
EBS 수능특강 과학탐구영역 화학 1 (2020년),"새 교육과정 및 교과서 분석을 통한 핵심 내용을 제시함으로써 2021학년도 수능에 대비한 탄탄한 기초 확보를 도와준다. 최근 수능의 트렌드와 특징, 신유형을 잘 반영한 엄선된 수능형 연습 문제를 통해 2021학년도 수능을 완벽하게 대비할 수 있으며, 교육과정에 따른 체계적인 교과 내용 분석과 이를 최적화한 필수 실전 문제를 통해 실력 점검·실전 감각을 향상시킬 수 있다.

단원별로 확실한 개념 설명 및 적용 문제가 제공되어, 학습자 본인의 강·약점을 자연스럽게 파악하고, 이를 스스로 강화하고 보완하는 것이 가능하고, 한눈에 보는 정답 서비스, 영어영역 단어장부터 최고의 강사진이 함께하는 수능특강 강의까지 EBSi 홈페이지를 통해 제공된다."
EBS 수능완성 수학영역 수학 나형 (2020년),2015 개정 교육과정 첫 수능에 맞추어 영역별 기본적으로 알아 두어야 할 출제 유형을 풀어 보며 스스로 취약한 문제 유형이 무엇인지 쉽게 파악할 수 있다. 최근 대학수학능력시험 및 모의평가 문항을 철저하게 분석하여 실전과 가장 가까운 문항을 수록하였다.
신사고 쎈 고등 수학 (상) (2020년용),"전국 고등학교 내신 기출 문제와 평가원.수능 기출 문제는 물론 수많은 기본서, 내신서, 수능서까지 분석하여 모든 수학 문제를 수집.분류하여 강력한 유형 그물을 만들었다. 모든 문제를 3단계로 나누어 수준별로 구성하고, 유형 뽀개기에서는 이를 다시 하, 중, 상의 난이도로 세분하여 체계적으로 수학 실력을 키울 수 있도록 만들었다. 또한 고교 과정에서 다뤄야 하는 모든 문제를 199개 유형으로 분류하고 1340문제로 정리하여 유형별로 충분한 문제 연습이 가능하게 하였고 이를 통해 문제 해결력을 기를 수 있다."
신사고 쎈 고등 수학 (하) (2020년용),"전국 고등학교 내신 기출 문제와 평가원.수능 기출 문제는 물론 수많은 기본서, 내신서, 수능서까지 분석하여 모든 수학 문제를 수집.분류하여 강력한 유형 그물을 만들었다. 모든 문제를 3단계로 나누어 수준별로 구성하고, 유형 뽀개기에서는 이를 다시 하, 중, 상의 난이도로 세분하여 체계적으로 수학 실력을 키울 수 있도록 만들었다. 또한 고교 과정에서 다뤄야 하는 모든 문제를 159개 유형으로 분류하고 958문제로 정리하여 유형별로 충분한 문제 연습이 가능하게 하였고 이를 통해 문제 해결력을 기를 수 있다."
EBS 수능완성 수학영역 수학 가형 (2020년),"2015 개정 교육과정 첫 수능에 맞추어 영역별 기본적으로 알아 두어야 할 출제 유형을 풀어 보며 스스로 취약한 문제 유형이 무엇인지 쉽게 파악할 수 있다. 자세한 유형 설명과 정답 해설로, 보다 정확한 유형 이해가 가능하다. 또한, 최근 대학수학능력시험 및 모의평가 문항을 철저하게 분석하여 실전과 가장 가까운 문항을 수록하였다. 실전처럼 구성된 ""5회분의 실전 모의고사""로 실전 감각을 키울 수 있다."
EBS 수능특강 영어영역 영어독해연습 (2018년),"과목별 교육과정의 핵심 내용을 제시함으로써 개편된 수능에 대비한 탄탄한 기초를 확보할 수 있는 교재다. 수능의 특징을 잘 반영한 엄선된 수능형 연습 문제를 통해 2018학년도 수능을 완벽하게 대비할 수 있으며, 교육과정에 따른 교과 내용을 최적화한 실전 문제를 통해 실력 점검.실전 감각 향상이 가능하다."
EBS 수능연계교재의 Voca 1800 (2020년),EBS 수능 영어 연계교재의 주요 어휘를 총정리하여 2021학년도 대수능을 준비하는 학생들이 EBS 연계교재를 효율적으로 학습할 수 있도록 구성했다.
EBS 수능특강 과학탐구영역 물리학 1 (2020년),"새 교육과정 및 교과서 분석을 통한 핵심 내용을 제시함으로써 2021학년도 수능에 대비한 탄탄한 기초 확보를 도와준다. 최근 수능의 트렌드와 특징, 신유형을 잘 반영한 엄선된 수능형 연습 문제를 통해 2021학년도 수능을 완벽하게 대비할 수 있으며, 교육과정에 따른 체계적인 교과 내용 분석과 이를 최적화한 필수 실전 문제를 통해 실력 점검·실전 감각을 향상시킬 수 있다.

단원별로 확실한 개념 설명 및 적용 문제가 제공되어, 학습자 본인의 강·약점을 자연스럽게 파악하고, 이를 스스로 강화하고 보완하는 것이 가능하고, 한눈에 보는 정답 서비스, 영어영역 단어장부터 최고의 강사진이 함께하는 수능특강 강의까지 EBSi 홈페이지를 통해 제공된다."
[세트] EBSi 강의노트 수능개념 국어 윤혜정의 개념의 나비효과 세트 - 전2권 (2021년용),<EBSi 강의노트 수능개념 국어 윤혜정의 개념의 나비효과> + <EBSi 강의노트 수능개념 국어 윤혜정의 개념의 나비효과 미니과제>로 구성된 세트 교재다.
"예비 매3비, 매일 지문 3개씩 푸는 비문학 독서 기출 (개정5판)","<매3비>의 구성 및 체제를 따르되 ‘준비편(입문편)’의 성격에 맞게 좋은 문제와 잘 다듬어진 지문이면서 수능 기출 문제보다 쉬운 지문과 문제들로 구성한 교재다. 특히 이번 개정판에서는 최근 수능 시험의 출제 경향을 심층 분석 반영하였고, 2019년 3월 8일에 실시한 2019학년도 3월 고1 전국연합학력평가를 추가하여 비문학 실전 훈련을 할 수 있게 하였다.

한편, <클리닉 해설>에는 학생들이 재질문한 내용(Q&A)과 필수 개념(개념 +)을 추가하였고, ‘복습을 위한 어휘 노트’를 전면 개편하여 낯선 어휘를 접했을 때에도 그 의미를 이해할 수 있게 ‘매3’에서 강조한 ‘어휘 문제 3단계 풀이법’을 적용하여 새롭게 구성하였다. 본문의 문제 옆에 있는 ‘분석쌤 강의’에도 최근 수능을 심층 분석한 결과에 따른 공부법까지 반영하여 업그레이드하였다.

아울러, ‘나만의 오답 노트’의 중요성은 알지만, 어떻게 만들고 활용해야 할지를 모르는 학생들을 위해 누구나 쉽게 따라 만들 수 있게 ‘매3 오답 노트’ 작성법과 실제 예시를 교재 곳곳에 작성법 및 활용법을 녹여 구성하는 등 ‘오답 노트 작성법’을 더 구체화하여 제시하였고, 비문학 실수 유형까지 분석하여 대비하게 하였다."
EBS 수능특강 사용설명서 국어영역 문학 (2020년),"연계교재 수능특강의 지문과 자료를 해석하는 것이 어려운 학생을 위한 교재로 문항, 지문, 자료와 선지 분석으로 매력적인 오답의 의도, 오답을 피하는 방법을 수록했다."
EBS 수능특강 영어영역 영어 B형,"체계적인 교과 내용 분석과 그에 따른 필수 점검 문항으로 구성된 수능 준비를 시작하기 위한 최적의 교재로 A/B형 읽기 대비서. 유형편, 주제 소재편, 테스트편으로 구성되었습니다."
매3문 - 매일 지문 3개씩 푸는 문학 수능 기출 (2020년),"2019년에 실시된 2020학년도 수능과 6월과 9월 모의평가를 모두 반영하여 만들었다. '열심히'보다 더 중요한 '제대로' 공부법이 몸에 배게 구성한 <매3문>은 갈래별 제대로 공부법을 익히며 공부할 수 있게 하였고, 좋은 문제 기출과 중요 작품으로 수능식 사고로 훈련할 수 있게 하였으며, 나만의 오답 노트로 활용할 수 있게 하였다."
EBS 수능완성 과학탐구영역 지구과학 1 (2020년),"2015 개정 교육과정 첫 수능에 맞추어 영역별 기본적으로 알아 두어야 할 출제 유형을 풀어 보며 스스로 취약한 문제 유형이 무엇인지 쉽게 파악할 수 있다. 자세한 유형 설명과 정답 해설로, 보다 정확한 유형 이해가 가능하다. 최근 대학수학능력시험 및 모의평가 문항을 철저하게 분석하여 실전과 가장 가까운 문항을 수록하였다. 실전처럼 구성된 '5회분의 실전 모의고사'로 실전 감각을 키울 수 있다."
[세트] 예비 매3비 개정 6판 + 예비 매3문 개정 5판 - 전2권,"『예비 매3비』는 『매3비』의 구성 및 체제를 따르되 '준비편(입문편)'의 성격에 맞게 좋은 문제와 잘 다듬어진 지문이면서 수능 기출보다 쉬운 지문과 문제들로 구성하였다. 그리고 '나만의 오답 노트'의 중요성은 알지만, 어떻게 만들고 활용해야 할지를 모르는 학생들을 위해 누구나 쉽게 따라 만들 수 있게 '매3 오답 노트' 작성법과 실제 예시를 교재 곳곳에 녹여 구성하였다."
EBS 수능특강 영어영역 영어듣기 (2018년),"과목별 교육과정의 핵심 내용을 제시함으로써 개편된 수능에 대비한 탄탄한 기초를 확보할 수 있는 교재다. 수능의 특징을 잘 반영한 엄선된 수능형 연습 문제를 통해 2018학년도 수능을 완벽하게 대비할 수 있으며, 교육과정에 따른 교과 내용을 최적화한 실전 문제를 통해 실력 점검.실전 감각 향상이 가능하다."
EBS 수능완성 과학탐구영역 생명과학 1 (2020년),"2015 개정 교육과정 첫 수능에 맞추어 영역별 기본적으로 알아 두어야 할 출제 유형을 풀어 보며 스스로 취약한 문제 유형이 무엇인지 쉽게 파악할 수 있다. 자세한 유형 설명과 정답 해설로, 보다 정확한 유형 이해가 가능하다. 최근 대학수학능력시험 및 모의평가 문항을 철저하게 분석하여 실전과 가장 가까운 문항을 수록하였다. 실전처럼 구성된 '5회분의 실전 모의고사'로 실전 감각을 키울 수 있다."
능률 VOCA 어원편,어원 이해를 통한 효율적인 어휘 학습을 돕는 고교 어휘서로서 예비고교생을 비롯한 교고생 전체를 대상으로 한 교재이다. 어휘 학습과 어휘 테스트를 분리시켜 각 활동에 집중할 수 있도록 어휘만 수록한 '본책'과 어휘 테스트 문항만으로 구성한 '워크북'으로 구성하였다. 깔끔한 디자인과 기발한 아이디어가 담긴 컬러 삽화로 학습의 즐거움을 높이고 지루함을 줄였다.
EBS 수능특강 사회탐구영역 한국지리 (2020년),"새 교육과정(2015 개정 교육과정) 및 교과서 분석을 통한 핵심 내용을 제시한다. 최근 수능의 트렌드와 특징, 신유형을 잘 반영한 엄선된 수능형 연습 문제를 통해 2021학년도 수능을 완벽하게 대비할 수 있다. 교육과정에 따른 체계적인 교과 내용 분석과 이를 최적화한 필수 실전 문제를 통해 실력 점검·실전 감각을 향상시킬 수 있다. 단원별로 확실한 개념 설명 및 적용 문제가 제공되어, 학습자 본인의 강·약점을 자연스럽게 파악하고, 이를 스스로 강화하고 보완하는 것이 가능하다."
천일문 베이직 기본 1001 SENTENCES BASIC,"2004년 발간 후 261주 이상 1위를 지켜온 베스트셀러 <천일문>의 업그레이드 개정판이다. 설명이 주가 되고 예문이 부가 되는 여타의 다른 책들과 달리, 천일문은 문장이 주가 된다.

이 책에 실린 1001개의 문장은 원어민들이 실제로 사용하는가(authenticity), 자주 꺼내 쓸 수 있는 표현인가(real-life usability), 흥미롭고 참신한 정보나 삶의 지혜를 담고 있는가(educational values)의 기준으로 엄선했다. 또, 천일문 한 권으로 학습자들은 모든 영어 시험에서 다뤄지는 기본적인 구문을 체계적으로 학습할 수 있다."
EBS 수능완성 사회탐구영역 생활과 윤리 (2020년),2015 개정 교육과정 첫 수능에 맞추어 영역별 기본적으로 알아 두어야 할 출제 유형을 풀어 보며 스스로 취약한 문제 유형이 무엇인지 쉽게 파악할 수 있다. 최근 대학수학능력시험 및 모의평가 문항을 철저하게 분석하여 실전과 가장 가까운 문항을 수록하였다.
Xistory 자이스토리 영어 독해 기본 (2020년),"수능 독해 공부를 하기 위해 수험생들이 꼭 풀어야 할 가장 좋은 문제는 논리적 흐름이 완벽한 글이 있어야 하며, 수능 첫 입문자들에게 적절한 수준이어야 하고, 문제와 선택지가 타당성을 갖춰야 한다. '2020 자이스토리 영어 독해 기본'은 최신 9개년 고1 학력평가의 우수 문항을 선별하여 체계적인 단계별 학습 시스템으로 독해력을 확실하게 향상시켜 준다."
EBS 수능완성 사회탐구영역 사회.문화 (2020년),"2015 개정 교육과정 첫 수능에 맞추어 영역별 기본적으로 알아 두어야 할 출제 유형을 풀어 보며 스스로 취약한 문제 유형이 무엇인지 쉽게 파악할 수 있다. 자세한 유형 설명과 정답 해설로, 보다 정확한 유형 이해가 가능하다. 최근 대학수학능력시험 및 모의평가 문항을 철저하게 분석하여 실전과 가장 가까운 문항을 수록하였다. 실전처럼 구성된 '5회분의 실전 모의고사'로 실전 감각을 키울 수 있다."
개념원리 수학 1 (2019년 고3용),"개념과 원리에 대한 친절하고 자세한 설명과 문제를 통해 수학의 개념과 원리를 짚어주는 개념체크와 필수예제가 수록되어 있다. 또, 내신 및 수능·모의고사 대비를 위한 연습문제와 심화문제도 담아냈다."
"예비 매3문, 매일 지문 3개씩 푸는 문학 기출 (개정4판)","<예비 매3문>은 <매3문>의 구성 및 체제를 따르되 ‘준비편(입문편)’의 성격에 맞게, 좋은 문제와 잘 다듬어진 지문이면서 수능 기출 문제보다 쉬운 지문과 문제들(고1 전국연합학력평가)로, 수능은 물론 학교 중간.기말 고사 대비를 위해 최근 수능 시험의 출제 경향 및 새 국어 교과서 및 문학 교과서를 심층 분석하여 작품을 선정하였다.

특히, 이번 개정판에서는 최근 수능 시험의 출제 경향을 심층 분석하여 문학 기초부터 다져 실제 수능 시험에서도 적용할 수 있는 문학 공부법을 반영하였고, 2019년 3월에 실시한 2019학년도 3월 고1 전국연합학력평가를 추가하여 문학 실전 훈련을 할 수 있게 하였다. 뿐만 아니라 최근 수능에서 강화된 갈래 복합도 대비할 수 있게 하였다."
2021 수능대비 마더텅 수능기출문제집 국어 독서 (2020년),"대한민국 최초! 전 지문, 모든 선지에 100% 첨삭 해설을 수록하였다. 총 698문항, 2009~2020학년도 12개년 수능·모의평가 기출문제 전 문항 + 2007~2008학년도 2개년 수능·모의평가 기출문제 선별 수록하였다."
EBS 수능특강 사회탐구영역 윤리와 사상 (2020년),"새 교육과정(2015 개정 교육과정) 및 교과서 분석을 통한 핵심 내용을 제시한다. 최근 수능의 트렌드와 특징, 신유형을 잘 반영한 엄선된 수능형 연습 문제를 통해 2021학년도 수능을 완벽하게 대비할 수 있다. 교육과정에 따른 체계적인 교과 내용 분석과 이를 최적화한 필수 실전 문제를 통해 실력 점검·실전 감각을 향상시킬 수 있다. 단원별로 확실한 개념 설명 및 적용 문제가 제공되어, 학습자 본인의 강·약점을 자연스럽게 파악하고, 이를 스스로 강화하고 보완하는 것이 가능하다."
EBS 인터넷 수능 영어영역 영어독해연습 B형,"교재 특징 및 활용
개편수능의 기본 난이도 + 실용소재의 A형과 중.고난이도 + 기초학술소재 B형에 적합한 독해 문항유형 제시, 실전문항 풀이 & 문장구조분석으로 독해력 강화"
EBS 인터넷 수능 운문문학,"[안내]
1쇄 (인쇄일 2011.03.28)에 반영되지 않은 11강, 12강의 정오표 파일을 다운받으실 수 있습니다."
Xistory 자이스토리 고3 수학 1 (2020년),"자이스토리 고3 수학은 새교육과정을 철저히 분석하여 2021 수능 대비를 위해 유형을 촘촘히 분류했다. 또, 각 유형에서 사용될 개념과 공식, 유형 접근법을 난이도별로 수록하였다. 자이스토리 고3 수학에 수록된 유형 순서대로 공부하면 수능을 좀 더 체계적으로 공부하여 수능에 대한 자신감과 흐름을 잡을 수 있다. 또한, 정확하고 자세한 해설, 풍부한 보충 첨삭 해설은 문제를 풀어가면서 개념을 적용하는 방법을 자연스럽게 익힐 수 있도록 도와준다."
EBS N제 영어영역 영어 B형 230제,"2014 수능 출제예상문항을 실제 수능시험 형식과 문항배열에 적합하도록 구성하였으며, 난이도의 편중현상 탈피, 영역별.단원별 학습이 가능한 수능형 실전 문항을 배치한 교재입니다."
EBS 수능특강 수학영역 수학 2 & 미적분 1 (2018년),"과목별 교육과정의 핵심 내용을 제시함으로써 개편된 수능에 대비한 탄탄한 기초를 확보할 수 있는 교재다. 수능의 특징을 잘 반영한 엄선된 수능형 연습 문제를 통해 2018학년도 수능을 완벽하게 대비할 수 있으며, 교육과정에 따른 교과 내용을 최적화한 실전 문제를 통해 실력 점검.실전 감각 향상이 가능하다."
2021 수능대비 마더텅 수능기출문제집 국어 문학 (2020년),"총 646문항, 272개 작품을 6개의 유형별로 배치하였다. 2011~2020학년도 10개년 수능·모의평가 전 문항을 수록하였고, 2008~2010학년도 3개년 수능·모의평가 우수 문항을 선별·수록하였다. 지문마다 풀이 시간 제시로 실전 연습이 가능하다."
EBS 수능특강 사회탐구영역 정치와 법 (2020년),"새 교육과정(2015 개정 교육과정) 및 교과서 분석을 통한 핵심 내용을 제시한다. 최근 수능의 트렌드와 특징, 신유형을 잘 반영한 엄선된 수능형 연습 문제를 통해 2021학년도 수능을 완벽하게 대비할 수 있다. 교육과정에 따른 체계적인 교과 내용 분석과 이를 최적화한 필수 실전 문제를 통해 실력 점검·실전 감각을 향상시킬 수 있다. 단원별로 확실한 개념 설명 및 적용 문제가 제공되어, 학습자 본인의 강·약점을 자연스럽게 파악하고, 이를 스스로 강화하고 보완하는 것이 가능하다."
개념원리 수학 2 (2018년 고2~3년용),개정 교육과정에 맞춘 사고력.응용력.창의력을 길러 주는 개념원리 기본서. 개념원리수학 기본서는 어렵다는 편견없이 시작할 수 있도록 학생들의 눈높이에 맞춘 수학기본서이다. 교과서 내용을 충실히 담아 개념과 원리를 확실히 이해하고 문제를 쉬운 것에서부터 단계적으로 제시하여 차근차근 공부하다 보면 수학에 대한 자신감이 생길 것이다.
오투 고등 통합과학 (2020년),교과서 내용을 쉽게 설명한 진도교재와 중간·기말고사를 완벽하게 대비할 수 있는 시험대비교재로 이루어져 있어 과학이 어려운 학생들이 쉽게 이해하고 과학 점수까지 오르게 해준다.
EBS 수능특강 사회탐구영역 세계지리 (2020년),"새 교육과정(2015 개정 교육과정) 및 교과서 분석을 통한 핵심 내용을 제시한다. 최근 수능의 트렌드와 특징, 신유형을 잘 반영한 엄선된 수능형 연습 문제를 통해 2021학년도 수능을 완벽하게 대비할 수 있다. 교육과정에 따른 체계적인 교과 내용 분석과 이를 최적화한 필수 실전 문제를 통해 실력 점검·실전 감각을 향상시킬 수 있다. 단원별로 확실한 개념 설명 및 적용 문제가 제공되어, 학습자 본인의 강·약점을 자연스럽게 파악하고, 이를 스스로 강화하고 보완하는 것이 가능하다."
EBS 수능완성 과학탐구영역 화학 1 (2020년),"2021학년도 대학수학능력시험 연계율 70%의 EBS 수능완성 교재. 2015 개정 교육과정 첫 수능에 맞추어 영역별 기본적으로 알아 두어야 할 출제 유형을 풀어 보며 스스로 취약한 문제 유형이 무엇인지 쉽게 파악할 수 있다.

자세한 유형 설명과 정답 해설로, 보다 정확한 유형 이해가 가능하다. 또한 최근 대학수학능력시험 및 모의평가 문항을 철저하게 분석하여 실전과 가장 가까운 문항을 수록하였다. 실전처럼 구성된 ""5회분의 실전 모의고사""로 실전 감각을 키울 수 있다."
EBS FM 라디오 고교 영어듣기 B형,2014학년도 개편 대수능 A형과 B형의 영어듣기 시험을 유형별로 대비하여 기초학술 영어 및 실용영어를 망라한 신유형 문제가 수록된 교재입니다.
2021 수능대비 마더텅 수능기출문제집 사회.문화 (2020년),"총 921문항을 5개의 단원으로 나누어 수록하였다. 2020학년도 수능 · 모의평가, 2019년 학력평가 기출문제와, 2018~2014년 시행된 수능 · 모의평가 · 학력평가 기출문제를 선별 수록하였다."
떠먹는 국어 문법 (2020년),"영문법보다 오히려 더 어렵게만 느껴지는 국어문법을 누구나 쉽게 이해할 수 있도록 서울대 국어교육과 선배 6명이 뭉쳐 펴낸 국어문법 교재의 여섯 번째 개정판이다. 아무리 읽어봐도 도대체 무슨 소리를 하는 건지 막막하기만 한 이해불가침 영역의 국어문법 교과서를 최대한 쉽게 풀고 또 풀어 썼다. 특히 이번 개정판에서는 수능국어와 국어모의고사, 내신까지 다양한 수준의 개념적용 문제를 풀어보는 연습을 통해 완벽한 실력을 갖출 수 있도록 신유형의 문제를 강화하였다. 또한 최신 수능국어 출제경향을 반영하여 중세국어 관련 개념을 보강하고 새롭게 출제한 실전모의고사 문제도 수록하였다."
