title,summary
Debate Pro Book 1,"다양한 주제의 지문을 읽고 필수적인 Debate Skill을 학습하면서 영어 토론 실력을 향상시킬 수 있도록 고안된 중급 Debate 시리즈. 본책, 워크북, 그리고 Audio CD로 구성되어 있다. 본책은 5개의 Chapter와 10개의 Unit으로 구성되어 있으며, 각 Unit은 A와 B, 두 영역으로 구분되어 있다.

Unit A는 제시된 지문을 읽은 후 주제에 대해 생각해보고 Sample Opinion 및 Chapter에서 다루고 있는 Debate Skill을 활용하여 자신의 의견을 정리할 수 있도록 구성되어 있으며, Unit B는 자신의 의견을 정리한 내용들을 활용하여 토론을 한 후 그 내용을 요약해볼 수 있도록 구성되어 있다. 책속의 책으로 제공되는 워크북은 의견 정리 및 자료 수집과 같이 토론을 준비하기 위한 과제물로 활용될 수 있다. 제공되는 Audio CD에는 모든 지문과 Sample Opinion이 녹음되어 있다."
자신만만 자소서 족보,"자기소개서가 무엇이고 어떻게 평가하는지 자세히 보여주는 책이다. 한 번도 자기소개서를 작성해 본 적이 없고 의지할 곳이 없는 학생도 자기소개서를 완성할 수 있도록 구성하였다. 사교육 기관에 의존하지 않더라도 학생, 학부모 모두 독학으로 쉽게 자기소개서를 완성할 수 있고, 자기소개서 지도의 경험이 없는 선생님도 지도가 가능하도록 안내한다."
나쁜국어 독해기술 (2019년),"저자가 제시한 체계적인 독해 방법론(공부법)에 따라 훈련을 하며 쉽고 빠르게 독해력을 향상시키는 신개념 독해력 강화 프로그램이다. 저자는 수능 국어는 물론 어떤 국어 시험에도 통하는 18가지의 독해기술을 바탕으로 한, 빠르고 정확한 독해 방법론을 제시하였다. 또한 이 독해 방법론을 바탕으로 많은 학생들이 특히 어려워하는 과학/기술 지문과 긴 지문 독해를 ‘과학/기술 지문 강화’와 ‘고난도 긴 지문 강화’라는 별도의 꼭지로 다루고, 이에 대한 해법까지 제시함으로써 탄탄한 독해력을 갖출 수 있도록 하였다."
최강 공부법,"중3부터 고3까지, 학교의 모든 내신시험과 대학수학능력시험에 대비하기 위한 최강의 공부법을 밝힌 공부 전략서다. 먼저 고등학생이 되기 전, 중3 겨울방학에 어떤 준비를 해야 하는지부터 가르쳐 준다. 자기 스스로를 분석해서, 공부를 하기 위해 나는 어떤 점이 장점이고 단점인지 파악하는 일로부터 시작한다. 메모지 한 장이면 정리할 수 있도록 방법을 가르쳐 준다.

그리고 나면 고등학교 3년 동안에는 도대체 무엇을 배우며 어떤 시험들을 치르며, 학생은 어떤 준비를 해야만 하는지를 종류별로 모두 짚어 준다. 고등학생이 배우고 시험을 봐야 하는 것은 어떤 과목들인지, 그걸 공부하려면 스스로 혼자 하는 게 좋을지, 학원에 다닐지, 인강으로도 가능한지, 그 장단점들을 조목조목 짚어가며 분석해 준다.

또한, 각 과목별 공부 방법과 수행평가에 대한 준비와 대처 방법은 물론이고 고등학교 1학년 때부터 멀리 수학능력시험을 내다보고 미리 준비할 것들을 세세하게 점검해 준다. 대입전략을 위한 입시정보를 필두로, 수행평가과 비교과 활동, 학생부 자기 소개서, 독서 활동, 인터넷 강의에 대해서, 각각 한 챕터씩을 할애했다."
숨마쿰라우데 수학기본서 미적분 2 (2019년 고3용),"학생들에게 정말 필요하고, 학생들이 쉽게 이해할 수 있도록 형식적인 설명이 아닌 자세하고 쉬운 개념 설명을 위주로 구성하였다. 기본 원리의 이해부터 심화 항목의 이해까지 이 책 한 권으로 모두 마스터할 수 있도록 하였다. 상세한 설명과 더불어 꼭 필요한 예제, 양질의 문제들, 선배들의 노하우 등이 다양하게 수록되어 있다."
수능리허설 EBS 연계출제 완벽분석 봉투 모의고사 외국어영역,"2013학년도 6월, 9월 평가원 모의고사 및 EBS 연계출제 분석을 통한 2013 대학수학능력시험의 출제경향을 100% 반영하여 개발된 실전형 봉투모의고사. 현장에서 강의중인 51인의 국내 최고의 집필진과 60여명의 감수진, 500여명의 검토진에 의해 완성되었으며, EBS 연계 70%와 비연계 30%를 반영하여 수능에 가장 가까운 실전형 봉투모의고사이다.

국내 최초로 사탐, 과탐을 포함한 전영역을 출간하였으며, 변화된 OMR카드도 실전과 동일하게 구성하여 실수하여 마킹하는 일이 없도록 하였다. 각 문항에 대한 EBS 연계포인트와 개념을 별도로 정리하여 해설지에 첨부하였고, 부록으로 수능 당일까지의 건강관리와 식단, D-day에 따른 각 영역에 대한 대비책을 부록으로 수록하였다."
다빈출코드 학평기출문제집 영어영역 고1 독해 (2021년),최신 6년 동안 출제된 교육청 전국연합학력평가 기출 문항 중 우수 문항을 선별하여 유형별로 수록하였다.
"매3문법, 매일 개념 3개씩 공부하는 문법기출","2014 수능 국어 영역 [문법]을 완벽하게 대비할 수 있도록 만들었다. 공부하다가 궁금한 점은 저자에게 직접 질문(안인숙 국어클리닉&컨설팅 카페: cafe.daum.net/anin95)할 수 있어, 이제 ‘문법’에 대한 두려움은 <매3문법>으로 해결할 수 있다."
Listen Master 모의고사 35회,"본서는 문제를 풀 때 내용 이해와 전반적인 분위기를 파악하는 학습에 초점을 맞추었다면, 딕테이션 코너에서는 단어의 발음.문장의 억양 구별, 어순 이해 등에 집중하면서 정확한 듣기 실력을 향상시킬 수 있도록 하였다.

또한, 한 눈에 보이는 4단계 해설로 문제를 풀 때 필요한 해결과정을 문제 -> Script -> Translation -> Vocabulary & Expressions로 한 눈에 보이도록 모두 실었으며, EBS, ARIRANG TV와 라디오를 비롯한 각종 CF 속 바로 그 성우 5팀이 녹음한 생생한 MP3 파일을 수준별 모의고사에 맞는 3가지 속도로 제공한다."
훈련도감 비문학 (2020년),"최신 출제코드에 적합한 평가원 10개년 기출문제로 완벽 훈련하는 국어 비문학 문제집이다. 쉬운 문제에서 어려운 문제로 난이도순으로 되어 있어 중하위권도 실력 향상시키기에 좋은 구성이다. 점점 어려워지는 고난도 비문학 문제를 대비한 「고난도 긴 지문」과 「융합 지문」을 강화하였고, 시험장에서 문제푸는 사고과정을 보여 주는 실전적 지문독해와 문제분석식 해설을 담았다."
개념 SSEN 쎈 라이트 미적분 (2021년용),"중요한 개념을 먼저 제시하고 예, 참고, 설명 등으로 이해를 도왔으며, 핵심 개념을 알아보기 쉽게 도식화하여 직관적 이해를 돕도록 하였다. 꼭 풀어봐야 할 유형을 엄선하여 대표유형로 구성하고 충분한 학습이 이루어질 수 있도록 다양한 유제를 제공하였으며, 최근 출제 경향을 반영한 2단계 마무리 문제로 개념 학습부터 실전 대비까지 가능하도록 최적의 학습 체제를 구현하였다."
단톡 국어영역 현대시 (2019년용),"기출로 개념 이해부터 문제 풀이까지 빠르게 끝내는 단기 학습서로, 기출에서 뽑은 '제재별 대표, 빈출지문'을 완전 정복한다. 선택지별 정답.오답인 이유를 친절하고 자세하게 설명한 것은 물론, 고난도 문항은 첨삭식 해설 [보면서 이해하기]를 통해 완벽하게 이해하고 넘어갈 수 있도록 하였다."
Xistory 자이스토리 고난도 1등급 수학 가형 (2020년),"고난도 1등급은 수능 수학 1등급을 목표로 가진 학생이나 1등급을 유지하고자 하는 학생들에게 유용한 고난도 문제집이다. 고난도 문제에서 자주 이용되는 스킬이나 특별한 비법을 알 수 있도록 하고, 수능 트렌드에 맞는 고난도 문제로 1등급을 완성할 수 있는 교재이다. 유형 순서대로 공부하면 좀 더 체계적으로 고난도 문제에 대한 감과 흐름을 잡을 수 있을 것이다. 또한, 정확하고 자세한 해설, 풍부한 보충 첨삭 해설은 문제를 풀어가면서 개념을 적용하는 방법을 자연스럽게 익힐 수 있도록 도와준다."
EBS 수능 기출의 미래 영어영역 7개년 모의고사 (2020년),"2014학년도부터 2020학년도까지 7년간의 수능, 9월 모평, 6월 모평 총 21회 기출 문제를 한 권에 수록한 교재다. 한국교육과정평가원 출제 기출 문제 21회분을 실제 시험을 보듯 풀어볼 수 있으며, 자세하고 명쾌한 해설로 문제의 핵심을 제대로 파악할 수 있다."
리얼 오리지널 수능기출 5개년 모의고사 15회 고3 수학 나형 (2020년),"2016~2020학년도 최근 5개년 동안 시행된 ‘6·9·수능 평가원 기출문제’만을 15회 수록했다. 2015 개정교육과정에 맞는 문제만을 엄선하여 개편 재구성하였으며, 2021 수능시험과 6월, 9월 모평을 대비할 수 있다. 실제 시험지와 똑같은 형태로 되어 있고, OMR 체크카드를 제공하므로 실전 모의고사와 동일한 느낌으로 학습할 수 있다. 또한 빠른 정답과 등급 컷을 수록해 자신의 실력을 바로 확인할 수 있다."
2020 마더텅 전국연합 학력평가 기출문제집 고2 영어 어법.어휘 (2020년),"2002~2019 18개년 고2 전국연합 학력평가 전 문항 최다 수록했다. 2013~2019년 최신 기출 경향을 반영한 기출 변형 문제로 구성된 '실전모의고사' 18회, 수능 기출 문장을 통해 필수 어법을 익힐 수 있는 '수능 독해를 위한 구문 101 부록', 전 문항 모든 선지에 정·오답을 명확히 설명해주는 자세한 풀이 등을 실었다."
지금필수 국어영역 국어 (2021년용),"개념부터 유형, 그리고 실전까지 수능 국어 영역의 기본기를 다질 수 있는 수능 입문서다. 수능 출제의 바탕이 되는 국어 영역의 필수 개념을 갈래별로 꼼꼼하게 정리할 수 있으며, 기출문제를 통해 빈출되는 기본 유형을 알고, 변형 문제를 통해 수능 국어의 필수 유형을 익힐 수 있다."
EBS 수능 기출의 미래 과학탐구영역 물리학 1 (2020년),"기출로 시작해서, 기출로 끝내는 수능 대비. 수능 준비에 있어 아무리 강조해도 지나치지 않는 기출 문제 풀이와 반복학습을 할 수 있다. 최근 5개년의 대수능, 모의평가, 학력평가 기출 문제를 엄선하고 최다 문제를 실었다."
대학전공백과 : 인문사회.예체능 편,"인공지능 기술을 통해 전국 110개 대학, 4000 여개 학과의 진로/진학 정보를 분석한 종합 입시정보지이다. 1부 '대학별 학과지도'는 110 개 대학의 학과 정보를 지도 형태로 시각화 하여 제공한다. 2부 '전공별 상세정보'는 개별 전공에 초점을 두고 학과별 상세정보를 워드 클라우드의 형태로 제공한다."
EBS N제 수학영역 수학 가형 210제 (2017년용),EBS N제 수학영역 가형 210제의 일부 문항은 EBS 수능교재 중 엄선된 우수한 문항으로 구성하였다.
리딩튜터 Reading Tutor 수능 PLUS,"독해에 대한 자신감을 충전하고 독해 실력을 향상시키고 싶은 학생들을 위한 독해 기본서. 다양하고 재미있는 소재의 지문으로 지루하지 않게 독해를 할 수 있다. 최신 문제 유형과 학습 트렌드가 반영된 수준 높은 문제들로 내신, 수능에 대비할 수 있다."
"나기출, 나 없이 기출 풀지 마라 화작문 (문제 + 해설) (2020년)","12개년 화법, 작문, 문법 문제와 해설로 이뤄진 교재로, 따로 개념어 정리집을 살 필요가 없도록 기출에 바로 적용할 수 있는 개념 설명을 하였다. 시험이 끝난 후에 하는 당위적인 해설이 아니라, 시험장에서 학생들이 할 수 있는 해설을 하였으며, 이런 문제와 지문을 시험장에서 만나면 이렇게 대처하라는 실전적 해설을 하였다. 또한, 어렵거나 애매한 선지에 대한 해설을 매우 상세하게 하여 사고를 정교하게 교정할 수 있도록 구성하였다."
2021 DCAF 생명과학 1 기출해체분석서 - 상 (2020년),기출해체분석서는 기출분석으로 확실히 끌어내야 할 선택적 독해능력/행동 강령/필연적 논리를 수많은 관점으로 빚어내 탄생했다. 2015년부터 꾸준히 연구한 문제 풀이 관점/스킬적 결론/상세 해설을 수험생들이 온전히 체화시킬 수 있도록 표현하였다.
맨처음 수능 영어 유형독해 실력편,"‘맨처음 수능 영어 시리즈’는 중학교 수준으로 난이도를 조절한 기출 지문을 통해, 유형독해에서 실전 모의고사까지 총3권으로 수능을 완성할 수 있는 단계별 학습서다. ‘맨처음 수능 영어 시리즈’의 두 번째 책인 본 교재는, 중학교 수준의 어휘를 통해 모의고사는 물론 수능 기출 문제까지 학습할 수 있도록 구성되었다. 특히 수능 유형에 대한 유형별 학습 방향을 제시하고, 생생한 유형풀이 전략을 통해 수능 대표 유형을 마스터할 수 있다."
누드교과서 국어영역 문법 (2019년용),"누드교과서 문법은 '한눈에 보기'와 '중단원 누드 정리'를 통해 개념을 체계적으로 이해하고 오래 기억할 수 있도록 구성하였다. 또, 다양한 자료와 예시를 통해 문법 개념을 통합적으로 이해할 수 있도록 하고 기존 교과서의 설명처럼 딱딱하게 느껴지지 않도록 친절하게 풀이하고 있다."
짱 쉬운 유형 수학(상) (2021년용),내신과 학력평가에서 가장 쉬운 유형만 모아 놓은 기출분석 교재다. 기본＋기출＋예상 3단계로 유형을 완벽 공략한다.
영어 빈출 주제 15분 모의고사 (2021년용),"최근 수능과 모의평가 지문의 주제를 분석하여 빈출 주제를 선정하였고, 수능과 모의평가 기출 문제에서 엄선한 지문들로만 구성했다. 지문이나 문항 유형의 난이도 등을 고려하여 15분 안에 문제 풀이를 할 수 있도록 8~10문항을 배치하였다. 각 회별로 문제 풀이 후 해당 주제의 빈출 어휘를 학습할 수 있도록 하였으며, 해당 지문의 주제, 정확한 해석, 해설, 필수 어휘, 구문을 수록하였다."
진짜 잘 이해되는 고교 영문법 2,영문법의 기본 개념과 핵심 문법 사항을 생생한 대표 예문들과 다양한 유형의 문제들로 익힐 수 있는 컴팩트한 최적의 학습 체계를 가진 영문법 기본서이다. 영문법의 기본 개념과 핵심 문법 내용을 이해하기 쉽게 정리된 친절한 설명과 생생한 대표 예문을 제시하였다.
2019 수능대비 마더텅 수능기출문제집 한국지리 (2018년),"총 795문항을 18개의 단원으로 나누어 수록하였다. 2018학년도 수능 · 모의평가, 2017년 학력평가 기출문제 전 문항을 수록하였고, 2010~2016년 시행된 수능 · 모의평가 · 학력평가 기출문제를 선별 수록했다."
2021 이해원 모의고사 N제 수학 2 (2020년),"실제 수능 수학에 출제될 수 있는 문항들과 수능 수학 공부에 도움이 되는 문항들을 모두 공부할 수 있도록 제작하여 수록하였다. 또한 단순한 문제 모음이 아니라 모든 문제를 공부했을 때, 수능 범위에 나올 수 있는 모든 유형과 수능 범위에 해당하는 교과서 개념을 모두 복습할 수 있도록 구성하여 수능 수학을 공부하는데 큰 도움을 준다."
수능기출 단원별+연도별 수학영역 A형,"2007년부터 200만 부를 판매한 마더텅 기출문제집의 결정판. 단원별 + 연도별 1,476문제, 신수능 기출문제 8회분을 수록하였다."
All New Time for Grammar Intermediate,"명확한 문법 설명을 제시하여 학습자가 문법의 개념을 쉽게 익히도록 하였다. 실용적인 예문과 함께 Think!, Grammar Info와 같은 코너를 두어 문법을 단순히 암기하는 것이 아니라 개념과 원리를 생각해보며 재미있게 학습할 수 있도록 하였다.

해당 Unit의 문법 설명과 대응한 확인 및 연습 문제를 통해 문법 개념을 이해했는지를 점검하였으며, 'Step 1 문법 개념 확인 → Step 2 문장 쓰기 → Step 3 문장과 글 쓰기'로 구성된 글쓰기 연습을 통해 학습한 문법 사항을 작문에 적용해봄으로써 문법의 실제적 쓰임을 익히고 영작 실력을 향상시킬 수 있다."
리딩튜터 - 마무리,"10년 가까이 지속되어 온 '리딩 튜터'시리즈 중 하나로, 난이도에 따라 분류되어 있다. 개인차가 있지만 '기본'편은 고1, '도약'편은 고2, '마무리'편은 고2-3학년에 적합하다. 흥미로운 지문을 이용해 학습자가 독해에 지루함을 느끼지 않도록 배려했다. '입문'편은 예비 고등학생에게 적합한 난이도이다."
수학의 샘 미적분 (2021년용),"2018년 3월 1일부터 적용되는 새 교육과정(2015 교육과정)에 맞추어 고등학교 수학 교육과정이 바뀐다. 새 교육과정은 복잡한 계산 위주의 학습을 지양하고, 내용 및 주제 간의 연결성을 강조하였다. 또한 내용 삭제로 학습량 축소, 내용 이동 및 추가로 인한 연계학습이 변화하였다. 『수학의 샘』시리즈는 교육과정의 내용 삭제로 학습량 축소, 내용 이동 및 추가로 연계학습의 변화를 동시에 공략할 수 있는 수학 기본서다."
리얼 전국 연합 모의고사 3개년 기출 문제집 고1 영어영역,입시플라이 ‘고1 | 전국 연합 모의고사 <3개년> 문제집 <리얼>’은 최근 3년 동안 고1을 대상으로 시행된 교육청 학력평가를 월별로 묶어 풀도록 구성하여 출제 경향과 난이도 변화의 흐름을 파악하기 쉽도록 했다.
리딩 마스터 Reading Master 유형독해 (2021년용),"EBS 교재 집필진이 엄선한 참신한 지문을 수록하였으며, 출제 경향에 딱 맞춘 수능 필수 18개 유형을 마스터한다. 감으로 추론하는 독해가 아닌 지문의 논리적 구조를 훈련하고, 절대로 놓쳐선 안될 특별부록 28개 절대기출문항을 제공한다."
2017 수능대비 마더텅 수능기출문제집 수학 2 (2016년),"누적 판매 230만 부, 2015년 한 해 동안 50만 부가 판매된 베스트셀러 기출문제집. 전 문항, 모든 선지에 100% 첨삭해설을 수록하였으며, 2014~2016학년도 3개년 수능.모평.학평에서 전 문항(380문항)을 수록하였다. 수능에 꼭 나오는 단원별, 소주제별 필수 개념 및 암기사항을 정리하였고, 2014~2016학년도 3개년 수능.모의평가 9회분을 연도별로 추가 수록하였다."
교과서 다품 고등 수학 1 (2021년용),"9종 교과서 문제를 분석하여 교과서 수준의 난이도로 구성하였다. 교과서 변형 문제를 해당 교과서 출판사와 함께 제공하였다. 쌍둥이/유사 문제를 2단계까지 제공하여 반복 학습에 최적화되어 있으며, 시험 출제율을 제공하여 문제의 중요도를 학생들이 인지할 수 있도록 구성하였다."
2016 한석원 실전모의고사 1 수학 B (2015년),"시리즈로 출시되며 6평 이후부터 수능 직전까지 수험생의 학습 스케줄에 맞춰 체계적인 마무리 학습을 할 수 있도록 총 15회분(1권 - 8회분, 2권 - 7회분)으로 구성하였다. ‘2016 한석원 실전모의고사 1’은 많은 수험생들로부터 인정받은 2014, 2015 한석원 실전모의고사에서 우수문항만을 엄선하여 8회분으로 구성한 수능 대비 실전모의고사이다."
2021 파워오브원 한국지리 이것이 기출이다 - 전2권 (2020년),한국지리에서 반드시 공부해야 할 중요한 내용을 체계적으로 담아낸 교재다. 지금까지 출제된 기출문제를 꼼꼼하게 분석해서 핵심 내용이 문제로 출제될 때 이를 해결하는 노하우까지 정성스레 담았다.
상상국어 N제 문학 (2020년),수능 국어 영역 대비를 위한 학습서로서 수험생들의 취약점을 단기간 집중 보완할 수 있도록 구성되었다. 수험생들에게 필수 교재로 자리 잡은 [상상국어 모의고사] 기출 문제 중 2021학년도 수능을 준비하기 위해 꼭 필요한 문제들을 선별했다.
100발 100중 고등 국어 기출문제집 A 1학기 중간고사 창비(최원식) (2021년용),"전국 고등학교의 내신 기출문제를 종합, 분석하여 핵심 적중 문제 다량 수록하였으며, 최신 출제 경향과 출제율을 100% 반영하여 등급을 가르는 서답형, 서술형 문제까지 완벽 대비할 수 있다. 또한 '지문 분석-확인 문제-기본 평가-심화 평가'로 이어지는 단계별 학습 설계로 내용을 완벽하게 습득할 수 있으며, 최종 점검 실전 모의고사도 담겨있다."
고등 교육용 한자 900 + 고사성어 쓰기교본,"고등학교 교육용 기초한자는 급수별로 분류한 후, 중요도에 따라 알기 쉽게 ‘가나다’순으로 배열.수록하였으며, 학생들이 언어생활과 전공 학습에 필요한 한자를 학습하고, 국가공인 한자자격증 시험을 준비하는 데 도움을 주고자 상용 한자 어휘의 자료를 충실히 반영하고, 그외 다양한 실생활과 학업에 필요한 한자만을 열거하였다. 모든 한자는 표제자의 부수, 획수, 총획수를 표시하여 고등학교 교육용 한자만을 골라 900자와 고사성어로 구성되었다.

세계화에 대비해서 완벽한 언어로 발전하기 위해 4개국어로 표기되어 누구든지 쉽게 활용할 수 있다. 또한 한자 어휘를 중심으로 해당 한자의 음과 뜻, 한자 어휘의 활용, 해당 어휘가 활용된 예를 제시하였으며, 중국어 간체자뿐만 아니라 일본어 약자 및 파생어 등도 함께 수록하여 한자 익히기에 도움을 주었다."
EBSi 강의교재 수능개념 사회탐구영역 쾌걸 강봉균의 돌격 한국지리,강사가 직접 자신의 강의에 최적화하여 집필한 교재로 EBSi 사이트를 통해 강좌를 들으며 이용할 수 있다.
EBS 고난도 시크릿X 봉투 모의고사 3회분 영어 (2018년),"기존 모의고사와 차별화된 ‘9평 시즌, 고난도, 프리미엄’ 모의고사이다. 6.9 모평 분석 및 킬러 문항을 수록하였고, X문제(시간 내 못 푸는 문제, 역대 최고난도 기출 등)를 추가 제공한다."
[세트] 비상 완자 내신 1등급 세트 통합과학 (완자 + 완자 기출픽) - 전2권 (2021년),도서 '완자 기출PICK 통합과학 1266제 (2021년)'와 '완자 고등 통합과학 (2021년용)' 세트 상품이다.
"매3화법과작문, 매일 3단계로 훈련하는 화법과 작문 수능 기출 (2018년)","수능 1교시 1번부터 시작되는 화법과, 화법에 이어 6번부터 출제되는 작문은 자신감을 갖고 풀어야 문법과 비문학(독서), 문학도 당황하지 않고 풀 수 있다. 화법과 작문은 한 문제라도 틀리면 억울한 영역이기 때문에 만점 공부 전략이 필요하다. 시간 초과나 실수 때문에 안타깝게 틀리게 되는 화법과 작문 문제를 문제 풀이 시간을 단축할 수 있게, 실수를 줄이는 공부법으로 구성해 1교시 국어 영역에 자신감을 가질 수 있도록 하였다."
2021 파워오브원 세계지리 이것이 기출이다 - 전2권 (2019년),세계지리에서 반드시 공부해야 할 중요한 내용을 체계적으로 담은 것은 물론이고 지금까지 출제된 기출문제를 꼼꼼하게 분석해서 핵심 내용이 문제로 출제될 때 이를 해결하는 노하우까지 정성스레 담고 있다.
MAPL 마플 시너지 내신문제집 미적분 1 1927Q (2019년 고3용),유형별 내신 대비 문제집. 모든 교과서의 출제 가능한 문제로 구성되어 있다.
新수학의 바이블 BOB 수학 2 (2021년용),"개념 콕콕, 유형 콕콕, 실력 콕콕의 구성으로 3단계 수준별 학습이 가능하다. 개념을 직접적으로 적용할 수 있는 간단하고 쉬운 문제 수록하여 개념을 확실히 익히고 소화할 수 있도록 하였으며, 엄선된 대표 유형과 해당 유형을 보다 구체적으로 알고 싶을 때 사용할 수 있는 QR코드를 통해 '新수학의 바이블'의 대표 예제와 연동하여 학습할 수 있도록 링크를 걸어두었다."
냥샘과 함께하는 국어여행 제로,"중학교와는 다른 고등학교 국어를 처음 공부하는 학생들에게 '국어의 올바른 학습 방법론'을 제시해 주는 책으로, 단순히 문제만 푸는 책이 아니라, 문학 작품 해석 방법과 비문학 독해 방법, 문제 풀이 비법 및 문학 개념을 알려 주는 책이다. 매일 하루 1시간씩 30일 동안 수능 국어의 전체 영역(화법, 작문, 문법, 비문학(독서), 문학)의 기초/기본을 닦을 수 있다."
