title,summary
개념 있는 국어문법 (2021년용),"대학교에서 각 분야를 연구.강의하는 교수님들이 직접 책임 집필한 책이다. 축적된 경험과 앞서가는 지식, 학생들의 눈높이에 맞추어 친절하고 자세한 설명이 수록되어 까다로운 문법 개념을 완벽히 익힐 수 있다. 참신하고 세련된 개념 연습 문제와 실전 문제를 통해 시험을 대비할 수 있으며, 필수 개념에서 심화 개념까지 학습 내용을 스스로 점검할 수 있도록 구성하였다."
EBS 수능특강 과학탐구영역 화학 2 (2021년),"최신 수능 경향과 기출 유형을 분석한 2022학년도 수능 대비 종합 개념서. 교육과정과 최신 수능을 반영한 핵심 내용을 제시했다. 수능 시험을 대비하는 학생이라면 꼭 봐야 할 교재다. 수능특강과의 완벽한 시너지, 수능특강 지문과 유사도가 높은 기출문제를 선별수록 했으며, 어휘로 판가름 나는 수능 등급, 연계교재의 어휘 학습을 한권으로 완성할 수 있다."
EBS 수능 기출의 미래 수학영역 수학 1 (2021년),"2022학년도 수능과 교육과정에 딱 맞는 문항만을 엄선하고, 핵심만 깔끔하게 정리된 슬림한 해설을 제공하는 책이다. 핵심 문항, 고난도 킬러 문항의 해설은 더 자세하게 설명하였다. 한 번 더 듣고 싶은 문항의 해설 강의는 문항코드 검색으로 쉽게 찾아볼 수 있다."
문학 개념어와 논리적 해석,"수능, 평가원모의고사, 학력평가 등 모든 시험에 대비할 수 있는 문학의 기초이나 필수인 문학 개념어를 쉽게 이해할 수 있도록 자세하게 설명한 책이다. 또한 문학 문제의 출제 의도를 파악하고 함정을 피해 답을 찾아내는 문제 해결력을 기를 수 있도록 하였다. 어떤 작품이더라도 정확하게 읽고 그에 맞게 문제를 풀 수 있도록 대표성 지닌 작품과 낯선 작품을 다양하게 수록하고 그에 대한 문제도 실었다."
해법 문학 고전 시가 (2021년용),"15개정 교육과정에 따른 10종 문학 교과서, 11종 국어 교과서 및 독서, 화법과 작문, 언어와 매체 등에 실린 고전 시가를 최다 수록한 문학 참고서다. 교과서에 실린 작품을 포함한 시대별 주요 작품 226편을 통해 이 한 권으로 고전 시가 학습을 끝낼 수 있도록 구성했다.

각 작품의 상세한 분석과 함께 핵심 내용을 한눈에 볼 수 있도록 구조화하여 쉽고 재미있게 문학 작품을 학습할 수 있도록 했으며, 교과서 학습 활동을 바탕으로 한 문제와 수능·평가원·교육청 기출문제를 수록하여 내신과 수능을 동시 대비할 수 있도록 하였다."
新수학의 바이블 미적분 (2021년용),"하나의 예제를 숫자바꾸기(모방) -> 표현바꾸기(변형) -> 개념넓히기(응용) 3단계 유제로 학습하여 유형에 대한 적응력을 높일 수 있으며, 기본다지기 -> 실력다지기 수준별 연습 문제를 통해 기본에서 고난도까지 문제 해결력을 기를 수 있다. 또, 접근방법 -> 상세풀이 -> 보충설명 3단계의 체계적이고 자세한 풀이 방식으로 문제에 대한 접근 및 해결방법을 쉽게 이해할 수 있다."
블랙라벨 수학 2 (2021년용),"<2015 개정 교육과정>에 맞춰 새롭게 개발한 상위권을 위한 단계별 명품 수학 문제집이다. 우수 기출 대표문제와 특목고.강남8학군의 변별력 있는 신경향 문제, 문제 해결력을 강화시킬 수 있는 종합 사고력 문제를 단계별로 학습하면서 변별력이 높아지는 내신시험에서 1등급을 달성할 수 있도록 하였으며, 이와 함께 수능 실력 또한 함께 쌓을 수 있도록 구성하였다. 기존 상위권 문제집의 문제 구성 비율을 뒤집은 다이아몬드식 문항 구성으로, 질 좋은 '상', '최상' 난도의 문제가 가득하다."
Reading Expert 2,"Reading Expert는 중고등학생을 대상으로 한 5단계 구성의 원서 독해 교재다. 단계별 학습을 통해 독해기술, 배경지식, 문장 구조, 어휘 등의 지식을 확장함과 동시에 독해 실력도 향상시킬 수 있다."
씨뮬 9th 수능기출 전국연합학력평가 3년간 모의고사 고3 국어 공통+선택(화법과 작문) (2021년),"달라지는 2022학년도 수능 체제를 적용하여 공통과목+선택과목으로 구성하였다. 과목별로 기출 문제를 푸는 가장 효과적인 방법을 제시하고 이를 적용하여 상세하게 설명하였다. 문제 풀이 후 빠른정답과 등급컷을 바로 확인할 수 있으며, 실전 느낌을 더욱 높여주기 위한 필수 항목인 OMR 카드를 제공한다."
Xistory 자이스토리 수능 국어 문학 실전 (2021년),"갈래별 7개 ‘독해 공식’과 대표 문제 유형에 대한 ‘문제 풀이 꿀팁’을 통해 쉽고 빠르게 수능 국어 문학을 완성할 수 있는 교재다. 최신 기출 문제에 독해 공식과 문제 풀이 꿀팁을 직접 적용하며 스스로 익혀 나갈 수 있는 수능 문학 독해 훈련 프로그램을 제공한다. 수능 유형에 꼭 맞는 수능.평가원.학력평가 기출문제를 선별하여 지문 주제별 혹은 유형별로 분류했다.

또한 오답률이 높았던 고난도 지문 및 문제를 ‘1등급 고난도 지문’으로 분류하여 집중 학습하고, 1등급 킬러 문제를 쉽게 해결할 수 있는 특별한 ‘문제 풀이 Tip’을 제공한다. 수능에 대비할 수 있도록 15문항으로 구성된 문학 모의고사를 수록하였다."
현자의 돌 생활과 윤리 기출문제집 - 전2권 (2021년),"차별화된 전략을 갖춘 ‘기출문제 해설-분석서‘다. 수능&6.9평 기출 문항을 수록하였고, 사상과 원전을 통한 오개념 없는 설명을 실었다. 심화 기출 분석 강의 같은 상세한 해설을 실었고, 논리적인 문제풀이(독해) 방법론을 제시하였다."
EBS 수능특강Q 미니모의고사 영어영역 영어 Hyper (2021년),"3,300원으로 만나는 한국교육과정평가원 역대 감수 문항 에센스 '수능특강Q 미니모의고사'. 역대 수능 연계교재의 고퀄리티 문항을 엄선하여 15~20분 분량의 14회 미니모의고사로 구성했다. 목표 시간과 헷갈린 문항, 틀린 문항을 정리할 수 있는 학습계획표를 제공한다."
나쁜국어 독해기술 (2021년),"저자가 제시한 체계적인 독해 방법론(공부법)에 따라 훈련을 하며 쉽고 빠르게 독해력을 향상시키는 신개념 독해력 강화 프로그램이다. 저자는 수능 국어는 물론 어떤 국어 시험에도 통하는 18가지의 독해기술을 바탕으로 한, 빠르고 정확한 독해 방법론을 제시하였다.

또한 이 독해 방법론을 바탕으로 많은 학생들이 특히 어려워하는 과학/기술 지문과 긴 지문 독해를 ‘과학/기술 지문 강화’와 ‘고난도 긴 지문 강화’라는 별도의 꼭지로 다루고, 이에 대한 해법까지 제시함으로써 탄탄한 독해력을 갖출 수 있도록 하였다."
100발 100중 고등 국어 기출문제집 B 1학기 기말고사 신사고(민현식) (2021년용),"전국 고등학교의 내신 기출문제를 종합, 분석하여 핵심 적중 문제 다량 수록하였으며, 최신 출제 경향과 출제율을 100% 반영하여 등급을 가르는 서답형, 서술형 문제까지 완벽 대비할 수 있다. 또한 '지문 분석-확인 문제-기본 평가-심화 평가'로 이어지는 단계별 학습 설계로 내용을 완벽하게 습득할 수 있으며, 최종 점검 실전 모의고사도 담겨있다."
올바른 책 수능특강 분석노트 영어영역 영어독해연습 (2021년),"2022학년도 EBS수능특강 모든 지문을 분석하였다. 중간고사 및 기말고사 100% 내신 대비가 가능하며, EBS교재 및 변형문제와 병행 공부할 수 있다. 지문에 적용된 문법을 완벽 정리하고, 지문 주제 파악 및 요약을 수록하였으며, 지문 해석과 주요 어법구조와 핵심 어휘 및 표현을 제시하였다."
7일 끝 중간고사 기말고사 고등 통합사회 (2021년),"7일 동안 하루 8쪽 학습으로 단기간에 내신 평가 대비 학습을 빠르게 마스터할 수 있는 교재로, 매일 스스로 학습하기에 부담스럽지 않은 분량이다. 시험에 꼭 나오는 핵심 개념과 빈출 유형만을 콕 집어 제시하였으며, 어렵지 않은 난이도 문제를 풀면서 중하위권 학생들도 사회 공부에 자신감을 가질 수 있다."
능률 Grammar Zone 기본편 1,"그래머존은 살아있는 예문과 자세한 문법 설명의 국내 유일무이 전(全)단계 문법 기본서다. 그 중 기본편은 수능 및 내신 대비를 위해 본격적인 문법 학습을 원하는 예비 고교생 및 고등학생을 위한 문법 교재다. 개정을 통해 최근 경향과 더욱 정확한 용법을 반영한 그래머존으로 다시 태어났다. 코퍼스 데이터에 기반을 둔 문법 항목을 선정, 불필요한 문법 내용을 배제한 주요 문법 중심 구성이다.

정확하고 자세한 설명과 영미문화권에서 실제로 사용하는 활용도 높은 예문을 제시하였고, 미국식과 영국식, 문어체와 구어체, 구식 표현과 최근 경향 등을 비교하여 정확한 용법(usage)을 제시한다. 다양한 유형의 연습 문제와 단락 독해를 통한 체계적인 학습으로 문법 적용력을 향상시켜준다."
블랙라벨 수학 (하) (2021년용),"2015 개정 교육과정에 맞춰 새롭게 개발한 상위권을 위한 단계별 명품 수학 문제집이다. 우수 기출 대표문제와 특목고.강남8학군의 변별력 있는 신경향 문제, 문제 해결력을 강화시킬 수 있는 종합 사고력 문제를 단계별로 학습하면서 변별력이 높아지는 내신시험에서 1등급을 달성할 수 있도록 하였으며, 이와 함께 수능 실력 또한 함께 쌓을 수 있도록 구성하였다.

기존 상위권 문제집의 문제 구성 비율을 뒤집은 다이아몬드식 문항 구성으로, 질 좋은 '상', '최상' 난도의 문제가 가득하다. 또한 특목고.강남8학군 교사와 명강사가 함께 집필하고, 특목고.강남8학군 학생이 검토하였으며, 서울대 선배들의 1등급 비법 노하우를 담았다."
어휘끝 고교기본,"‘추론 능력’을 기르는데 탄탄한 밑바탕이 되도록 고교내신과 수능 어휘의 약 80%를 차지하는 기본 2,400여 개의 어휘들을 수록했다. 이 어휘들은 빈도가 높을 뿐 아니라 소재를 가리지 않고 활용되는 어휘들로 생소한 어휘를 추론하는데 결정적 역할을 하게 될 것이다. 또한 어휘를 설명하는 모든 예문의 우리말 번역에 표제어를 빈칸으로 처리해, 어휘를 보며 뜻을 추론하는 능력을 자연스럽게 기를 수 있도록 구성했다."
MAPL 마플시너지 내신문제집 수학 2 (2021년용),"학교 교과서를 유형별 단원별로 정리한 학교 내신의 완벽 대비서로, 내신 1등급 필독서이다."
해법 문학 세트 - 전5권 (2021년용),"2015개정 교육과정에 따른 10종 문학 교과서, 11종 국어 교과서 및 독서, 화법과 작문, 언어와 매체 등에 실린 문학 작품을 최다 수록한 문학 참고서다. 교과서에 실린 작품을 포함한 주요 작품 875편을 통해 문학 작품 학습을 끝낼 수 있도록 구성했다. 각 작품의 상세한 분석과 함께 핵심 내용을 한눈에 볼 수 있도록 구조화하여 쉽고 재미있게 문학 작품을 학습할 수 있도록 했으며, 교과서 학습 활동을 바탕으로 한 문제와 수능.평가원.교육청 기출문제를 수록하여 내신과 수능을 동시 대비할 수 있도록 했다."
EBS 국어 독해의 원리 고전 시가 (2021년용),"예비 고1~고2 학생들을 대상으로 문학 작품과 독서(비문학) 지문을 독해하는 방법을 정리하였다. 독해 방법을 6가지 원리로 정리, 작품과 지문을 독해할 때 필요한 요소들을 한 번에 학습할 수 있으며, 현대시, 현대 소설, 고전 시가, 고전 산문, 독서(비문학) 5권으로 구성하여 영역별로 집중 학습이 가능하다."
EBS 수능특강 과학탐구영역 지구과학 2 (2021년),"최신 수능 경향과 기출 유형을 분석한 2022학년도 수능 대비 종합 개념서. 교육과정과 최신 수능을 반영한 핵심 내용을 제시했다. 수능 시험을 대비하는 학생이라면 꼭 봐야 할 교재다. 수능특강과의 완벽한 시너지, 수능특강 지문과 유사도가 높은 기출문제를 선별수록 했으며, 어휘로 판가름 나는 수능 등급, 연계교재의 어휘 학습을 한권으로 완성할 수 있다."
능률 EBS 수능특강 변형 문제 738제 영어(상) (2021년),2022학년도 수능 및 내신을 한 번에 대비할 수 있는 EBS 변형문제집이다. 70명의 NE능률 영어교육연구소 집필진이 개발한 양질의 변형 문제로 EBS 전 지문 변형 문제 학습이 가능하다.
2022 수능대비 마더텅 수능기출문제집 영어 어법.어휘 (2021년),"수능/모평/학평에 출제되는 문법과 유형을 분석하여 적용한 문법별/유형별 기출문제집이다. 기출 100% 반영으로 수능에 효과적으로 대비하는 완벽 실전 훈련서다. 총 444문항, 수능/모평/학평 및 경찰대/사관학교 기출문제 최다 수록으로 실전을 완별 대비할 수 있다."
능률보카 숙어편,"새 교육과정 교과서 전종을 반영한 고교 필수 숙어 총정리 교재다. 전치사/부사의 의미에 따라 분류하여 과학적 암기가 가능하다. 각 숙어의 유/반의어, 자주 쓰이는 목적어를 수록하였고, 각 숙어의 실제 쓰임을 잘 보여주는 실용적인 예문을 제시하였다. 혼동되는 숙어, 뜻이 대조되는 숙어, 비슷한 숙어를 정리하여 실었다."
Xistory 자이스토리 생활과 윤리 (2021년),"새교육과정 교과서를 분석하여 개념을 총정리 하고 기출 문제와 예상 문제를 수록하여 2022학년도 수능에 꼭 맞는 기출 문제집이다. 새교육과정 교과서의 개념 순서와 문제 유형에 따라 문제를 배열해 기출 분석 효과를 더욱 높였으며, 최신 수능과 6월, 9월 모평 기출 문제를 분석하여 어떻게 출제되었는지 구체적으로 알려주고, 출제 경향에 맞춰 학습할 수 있도록 했다.

또한 실제 수능 선택지와 자료로 ‘깨알 개념 체크’ 문제를 구성하여 개념을 정확히 이해하고 암기하는데 효과적이고, 고난도 문제가 출제되는 단원은 따로 킬러 단원으로 표시하고 문제를 2등급 킬러, 1등급 킬러로 분리해 수록하였다. 수능 대비를 위한 최종 실력 점검을 위해 최신 연도별 모의고사 10회를 제공한다."
1페이지 공부법,"MBC '공부가 머니?' 출연으로 큰 화제가 되었고, 방송 이후에도 해당 영상의 조회 수가 100만 회를 넘길 만큼 뜨거운 관심을 받은 2020학년도 수능 만점자 홍민영 학생의 공부법을 촘촘하게 담았다. 1부에서는 고3에 올라가 딱 7개월 준비한 수능에서 만점을 받고 서울대에 진학할 수 있었던 핵심 비법인 동시에 내신과 수능에 모두 통하는 ‘1페이지 공부법’과 ‘과목별 공부법’을 구체적으로 알려준다.

2부에서는 공부를 방해하는 슬럼프나 불안감 같은 심리적 요인과 여러 환경적 요인에 현명하게 대처하는 방법들을 상세하게 조언한다. 코로나로 학습 결손이 커진 요즘, 공부 효율을 최대로 끌어올리고 싶다면 반드시 읽어야 할 수험생 필독서이다."
EBS 수능특강Q 미니모의고사 국어영역 국어 Hyper (2021년),"역대 수능 연계교재의 고퀄리티 문항을 엄선하여 15~20분 분량의 14회 미니모의고사로 구성하였다. 목표 시간과 헷갈린 문항, 틀린 문항을 정리할 수 있는 학습계획표를 제공한다."
EBS 수능특강Q 미니모의고사 국어영역 국어 Jump (2021년),"역대 수능 연계교재의 고퀄리티 문항을 엄선하여 15~20분 분량의 14회 미니모의고사로 구성되었다. 목표 시간과 헷갈린 문항, 틀린 문항을 정리할 수 있는 학습계획표를 제공한다."
메가스터디 N제 고1 통합과학 1480제 (2021년용),"교과서 집필 전문가, 교육청 출제 전문가, EBS 교재 집필 전문가가 함께 모여 내신 1등급을 위한 내신 대비 교재로 개발하였다. 학교 기출 문제 분석을 토대로 개념과 자료를 정리하고, 학교기출 빈출문제, 학교기출 최다 오답문제, 고난도 문제, 교육청 기출 변형문제, 서술형 문제 등 다양한 유형의 문제를 최다로 수록하여 내신 1등급이 가능하도록 하였다."
어삼쉬사 미적분 (2021년용),"수능 수학, 어삼쉬사를 넘어야 1등급 도전이 시작된다! 어삼쉬사란? 중위권 학생에게는 꼭 정복해야 할 유형, 상위권 학생에게는 빨리 풀어야 할 유형을 담은 어려운 3점, 쉬운 4점 문항 집중 공략서다. 최상위권 도약을 위해 꼭 해결해야 할 유형을 한 권으로 압축한 필수 유형 훈련서로 수능.모의고사 기출을 모티브로 제작한 100% 신규 문항을 수록하였다. 기출 학습과 병행할 필수 도서이며 부록으로 제작의 모티브가 된 짝기출을 제공한다."
P.I.R.A.M 피램 수능 국어 생각의 전개 독서 (2021년),"수능 국어가 변했다. 유형이 변했고, 문제의 순서가 변했다. 나아가 더 깊은 이해력, 더 높은 사고력을 요구하고 있다. 너무나 어려워진 수능 국어, 여러분을 고득점으로 이끄는 것은 결국 '일관된 생각의 힘'이다. 어떤 '생각'을 해야 하는지, 어떻게 그 '생각'을 할 수 있는지 자세하게 알려준다."
2022 OWL FRAME 기출문제집 화학 1 (2021년),"2015 개정 화학의 학습 방향 설정을 위한 필독서이다. 교육과정 성취기준과 평가원 출제경향을 완벽 분석하여 문항을 엄선한 전공자 및 전문 출제진의 다양한 시선이 담겼다. 2014학년도 이후 평가원 시행 모의고사 전문항을 수록하고, 2014학년도 이후 교육청 시행 모의고사 문항을 선별하여 수록하였으며, 2014학년도 이전 평가원 시행 모의고사 문항을 선별하여 수록하였다. 최신 평가원 편집 양식으로 전문항 재편집 수록하였다."
너기출 For 2022 미적분 (2021년),"2015 개정 교육과정에 적합한 수학 평가원 기출을 빠짐없이 담았다.
수능형 핵심개념을 정리한 너기출 개념코드(너코)로 개념, 문제, 해설의 유기적 학습이 가능하며 각 유형별 난이도순/출제년도 순 매끄러운 배열로 기출의 진화 한눈에 파악이 가능하다.
평가원 기출부터 제대로, 전체를 끝까지 빠르게 공부하고 싶다면, 너기출 For 2022!"
너기출 For 2022 확률과 통계 (2021년),"2015 개정 교육과정에 적합한 수학 평가원 기출을 빠짐없이 담았다.
수능형 핵심개념을 정리한 너기출 개념코드(너코)로 개념, 문제, 해설의 유기적 학습이 가능하며 각 유형별 난이도순/출제년도 순 매끄러운 배열로 기출의 진화 한눈에 파악이 가능하다.
평가원 기출부터 제대로, 전체를 끝까지 빠르게 공부하고 싶다면, 너기출 For 2022!"
EBS 수능특강Q 미니모의고사 과학탐구영역 생명과학 1 (2021년),"3,300원으로 만나는 한국교육과정평가원 역대 감수 문항 에센스 '수능특강Q 미니모의고사'. 역대 수능 연계교재의 고퀄리티 문항을 엄선하여 15~20분 분량의 14회 미니모의고사로 구성했다. 목표 시간과 헷갈린 문항, 틀린 문항을 정리할 수 있는 학습계획표를 제공한다."
N기출 수능기출 문제집 수학영역 (선택과목) 미적분 3점 / 4점 집중 (2021년),"<N기출 수능기출 문제집 수학영역>은 최근 5개년 수능 및 평가원 기출 문제를 수록하였으며, 3점, 4점 기출 문제를 공통과목, 선택과목으로 분책하고 수능을 배점별, 난이도별로 대비할 수 있도록 구성하였다."
백발백중 학교시험 수능대비 EBS 수능특강 평가문제집 영어독해연습 (하) (2021년),"영어독해연습에 수록된 전 지문의 소재, 요약, 단락 분석, 핵심 문장, 핵심 어휘, 핵심 어법을 제시하여 지문을 쉽게 이해하도록 하였다. 또한 단계별 변형 문제와 서술형 문제를 학습하는 과정을 통해 문제 해결력을 기르도록 하였다."
100발 100중 고등 영어 기출문제집 B 1학기 기말고사 능률(양현권) (2021년용),"기출문제를 종합 분석하여 출제율이 높은 문제를 다량 수록하였다. 출제 경향과 출제율을 반영해 실전 문제 및 수능형, 서술형 문제까지 완벽 대비할 수 있다. 교과서의 모든 내용이 자연스럽게 각인되는 단계별 학습 설계이며, 수업이나 자기주도 학습을 통해 학습 내용을 완벽하게 습득할 수 있다."
수능·내신 한 권에 끝내는 고교 국어 문법 500제,"국어 문법을 6개의 유형으로 나누어 수록하였다. 유형별 기본 개념과 115문항의 연습 문제를 제시하였고, 내신 변형문제 245문항 및 실전 기출문제 297문항을 수록하였다. 2015 개정 교육과정을 반영한 교과서 필수 개념으로 내신을 대비할 수 있다."
개념원리 고등 수학 확률과 통계 (2021년용),"수학을 어렵다는 편견 없이 시작할 수 있도록 학생들의 눈높이에 맞춘 수학 개념기본서다. 교과서 내용을 충실히 담아 개념과 원리를 확실히 이해하고 문제를 쉬운 것부터 단계적으로 제시하였다. 또한, 단순한 암기식 풀이가 아니라 개념원리에 의한 독특한 교수법으로 새 교육과정에서 요구하는 사고력, 응용력, 창의력을 배양할 수 있도록 기획되어 생각하는 방법을 깨칠 수 있도록 하였다."
국어의 기술 제로 0(ZERO) (2021년용),"중학교 과정을 정리하고 수능과 고등 내신에 대비하는 기본서. 기출문제를 통해 지문 독해법, 문제 풀이법, 국어 기초 개념을 제시하였고, 필수적으로 알아야 할 기초 개념의 정리와 복습을 통해 기초를 탄탄하게 쌓을 수 있도록 하였으며, 스토리텔링을 통한 친근한 문제 해설과 학습 비결을 제공한다. 또한 1일 적정 학습량과 1달 완독 학습 계획을 제시한다."
新수학의 바이블 수학 (상) (2021년용),"※ 해당 강의 영상은 학습을 보조하는 수단이며 유료 컨텐츠입니다. 강의 없이 도서만으로도 학습 가능합니다.

2018년도에 고1에 적용되는 2015 개정 교육과정을 가장 확실하게 반영한 고등 수학 기본서다. 하나의 예제를 숫자바꾸기(모방) -> 표현바꾸기(변형) -> 개념넓히기(응용) 3단계 유제로 학습하여 유형에 대한 적응력을 높일 수 있다. 기본다지기 -> 실력다지기 수준별 연습 문제를 통해 기본에서 고난도까지 문제 해결력을 기를 수 있다. 접근방법 -> 상세풀이 -> 보충설명 3단계의 체계적이고 자세한 풀이 방식으로 문제에 대한 접근 및 해결방법을 쉽게 이해할 수 있다."
新수학의 바이블 수학 1 (2021년용),"新수학의 바이블만의 1+3 단계별·수준별 수학 학습 시스템. 2018년도에 고1에 적용되는 2015 개정 교육과정을 가장 확실하게 반영한 고등 수학 기본서다. 하나의 예제를 숫자바꾸기(모방) -> 표현바꾸기(변형) -> 개념넓히기(응용) 3단계 유제로 학습하여 유형에 대한 적응력을 높일 수 있다.

기본다지기 -> 실력다지기 수준별 연습 문제를 통해 기본에서 고난도까지 문제 해결력을 기를 수 있으며, 접근방법 -> 상세풀이 -> 보충설명 3단계의 체계적이고 자세한 풀이 방식으로 문제에 대한 접근 및 해결방법을 쉽게 이해할 수 있다."
빠른 독해 바른 독해 : 기초세우기,"‘새로운 접근을 통한 문법과 독해의 기본적인 토대 확립’을 목표로 구성되었다. 독해를 쉽고 빠르게 할 수 있도록 문장 성분을 확장하는 방식으로 문법에 접근하고, 독해를 할 때 반드시 알아야 할 기본 사항을 담아 빠르고 정확한 독해 방법을 고안.제시하였다. 이번 개정판에서는 최신 수능 경향에 맞춰 독해 지문을 대폭 교체하였으며, 내신 출제 경향에 맞춰 서술형 주관식 문제를 재정비하고, 학습 내용을 점검할 수 있는 Review Test를 강화하였다."
