title,summary
20세기 미술사,"'추상미술의 창조와 발전'이라는 부제대로, 이 책은 1910년대 칸딘스키와 몬드리안으로부터 추상미술이 시작된 이후, 러시아 구성주의와 1930-40년대 파리 화단을 거쳐 2차 대전 후의 미국 추상표현주의와 유럽의 앵포르멜까지에 이르는 추상미술의 역사를 다루고 있다.

추상미술의 가장 큰 의의는 미술과 미술가들을 자연으로부터 해방시켰다는 데에 있을 것이다. 눈에는 보이지 않는 인간의 내적인 감수성, 즉 이성적이고 논리적인 사고 혹은 폭발할 것 같은 감정의 분출을 그 자체로 표현해 낼 수 있게 된 것이다. 서정적 추상('뜨거운 추상')의 창시자인 칸딘스키는 내적 필연성을 표현하는 정신적인 세상을 회화에서 실현하고자 하였으며, 기하학적 추상('차가운 추상')의 창시자인 몬드리안은 질서 있고 평등한 유토피아를 추구하였다.

제목이 20세기 미술사인 것은 20세기에 창조되어 가장 크게 발전한 것이 추상미술이기 때문이겠지만, 회화 이외에 조각, 건축 등은 거의 다루고 있지 않다. 차라리 부제인 '추상미술의 창조와 발전'을 제목으로 했으면 어떨까 하는 아쉬움이 남는다. 110개의 컬러 도판이 수록되어 있다."
서울체,"한국 현대건축의 지리지 2권. 비교적 명확한 지리 문화적 특징을 보여주는 제주에서 지방의 특질을 확인한 후, 대한민국=서울이라는 등식이 당연한 것으로 여겨지는 현대건축에서 서울성이라는 특질을 추출해 낼 수 있다는 자신감을 확인한 저자가 본격적으로 써내려간 건축 지리지다.

이 책에는 부동산 공화국 대한민국 수도 서울의 건축물 수십만 채 중 서울의 특질과 관련한 11개의 키워드로 엄선한 140여 개의 건축 작품이 실려 있다. 11개의 키워드는 단번에 추출된 것이 아니라 1980년대부터 시작된 저자의 ‘서울의 건축’에 대한 기록에서부터 시작하여 수많은 피드백을 통해 40여 년 만에 완성한 것이다.

이 책은 건축학과 교수로 재직하며 평생을 한국 현대건축 연구와 평론을 해온 건축석학 박길룡 교수가 글을 쓰고 건축전문 사진작가 이재성의 건축사진으로 완성되었다."
남주희 성인 바이엘 3,"성인의 눈높이에 딱 맞춘 피아노 기초 교본이다. 딱딱하고 지루한 반복으로 이루어진 연습곡 대신 클래식, 민요, 대중가요, 트로트 등 흥미로운 레퍼토리를 수록하여 활용도를 높였다. 남주희 선생님만의 노하우 가득한 음악이론과 음악 상식을 배우고 곧바로 연주에 적용함으로써 이론과 연주곡의 체계적인 연계학습이 가능하다. 악보와 핑거링, 가사가 큼직하여 한눈에 볼 수 있다."
샤이닝 리사이틀 3,"바이엘을 치는 초급 레벨에서도 흥겹고 동기유발이 되며, 학습적으로도 뛰어나고, 감상용으로도 적합한 곡들로 교재를 만들었다. 학원에서 연주회를 할 때마다 곡 선정으로 고민하는 어려움도 덜어주고자 가능한 다양한 장르를 포함하였다. 이 교재는 진도 순서로 되어있지만, 모든 곡을 학습해야만 다음 교재로 진행하는 것은 아니고 학생이 원하는 곡을 자유롭게 선택해서 연주할 수 있다."
I LOVE 아이 러브 바이엘 2,"탄탄한 구성, 체계적인 연습, 재미있는 선곡으로 업레이드 된 <I♥LOVE 바이엘> 개정신판. 아이들과 선생님들이 함께 재미있어할 내용으로 구성하고 밝고 톡톡 튀는 ‘시크도도 미유, 뇌섹보이 수민, 상큼발랄 루미, 씩씩열혈 은호’와 함께 새롭게 디자인했다."
판타스틱 시티 도시여행 컬러링북,"아티스트 스티브 맥도날드가 그린 아름다운 전세계 도시풍경 일러스트를 담은 컬러링북이다. 브라질 빈민가의 복잡한 구조, 뉴욕의 우뚝 솟은 고층 건물, 파리의 유서 깊은 주택들의 모습 등 수많은 나라의 눈길을 사로잡는 도시정경이 높은 곳에서 내려다보는 듯한 조감으로 그려져 있다. 마치 영화 ‘인셉션’의 한 장면과 같은 만다라를 컬러링 하다 보면 더욱 깊은 명상에 빠져 창의적인 상상의 나래를 펼치게 될 것이다. 또한, 색다른 시점과 미로처럼 정교한 일러스트는 예술적으로 많은 영감을 줄 것이다."
봉주르 프랑스 컬러링북 (스프링),"추억과 낭만, 설렘과 즐거움이 가득 찬 파리 컬러링 여행. 고흐를 비롯해 많은 화가와 시인들이 모여들었던 몽마르뜨 언덕, 로트랙 그림의 배경이 된 댄스홀 물랭루즈, 헤밍웨이가 자주 찾으며 작품을 구상했던 파리의 노천 카페 레 뒤 마고, 영화 [아멜리에]의 배경이 된 카페 ‘두물랑’, 기차역을 재건한 오르세미술관 등 역사와 추억이 깃든 파리의 실제 모습을 생생한 스케치로 만나고 나만의 컬러로 완성해보도록 구성했다. 한 장의 사진이 주는 생생한 추억만큼 또렷하고 특별한, 나만의 파리 여행이 될 것이다."
컵케이크,"마음을 치유하는 색칠놀이 아트테라피 시리즈 2권. 어른을 위한 색칠놀이에 ‘아트테라피’적인 요소를 가미한 책이다. 프랑스의 유명 일러스트레이터 안느 마고 랑스탱이 그림을 그린 이 책은 컵케이크를 비롯하여 머핀, 마카롱, 도넛, 에클레어, 웨딩 케이크, 사탕, 과자 등 우리가 자주 접하는 디저트 100가지를 수록하여 우리의 혀와 눈을 유혹한다. 또한 갈런드와 픽 만드는 법도 함께 실어서 직접 색칠을 한 후 자르고 붙여서 식탁을 더욱 풍성하게 만들 수 있도록 했다.

이 책은 친숙한 컵케이크를 비롯하여 머핀, 마카롱, 도넛, 과자 등이 가득 차려진 식탁으로 우리를 초대한다. 이들 디저트를 맛보는 방법은 간단하다. 자신이 먹고 싶은 디저트를 선택한 다음 가까이에 있는 재료, 즉 색연필, 수채물감, 파스텔 등을 이용하여 색을 칠한다. 컵케이크 위를 장식하는 딸기를 꼭 붉은색으로 칠할 필요는 없다.

자신의 마음 상태에 따라 아무 색이나 골라서 창의적으로 색을 칠한다. 이때 중요한 것은 마음속에 내재해 있는 우울, 분노, 슬픔, 스트레스 등을 잠시 내려놓는 것이다. 이렇게 색칠에 집중하다보면 어느덧 스트레스에서 벗어나고, 마음이 차분해지며, 보다 긍정적으로 바뀌는 것을 경험할 것이다. 그뿐인가. 배고픔도 잊게 될 것이다. 거기에 완성된 그림을 바라보며 느끼는 뿌듯함은 덤이다."
랭포드의 사진 강의,"영국 및 영연방국가의 대학 사진학과에서 사진학 개론서로 사용하고 있는 책이다. 이 책은 사진 실기 분야의 다양한 기술을 망라하는 사진 종합이론서로, 사진에 대한 포괄적인 지식을 일목요연하게 정리했다.
다양한 연령층의 학생들과 사진에 대한 지식이 전혀 없는 사람들도 큰 무리 없이 읽을 수 있다.

사진 장비와 테크닉, 아날로그와 디지털 사진의 전반적인 이론과 각종 재료, 현상과 인화, 촬영과 후 보정 등을 총괄적으로 다루고 있다. 더불어 주요한 현대 사진가들과 역사적인 사진가들의 언급을 통해 사진의 시각적인 내용과 그 의미의 중요성에 대해 다룬다."
20세기 문화 지형도,"지난 100여 년의 시간을 ‘문화’라는 이름으로 돌아보았다. 유럽에서 시작되어 역사를 만들어온 마르크스와 모더니즘, 소쉬르와 구조주의, 리오타르와 포스트모더니즘 그리고 롤랑 바르트와 후기 구조주의 등 우리 기억 속에 선연한 각각의 사조와 그 대표 인물을 통해 20세기 문화와 사유의 궤적을 그렸다.

특히 지은이는 역사적 흐름 속에서 ‘미국’을 유심히 볼 것을 요구하면서, 유럽에서 만개한 문화와 사상이 미국으로 전이되고, 그 속에서 자본주의라는 거센 파도를 만나 원래와 다른 모습으로 바뀌었음을 상기시키려한다. 미국이라는 거대한 문화의 흐름을 직접 목격하고, 그 속에서 예술가이자 문화이론가로 치열하게 살아왔던 지은이의 제언은 적잖은 울림을 가져다준다.

또한 지은이는 여전히 척박한 이 땅의 문화적 현실 속에서 고군분투하는 젊은 문화인들에게, 문화의 흐름을 인지하는 것도 중요하지만, 그 흐름의 동기와 흔적을 추적하는 일이 우리의 현재 위치를 파악하고 미래를 내다볼 수 있는 원동력이 된다고 말한다."
사랑한다면 그림을 보여줘,"학고재 큐레이터이자 미술평론가로 활동하고 있는 공주형의 미술 이야기. 마흔여 명의 작가들의 그림을 컬러도판과 함께 소개한다. 자신의 삶 이야기와 문학, 미술을 넘나드는 상세한 설명을 통해 그림을 보는 새로운 시각과 삶을 돌아보는 계기를 전한다."
코코 샤넬,"샤넬 N。5로 전세계에 이름을 알린 코코 샤넬의 전기. 장돌뱅이 아버지와 천식을 앓는 어머니 사이에서 태어난 가브리엘(본명)은 12살에 부모로부터 버려진다. 어머니는 병으로 죽었고, 역마살이 있는 아버지는 아이들을 키울 능력도, 생각도 없었다. 수녀원에 맡겨진 가브리엘은 그 때부터 몽유병을 앓기 시작해 죽을 때까지 가죽끈으로 몸을 묶은 채 잠을 자야 했다.

그녀 나이, 스무 살. 샤넬은 낮엔 양재 보조로, 밤엔 뮤직홀에서 '코코'라는 가수로 일했다. (이 때 얻은 애칭은 죽을 때까지 그녀를 '코코 샤넬'로 불리게 했다. 정작 본인은 이렇게 불리길 싫어했지만.) 연예생활을 본격적으로 하기 위해 샤넬은 곧 '비시'로 옮겨갔다. 그러나 그녀에서 쏟아진 것은 냉대와 무관심뿐. 물랭 시절에 사귄 에티엔의 도움으로 샤넬은 승마를 배우게 되고, 이 때 남성용 승마 바지를 여성용으로 개조하는 기지를 발휘하게 된다.

그때만 해도 치렁처렁한 레이스 치마에 호화로운 모자가 유행하던 시절. 샤넬의 심플한 디자인은 예기치 못한 행운을 불러왔다. 사업가 아서 카펠이 그녀에게 모자샵 운영의 제의한 것. 그 때부터 샤넬은 이전과는 정반대되는 길을 걷기 시작한다.

모자 디자이너로 시작한 패션 사업은 전쟁 중에 더욱 호황을 누렸다. 전쟁에 동원된 남편들이 집을 비운 사이, 여자들은 보다 자유로워지고 활동적이 되었다. 당연히 복식에도 큰 변화가 일었고, 샤넬이 그 선두에 섰다.

실리엣과 라인을 살린 옷, 정확하고 단순한 디자인, 여성의 신체적 자유를 고려한 낙낙한 품은 대다수의 여성들을 매료시켰다. 일에서는 승승장구하는 그녀였지만, 개인적으로는 별로 좋지 못했다. 전쟁통에 오랜 연인과 동생을 잃었으며 아이를 낳을 수 없어 결혼하고 싶은 상대도 포기해야 했다. 힘들게 결혼을 결심하자 이번에는 죽음이 그를 데려갔다.

보석 디자인 작업은 이 외롭고 고단한 시절을 견딜 수 있게 해주었다. 그러나 1936년 인민전선이 내각을 장악하면서 그녀의 상점도 파업에 동참한 점원들에게 점거되고 만다. 모든 의욕을 상실한 샤넬은 이로써 '메종 샤넬'의 문을 닫게 되는데...

그녀 나이, 일흔 한 살. 고령의 나이에 샤넬은 재기에 성공한다. 패션계의 흐름을 또 한번 바꿔내며 검정드레스와 발꿈치가 훤히 드러나는 샌들을 전세계적으로 유행시킨 것. 이처럼 개인적인 불행과 성공은 반복적으로 그녀의 삶을 직조해왔다. 리츠 호텔에서의 외로운 죽음 또한 이 공식을 따른 것이었을뿐."
이집트 구르나마을 이야기,"1945년 이집트 룩소르 부근의 구르나마을 이주건설 계획을 담당했던 저자의 작업기록으로, 제3세계에서 유례없이 아름다운 마을의 건설사례를 감동적으로 기술하고 있다. 특히 그는 조국의 전통적인 축조술을 재생시키고 수세기에 걸쳐 주된 건축재료로 사용되어 오던 흙벽돌을 사용했다는 점에서 이집트의 구르나마을은 전통의 창조적 계승의 모범사례로 꼽을 만하다."
어머니,"플로리앙 젤레르는 현대 프랑스 연극을 대표하는 극작가다. 가족 삼부작인 ＜아버지＞, ＜어머니＞, ＜아들＞이 연이어 무대에 오르며 국내에서도 이름을 알리기 시작했다. 삼부작을 여는 첫 희곡 ＜어머니＞는 ‘빈 둥지 증후군’에 시달리는 어머니의 내면을 깊이 들여다보고 있다. 작가가 장성한 뒤 자신의 어머니를 떠올리며 창작한 것으로, 어머니에 대한 미안한 마음에서 출발한 작품이다. 불안감에 사로잡혀 우울과 광기의 경계에서 방황하는 어머니의 모습을 통해 가족의 의미, 관계, 정체성에 대한 질문을 던진다."
실용 재즈 피아노 레시피 (브라운),"저자 특유의 편곡 스타일로 만나는 재즈피아노 연주곡집이다. 대략적인 재즈 역사를 수록하여 재즈에 대해 아무것도 모르는 사람들도 재즈의 흐름을 익힐 수 있다. 페달을 기보하여 악보 그대로 연주한다면 누구나 진짜 재즈 피아노를 연주할 수 있다. 또 연주회, 발표회, 실용콩쿨 등 다용도로 활용할 수 있어 유용하다."
제로에너지 그린리모델링,"준공과 동시에 국내 에너지 관련 건축상을 모조리 휩쓴 화제의 건물, 서울 강남 한복판 노후된 빌딩을 리모델링한 청연빌딩의 모든 것을 담은 책이다. 친환경건축가이자 친환경건축컨설턴트를 하고 있는 저자들이 리모델링을 하며 겪었던 설계와 시공 과정, 이를 실현하기 위해 적용한 관련 제도와 지원 제도들을 꼼꼼히 파헤치며 총 건축비용과 함께 건축 전후 만족도까지 빠짐없이 기록했다.

특히, 그린리모델링과 제로에너지건축을 통해 에너지비용 절감과 이자지원의 혜택을 받고 싶어 하는 건축주를 대상으로, 일반인들도 이해할 수 있게 쉽게 풀어 쓴 점이 특징이다. 한 권의 책을 통해 노후건축물 그린리모델링의 시작과 끝, 그 이후까지 전 과정을 따라잡을 수 있다."
순응과 전복,"<씨네21> 창간 멤버이자 <필름2.0> 편집위원을 지내며 활발하게 영화평론가로 활동해 온 김영진 평론가가 지난 20여 년 동안 한국 영화계에 불어온 미학적 활기에 관해 기록한 평론집을 펴냈다. 저자는 한국 영화의 르네상스시기를 이끌었던 영화감독 이창동, 박찬욱, 봉준호, 류승완, 김지운 등의 작품을 중심으로 그들이 이루어 낸 눈부신 성취를 이야기하며, 독창적이고 위배적인 그들만의 고유한 정체성을 집중적으로 풀어냈다.

나아가 2000년대부터 현재까지 예술적, 산업적으로 비약적인 변화를 추구했던 현대 한국 영화의 다양한 장르적 시도를 블록버스터, 역사, 멜로 등의 장르를 통해 한눈에 바라보고, 앞으로 우리 영화가 걸어갈 좌표와 지도를 그려 본다."
엄마의 시간을 시작하는 당신에게,"미술사 박사 논문이 거의 마무리되는 와중에 임신했음을 알게 된 저자 정하윤은, 기쁨과 동시에 두려움이 밀려왔다고 한다. 새로운 생명과의 만남은 분명 행복한 일이다. 그런데 원래 '나'의 계획은 임신이 아니라, 서둘러 학위를 마치고 일자리를 얻어 커리어를 쌓는 것이었다. 또한 출산과 육아로 사회적 경력이 단절된 여성들의 모습도 주변에서 많이 봐왔다. 앞으로 진행될 미래를 단 하나도 예측할 수 없어 두려웠노라고 저자는 고백한다.

남편과 둘일 때는 계획적인 삶을 사는 게 그리 어렵지 않았는데, 엄마가 되고나니 자신이 아닌 아이의 하루 일과에 맞춰나가야 한다는 것 역시, 심정적으로 쉽지 않았노라고 또 고백한다. 삶의 전반에 대한 결정권을 잃어버린 것 같았다고 말한다. 그때 그에게 말을 건넨 것은 그림들이었다.

저자는 아이를 낳고 키우면서, '나의 색을 다시 찾을 수 있을까' 하는 두려움에서 이 책의 집필을 시작했다고 밝혔다. 자신의 경험과 고민을 상세하게 기술함으로써 자신이 건너고 있는 엄마의 시간에 단단한 힘을 부여한다. 힘을 얻은 그 시간은 저자가 소개한 그림 위에 고스란히 드러난다."
The Cross : 오화평 가스펠 연주곡집,"재즈피아니스트 오화평의 신앙고백과도 같은 악보집이다. 찬송가와 CCM으로 구성된 2013년 작 앨범의 10곡을 그대로 수록하였으며 즉흥적이나 클래식에 기반을 둔 편곡으로 전공자를 포함하여 비전공자에게도 쉽게 접근하고자 했다. 선곡부터 편곡, 제작 마무리까지 저자의 섬세함이 곳곳에 묻어난다."
나의 예술인생,"연출가 이전에 배우로도 활동했던 스타니슬랍스키가 회고록을 통해 ‘예술’과 ‘인생’에 대한 자기만의 철학을 풀어놓았다. 체홉, 고리키, 마테를링크 등 대문호들과의 교류, 청년기와 성숙기로 나눈 그의 삶 이야기들은 예술이란 결코 우연으로 완성되는 것이 아님을 한 편의 연극처럼 보여 주고 있다.

이 책의 구성은 ‘배우로서의 어린 시절’, ‘ 배우로서의 소년 시절’, ‘배우로서의 청년 시절’, ‘배우로서의 성숙기’ 등으로 이루어져 있다. ‘연기 시스템’을 완성해 나가는 스타니슬랍스키의 창조의 길은 배우로서의, 연출자로서의 그의 성장과 하나로 이어져 있다.

스타니슬랍스키는 이 책에서 자신이 무대에 오르고 연출했던 모든 경험들을 솔직하면서도 섬세하게 포착하여 적어 나가고 있다. 또한 쉐프킨, 체홉, 톨스토이, 고리키 등과 같은 당대의 예술가들과의 우정을 들려준다."
[세트] 아름다운 민화 컬러링북 : 부귀영화 + 소원성취 + 무병장수 + 사임당 빛의 일기 - 전4권,"정겨운 우리 그림 민화는 대중의 예술이며, 생활 속의 예술이며, 훌륭한 문화유산이다. 그리고 우리 삶의 현대적 공간에서 유용한 미술로서 충분한 역할을 한다. 이러한 우리 민화를 보고, 그리고, 즐기고, 원하는 공간에 장식하며 우리의 라이프에 아트를 더했으면 한다.

이 책은 지금까지 잊고 왔던, 또는 무심히 지나쳐 왔던 우리 그림, 민화에 담긴 상징적인 이야기를 전하고, 민화그리기 방법과 도구들을 간략히 소개한다. 하지만 소재가 일반적이지 않아 우선 독자 여러분들은 주변의 손쉬운 도구들로 자유롭게 그리며 민화와 친숙해지는 것에 의의를 두었다. 또한 행복한 생활공간 속에 민화를 포함시켜 우리 문화를 부담 없이 즐길 수 있도록 컬러링북으로 만들었다."
가고 싶은 유럽의 현대미술관,"국립중앙도서관 예술분야 대출 10대 책

현대미술가.평론가.독립 큐레이터.대학 강사 등 현대미술과 관계된 다양한 영역에서 활동하고 있는 현대미술 전문가인 저자가 독자들을 유럽 현대미술관 16곳과 그 풍성한 컬렉션 속으로 안내한다. 2005년 출간된 <21세기 유럽 현대미술관 기행>의 개정판으로, 그동안 미술관의 변화를 다시 한 번 점검하고 반영하기 위해 글과 도판을 보강했다.

이 책에서는 빌바오 구겐하임이나 테이트 모던처럼 세계적으로 주목받고 있는 현대미술관에서, 홈브로이히 박물관 섬이나 팔레 드 도쿄처럼 고정관념을 깨는 색다른 미술관들까지 5개국 영국.프랑스.독일.네덜란드.스페인의 미술관 16곳을 만날 수 있다. 또 루브르나 오르세처럼 현대미술과는 무관해 보이는 미술관들이 어떻게 현대미술과 접속을 시도하는지도 엿볼 수 있다.

저자는 지난 20여 년간 유럽 곳곳의 미술관을 찾아다닌 경험을 바탕으로, 꼭 소개하고 싶은 미술관과 작품을 골라 이야깃거리를 펼친다. 무엇보다 미술관의 탄생 배경뿐 아니라 건축 콘셉트, 컬렉션의 특성, 전시 프로그램, 작가와 작품에 얽힌 뒷이야기 등을 충실히 담아, 현대미술 애호가뿐 아니라 독특한 미술관 여행을 원하는 독자들에게도 내실 있는 가이드북이다."
냠냠 맛있는 간추린 체르니 40 (스프링),"현장에서 지도하고 계시는 학원 원장님들의 의견을 적극 수렴하여 구성한 책이다. 체르니 40연습곡(OP.299)을 바탕으로 고급 과정의 학습자들이 꼭 공부해야 할 30곡을 선별하여 난이도 순으로 배열하였으며, 책의 모든 연습곡에는 각 곡의 목표를 제목으로 제시하고, 주의해야 할 점이나 악상기호 등 연주 시 학습에 도움이 되는 포인트를 두어 연습할 때 참고하여 그대로 적용할 수 있도록 구성하였다. 또한, 각 연습곡에 연습을 돕는 (잠깐만)을 수록하여 연주 시 참고할 수 있도록 하였다."
딸과 떠나는 성당 기행,"근대 한옥성당부터 현대 명품성당까지, 시골 공소에서부터 서울성공회 성당까지 우리 땅 곳곳에 산재한 성당을 찾아 우리 문화 전반을 배우는 인문학 기행서. 건축평론가인 저자는 딸과 함께 전국의 의미있는 성당을 함께 찾아가서 인생을 이야기한다. 따라서 이 책은 성당의 외형에서 보이는 건축 지식보다는, 성당이 세워지게 된 수많은 배경 이야기에 더 많은 관심을 보이고 있다."
영화제작 매스터북,"이론과 기술, 정보, 사례를 담은 가이드북. 프리-프로덕션, 프로덕션, 포스트 프로덕션, 그리고 후반작업의 핵심인 편집에 이르기까지 영화제작의 전 과정이 정리되어 있다. 그림과 도표, 실제 테스트한 사진들을 다수 수록해 이해를 도왔다. 부록에는 저자의 35mm 단편작 <경례>의 스토리보드와 학생 연출자가 직접 발로 뛰며 기록한 '포스트 프로덕션 다이어리', 영화기획서를 수록했다."
장산곶매,"최근에 12년 만의 장편소설 <오래된 정원>을 펴낸 작가 황석영(黃晳暎)이 그간의 문학적 성과를 중간결산하는 <황석영 중단편전집>(전3권)과 <황석영 희곡전집>(전1권)을 출간하였다.

1962년 단편소설「입석 부근(立石附近)」으로 사상계 신인문학상을 수상한 것을 기점으로 약 40년간의 작품활동을 담은 이 전집은 그간 황석영의 문학적 궤적을 잘 보여주는 결정판이자 정본이라 할 수 있다.

이 희곡전집에는「장산곶매」,「한씨연대기」등의 희곡과 단편영화 시나리오 「날랑 죽겅 펄에나 묻엉」, 지하방송 '자유광주의 소리' 대본「넋풀이」를 비롯하여 총 12편의 작품을 수록하고 있다. 여기에 실린 작품들은 사회참여적인 작가의 문학적 성향이 특히 잘 반영되어 있는데, 주로 7,80년대 지역문화운동의 현장을 직접 일구면서 길어올린 마당극을 비롯한 각종 공연작의 대본이 되었던 작품들이다.

특히 「넋풀이」는 광주학살의 진상을 알리기 위해 1982년 작가가 구성하여 지하에서 제작 배포한 '자유광주의 소리' 테이프의 대본으로, 항쟁에서 숨진 윤상원과 노동열사 박기순의 영혼결혼식을 주제로 한 작품이다.

여기에 수록된 '님을 위한 행진곡'은 그후 전국으로 퍼져나가 우리에게 너무나 친숙한 대중적 운동가요가 되었다. 책 뒤에는 문화운동의 현장에서 작가와 함께 활동했던 연출가 김석만 교수(한국예술종합학교 연극원)의 발문이 수록되어, 작가의 창작활동의 의의와 함께 재미있는 일화도 읽을 수 있다.

시대의 증언으로서 공연예술활동의 씨앗으로서 그 역량을 가감없이 발휘해 온 황석영의 이번 문학전집이 남북한 교류의 시대에 든든한 디딤돌이 되기를 기대해본다."
