title,summary
즐거운 망명자,"여든이 넘은 원숙한 신앙인이 삶을 돌아보며 한 사람의 그리스도인으로서 지켜온 신념을 고백한다. 또한 그리스도의 제자가 이어 가야 할 가치와 확신들을 후대 그리스도인들에게 당부하는 기록. 이 책은 제임스 휴스턴의 철학적, 신학적 입장이 확연히 드러날 뿐 아니라, 그의 인생 이력, 친구들, 좋아하는 문학 작품 등 개인적 면모도 엿보인다. 세속적 성공에만 급급한 현대 문화의 속물성을 지적하고, 세상과 다를 바 없는 기독교계와 지도자들을 비판하며 경계하는 의견도 담겨있다."
[베이비핑크/고급] 일러스트 쉬운성경 - 소(小).단본.색인,"8년간의 결실인 권위있는 원문 번역 성경. 그림이 있어 더욱 생생하게 이해되는 일러스트 쉬운성경이다. 성경을 어려워하는 자녀들에게 필요한 성경으로, 성경의 이해를 도와주는 일러스트레이션이 수록되어 성경 읽는 재미가 솔솔 난다."
예수로 성경읽기,"저자가 자신의 장점을 살려 성경의 각 시대에 대한 풍부한 역사적 배경을 제공함으로 어려운 성경이 구체적이고 친근하게 우리에게 다가올 수 있도록 했다. 성경을 통전적으로 읽고 성경 속에 일관되게 나타난 하나님의 구원 사역을 드러내준다.

이런 성경 이해를 바탕으로 이 시대 교회로서 우리가 감당해야 할 시대적 사명을 분명히 하면서도 통찰력 있게 제시하는 그런 책이다. 쉽게 읽히면서도 성경 전체에 흐르는 메타내러티브를 집어냄으로 우리에게 성경이 과연 어떤 책인가를 잘 짚어준다."
고난 가운데 잠잠한 영혼,"고난을 정의하는 것은 쉽지 않다. 하지만 모든 고난이 우리가 죄인이기 때문에, 또 원죄로 말미암은 죄와 비참 때문에 생기는 것임은 분명하다. 토머스 브룩스의 <고난 가운데 잠잠한 영혼>은 이러한 모든 종류의 고난에 대해 우리, 곧 그리스도인이 하나님 앞에서 어떠해야 하는지를 말해 준다.

브룩스는 곳곳에서 우리가 당하는 고난의 대부분이 바로 우리의 죄 때문임을 지적한다. 그렇지만 곧바로 우리가 낙담하지 않게 우리의 눈을 우리의 죄보다, 우리의 고난보다 크신 하나님께, 하나님의 은혜와 자비에 돌린다."
귀를 핥으시는 하나님,`3차원 의학`으로 유명한 폴 투르니에 저자가 만남과 묵상을 통해 전인적 치유를 제시한 책. 그가 남긴 20여 권의 저서 중에서 가장 최후의 것이기에 더욱 가치가 있다.
하나님이 도우시는 치유의 시간,"병상에서 드리는 기도문. 저자는 병상이라는 캄캄한 터널의 입구에 들어선 이들에게 작은 위로와 희망을 주고자 이 기도문을 썼다. 저자는 외로워하지 말라고, 병마와 혼자서 싸우는 것이 아니라고 말한다. 눈에 보이지 않을 뿐, 언제나 예수 그리스도가 함께 하신다는 걸 꼭 기억하라고 말이다.

책은 시시콜콜 상황에 맞춘 기도문으로 구성되어 있다. 상황마다 우리의 간절함이 다르기 때문이다. 병을 알게 된 순간부터 병상 생활을 하고 치료 하는 과정까지, 그리고 인간이라면 모두가지고 있는 '죽음'의 두려움을 극복하는 것까지 그 간절함이 기도문 안에 진실 되게 담겨있다."
"민수기, 광야를 걷는 예배자","'하정완 목사와 성경읽기' 시리즈 다섯 번째 책. 광야 생활 38년은 무슨 대단한 사건 없이 단순하지만 반복된 일상적인 삶이었다. 오로지 하나님만 바라보는 시간이었다. 어쩌면 지루한 삶, 그런 이야기의 반복이다. 그래서 민수기가 중요하다. 우리가 살고 있는 이 갑갑한 광야같은 세상을 어떻게 살아야 하는지 그 힌트를 찾을 수 있기 때문이다.

광야 38년 생활 후 가나안으로 들어가는 이스라엘은 다른 존재가 되어 있었다. 그 첫 성 여리고성 점령은 신비 자체였다. 정확히 말해서 여리고성을 돌고 있는 이스라엘 백성의 모습이 신비로움이었다. 사실 하나님만 바라보며 38년을 산 이스라엘의 결과였다. 민수기에 나타난 그 소소한 일상과 하나님의 이야기들을 보면서 우리는 광야를 사는 예배자의 삶과 비밀을 배우게 될 것이다."
화두,"불교를 공부하면서도 단지 책상머리에 앉아 교(敎)에만 전념할 뿐 온몸으로 정진하는 선(禪)을 행하지 못함이 늘 마음에 걸렸었다. 언젠가 나도 화두를 들고 선을 해보고 싶은 마음, 나를 진리의 세계로 이끌어줄 선지식을 만나고 싶은 마음이 간절하였다. 그리고 어느 날 마치 우연처럼, 마치 선물처럼 내게 그런 기회가 왔다.

이 책 『화두』는 그런 인연으로 체험한 선수행의 기록이다. 글은 3부분으로 되어 있다. 1부와 3부는 6개월의 차이를 두고 각각 부산 안국선원과 해남 달마산 미황사에서 7박 8일의 집중수행 기간에 바로 그 자리에서 쓴 것이고, 그 사이에 있는 2부는 미황사에 가기 전에 썼던 것을 후에 조금 손을 본 것이다. 본래 이 글들은 수행을 하는 과정에서 내 마음을 정리하고자 나 자신을 위해 일기처럼 썼던 글들이다."
에스라 느헤미야 개론,"본서는 영국 구약학계의 최고 권위자들이 신학 입문용으로 집필한 구약가이드(Old Testament Guide) 시리즈 가운데 한 권으로서 현재 학계에서 논란이 되는 에스라 ? 느헤미야의 가장 중요한 주제들을 일목요연하게 정리해 놓았다.

에스라와 느헤미야서는 이스라엘의 포로기 이후 이스라엘 역사를 재구성하고 이해하는 데 필수적이고 예수님과 초대교회의 신앙의 자양분을 추출해낼 수 있는 책들로서 그 가치가 크다고 저자는 말한다. 본서는 이렇게 중요한 에스라와 느헤미야서를 공부하는 이들에게 기본적인 교과서와 같은 역할을 할 것이다."
"결혼, 하고 싶다","저자는 하루가 멀다 하고 올바른 연애에 관한 질문 세례를 받는다. 또한 저자의 교회는 매년 결혼을 앞둔 커플과 결혼한 부부들을 대상으로 한 상담에 수천 시간을 투자한다. 하나님이 기뻐하시는 연애와 결혼, 성을 원하는 마음은 간절한데 정작 그에 관한 지혜와 실질적인 노하우는 턱없이 부족하다. 성경에 관한 지식과 그 지식의 적용은 꽤 큰 격차를 보인다. 교회 안에서도 남녀관계와 성으로 인해 혼란스러워하고 고통스러워하는 교인들이 있다.

저자는 실질적인 지침을 제시하고 있다. 하지만 옳은 동기와 옳은 인격이 뒷받침되지 않은 실질적인 단계들로는 한계가 있다. 이런 주제를 진정 성경적으로 다루려면 외적인 적용보다 더 깊이 들어가야 한다. 성령은 무엇보다도 우리의 내적 변화를 원하신다. 좋은 소식은, 성령이 이 일을 도와주신다는 것이다."
맥스 루케이도의 일상의 은혜,"일상의 은혜는 하나님이 우리에게 주신 특별한 선물이다. 해변의 모래알을 셀 수 없듯이, 우리를 향한 그분의 사랑은 헤아릴 수 없다. 그분은 오늘도 우리와 함께 누릴 영원한 삶을 꿈꾸신다. 우리와 함께 살 수 없다면, 그분은 우리를 위해 목숨을 버리실 것이다. 어떻게 하면 그분이 넘치게 부어 주신 은혜를 내 삶의 자리에서 누릴 수 있을까? 베스트셀러 작가 맥스 루케이도가 우리 영혼에 평강이 깃들고 마음을 살찌우는 글을 전한다."
구약성경 개론,"본서는 제임스 L. 쿠걸 교수가 하버드대학교의 교편생활을 정리하면서 강의한 내용을 망라한 야심작이라고 할 수 있다. 구약성경에 관심 있는 교양인들을 위해 쓴 책이며, 구약성경의 내용 요약, 현대 성경학자들의 연구 결과 소개, 고대 해석가들의 구약 해석을 소개한 것이 기존의 구약 개론서들과 차별성이 있다."
한국인을 위한 달라이 라마의 인생론,"달라이 라마의 인생 강의록. 인생이란 무엇인가? 어떻게 살고 어떻게 죽을 것인가? 좋은 삶을 살기 위해서 우리가 놓치지 말아야 할 것은 무엇인가? 인간이 평생 안고 살아가는 이 숙명적 질문에 금세기 최고의 현자로 손꼽히는 달라이 라마가 명쾌한 답을 들려준다.

이 책은 종교와 이념을 초월해 세계인의 영적 스승으로 불리는 달라이 라마의 깊은 사유와 통찰이 담긴 인생 강의록이다. 그의 한국 방문을 추진하기 위해 결성한 신행 모임인 '달라이 라마 방한추진회'가 여러 해 동안 그의 법문을 듣고 정리해 한 권으로 엮었다. '세계와 나', '붓다와 나'를 주제로 130편의 짧은 글 속에 삶의 지침이 되는 가르침을 담고 있다. 달라이 라마의 친필 메시지와 사인을 책의 첫 장과 마지막 장에 각각 담아 그의 방한을 오랫동안 염원해온 한국인들에게 매우 특별한 선물이 될 것이다."
야고보서 강해 : 믿음의 시험,"야고보의 중대한 주제들 곧 시련에 대한 인내와 성숙의 연관성, 온전함의 문제, 하나님의 좋은 선물, 믿음과 행위와 인간의 필요에 대한 그리스도인의 관심, 부주의하고 악한 말이 지닌 함축, 싸움의 의미, 교회와 치유, 죄에 대한 고백, 정결한 삶에 대한 필요 등을 감동적으로 제시한다."
미셔널처치 바로 알고 시작하기,"미셔널처치에 대한 한국 교회의 관심이 높아지고 있지만, 미셔널처치가 무엇이고 어떻게 그런 목회를 실천할 수 있을지에 관해서는 아직도 명확한 설명과 안내가 부족한 것이 현실이다. 그런 가운데 한국선교신학회와 세뛰새KOREA는 2019년과 2020년 연속으로 ‘선교적 교회’를 주제로 한 공동포럼을 개최했다.

2019년 ‘선교적 교회 컨퍼런스’에서는 ‘한국적 선교적 교회의 현재와 미래’라는 주제로 네 곳의 선교적 교회 사례 발표와 그에 따른 선교신학자들의 논찬이, 2020년 ‘한국선교신학회 & 세뛰새KOREA 공동 포럼’에서는 ‘한국적 선교적 교회의 자리매김’이라는 선교신학자의 주제발표와 ‘예배·양육·사역’을 각각 모범적으로 실천하고 있는 세 곳의 선교적 교회 사례 발표가 이루어졌다. 그 현장의 목소리를 생생한 담아낸 기록이 바로 이 책이다.

목회자와 신학자들의 신선하고 통찰력 넘치는 이야기를 통해 현장과 이론을 통합적으로 연결하며 한국적 선교적 교회의 방향을 구체적으로 그려주고 있는 이 책은, 미셔널처치에 관해 더 깊이 알기 원하는 목회자와 신학생은 물론 본질을 잃어버린 채 표류하고 있는 한국교회를 염려하는 그리스도인이라면 누구나 깊이 곱씹어봐야 할 내용으로 가득하다."
게하더스 보스의 종말론 세트 - 전2권,"신학자 게하더스 보스의 종말론 세트. 바울 신학의 체계에 새 지평을 연 선구작 <바울의 종말론>과 구약 성도들이 미래를 바라보며 품었던 소망과 기대, 그들이 이해한 미래를 담은 <구약의 종말론>으로 구성되어 있다."
끝날 때까지 끝난 것이 아니다,"저자 R. T. 켄달은 응답되지 않는 기도, 질병의 치유, 방황하는 자녀들, 부흥, 하나님의 계획과 부르심, 결백의 증명 등 오랜 기다림을 요하는 주제들에 대해 이야기하며 삶에 대한 희망을 품어야 할 이유를 제공한다. 80세 노신학자의 풍부한 경험과 성경의 진리가 녹아든 이 책을 읽다 보면, 인생의 난제들 속에서 수수께끼처럼 느껴지던 하나님에 대한 의문이 풀릴 것이다. 또한 팔레스타인해방기구 야세르 아라파트 의장을 전도한 이야기를 비롯한 다양한 사례와 간증을 통해 우리가 끝까지 포기하지 않을 때 역사하시는 하나님에 대한 기대와 소망을 품게 된다."
만화 손양원,"손양원 목사는 7세에 부모님으로부터 신앙을 물려받고, ‘나병’으로 불리는 한센병 환우들을 위해 전 삶을 바쳤다. 그러한 희생적인 삶 가운데서도 일제의 탄압 속에서 ‘신사참배’를 거부하여 갖은 고생과 고문을 당하고 5년 간 옥고를 치러야 했다.

조국의 광복과 함께 맞은 석방. 그러나 그의 시련은 거기서 끝나지 않고 1948년 여순사건으로 인해 두 아들을 하나님께 앞서 보낸다. 그 누가 보아도 가슴 아픈 시련이라 할 수밖에 없건만, 그는 두 아들의 순교 앞에 ‘아홉 가지 감사의 제목’을 올려드리고 두 아들을 죽인 청년을 용서하고 자신의 양자로 삼기까지 한다. 그야말로 ‘초월적인 용서와 사랑’의 본을 보여 준 삶이다.

1950년 6.25 전쟁 가운데 마지막까지 자신에게 맡겨진 한센병 환우들과 함께 하다가 공산군에 의해 죽음을 맞이하여 순교를 한다. 이 귀한 삶의 걸음을 ‘만화’라는 도구로 생생하게 전하고 있는 이 책을 통해 자녀들과 함께 나누어 부모는 신앙의 삶에 대한 결단을 다짐하고, 자녀에게는 신앙의 유산을 물려주기 바란다."
믿음나무에서 꽃피운 세 딸,한 사람의 인생 승리를 스스로 기록한 책이다. 어떻게 보면 평범한 사람의 평범한 이야기일 수 있다. 실로 그는 세상에서 유명세를 탄 사람이 아니다. 그러나 이 안에는 순박한 사람의 진솔한 삶의 이야기가 기록되어 있다. 그는 여기서 자기에게 주어진 환경을 어떻게 극복했는가를 썼다. 그리고 그는 이 과정이 위대하신 하나님의 은혜였음을 고백하고 감사한다.
이슬람 세계 속 기독교,"한국교회에 매우 생소할 뿐 아니라, 서구기독인들에게도 대부분 잘 알려지지 않은 아랍 기독교의 역사를 다루고 있으며, 특히 무함마드가 나타나 활동을 시작했던 6/7세기부터 13세기 몽골의 침략에 이르는 시기 동안 나타난 아랍 기독교인들의 문화적·지적 성취 및 이슬람에 대항한 기독교의 변증활동을 포함한 신학 활동에 초점을 맞추고 있다.

저자인 시드니 그리피스의 서술을 따라가다 보면, 독자는 네스토리오스파, 야콥파(단성론파), 황제파(멜카이트)로 대별되는 중동지역의 기독교 교파들의 역사가 이슬람의 지배하에서 단지 지속적으로 그 수효와 세력이 감소되었던 수동적인 쇠퇴의 과정이 아니라, 그 사회의 통용어인 아랍어를 채택하여 이슬람의 반기독교적 선전에 대항하는 변증 작품을 생산하고 아울러 각 교파 간에 각자의 교리적 정당성을 옹호하는 신학 작업을 활기차게 진행해왔던 능동적인 문화적 적응과 신학적 창조의 역사임을 새삼 깨닫게 된다."
[스카이블루] 하나님과 함께하는 아침기도 365 (미니북),"‘왜’ 기도해야 하는지 알지만 ‘무엇을’ ‘어떻게’ 기도해야 할지 막막한 모든 사람을 위한 아침 기도문이다.아침을 하나님과 시작해야 한다고 생각하지만, 말처럼 쉽지만은 않다. 바쁜 일정에 기도를 놓칠 때도 많고, 걱정에 마음이 억눌려 기도할 힘조차 없을 때도 많다. 혹은 기도를 하려고 해도 무엇을 어떻게 구해야 할지 막막하기만 합니다.

기도할 말, 기도할 힘을 잃었으나 기도할 마음의 불씨가 아직 꺼지지 않은 분들을 위해 쓰였다. 가정에서, 학교에서, 직장에서 혹은 출근길에서, 하나님을 먼저 만나고픈 마음이 아주 조금이라도 있다면, 이 책을 펼쳐 보기를 권한다. 삶에 생명력을 더하는 기도의 언어가 살아나고, 하나님을 대하는 시간이 점점 편하고 자연스러워질 것이다. 슬픔이 아닌 찬송으로, 걱정이 아닌 믿음으로, 두려움이 아닌 소망으로, 그리고 자만이 아닌 겸손으로 하루를 시작하게 될 것이다."
치열한 도전,"하나님은 ‘거의 교회’에서 ‘온전한 교회’로 나아가는 도전을 보고 싶어 하신다. 그 힘찬 도전을 응원하신다. 하나님의 교회는 결코 편안하게 안주하는 곳이 아니다. 불편하게 살아 움직이는, 하나님과 세상 사이에서 주님의 뜻대로 세상과 함께하는 생명체이다. 이 책을 통해 오늘날 존재 이유를 상실한 제도화된 교회들 속에서 “선교적이 아니면 교회는 교회가 아니다”를 외치며 교회들이 하나님께서 원하시는 모습을 세울 수 있도록 올바른 교회론을 제시하려 고민하고 노력하는 만나교회의 모습을 발견할 수 있다."
교회 교의학 1/1,"20세기의 위대한 신학자 칼 바르트의 주요 저작으로, 기독교 역사에서도 손꼽히는 저작으로 꼽힌다. 신학이 신학자들이나 철학자들의 논쟁거리에서 벗어나 교회를 위해 적용될 수 있도록 인도하여, 신학의 방향을 바꾸려한 그의 노력이 여실히 드러나는 대작이다."
개혁교의학 색인,"아브라함 카이퍼, 벤저민 워필드와 더불어 세계 3대 칼빈주의 신학자로 평가되는 헤르만 바빙크의 책. 제임스 패커는 바빙크의 인물됨과 바빙크의 <개혁교의학>에 대해 이렇게 평가했다. “바빙크는 아우구스티누스, 칼빈, 에드워즈 같이 위대한 사상과 방대한 지식과 시대를 초월한 지혜와 뛰어난 성경 주해 능력을 가진 학자이며, 바빙크의 대작 <개혁교의학>은 한 세기가 지난 지금에도 최고의 성과물임이 틀림없다”.

리차드 개핀도 <개혁교의학>의 중요성과 가치에 대해 이렇게 말합니다. “<개혁교의학>은 개혁파 전통에서 나온 가장 중요한 조직신학 저술이다. 역사신학 및 조직신학 모두에 있어서 깊은 이해와 풍요로운 사상을 제공하는 이 책의 출현은 세대를 불문하고 신학생, 목회자, 교수들 모두에게 비교할 수 없는 복이 될 것이다.”"
프락티코스,"욕정과 무질서한 충동을 정화하는 방법, 수도승들의 금욕생활에 관한 가르침. 고대 수도 교부 에바그리우스는 영성생활을 프락티케와 그노스티케로 구분했다. 프락티케는 수행을 뜻하고, 그노스티케는 인식 혹은 관상을 뜻하는데, 후자는 다시 피조물에 대한 인식(자연학)을 뜻하는 퓌시케와 하느님에 대한 인식(신학)을 뜻하는 테올로기케로 구분된다.

<프락티코스>는 바로 '프락티케', 수행생활에 관한 에바그리우스의 지혜와 가르침을 담은 책이다. 이 책은 욕정과의 영적 전투에서 승리할 수 있는 '전략'을 제시한다. 특히 탐식, 음욕, 탐욕, 슬픔, 분노, 아케디아, 헛된 영광, 교만이라는 '여덟 가지 악한 생각'을 물리치는 지혜로운 방법이 소개된다. 이 가르침은 모두 개인적 체험과 통찰의 산물이다.

이 작품은 100개의 독립 단장短章 혹은 경구警句로 구성되어 있다. 언뜻 보면 툭툭 끊기는 듯하지만, 살펴 읽으면 한 줄기로 흐르는 통찰의 큰 강이 보인다. 심오하고 함축적인 언어로 표현되어 있어서, 한 구절씩 가슴에 품고 오래 묵상하기에도 좋다. 역주와 해제가 이해를 돕는다."
성령 세례,"성경을 주의 깊게 연구한다면 성령 세례에 대해 완벽하고 분명한 정의를 얻을 수 있다. 사도행전 1장5절에서 예수님은 “너희는 몇 날이 못되어 성령으로 세례를 받으리라”고 말씀하셨다. 이 약속이 이루어진 때를 사도행전 2장 4절은 “그들이 다 성령의 충만함을 받고”라고 기록하고 있다.

사도행전 1장 4절에는 “아버지께서 약속하신 것”으로 되어 있고 누가복음 24장 49절에는 “내 아버지께서 약속하신 것”이라고 하면서 위로부터 오는 능력이라고 말하고 있다. 사도행전 10장 44,45,47절을 사도행전 11장 15,16절과 비교해 보면 “성령이 내리셨다” “성령을 선물로” 그리고 “성령을 받았다”는 표현이 모두 “성령으로 세례 받았다”는 뜻임을 알게 된다."
화해,"화해의 대상은 누구에게나 있다. 얼굴을 붉히면서 서로 다투었건, 혼자 상처받아 상대방 모르게 화가 났건 우리에게는 화해해야 할 상대가 분명 있다. 대상은 개인일 수도 단체일 수도 있다. 한번 어긋난 관계를 바로잡지 않으면 같은 어려움을 반복해서 겪게 된다. 관계의 회복은 그래서 중요하다.

늘 부딪히는 관계의 어려움을 피해 다른 곳으로 옮길 것인가, 그 단계를 뛰어넘어 한 단계 성숙해질 것인가. 예수님은 우리를 위해 단번에 죽으셨다. 그 죽으심으로 우리를 용서하신 것이다. 참된 부흥은 용서와 회개 그리고 화해에 이른다. 먼저 하나님과 화해하면 그리스도의 몸을 이루는 사람들 간의 화해도 가능해진다."
인생 코칭을 위한 오행중심 용신활용 사주학,"사주명리학 시리즈의 저자 김동완의 신간이다. 오행 분석으로 사주명리학의 핵심인 용신을 찾는다. 타고난 운명을 긍정적으로 변화시키는 인생 코칭을 제안한다. 사주팔자 8글자를 점수화하여 자신의 사주팔자에 가장 필요한 오행을 쉽게 찾아내고, 그 오행의 색상과 방향을 실생활에 활용한다."
하나님이 내신 결혼과 가정 - 첫 번째 나눔,"결혼과 가정의 원리를 모른 채 살아가는 이 시대의 가정회복 필독서다. 가정의 제도와 원리를 만드신 하나님의 말씀으로 돌아갈 때 하나님이 내신 행복한 가정의 모습이 회복된다. 많은 사람이 하나님이 정하신 남편과 아내의 역할이 무엇인지 모른 채 결혼을 한다. 부모가 자녀를 어떻게 양육해야 하며, 자녀들은 자기 부모님을 어떻게 공경해야 하는지 잘 모르는 채 피상적인 가족 관계를 유지하고 있다. 그래서 가정 안에 많은 문제가 생길 수밖에 없다.

가정의 문제를 해결하는 방법은 가정 제도와 원리를 만드신 하나님의 말씀으로 돌아가는 것이다. 그래야 하나님께서 만드신 가정의 질서가 회복된다. 하나님은 남편과 아내, 부모와 자녀들이 각각 가정에서 지켜야 할 질서를 말씀하고 계신다. 각자가 가정 안에 두신 하나님의 질서를 지킬 때 가장 행복하고 아름다운 가정을 이룰 수 있다."
불교심리학사전,"불교심리학의 세계로 인도하는 최초의 안내자가 되는 키워드를 모았다. 이 책은 국제적인 시각에서 불교심리학의 새로운 가능성을 볼 수 있도록 편집하였고, 현대의 불교와 심리학의 접점을 확대시켰다는, 다른 책에서는 볼 수 없는 특징을 갖추고 있다.

본서는 불교의 키워드, 심리학의 키워드(1)(기초와 임상), 심리학의 키워드(2)(심층의 탐구) 총 3부로 구성되어 있다. 각 부마다 불교와 심리학의 다양한 용어 가운데 불교심리학에 적용될 수 있는 용어를 엄선하여 정리하고 있다. 불교와 심리학의 전체 내용을 파악할 수 있으면서도, 불교심리학과 연관된 용어를 선택한 것은 편자들의 안목에 의해서만 가능했을 것이다."
연속성과 불연속성,"저명한 복음주의 신학자 13명이 여섯 가지 중요한 주제에 관한 ‘연속성/불연속성’ 토론을 펼친다. 그 주제는 ‘신학적 체계,’ ‘해석학,’ ‘구원의 문제,’ ‘하나님의 법,’ ‘하나님의 백성,’ 그리고 ‘왕국 약속’ 등이다. 언약 신학과 세대주의 사이의 차이점 그 이상의 수준 높은 여러 내용을 다루는 본서는 탁월한 복음주의 학자들이 산출해낸 작품으로서 유익한 연구와 토의에 활기를 더할 것이다."
개역개정판 국한문 성경전서 (NKR72EMSN) - 대(大) 무색인,국한문성경 한자가 있는 성경. 한자를 통해 성경 본문의 의미를 더욱 정확하게 이해할 수 있다.
하나님 나라의 모략,"대럴 구더, 짐 월리스, 셰인 클레어본, 라이언 볼저, 스튜어트 머레이 등 전 세계 교회 갱신 전문가 강력 추천. 교회 갱신 전략가 탐 사인은 가장 창의적이며 대담한 그리스도인들이 새로운 미래로 향하는 길 위에 서 있으며, 이들이 이미 벌이고 있는 일이 무엇인지에 대한 명확한 지도를 세밀하게 그려 준다.

전 세계 교회 안에 확산되고 있는 이머징 교회, 선교적 교회, 모자이크 운동, 새로운 수도원 운동들에 대한 명쾌한 해석, 소비주의, 세계화, 신자유주의 등 현대 교회를 노골적으로 현혹하고 있는 시대정신에 대한 예리한 분석, 종말과 제자도, 청지기직과 교회, 선교에 관한 성경적이고 온전한 이해를 바탕으로 저자는 은밀하게 그러나 역동적으로 전개되는 우리 시대 하나님 나라 운동에 초대한다."
