title,summary
레드썬 컬러타로,국내에서 처음으로 유니컬러와 조합하여 해석할 수 있는 비법들을 알게 되었고 몇 년여에 걸쳐 상담하고 강의를 하며 컬러타로의 보급에 힘쓰고 있다. 위대한 것은 타로가 아닌 사람 자신이다. 사람은 누구에게나 영적인 능력이 있으며 잠재력을 가지고 있다. 하지만 그 능력은 저절로 개발되어 지지는 않는다. 기본기를 잡아줄 이 컬러타로 책을 토대로 끈임없이 상담하며 노력한다면 멋진 컬러타로 상담가가 될 수 있을 것이다.
선한 청지기로 살아가라,"우리가 받은 몸, 사고, 재능, 시간, 믿음, 돈, 가정에 대한 청지기 직분을 어떻게 하면 낭비하지 않고, 하나님 나라의 유익을 위해 사용할 수 있는지 알려준다. 헌신이란 무겁고 하기 힘든 것이라는 선입견을 벗어버리고, 하나님을 섬기며 그분의 집을 위해 일하는 청지기의 삶이야말로 다른 어떤 것과 비교할 수 없는 하나님이 주시는 가장 귀한 선물임을 깨닫게 해준다."
성모의 메시지,"지구 대변화기를 맞아 이 세상을 변형시키기 위한 성모 마리아의 영적 가이드북. 승천한 인류의 영적스승으로서의 성모 마리아가 계시를 통해 전 인류에게 전해주는 과학적 우주신학이자 창조론이며, 또한 신(神)의 우주법칙과 원리에 관한 놀라운 가르침들이다. 그리고 이런 가르침들이 우리의 현실적 삶의 성공과 행복, 더 나아가 영적인 구원 문제로까지 확장되고 연계되어 상세히 설명되고 있다.

이 책에서의 성모님의 메시지와 가르침들은 대단히 과학적이고 합리적인데, 따라서 지성인이라면 누구나 그것을 이해하고 인정할 수밖에 없을 정도로 그 내용이 매우 논리정연하고 명쾌하다. 그런 까닭에 이 책은 그동안 가톨릭 계통에서 나왔던 기존의 성모의 계시류의 내용들과는 완전히 그 격(格)을 달리하는 책이다."
우리 아이 교육을 묻습니다,"모든 그리스도인 부모를 위한
‘내 아이, 그리스도인답게 가르치는 길’
어떻게 해야 자녀를 하나님의 사람으로 기를 수 있을지 궁금하고, ‘이건 아닌데...'라고 생각하면서도 대안(사실은 믿음과 용기)이 없어 울며 겨자 먹기로 기존의 교육 시스템(학교, 학원, 교회)에 자녀를 맡겨놓은, 하나님을 대적하는 시대정신과 문화 속에서 소신이나 방향 없이 자녀를 키우고 있는 모즌 그리스도인 부모를 위해 기획한 ‘기독교적 교육관’에 대한 책이다. 이 책은 노하우를 전수하거나 정답(?)을 주는 대신, 그리스도인이 교육을 어떻게 바라봐야 할지 (관점을) 나누고, 남들 하는 대로, 세상이 시키는 대로 따라가는 것이 아니라,하나님나라의 교육방식이 무엇인지 이해하고 적용하도록 격려하는 내용을 담고 있다. 또한 이 책은 대한민국 크리스천 홈스쿨링 1세대 운동가와 관련 사역자들이, 척박한 환경 가운데 자녀를 가르치고 돌보면서 삶으로 깨달은 기독교적 교육관을 대화하듯 나누는 인터뷰 형식으로 구성되어 있다."
플로티노스 - 그리스 철학을 기독교에 전달한 사상가,"그리스철학을 기독교에 전달한 사상가로 평가되는 플로티노스의 삶과 그가 깨달은 것이 무엇이었는지, 그리고 그의 사상이 서양에 끼친 영향을 소개한 책. 플로티노스가 걸었던 여정을 쫓아가면서 그가 남긴 존재와 ‘하나’, 영혼과 감각, 운명과 자유에 대한 그의 철학을 말해준다."
엑스포지멘터리 다니엘,"엑스포지멘터리(Expository + Commentary, 해설주석)은 “해설, 설명”을 뜻하는 ‘Expository’와 “주석”을 뜻하는 ‘Commentary’를 합성한 단어다. 본문의 뜻과 저자의 의도와는 별 연관성이 없는 주제와 묵상으로 치우치기 쉬운 expository의 한계와 필요 이상으로 논쟁적이고 기술적일 수 있는 commentary의 한계를 극복하여 가르치는 사역에 도움을 주기 위한 새로운 장르다."
그 길을 걸으라 (반양장),"유진 피터슨 영성 시리즈 3권. 형용사는 명사의 방향을 꺾어서 여러 가지 다른 길을 가게 만든다. 마치 부사가 동사의 길을 정해 주는 것과 같다. 좋은 형용사는 명사를 경이롭게도 성장과 확장이 일어나는 방향으로 가게 할 수 있다. 그러나 나쁜 형용사는 명사를 죽일 수 있다.

유진 피터슨은 전 작에서 우리가 기독교와 관련된 명사들과 함께 사용하는 형용사에 주의를 기울이고 이를 면밀하게 조사함으로써 그 명사들의 원래 의미를 복원하고자 했다. 그렇게 함으로써 피터슨은 기독 교회에 매우 중요한 공헌을 했다. 대부분의 지역에서 대부분의 시기에 대부분의 그리스도인들이 예수님을 따르는 일의 '무엇'과 관련된 것에 대해서는 대체로 동의했지만, 우리가 길을 잘못 들고 구덩이에 빠진 부분은 바로 '어떻게'이기 때문이다. '무엇'은 명사의 영역이지만 '어떻게'는 형용사의 영역이다.

<그 길을 걸으라>는 형용사에 관한 책이다. 즉 예수님을 따르면서 우리의 성경적 상상력을 회복하는 일에 대한 책이다. 어느 문화에 속해 있건, 교회는 성경적 형용사들을 도둑맞고 그 자리가 주변 문화의 형용사들에 의해 대체되는 경험을 했다. 다른 책을 통해 이미 보여 주었던 동일한 집중력과 주의력을 가지고 성경 이야기를 풀어가는 피터슨은 이 책에서 예수님을 따르는 사람이 된다는 것의 핵심을 건드리며 우리에게 성경적으로 조건 지워진 형용사들을 회복해 준다."
예배를 위한 찬송가 반주 & 연주곡집 (스프링),"사랑의교회 쉐키나 워십의 음악감독인 송은정의 실제 예배에서 바로 사용할 수 있는 편곡으로 가장 많이 불리는 50곡의 찬송가를 수록, 현대적 코드와 리듬을 사용한 세련된 사운드, 그 깊이와 의미는 그대로 전달하였고 화려함보다는 예배를 위한 안정되고 정확한 편곡으로 피아노 악보와 함께 쉐키나 워십 앨범 수록곡 밴드용 리드시트 악보를 제공하여 반주용 · 연주용 모두 만족할 수 있는 찬송가 편곡 악보집이다."
52주 가정예배 2,"가정예배는 이 세상 가치에 대한 저항이자 대안이다. 일주일에 한 번, 온 가족이 둘러 앉아 가정예배를 드리면 영적으로 하나가 된다. 혼돈의 세상을 살아갈 힘을 얻고, 잃어버린 길에서 불빛을 발견한다. 가정예배는 이 세상이 좇는 가치에 동조하지 않겠다는 저항이다. 이 세상의 방법이 아닌 하나님의 방법으로 우리 가정을 세우겠다는 선언이다. 시간이 주어지고 상황이 좋아지면, 그때 가정예배를 드리겠다고 하지 말고 지금 당장 시작해야 한다. 가정예배를 통해 우리 가정이 누구에게 속해 있는가를 확인하고, 우리 가정의 정체성을 선포하라."
요한계시록,"요한계시록이 기록되던 당시의 사회적.경제적.정치적 삶의 자리를 충실히 반영하여 한국교회의 잘못된 종말론 사상을 비판하고 요한계시록이 말하려는 본래의 메시지를 정확하게 제시하는 책이다. 저자는 요한계시록이 인류의 종말적 대참사와 파국을 보도하는 종말론적 시나리오가 아니라, 오히려 하나님의 정의에 역행하는 로마 제국 같은 거대한 통치 시스템에 저항하도록 돕는 문서라고 주장한다.

요한계시록이 기록되고 회람되던 시대에는 로마 제국의 군사적 패권주의와 수탈경제 체제가 정당화되고 황제 숭배가 당연시되었다. 이런 시대적 상황에서 요한계시록의 저자는 악한 세상의 역사가 하나님의 심판과 어린 양의 진노로 종말을 맞이하고, 희망찬 대안적 세계가 시작된다는 사실을 밝혀 암울한 시대를 사는 성도들에게 희망을 주며 참된 예배를 독려했다.

저자는 요한계시록을 통해 오늘을 사는 그리스도인들에게 요한계시록의 메시지에 귀를 기울이고 오늘날의 전쟁 체제와 신자유주의적 경제 세계화의 현실을 숙고하라고 요청한다. 또한 그리스도인들이 오늘날 제국의 신화들이 날마다 주입하는 마취에서 깨어나 시장의 제국과 다국적 자본에 충성하는 우상 숭배를 거부하고 약자들의 생명을 돌보는 하나님과 어린 양에게만 충성하는 참된 예배를 드려야 한다고 주장하고 있다."
기독교신앙,"슐라이어마허 신학사상의 결정판. 지은이는 자신의 논의를 단순한 교의학이 아닌 신앙론으로 규정하고, 교리의 추상성을 넘어서 신앙인의 마음에 실질적으로 작용할 수 있는 생동적인 기독교상을 제시하여 보다 현실적이고 구체적인 생활로서의 신앙을 사람들에게 전달하고자 했다.

책은 21세기를 사는 우리에게도 여전히 파격적이며 논쟁적이다. 특히 지은이의 이론이 제대로 알려지지 않은 한국 사회에서는 더욱 그러하다. 지은이는 '관계'를 통해 세계를 설명하지만 상대주의적인 관점에서 해체하지는 않는다. 그리스도라는 중심을 세워 일관된 세계관을 구축한 슐라이어마허식 사고의 도정은 상대주의적 강박증에 시달리는 현대 사회에 적잖은 시사점을 남긴다.

진정한 신앙은 삶의 현장과 무관하게 위로부터 주어진 교리에 무조건적으로 복종하는 것이 아니라 삶의 한가운데서 하나님을 만나고 그와 교제하는 것이라는 점에서 옮긴이는 슐라이어마허를 '감동과 영성의 사상가'로 규정한다. 나아가 늘 새로운 감동은 삶을 관통하는 실제적인 말씀의 능력으로 이어진다는 점에서 이 책을 '육화된 말씀의 신학'으로 규정한다."
"어린이 설교, 어린이가 좋아하는 내러티브 강해","어린이 설교는 강해 설교여야 하고, 또한 내러티브 방법을 활용해야 한다. 어린이들에게 적합한 설교는 명제식 설교보다는 내러티브 강해 설교다. 어린이 설교로 박사(D.Min) 과정을 공부하면서 이해하게 된 설교학 이론들과 또 현장 사역자로 섬기면서 경험한 어린이 설교의 실제를 이 책에 담고자 했다.

또 파이디온 선교회에서 사역하는 동안, 많은 이들의 설교를 듣고 설교문을 감수하면서 깨닫게 된 것들을 이 책에 담았다. 주일학교 사역 현장에서 매주일 어린이 설교를 감당해야 하는 많은 설교자들에게 이 책이 어린이 설교의 가치와 방향에 대해 실마리를 제공하기를 바란다."
지금 있는 곳에서 시작하라,"<모든 것이 산산이 무너질 때>, <지금 여기에서 달아나지 않는 연습>의 저자 페마 초드론의 세 번째 명상에세이. 삶에서 마주하는 고통을 부정하지 않고 그것을 끌어안는 방법으로 사마티-위빠사나, 통렌, 로종 명상을 소개한다. 영국의 명상 매거진 <왓킨스Watkins>는 '2015년 가장 영향력 있는 영적 인물 100인'에 달라이 라마, 프란치스코 교황, 틱낫한 등과 함께 그녀를 선정했다.

페마 초드론은 세 가지 명상 수행법을 통해 지금 있는 곳에서 시작할 수 있는 용기를 일깨워준다. 사마타-위빠사나 명상은 끊임없이 우리 마음속을 흘러 다니는 여러 가지 생각들을 알아차림으로써 지금 여기에 머무를 수 있게 한다. 로종 명상은 불안, 두려움, 고통 등 삶의 어두운 측면들을 장애물로 보지 말고 오히려 내 안의 자비심을 일깨워줄 연료로 삼으라고 한다. 통렌은 나를 비롯한 모든 사람들의 고통과 슬픔을 기꺼이 받아들이고, 나를 비롯한 모든 사람들에게 기쁨을 보내는 과정으로 이루어져 있다.

내 안의 자비심을 일깨우는 전제조건으로 페마 초드론은 자신의 결점을 받아들이고, 자기 자신을 진정으로 껴안으라고 한다. 부록에는 티베트에 전해지는 천 년의 지혜, 59개의 경구로 이루어진 아티샤의 수심요결을 수록했다. 또 자기성찰을 위한 질문, 핵심 명상 수행을 심화하기 위한 자료들을 소개해서 마음공부의 지침으로 활용할 수 있게 했다."
구약에서 찾은 복음,"구약으로 복음을 설교한다. 마틴 로이드존스는 구약과 신약은 한 권의 책으로, 단 하나의 주제, 단 하나의 메시지를 전한다고 강조했다. 그가 구약의 중요성을 깨달은 것은 순전히 구약 말씀으로 자신을 조명한 결과다.

많은 사람에게 강해설교자로 알려진 로이드존스이지만, 그는 어느 교회든 매주 한 번씩은 복음을 전해야 한다고 주장하며 구약으로 탁월하게 복음을 전한 복음전도자이기도 했다. 그는 사람들에게 복음이 필요하다는 사실을 깨닫게 해주는 진리야말로 복음 설교의 주요 주제가 되어야 한다고 생각했으며, 그것이 바로 구약 역사의 목적이라고 보았다. 로이드존스가 보기에 구약은 악하고 연약한 우리 인간에게 구세주가 필요하다는 사실을 설교하기에 가장 적실하고 훌륭한 성경이었다."
건반 연주자를 위한 쉬운 찬송가 편곡집,총 200곡의 편곡을 통해 찬송가 반주를 돕는 편곡집이 나왔다. 많이 불리우는 곡은 ver.2를 통해 조금 더 편곡된 악보를 제공한다.
사도행전 속으로 4,"이재철 목사의 사도행전 설교집 4번째 책. 저자는 스데반의 순교를 기점으로 예루살렘에 대박해가 시작된 연유에서 실마리를 잡는다. 그것은 바로 사도들로 하여금 예루살렘을 넘어서게 하기 위한 하나님의 섭리였다고 말하며, 예루살렘을 고수하는 사도들의 행동이 겉으로는 신앙적으로 보이지만 실제로는 비신앙적 자기 집착에 지나지 않음을 밝혀 보인다.

또한 이미 존재하는 열두 명의 사도들, 위대한 직함의 그 사도들로부터 이방 선교의 촛대가 사울에게 옮겨진 사실에 주목하며, 저자는 사울을 택하신 주님의 뜻을 헤아려 나간다. 죽음의 삶을 치닫던 사울이 다마스쿠스 도상에서 주님을 만나 새 생명에 접붙임 받던 장면을 드라마틱하게 재현하는가 하면, 주님이 새로이 택하신 사울이란 그릇의 참된 의미는 무엇인지 심도 있게 파헤친다.

특별히 이 책에는 양화진을 둘러싸고 유니온교회와 갈등을 빚으며 겪었던 저자의 심정과 입장이 표명되어 있으며, 오늘날 한국 교회의 계급화된 직분제가 야기해 온 병폐들을 극복하기 위해 100주년기념교회가 집사·권사·장로 호칭제를 시행하는 취지에 대해 설명되어 있다."
"예배, 종교개혁가들에게 배우다","CLC 예배학 시리즈 22권. 루터, 칼빈, 츠빙글리, 부처 등 16세기 종교개혁가들의 논문과 저술을 분석하면서 그들의 예배신학을 토대로 예배가 무엇이며 어떻게 진행되었는지를 분석한다. 그래서 오늘날 실용주의적 예배로 흘러가는 상황 속에서 종교개혁가들의 예배신학을 통하여 예배가 무엇인지 다시 한 번 생각해 보면서 예배개혁에 대한 도전을 던져준다. 쉽고 평이하게 그러면서 핵심을 정확하게 찔러주고 있기에 누구나 쉽게 읽을 수 있다."
종교에 대한 여덟 가지 이론들,"종교에 대한 과학적 연구를 시작한 막스 뮐러와 인류학과 종교에 대한 비교연구를 개척한 에드워드 버넷 타일러와 제임스 프레이저의 연구에서부터 시작한다. 그리고 지그문트 프로이트, 에밀 뒤르켐과 카를 마르크스의 종교에 대한 ‘환원주의적’ 접근방법을 고찰하는데, 이 세 사람 모두 오늘날까지 큰 영향을 끼치고 있다.

이어서, 환원주의에 반대한 막스 베버, 미르체아 엘리아데의 연구를 정리해서 소개한다. 끝으로 에반스-프리차드의 민족지학과 클리퍼드 기어츠의 해석인류학을 통해 등장하게 된 새로운 방법론을 탐구한다. 저자는 이론가들을 정리한 각 장마다 그의 생애, 학문적 배경, 이론적 요점들, 개념적 분석과 비판적 평가를 제시한다.

이런 공통적인 형식을 통해 전체적으로 비교하고 치밀하게 평가할 수 있도록 해준다. 결론에서는 최근의 탈식민주의 이론과 인지과학의 영향 등을 검토하면서 종교에 대한 최근 연구 경향을 정리하고, 고전적 이론들을 서로 비교할 뿐 아니라 종교이론의 미래에 대해서도 전망하고 있다."
김구원 교수의 구약 꿀팁,<궁금해?> 1권. 구약 성경을 읽을 때 꼭 알아야 할 배경지식을 '구약학자가 엄선한 40가지 질문'을 통해 독자들이 자연스럽게 배울 수 있도록 구성했다. 한 손에 잡히는 작은 사이즈인 이 책을 들고 다니며 흥미로운 질문부터 자유롭게 읽어 가면 어느새 구약 성경의 핵심을 관통하게 된다. 또한 각 장마다 풍부한 사진 자료를 곁들여 독자들이 해당 내용을 쉽고 명확하게 이해할 수 있도록 했다. 그동안 어렵다는 생각에 쉽게 펼치지 못한 구약 성경을 제대로 이해하고 읽을 수 있도록 도와주는 '꿀팁'이다.
화두 놓고 염불하세,"인광 대사의 법문 중 핵심적인 내용을 간추린 <인광대사가언록>을 보적 김지수 교수님의 번역으로 2000년에 처음 한국 불자들에게 소개한다. 10여 년이 넘는 시간 동안 아홉 번이나 거듭 인쇄하며 정토염불 수행을 널리 알려온 책이다.

<화두 놓고 염불하세>는 <가언록>을 번역하는 것에 그치지 않고, 한국의 불자들에게 익숙하지 않은 중요한 교리나 용어를 상세히 해설하는 각주를 더하고 있다. 초판에서는 <실용불학사전(實用佛學辭典)>과 <사해(辭海: 上海辭書出版社, 1979년)>와 <실용대자전(實用大字典: 中華書局, 1982년)>을 참고하였고, 이번 개정판에서는 대만(臺灣) 불광산출판사(佛光山出版社)에서 발행한 불광대사전(佛光大辭典)의 전자본(電子本)을 활용하여 기존 각주를 보충하며 새로운 해설 각주를 더하였다.

<화두 놓고 염불하세>는 그동안 화두선 일변도인 한국불교의 풍토에 염불수행에 대한 새로운 인식과 큰 반향을 불러일으키면서, 염불 수행의 요체를 총체적으로 밝힌 뛰어난 염불 법문집으로 독자들의 사랑을 받아 왔다. 이번 개정판에서는 문장을 더 다듬고 번역자의 내용 설명을 더욱 보충하여 독자들에게 새롭게 선보이게 되었다."
무소유 잠언집,"무소유의 화두를 던지시고, 무소유의 삶을 몸소 실천하시다 가신 성철 스님과 법정 스님. 진정한 삶의 가치를 보여준 성철 스님과 법정 스님의 행동와 말씀을 담은 책이다. 부처님과 세상 사람들 사이에 다리가 되고자 하셨던 두 분 스님의 행동과 말씀에서 우러나오는 진정한 삶의 지혜, 그리고 무소유에 담겨있는 행복의 향기를 전한다."
간산 사주명리학 일주론,"그 사람을 알고 싶다면 日柱(생일)를 스캔해 보라! 한국 대표 일주론을 담은 간산 남창환 저자의 『간산 사주명리 일주론』. 기본적인 사주명리학에 대한 지식과 함께 저자만의 독창적 해설을 선보인다. 공부를 처음 시작하는 입문자에게는 공부 방법과 순서, 실질적인 노하우를 제시하고 있으며, 고급을 넘어선 프로에게는 저자만의 이론을 제시하며 공부거리를 제공하고 있기에 모두에게 사주명리학 공부의 길잡이 역할을 톡톡히 할 것이다."
이방인의 염려,교회 안에 존재하는 무늬만 그리스도인인 이방인에 대한 경고. 들의 백합과 공중의 새를 통해 이방인과 그리스도인의 존재론적인 차이를 밝힌다. 독자들은 이 책을 통해 참다운 그리스도인의 삶이 무엇인지 성찰할 수 있는 계기가 될 것이다.
나를 변화시킨 일곱 가지 질문,"믿음의 세계와는 거리가 있을 법한 기술경영, 데이터 과학 및 인공지능 전문가인 저자가 이십 대 후반 예수님을 영접한 뒤 자신이 하나님을 믿지 않던 시절에 가졌던 마음을 기억하면서 신앙에 대한 여러 의문과 의심의 질문들을 회피하지 않고 대답하며 하나님을 만나 믿음의 확신을 갖게 되기까지 변증적 체험적 신앙의 여정을 담은 책이다."
연대기로 보는 구약 성경,"많은 사람들이 구약성경을 읽고 말씀을 잘 이해할 뿐 아니라 그 말씀대로 살고 싶다는 마음을 늘 가진다. 하지만 실제로 성경을 꾸준히 읽는 것도, 그 말씀을 잘 이해하는 것도 생각처럼 쉬운 일이 아니라는 것에 동감할 것이다.

이 책은 학문을 위한 책이 아니며 학문적이지도 않다. 오직 구약성경을 꾸준히 읽어가면서 말씀의 의미들을 발견하고 삶으로 살아내려는 갈망이 있는 사람들을 돕는 길라잡이 역할을 하는 책이다. 성경을 읽거나 공부하기 전에 이 책을 통해 먼저 성경의 전체 구조와 역사적 배경, 중요 주제와 메시지를 파악해서 저자의 의도를 따라 성경을 읽고 공부하길 바란다."
미루나무 그림묵상,"미루와 나무가 들려주는 예수님 이야기. 예수님과 신앙에 관한 묵상을 감성적인 그림으로 따뜻하게 풀어내며 방황하는 크리스천들에게 위로와 응원의 손을 내밀고 있다. 한 장 한 장의 그림묵상을 읽어 나가다 보면, 펜 끝으로 전하는 저자의 진심이 무엇인지 가슴으로 느끼게 된다. 신앙생활에서 오는 어려움과 그에 대한 적절한 위로, 동역자의 소중함, 예수님과의 동행 등 다채로운 영적 메시지들을 담고 있다.

평범한 외모와 원만한 성격의 미루, 따뜻한 성품과 바른 신앙관을 가진 나무. 험난한 세상에서 하나님을 향한 믿음을 지켜 나가는 두 젊은 크리스천의 모습은, 이 시대를 살아가는 우리에게 도전이 되는 동시에 큰 위로로 다가온다. 한편 신학대학원에 재학 중인 저자의 묵상에는 말씀에 대한 깊은 통찰도 담겨 있다. 결코 가볍게 지나칠 수 없는 본질적 문제에 대해서는 단호한 태도를 보임으로써 세상과 타협하지 말라고 읽는 이들을 독려한다."
불교의 자녀사랑 기도법,무량심과 자애를 바탕으로 한 불교의 자녀 사랑법을 담은 책이다. 부모와 자녀간의 다생다겁 맺은 깊은 인연부터 부모님들의 자녀사랑법을 중심으로 상세한 기도방법을 실었다. 근심과 걱정 대신 자녀를 위한 기도와 축원으로 부모와 자식이 함께 살아나기를 돕는 이 책은 불자들의 자녀교육에 바른 길잡이가 될 것이다.
기독교 생활 지침 3,"리처드 백스터의 대작인 『기독교 생활 지침』은 백만 단어가 넘는 실천적이고 결의론적인 신학 해설을 곁들여 신자의 삶에 대해 날카로운 통찰력을 보여 준다. 신학의 실생활적 응용 측면에서 이 책은 청교도 작품 가운데서도 최고의 대중적 인기도와 그 내용에 있어서 폭과 깊이를 지닌다.

만일 현대 교회에서 실천적이고 성경적인 삶이 무엇인가에 대한 광범위한 관심이 있다면 백스터의 이 책은 모든 서재에 필수적인 것이 되어야 한다. 총 다섯 권으로 출간되는데, 3권은 “가정 윤리”에 관한 내용을 다룬다. 가정생활과 관련한 질문에 대한 견고한 성경적 답변을 얻고자 하는 사람들에게 꼭 필요한 책이 될 것이다."
온전한 성화,"<온전한 회심>으로 참된 회개의 중요성과 회심의 역동성을 일깨운 고든 스미스가 <온전한 성화>를 통해 ‘이미’ 의롭다 하심을 입었으나 ‘아직’은 불완전한 우리를 영적 성숙의 길로 안내한다. 고든 스미스는 이번에도 “신학책은 딱딱하고 지루하다”라는 선입관을 완전히 뒤집어놓았다. 거대하고 까다로운 주제인 ‘성화’를 적실한 사례와 누구나 공감할 수 있는 일상의 언어로 풀어내고, 이를 통해 성화가 신학자들의 논문에나 등장하는 현학적 단어가 아니라 복음의 핵심이자 우리를 향한 부르심과 직결된다는 것을 역설한다."
한스 큉의 유대교,"아브라함의 세 종교를 다룬 삼부작. 한스 큉의 유대교에 대한 총체적이고도 심오한 연구서다. 저자는 유대교 역사를 토마스 쿤의 패러다임 이론으로 일목요연하게 정리하고, 기나긴 역사의 밑바탕에 흐르는 유대교적 본질을 들춰낸다. 세 예언자적 종교의 원류인 유대교를 정치적.문화적.종교적으로 탁월하게 분석하고, 미래를 제시한다."
