title,summary
스티커 페인팅북 : 명화,"미국 아마존에서 100만부 이상이 판매된 베스트셀러로, 남녀노소 누구나 즐길 수 있는 아주 새롭고 매력적인 활동북이다. 예술가의 명작을 로우폴리아트 기법을 이용해 템플릿으로 만들었으며, 라벨에 맞는 스티커를 찾아 붙이면서 모자이크처럼 채워가는 책이다. 작품을 완성하는데 따로 도구가 필요 없으며, 활동에 필요한 재료가 책 안에 모두 들어 있다. 특별한 예술 감각이 없더라도 번호에 맞는 스티커만 붙이면 누구나 자신만의 명작을 탄생시킬 수 있다."
우리는 적당히 가까워,"제철소 옆 운동장 3권. 청소년의 섹스 이야기를 다룬 표제작 「우리는 적당히 가까워」를 비롯해 「후배 위하는 선배」, 「먼지 회오리」 등 단막극과 장막극 각각 세 편씩 총 여섯 편의 청소년희곡을 담았다. 특히 단막극 세 편은 ‘ASAC B성년 페스티벌’ 참가작으로, 지난해 안산문화예술의전당 무대에 올라 많은 청소년 관객의 사랑을 받은 바 있다.

대학로에서 활발히 활동 중인 세 명의 젊은 극작가가 참여한 이번 희곡집은 작품마다 독특한 개성과 매력을 뽐낸다. 진짜 나답게 사는 일에 대한 고민을 담은 「자존감 도둑」, 누군가를 좋아하게 되면 반드시 찾아오는 열병 같은 순간을 그린 「남자 사람 친구」, 부조리한 세상을 바라보는 엉뚱하고 발칙한 상상력이 돋보이는 「햄스터 살인사건」 등을 통해 연애, 섹스, 자존감, 죽음 같은 누구도 대답해주지 않는 ‘불편한 물음’들에 관해 생각하게 한다."
불꽃테크닉 핑거스타일 기타 (스프링),"입문자들도 배우기 쉽도록 핑거스타일 주법이 기초부터 탄탄하게 설명되어 있다. QR코드 동영상을 통하여 실전 테크닉과 솔로 곡 등을 개인레슨처럼 구간별로 자세히 따라할 수 있다. 스테디한 핑거스타일 대표 곡들과 오시오 코타로의 황혼, 파이트까지 책 한권으로 마스터할 수 있다."
책 잘 만드는 책,"2008년 출간된 <책 잘 만드는 책>의 개정판이다. 종이의 규격 및 특징부터 고르는 법, DTP와 디지털 출판, 인쇄 및 제책, 가공, 각종 제작 관련 업체들, 예산 집행에 이르기까지 출판에 관한 모든 정보를 한 권에 담았다. 완전개정판인 만큼 출판 제작 환경의 변화를 적절히 반영하면서 지금 현장에서 필요한 내용들을 추가, 보완했다.

출판의 이론과 실제를 세세히 다루고 있어, 출판 관련 실무자들이 자기 영역만 아는 것에서 벗어나 출판 제작의 전 과정을 숙지할 수 있도록 해준다. 저자가 출판 제작자로서 현장에서 직접 부딪히며 하나하나 체득한 귀중한 정보와 노하우가 체계적으로 정리되어 있으며, 사진과 인포그래픽 등 각종 시각 자료들도 적재적소에 풍성하게 실려 있다."
브라스 & 스트링스 편곡법,"브라스와 스트링스 편곡이론서. 각 악기의 구조, 연주법, 어레인지 상의 규칙, 시퀀서 입력 시에 필요한 실제 연주법의 시뮬레이션까지 풍부한 내용을 다룬다. 또한 연동 CD를 통해 각 악기의 실제 예, 악보 예 등을 해설했다."
암스테르담 국립 미술관,"'세계 미술관 기행' 시리즈는 개인적 감상이나 여행기를 배제한 채, 각 페이지마다 해당 미술관의 소장 작품 한 점씩을 상세히 소개한다. 각 미술관에 정통한 이야기꾼이 그림 및 화가의 삶, 당대의 화풍, 다른 작가와의 관계 등에 대해 들려준다. 큼직한 판형의 도판과 함께, 미술관 전반에 관한 설명을 더했다.

네덜란드 최고로 손꼽히는 암스테르담 국립 미술관은, 소위 '황금시대'라 불리는 시기에 발표된 17세기 화가들의 걸작품을 소장함으로써 국제적 명성을 얻었다. 렘브란트, 베르메르, 프란스 할스를 비롯, '황금시대'를 평정한 화가들의 주요 작품을 비롯, 15세기부터 19세에 이르는 네덜란드 회화의 파노라마를 감상할 수 있다."
잔혹성의 미학,"'잔혹극'이라는 말은 폭력이나 신체훼손 등을 떠올리게 하고 실제 잔혹극에서도 고문이나 형벌 등의 상황이 많이 등장하지만, 잔혹극에서 중요한 것은 '잔혹한' 상황 속에서 배우가 겪는 고통 자체가 아니다. 그보다는 관객들이 극 속에 완전히 몰입되어 무대 위 배우의 고통을 자신의 것처럼 체험하는 일이다. 이러한 '카타르시스'의 체험이 극장문을 나서는 관객들에게 어떠한 변화를 야기한다는 것.

잔혹극의 창시자인 앙토냉 아르토(Antonin Artaud, 1896∼1948)에게 잔혹극의 목표는 '인간의 치유' 또는 '세계의 새로운 창조'이다. 이 책의 옮긴이는 '아르토에게 연극은 삶이었으며, 삶은 곧 연극'이라고 말하고 있는데, 화가 반 고흐처럼 정신병에 시달리다 삶을 마감한 아르토에게 이러한 잔혹극은 단순한 이론만은 아니었던 것이다.

이 책은 아르토의 잔혹 연극에 대한 미학서이다. 아르토의 새로운 연극과 잔혹성의 의미가 무엇인지를 프로이트나 사드 등과 관련지어 풀어내면서 연극에 대한 아르토의 방식을 총체적으로 고찰한다. 그리고 아르토의 미학이 로제 비트락의 <빅토르 혹은 권력을 가진 아이들>, 미셸 드 겔드로드의 <에스퀴리알>, 사뮈엘 베케트의 <고도를 기다리며> 등의 작품에 끼친 영향과 이 작품들에서 잔혹성이 어떻게 형상화되는지를 살펴본다."
가상-건축 Architecture as Fabulated Reality,"디지털 테크놀로지에서 비롯되는 ‘범람하는 이미지의 시대’ 그리고 ‘리얼리티의 위기’ 등 시대적 조건 앞에서 건축이 이를 어떻게 포용하고 이로부터 새로운 미적-공간적 가능성을 끌어낼 수 있을지를 고민하는 내용을 담아냈다. 오늘날의 건축은 테크놀로지가 근본적으로 변화시키는 공간 개념에 대응하여 새로운 대안을 제시해야 하는 숙제를 안고 있다. 왜냐하면, 디지털 세상에서 가상은 더 이상 가짜가 아니라 또 다른 진짜이기 때문이다.

이미 세계 각지에서는 이와 같은 공감대를 바탕으로 하는 건축 실험과 담론이 활발하게 일어나고 있다. 이러한 활동들은 건물에 얽매여있기보다는 건축이 자체적으로 내재한 가능성과 이것이 디지털 매체를 통해 발현할 수 있는 새로운 영역에 집중한다. “가상-건축”은 선별된 외국 건축가들의 에세이와 AAPK의 작업 등을 통해서 이러한 담론들을 한국어로 소개한다. 특히, 결론이 난 아이디어보다는 태동하는 아이디어를 노출하기 위해 선별에 노력을 기울였다."
"디즈니 프린세스 스티커 팩 (30장, 지퍼백)","〈백설공주와 일곱 난쟁이〉의 백설공주부터 신데렐라, 인어공주, 뮬란과 〈알라딘〉의 쟈스민, 그리고 〈미녀와 야수〉의 ‘벨’까지! 디즈니의 초창기부터 디즈니의 르네상스라고 불리는 2000년대 초반까지의 디즈니 애니메이션 속 프린세스들의 모습을 한데 엮은 〈디즈니 프린세스 스티커 팩〉이 출시되었다.

이번 스티커는 특히 다이어리를 꾸미는데 사용하기 좋은 사이즈인 80*50㎜으로 제작되어 어느 판형의 다이어리에 붙여도 잘 어울리도록 구성되어있다. 거기에 애니메이션 속 명장면을 그대로 옮겨 담아, 보는 것만으로도 생생하게 그때의 그 감동을 다시 한번 느낄 수 있다. 또한 스티커를 담은 PVC 팩은 실용성이 좋아 스티커를 다 사용하고 난 다음에는 작은 액세서리 등을 담아 보관하기에도 좋다."
에브리데이 캘리그라피,"‘내 손글씨로 캘리그라피를 할 수 있을까?’ 이런 고민을 하는 분들의 걱정을 말끔히 씻어주는 캘리그라피 이론서이자 활용서이다. 30여 년 동안 먹글씨를 써온 작가는 기본이 있어야 나만의 글씨체를 만들 수 있다고 강조하며 그동안 익힌 캘리그라피의 모든 노하우를 아낌없이 풀어냈다.

한글의 자음, 모음 구조부터 시작하여 다양한 글자 변형 방법을 설명하고 한 글자, 두 글자, 세 글자 쓰기, 문장 쓰기를 순차적으로 알려준다. 또 연필, 샤프, 면봉 등 일상 도구로 캘리그라피를 하는 법, 캘리그라피를 더욱 돋보이게 만들어주는 먹 번짐과 먹그림을 그리는 법, 완성한 캘리그라피를 편집하고 합성하는 법까지 캘리그라피의 모든 이론을 한 권에 담았다."
비밀의 정원 엽서책 필통 세트,"예쁜 꽃과 나무, 작은 나비와 벌을 독특하고 정교한 방식으로 그려 컬러링북 열풍을 일으킨 《비밀의 정원》에 이어 《비밀의 정원 엽서책》으로 출간됐다. 《비밀의 정원 엽서책》은 《비밀의 정원》의 아름다운 일러스트 중 한국 독자에게 많은 사랑을 받은 서른 장면을 엄선한 특별판이다.

서른 개의 그림은 한 장 한 장 떼어 쓸 수 있어 바쁜 생활 속 소원했던 친구나 가족에게 마음을 담아 정성껏 칠한 후 선물하기 좋다. 그림은 한쪽 면에만 인쇄되어 마카펜이나 물감으로도 색칠할 수 있다. 마음에 드는 엽서를 골라 사무실 책상 위, 내 방 벽면 등 소중한 공간을 꾸며보자."
큐레이팅의 역사,"큐레이터 한스 울리히 오브리스트가 11명의 선구적인 큐레이터들과 나눈 인터뷰를 모아 정리한 책이다. 1960년대와 1970년대의 독립 큐레이팅 시기부터 현재 유럽과 미국을 중심으로 활발하게 진행되고 있는 도쿠멘타와 비엔날레 등 실험적인 대규모 전시 프로그램까지 전시 기획 분야의 전개 양상을 한눈에 살펴볼 수 있다.

전 세계의 저명한 큐레이터들, 월터 홉스, 퐁튀스 훌텐, 요하네스 클라더스, 장 레링, 하랄트 제만, 프란츠 마이어, 세스 시겔라우브, 베르너 호프만, 월터 자니니, 앤 다르농쿠르, 루시 리파드와 나눈 독특한 인터뷰를 담고 있다.

이 책은 오늘날 이루어지는 큐레이팅의 뿌리를 이해할 수 있는 배경 지식을 제공하고 관련된 고민들을 해결하는 데 필요한 통찰력을 제공해 준다. 대화 속에 역사적으로 중요한 의미를 지닌 전시와 작가들, 주요 미술관과 갤러리 등이 자주 등장하기 때문에 일반 독자들도 유용하다."
"배우, 연기를 훔쳐라","영화배우 신현준이 연기 생활 20여 년 동안 보고 듣고 느꼈던 것들을 정리해 한 권에 담았다. 그동안 그가 쌓아온 연기 생활의 노하우이자, 배우를 꿈꾸는 지망생들에게 전하는 ‘연기 바이블’이다. ‘매력적인 그 이름, 배우’, ‘오디션, 그 문을 두드리는 법’, ‘배우의 운명을 잡아라’, ‘배우로 살아남는다는 것’, ‘신현준 노트’로 구성되어 있다.

1장에서 신현준은 배우가 되려는 사람들의 자세와 목표의식, 본받을 만한 배우들을 소개한다. 그러면서 배우가 되려는 이들이 가장 먼저 해야 할 것이 ‘나는 왜 배우가 되려고 하는가?’에 대한 답을 찾는 것이라고 한다. 2장에서는 배우 지망생들이 통과해야 할 오디션 비법을 공개한다. 신현준은 오디션을 잘 보는 방법의 최우선으로 철저한 ‘준비성’을 뽑고 있다.

3장에서는 스태프를 사랑하고 가까이 할 것과, 감독을 믿고 따라야 하는 이유, 그리고 언제든지 촬영에 임할 수 있게 늘 준비되어 있는 배우가 되라고 주문한다. 또한, 리얼리티가 살아 있는 연기, NG를 두려워하지 말고 NG를 통해 성장하라는 조언을 실제 사례를 들어 설명한다. 마지막으로 4장에서는 진정한 배우로 살아남는 법을 말한다.

신현준이 배우 지망생 시절부터 연기 공부를 위해 보았던 ‘극단적인 캐릭터가 나오는 영화’와 지금까지 읽으며 연기 생활에 도움이 되었던 추천 도서, 20여 년 동안 연기하고 생활하며 느꼈던 단상을 모은 ‘연기 노트’를 특별 부록으로 첨부하였다."
오시오 코타로 Blue sky,"기타리스트 오시오 코타로의 한국 첫 공식 TAB악보 스코어. 기본적으로는 2006년에 일본에서 발간된 「Blue sky」악보집과 동일한 내용이지만, 완전 한글화, 새로운 사진 게재, 한국 팬을 위해 오시오 코타로가 자필로 쓴 인사글 등 한국판만의 새로운 점도 추가되었다."
아로마향초 만들기,"인테리어, 장식소품 그리고 멋진 선물로 꼭 만들어보고 싶은 양초 만들기 아이템을 소개한다. 파라핀이나 젤리 이외에도 실리콘 와플, 초콜릿 몰드를 이용한 퓨전 아로마향초 등 여러 다양한 레시피를 소개하고 있으며 초보자도 금방 따라 만들 수 있게 세 명의 양초공예 전문가의 감수를 받아 재미있고 알기 쉬운 설명들로 구성하였다."
"한국의 미, 최고의 예술품을 찾아서 세트 - 전2권","'한국 최고의 미(美)'로 꼽히기에 손색이 없는, 우리 고유의 역사와 문화가 집약된 전통 예술품 40점을 소개한다. 40여 명의 국내 전문가들이 기획과 작품 선정, 리뷰에 참여해 완성된 책이다. 충실한 해설을 통해 개별 작품이 갖는 역사적.미적 의미를 설명하고, 좋은 작품을 감상하고 느끼기 위한 방법을 더불어 안내한다.

'국제적 보편성, 한국적 특수성, 시대적 대표성, 미학적 완결성' 이라는 네 가지 기준을 적용, 회화, 공예, 조각, 건축 분야의 예술품을 각각 선정했다. 작품을 설명함에 있어서는 이해와 감상이라는 두 가지 측면에 집중했다. 기본적인 사항과 깊이 있는 최신의 연구 성과들을 객관적으로 서술하고, 미적 감흥을 전달해줄 수 있는 주관적인 해설을 덧붙인 것. 동시대 중국과 일본 예술품과의 비교 논의도 함께 실려 있다.

1권 - 회화/공예 편
회화 분야에는 고구려 고분벽화와 고려시대의 불화, 조선시대의 산수화, 인물화, 영모화, 풍속화, 민화 등이 포함되었다. 공예 분야에는 토기와 전돌, 금속공예와 목공예, 도자 가운데 청자와 분청자, 백자 등이 포함되었다. 여기에는 선사시대와 삼국시대, 통일신라기와 고려시대, 조선시대의 대표적 공예 작품이 고르게 안배되어 각 시대의 미감을 역사의 흐름 속에서 파악할 수 있도록 하였다.

2권 - 조각/건축 편
조각에서는 금동불, 소조불, 철불, 목조불상, 목각탱 등 재질면에서 다양한 작품을 담았고 삼국시대, 통일신라기, 고려시대, 조선시대의 종교와 사회상을 잘 대변하는 불상들을 선정하였다. 건축에서는 불교 탑파, 사찰건축, 궁궐건축, 사원건축, 조경문화, 민가건축, 석교 등 분야별로 선정하였고, 이를 통해 각 시대의 건축양식과, 삶과 정신을 담는 그릇으로서의 건축적 의미를 되새길 수 있도록 하였다."
뉴요커,"뉴욕, 뉴요커, 예술에 관한 산문집. 뉴욕에서 그림을 그리고 번역을 하고 있는 지은이가 자신이 사랑하는 뉴욕의 구석구석과 뉴욕에 사는 사람들, 그리고 자신을 매혹시킨 화가와 작품들에 대해, 직접 찍은 사진과 그림을 덧붙여 쓴 책이다.

1부와 3부는 뉴욕과 뉴요커에 대한 에세이가 주를 이룬다. 뉴요커의 고독감과 지은이의 일상적인 풍경을 담았다. 지은이가 사랑하는 맨해튼의 거리, 뉴욕공립도서관, 센트럴 파크, 중고서점 스트랜드 북스토어에서부터 우디 앨런, 고공 줄타기사 필립 프티 등의 이야기 등이 함께 실려있다.

2부는 그림들에 관한 이야기. 존 싱거 사전트의 '마담 X', 뉴욕에 걸려 있는 베르메르의 작품 8점, 에드워드 호퍼 등을 소개한다. 지은이 개인의 감상과 애정이 담뿍 드러난 감상에세이다."
율다우 애니메이션 OST,"전곡 계이름을 표기하였고, 쉬운 악보로 구성하였다. MR 반주음원을 제공한다."
쉽게 배우는 영문 캘리그라피 레슨,"일본 최고의 캘리그라퍼인 저자가 대표적인 서체인 ‘이탤릭체’와 ‘카퍼플레이트체’ 를 이용한 카드 및 디자인 제작 방법을 사진과 함께 상세한 설명을 덧붙여 소개한다. 초보자에게 꼭 필요한 사용 도구 설명, 펜 사용 방법, 기본 자세, 기본 스트로크를 자세히 설명하고 있으며, 다양하게 응용해볼 수 있는 여러 작품들을 소개하고 있어 중급자에게도 꼭 필요한 책이다.

뜯어서 연습해볼 수 있는 별책 부록 <캘리그라피 연습노트>가 책 뒤에 붙어 있어 본문에 소개하고 있는 알파벳 체와 여러 작품들을 직접 따라 써 볼 수 있도록 구성되어 있다."
베르톨트 브레히트,"'주어캄프 세계인물총서'는 문학, 음악, 사상, 철학, 모험, 팝아트 등 수많은 분야에서 세계사를 이끈 인물들을 엄선하고 있다. 각 인물들의 생애, 작품, 영향에 대해 현대적인 접근을 시도하면서 이들에 대한 이해를 위해 가장 중요한 지식을 한눈에 들어오게 정리했다.

세 번째권은 세익스피어 이후 가장 중요한 극작가로 평가받는 베르톨트 브레히트를 다루고 있다. 지은이는 일상적인 것이나 '저급한 것'과 같이 문학적인 가치가 없다고 여겼던 주제들에 대해섣 문학을 개방하고, 연극에서 새로운 의식적인 연기 형식을 세계적으로 관철시킨 브레히트의 업적을 다룸과 동시에 그의 다양한 초상들을 압축적으로 정리한다."
영화 이해의 길잡이,"<정재형의 영화 강의>(영화언어, 1994)를 저본으로 한 개정증보판이다. 영화 이해를 위한 기본 이론은 물론 이론 적용 사례로 우리 영화를 제시함으로써 독자의 이해를 한층 높였다. 시나리오, 편집, 연출, 제작 등으로 나눠 영화의 기초 이론을 먼저 설명하고, '작품분석을 통한 이해'를 매장마다 덧붙였다.

'작품분석을 통한 이해'는 테마별로 두 편의 영화를 언급했는데, 해당 이론을 가장 잘 보여주는 외국 영화와 최근의 한국 영화 한 편이 그것이다. 영화를 보면서 읽어야 그 맛을 더할 수 있는 '이론과 실제'를 겸비한 영화 입문서로 손색없다.

각 장 끝에 달린 '용어 해설'과 '더 읽어볼 만한 책'은 이제 막 '영화 읽기'의 길에 들어선 초보자에게 충실한 길잡이가 되어준다. 더불어 세계 영화 사조를 이해하는 가운데 우리 영화의 흐름도 함께 살펴볼 수 있도록 개략적인 우리 영화사를 수록했다."
인도 미술,"'Art & Ideas'는 영국의 미술전문 출판사인 파이돈(Phaidon)에서 기획하고 미국, 독일, 프랑스, 그리스, 중국, 일본 등에서 공동출판하는 미술책 시리즈이다. 2011년까지 140권을 출간한다는 방대한 계획을 갖고 있고, 한국에서는 한길사에서 출간한다.

이 시리즈는 남북 아메리카와 오스트레일리아, 아프리카, 아시아 미술을 망라하는 '세계의 미술', 서양 미술의 각 시대와 양식, 사조를 조망하는 '서양의 미술', 위대한 미술가들의 삶과 작품세계를 재구성하는 '위대한 예술가들'의 세 부분으로 구성된다. 사회와 역사, 문화, 철학의 전 맥락 속에서 미술의 모든 역사를 종횡으로 재구성한다는 기획이다.

학술적 권위를 소홀히 하지 않으면서도 일반 독자들도 어렵지 않게 접근할 수 있도록 서술한다는 기본 방향을 가지고 있다. 풍부하고 다양한 도판을 수록했으며, 그 질 역시 매우 뛰어나다. 조각 작품들의 사진을 보면 이 책의 도판들이 왜 특별한지를 금방 느낄 수 있다. 활자는 검은색이 아닌 갈색톤으로 약간 굵은 명조체를 사용한 것이 특징.

인도는 힌두교, 불교, 자이나교 등 세계 주요 종교의 발원지로, 기원전 3000-2000년 경에 이미 독자적인 문명을 가지고 있었다. 평온한 부처의 이미지, 흥미진진한 동굴벽화, 정교하기 이를 데 없는 사원 건축, 라자스탄의 궁전, 영국 식민지 시대의 유산 등 인도의 예술은 다양하면서도 연속적인 4500년의 역사를 가지고 있다.

기존의 인도미술 관련 책들이 고대 불교미술에 한정되는 경향이 있었다면, 이 책은 힌두교 미술, 이슬람 건축 및 회화와 함께 현대의 인도미술까지 다루고 있다는 점이 특징이다. 주요 미술품을 통하여 인도의 사상과 철학을 비롯해 종교와 미술과의 관련성, 미술의 특징 등에 대해 살폈다."
"촌놈, 김용택 극장에 가다","밥은 한끼 굶어도 보고싶은 영화는 굶지 않고 살아온 한 시인의 영화 이야기. 자신은 영화학도도 평론가도 아니고, 그냥 영화를 보는 행복한 관객이라고 고백하는 시인 김용택은 영화 속에서 따뜻한 감동과 아름다운 사랑, 인생의 모습을 찾는다. 전주에서 발행되는 잡지 <문화저널>에 연재되었던 글과 새롭게 쓴 글을 추려 엮었다.

지은이는 재미있고 감동적이며 기억에 남는다면 그것이 바로 잘 '만든' 영화라고 생각한다. 그래서 이 책에서는 <희생>이나 <나라야마 부시코>가 <다이하드>, <쉬리>와 동등하게 이야기된다. 무엇보다 그는 '영화는 관객이 완성한다'는 원칙에 충실해서, 자신이 살아온 삶, 자신이 느낀 재미와 감동, 현실에 대한 비판 등을 솔직히 써내려간다.

여주인공이 자신의 시를 낭송하는 장면이 나오는 영화 <미술관 옆 동물원>을 소개하면서 '자랑도 할 겸' 그 시의 전문을 싣기도 하고, <아름다운 시절>의 배경이 된 천담의 분교에서 근무했던 시절을 되새기며 추억에 잠기기도 한다. 영화를 보았든 보지 않았든, 소박하면서도 맛깔스럽게 풀어가는 시인의 영화 이야기에 공감할 수 있다.

영화, 특히 한국영화에 대한 애정이 글마다에서 베어나온다. 지은이는 영화를 만드는 모든 사람들을 좋아하며, 배우와 감독들에게 훌륭한 관객이고 싶어한다. 섬진강 가 작은 초등학교에서 아이들을 가르치고 있는 그는 여전히 극장에 가는 꿈을 꾼다."
칸트의 『미적 판단력 비판』 입문,"영국 에식스대학교 철학과의 피오나 휴즈가 저술한 Kant’s Critique of Aesthetic Judgement(2010)를 성신여자대학교 임성훈 교수가 우리말로 번역한 것이다. 저자 휴즈는 예술과 철학의 관계에 주목하면서 칸트의 인식론과 미학, 독일과 프랑스의 현상학 등의 분야를 연구하고 있는 학자이다.

칸트의 3대 비판서 중 마지막 책인 『판단력 비판』은 그가 앞서 저술한 『순수이성비판』, 『실천이성비판』과 함께 칸트의 비판철학을 체계적으로 정립하는 저서이다. 『순수이성비판』은 자연법칙에 따른 인과성에 중점을 두는 데 비하여, 『실천이성비판』은 원칙적으로 자연과 양립할 수 없는 자유의 영역에 초점을 두고 있다. 『판단력 비판』은 인식 원칙과 도덕 원칙 사이의 이 간격을 도덕적 행위가 대상의 경험계에 관여할 수 있다는 것을 보여줌으로써 매개하려 한다. 인식과 도덕의 갈등을 해소하기 위해 설정된 특별한 영역은 바로 ‘아름다움’에 대한 감상이라는 것이 세 번째 비판서의 1부인 『미적 판단력 비판』(1항-60항)의 주제이다."
한 권으로 끝내는 보타니컬 아트,"보타니컬 아트의 정확한 개념은 물론 필요한 도구와 구도 잡는 법, 광원에 대한 이해와 표현 기법, 나아가 작품을 돋보이게 액자에 담는 법까지, 보타니컬 아트에 관한 모든 것을 집약해놓은 완결판이라 할 수 있다. 보타니컬 아트에 관심이 있거나 현재 작품 활동을 하고 있는 사람들을 위한 책이다.

관찰한 것을 화폭에 아름답게 구현하려면 몇 가지 기술이 필요하다. 이 책은 보타니컬 아트를 완성하기 위한 자세한 방법들을 친절히 안내해준다. 그리고 마지막으로 기존 액자에 저자가 알려주는 약간의 장식만 가미하면 심플하면서도 고급스러운 액자가 탄생한다. 바로 프랑스 스타일 액자 만들기다.

보타니컬 아트는 이런 프랑스식 액자와 가장 잘 어울린다. 그림을 가장 돋보이게 간직할 수 있는 ‘꿀팁’이다. 이 책은 그릴 대상을 관찰하는 법과 구도 잡기, 스케치하기, 채색 기법, 작품을 액자에 담는 법까지 그야말로 보타니컬 아트의 모든 것을 한 권에 담아낸 ‘세상에서 가장 친절한 책’이라 할 수 있다."
