title,summary
건강 혁명,"80만 유튜브 구독자! 1억 3,300만 누적 조회 수의 주인공 「김소형 채널H」 화제의 인기 영상 중 건강한 삶을 유지하기 위해 반드시 물리쳐야 할 ‘건강 10적’을 선별해서 10적이 나타나는 원인을 짚어보고 이를 떨쳐내기 위한 ‘생활 속 건강 비책 10’을 체계적으로 소개한다.

또 유튜브 「김소형 채널H」에서 일상생활에서 쉽게 구할 수 있는 통합본초요법으로 인기가 많은 화제의 건강 레시피를 소개해 집에서도 쉽게 보약을 만들 수 있도록 살뜰하게 담아 따로 보관할 수 있도록 분권으로 제본했다.

《건강 혁명》은 25년째 누구보다 성실하게 임상의 길을 걸으며 가로수길에 있는 한의원에서 한결같은 마음으로 환자를 치료하는 김소형 원장의 365일 건강 혁명 일기이자 환자들의 질병 극복 수기요, 중년 친구들의 건강 체험담이다. 열심히 달려온 40~50 중년의 시간이 되면 신체 호르몬의 변화와 자연스러운 노화, 잘못된 생활 습관의 누적 등으로 몸이 일대 전환기를 맞이하는 시기이자, 앞으로의 삶에서 당당하고 품격 있게 나이 드는 결정적인 시기이기에 더욱 각별한 관리가 필요하다."
어르신들의 색칠놀이 : 12지신 & 우리의 전통,"두뇌 트레이닝을 위한 어르신들의 색칠놀이 책. 색칠을 하는 것은 작고 정밀한 움직임으로, 이것은 대뇌 피질 영역을 자극하며 감정조절에도 도움을 준다. 또한 색을 칠하는 행위는 정서적 안정을 가져다 줄 뿐만 아니라, 풍부한 감정 형성에 도룸을 준다."
일분치료법,"의료 산업과 제약 산업이 만들어 낸 치료의 복잡다단한 거미줄을 걷어내고 저자가 제시하는 진정한 치료의 길은 산소에 있다. 산소는 신체의 62~71%를 구성하고 있고, 우리 몸의 생물학적 에너지의 90%는 산소에서 나온다. 생존을 위해 필요할 뿐만 아니라 몸의 에너지 수준을 최적화하고 몸이 적절하게 기능하고 생산적으로 활동하기 위해서도 꼭 필요하다. 간편하고 비용도 저렴하다. 독성 약품과 다른 근치적 치료법을 적용할 때 전형적으로 수반되는 부작용이 하나도 나타나지 않는다.

저자는 모든 질병의 신체적 원인 중 주된 원인이 어떤 식으로든 산소 결핍과 연관되어 있음을 주장한다. 하지만 의료 환경에 있어서 산소는 그동안, 질병 “치료”는 말할 것도 없고 사전 예방에 있어서도 “1차 방어선”으로 활용되는 경우가 거의 없었고, 실질적으로 모든 질병에 대한 치료제라는 합당한 평가를 결코 받지 못했다. 그에 따르면 산소가 없다면 이내 죽을 수밖에 없다는 근본적인 진실은 쓸데없는 주제들에 완전히 파묻혀, 의학 분야에서 창조한 ‘바벨탑’에 의해 완전히 차단되었다."
안티 스트레스와 집중력 향상을 위한 점잇기&컬러링북 : 도시편,"'안티 스트레스와 집중력 향상을 위한 점잇기&컬러링북' 시리즈 중 ‘도시편’은 국내에서도 인기 있는 도시들의 풍경 및 건축물들을 선으로 이어 표현할 수 있다. 점잇기 도서에서 완성한 작품들로 구성된 컬러링북까지 제공하여 밋밋했던 선들에 색감을 입혀 화려하게 꾸며줄 있고, 나라별 여행 Tip과 정보들도 함께 담겨 있어 색칠을 하는 동안 지식을 쌓을 수 있다.

점잇기는 1,000개의 점으로 이루어진 도안의 1번부터 1,000번까지 번호를 따라 순서대로 점을 이으면 훌륭한 예술 작품이 완성된다. 100번 단위로 점의 색이 구분되어 쉽게 점을 이어 나갈 수 있고, 점을 잇는 동안 어떤 그림이 완성될 지 추측하는 쏠쏠한 재미도 더한다. 남녀노소 누구나 그림에 자신이 없는 사람들까지도 어떤 도구로든 훌륭한 작품을 완성할 수 있다."
1日1食,"세계 최장수국인 일본에서 출간되자마자 베스트셀러에 오른 이 책의 가장 큰 장점은 누구나 쉽게 따라할 수 있다는 데 있다. 책에서 제안하는 내용들은 어렵지 않다. 보통의 건강서와 달리 금주와 운동을 권하지 않으며, 엄격하게 하루 한 끼만을 고집하지도 않는다. 할 수 있는 것부터 시작하여 단기간에 최대의 효과를 보는 것이 나구모식 건강법이다.

처음 ‘1일 1식’을 들었을 때, ‘어떻게 하루 한 끼만 먹고 살아?’ ‘먹는 즐거움은 포기 못 해.’ 했던 사람들도 책을 읽으면서 모든 것이 공급 과잉인 시대에 먹을거리 역시 과잉 섭취하고 있다는 사실을 깨닫게 된다. 이 책은 30대 중반을 넘어가며 하루하루 몸이 다르다고 느끼는 남성들, 다이어트가 인생의 숙제가 되어버린 여성들에게 건강한 몸과 아름다움을 선사할 것이다."
운동화 신은 뇌,"KBS '생로병사의 비밀' 300회 특집에 방송된, 운동과 뇌기능의 관계를 심도 있게 연구한 책. 지은이 하버드대 정신과 교수 존 레이티는 다양한 실험 사례와 연구 결과들을 바탕으로 운동과 뇌의 놀라운 메커니즘에 관한 증거들을 제시하고, 우리가 자유롭게 선택할 수 있는 간단한 운동요법을 함께 일러준다.

이 책은 과학적이고 경험에 기초한 자료들을 근거로 하여 운동이 신체적 건강을 넘어서 뇌 건강, 즉 인간의 학습능력과 정신건강에도 지대한 영향을 끼친다는 사실을 철저히 밝히고 있다. 이는 운동 부족이 우리의 뇌를 죽음으로 이끌 수도 있다는 데 대한 반증이기도 하다.

따라서 이 책을 접하는 당신에게 저녁의 걷기 운동이나 달리기는 전혀 다른 의미로 다가올 것이며 더 나아가 삶을 바라보는 당신의 시선 자체가 바뀔 것이라는 것이 지은이의 주장이다."
나도 손글씨 잘 쓰면 소원이 없겠네,"소원풀이 시리즈. '작품'을 만들 정도는 아니더라도 기본부터 차근차근 자신의 손글씨를 다듬어 가도록 안내한다. 글씨를 처음 배우던 때로 돌아가 펜을 바르게 쥐고 한글 모양을 익히는 것부터 시작해 나에게 맞는 필체를 찾아 예쁜 메시지 카드를 쓸 수 있는 단계까지 4주 완성 프로그램으로 구성되었다. 손글씨의 변화를 느껴보며 즐겁고 뿌듯한 한 달을 보낼 수 있다.

글씨를 처음 배우는 것처럼 펜 쥐는 법부터 시작해 한글 정자체로 한글의 모양을 익혀보고 단어부터 긴 문장으로 조금씩 시야를 넓혀가며 큰 글씨로 반듯하고 가지런히 쓰도록 했다. 자음과 모음의 모양을 다양하게 바꿔 써보며 자신 글씨체의 장단점을 파악하고 자신에게 맞는 글씨체를 찾아 다양한 레이아웃으로 문장을 써보며, 캘리그라피를 할 수 있다."
근육에 힘 좀 빼고 삽시다,"환자들의 턱관절증 치료를 하던 중 근육을 살짝 흔들어주고 귓불을 마사지해주는 것만으로 전신의 통증이 개선되는 것을 발견한 저자는 1500회의 강연회를 통해 5만 명의 고질병인 근육통을 낫게 해주었다. 그가 고안한 ‘기적의 근육 풀기’는 한국, 미국 등에서도 지도자 양성 과정이 생길 정도로 그 전문성을 인정받고 있다.

저자는 근육통뿐만 아니라 ‘오전부터 피곤하고 진이 빠진다’, ‘체액 순환이 잘 되지 않아 몸이 붓고 냉증이 심하다’ 등의 만성피로와 각종 질병이 생기는 것 또한 우리 몸의 30~45%를 차지하는 근육이 뭉쳐 있기 때문이라고 말한다. 근육은 체액을 순환시키고 노폐물을 배출하는 역할을 하는데, 이 펌프 역할이 근육이 딱딱해지면서 멈추기 때문이다. 심장과도 같은 역할을 하는 근육을 올바른 방법으로 풀어줘야 하는 이유다.

평생 만성 통증과 아픈 몸으로 고생했다면 당장 마사지, 스트레칭, 근육 트레이닝을 멈춰야 한다. 그리고 가볍게 흔들고 만져주는 것만으로 이완되는 ‘근육 풀기 운동’을 시작해야 한다. 나이 들수록 오그라들고 딱딱해지는 근육은 ‘하루 5분 근육 풀기’ 운동으로 얼마든지 아기의 말랑말랑한 근육으로 되돌아갈 수 있기 때문이다."
스티커 아트북 : 랜드마크,"베스트셀러 『스티커 아트북-네이처』 『스티커 아트북-명화』 붐을 잇는 네 번째 스티커북, 랜드마트 편. 전 세계의 명소 중 우리에게 익숙한 랜드마크 10가지를 한데 모았다. 손으로 스티커를 떼어내 붙이기만 하면 되므로 책을 펼칠 공간만 있다면 언제 어디서든 할 수 있으며, 지정된 번호에 맞추어 스티커를 붙이기만 하면 색색의 면들이 마치 모자이크처럼 맞춰지며 아름다운 작품이 완성된다.

전 세계적으로 유명한 명소나 익숙한 고대 유적부터 한 나라를 대표하는 건축물까지 랜드마크 10가지를 추려 폴리곤 아트로 표현했다. <파르테논 신전>, <스핑크스>같은 고대 유적들도 폴리곤 아트로 재해석했고 <광화문>, <에펠 탑>처럼 기와나 철탑 교유의 섬세함을 필요로 하는 경우에는 특정 부분만 스티커로 만들어 건축물의 완성도와 스티커 아트의 즐거움을 동시에 느낄 수 있다."
영양의 비밀,"EBS 다큐 프라임 〈맛의 배신〉 출연한 프레드 프로벤자 교수의 평생 연구가 담긴 영양과 건강의 바이블. 프로벤자 교수가 이끄는 연구진은 동물이 세포 단위에서부터 먹이의 맛을 느끼고 그에 따라 제각기 다르게 반응하는 정교한 시스템을 보유하고 있으며 이를 통해 구축된 영양학적인 지혜를 바탕으로 현재 몸의 영양 상태와 의학적인 필요도에 따라 어떤 음식을 얼마나 먹어야 하는지 판단한다고 밝혔다.

프로벤자 교수는 이 책에서 동물행동 연구에서 확인된 동물의 영양학적 지혜에 관한 이론을 확장시켜 인간의 음식 선택과 영양, 건강관리와의 연관성을 분석한다. 이와 함께 우리 몸과 정신의 건강을 좌우하는 영양 수준을 최상으로 만들고 유지할 수 있는 가장 효과적이고 효율적인 방법은 무엇인지 제시하고, 그와 같은 요건을 안정적으로 구축하기 위해 학계와 산업계, 정치계가 협력해야 할 사항을 짚어준다.

인체는 엄마 뱃속에서부터 꼭 필요한 영양 기억과 음식으로 얻을 수 있는 약효에 관한 기억이 발달할까? 영양학 분야의 ‘권위자’들이 제시한 지침은 인체가 알아서 필요한 영양을 확보할 수 있는 지혜를 빼앗은 건 아닐까? 프로벤자 교수는 자연과 사회, 경제 시스템이 끊임없이 변화하고 우리의 식생활에 막대한 영향을 주는 현 상황에서 올바른 영양 섭취와 건강관리에 관한 지식과 상식이 얼마나 왜곡되고 변형될 수 있는지 지적한다."
5분 컬러링북 : 플라워 컬러링,"우리가 일상에서 만나는 다채로운 꽃을 채색하는 컬러링북이다. 꽃 밑그림을 색색의 색연필로 채색하며 누구나 쉽게 꽃 컬러링을 즐길 수 있다. 특히 ‘누드 양장 제본’으로 제작되어 어느 페이지에서나 컬러링하기 쉽도록 쫙 펴진다.

기초적인 색연필 채색 기법과 50여 종의 꽃 컬러링 방법을 담고 있어, 꽃으로 즐기는 특별한 컬러링을 원하는 사람에게 즐거운 시간을 선사할 것이다. 저자의 친절한 설명과 다양한 꽃을 가득 담은 보기 그림을 통해 일상을 아름답게 채색해 보자. 쉽고 재미있는 드로잉 워크북 '5분 스케치' 시리즈와 함께 활용하면 스케치와 컬러링을 더욱 풍성하게 즐길 수 있다.

이 도서는 누드 양장 제본으로, 책등 부분이 노출된 디자인입니다."
"병 안 걸리는 식사법, 현미밥채식","MBC스페셜 <목숨 걸고 편식하다>, <편식으로 고혈압잡기>에 소개되어 센세이션을 일으킨 현미밥채식의 영양 가치와 섭취법, 질병 예방 및 치유효과를 알려주는 건강 지침서다. 저자인 황성수 박사는 건강을 위해 무엇을 먹고 무엇을 먹지 말아야 하는지, 현미밥채식이 사람의 몸에 어떤 기적을 만들어내며 동물성 식품이 왜 건강을 해치는지, 평생 현미밥채식을 즐기는 방법은 무엇인지에 대해 분명한 지침을 제공한다.

또한, 현미에는 어머니의 젖에 들어 있는 함유량과 비슷한 수준의 단백질이 들어 있고, 건강에 유익한 불포화지방산이 다량 함유되어 있으며, 피를 만드는 원료가 되는 탄수화물이 넉넉하게 들어 있다. 식생활습관병을 해결해주는 섬유질도 다량으로 포함되어 있고, 콜레스테롤은 전혀 들어 있지 않다. 동물성 식품을 끊고 현미밥채식을 하게 되면 혈관에 낀 기름때가 녹아내리고 점차 혈관의 탄력이 회복되어 잃었던 건강을 되찾고 유지하는 방법을 알려준다."
빨강 머리 앤 컬러링북,출간 6개월만에 10만 독자를 사로잡은 <더모던 감성 클래식 2 : 빨강 머리 앤> 그 기쁨과 감동과 재미가 고스란히 담긴 컬러링북이다. 큼직한 판형에 60컷이 넘는 그림이 ‘애니메이션 원화와 함께’ 들어 있어서 앤처럼 다정하고 따듯하게 상상하며 예쁘게 색칠해 볼 수 있다. 하얀 자작나무가 동그랗게 에워싼 낭만적인 ‘한적한 숲’으로 앤과 다이애나와 함께 떠나는 신나는 소풍 같은 책이다.
프랑스자수 스티치 200,"일본 보그사의 기초 BOOK 시리즈로 유럽 자수를 중심으로 200 종류의 자수 테크닉을 자세하게 설명하고 있다. 파트1에서는 기본 스티치 116가지와 변형 14가지를 알려주고, 파트2에서는 리본 자수, 비즈 자수, 아플리케 등 자수 테크닉을 다루었다.

본문 곳곳에 작은 스티치 작품과 큰 스티치 작품을 배치하였고 도안을 함께 제공하여 본문에 실린 작품을 직접 수놓을 수 있도록 하였다. 그리고, 스티치 순서가 한땀 한땀 번호로 기재되어 있어서 그림을 보면서 쉽게 따라할 수 있다."
기적의 3분 시력운동 달력,"나빠진 시력은 회복되기 어렵다는 게 일반적인 생각이었지만, 저자인 의학박사 히비노 사와코는 눈 주변의 근육을 꾸준히 자극해주고 단련해주면 충분히 시력이 회복될 수 있다고 말한다. 이러한 원리를 이용하여 저자는 달력처럼 책상 위에 올려놓거나 벽에 걸어놓고 매일매일 1장씩 넘기며 시력운동을 따라할 수 있도록 ‘스탠드형 스프링북’으로 구성한 《기적의 3분 시력운동 달력》을 출간했다. 이 책은 출간 즉시 일본에서 뜨거운 반응을 일으키며 40주 연속 베스트셀러를 기록, 17만 부 이상의 판매부수를 기록하며 현재 건강 실용 분야 스테디셀러로 자리 잡았다.

책상에 오래 앉아 있는 학생과 직장인, 그리고 바쁜 현대인을 위해 안경과 수술 없이도 하루 3분만 투자하여 언제 어디서나 할 수 있는 간단한 시력운동 달력이다. 매일 아침, 점심, 저녁, 하루 세 번씩 눈 운동을 따라하면 시력 향상은 물론이고 근시, 원시, 스마트폰 노안, 안구건조증까지 개선되는 효과를 기대할 수 있다. 눈에 좋은 습관과 음식 등 눈 건강과 관련 있는 건강 정보도 함께 넣어 일상생활에서 이를 실천할 수 있도록 돕는다."
시크릿! 건강 핸드북,"건강의 핵심 원리를 단 10강으로 압축해 누구나 이해하기 쉽게 만들었다. 인체와 자연치유력에 대해 전반적으로 소개를 하고 있으며 노화와 질병의 원리를 밝히며, ‘최고의 식단’을 위한 상세한 정보를 제공한다. 또한 면역력에서도 제일 중요한 장 건강을 다루고, 요요 없는 다이어트법 등을 알려준다."
면역 혁명,"어떻게 해야 면역력을 높일 수 있을까? 이시형 박사는 일단 자신의 면역력이 어느 정도인지 점검해보라고 권한다. 다만 현대의 의학 기술로 면역력을 직접적으로 측정하기란 쉽지 않은 점을 염두에 두어야 한다. 면역력은 정신계, 신경계, 내분비계, 면역계 등 인체 내 4대 시스템이 따로 또 같이 협동과 조화를 이루며 만들어내는 전체적인 시스템(total system)이기 때문이다.

개개의 부품을 조사한다고 그 기기 전체의 기능을 측정할 수 없는 것처럼 어느 한 기관의 기능만 점검해서는 면역력 전체를 알 수 없다. 다만 간단한 혈액 검사로 할 수 있는 백혈구 분획검사 혹은 이 책에도 실려 있는 장력(腸力), 유산균력, 스트레스에 대한 정신력 체크리스트 등 면역력의 단편들이나마 파악해볼 수 있는 방법들이 있으니 이를 활용해 자신의 면역력부터 점검해보자."
코바늘 손뜨개,"코바늘 손뜨개를 처음 시작하는 초보자도 따라할 수 있도록 두터운 레이스 실과 가는 손뜨개 실을 사용하여 쉽고 빠르게 다양한 생활 속 소품을 완성하는 방법을 소개한다. 작은 컵 받침을 시작으로 기성복에 코바늘 레이스 장식을 붙여 완성하는 리폼(reform) 아이템 등 일상에서 자주 사용하는 소품을 중심으로 구성했다.

가장 기본적인 코바늘 모티브 뜨는 방법을 먼저 알려준다. 모티브는 하나의 문양이나 무늬를 이루는 코바늘 손뜨개의 가장 기본적인 단위로써, 이런 작은 모티브들은 도일리나 티 코스터 등 그 자체만으로도 멋진 코바늘 소품이 될 수 있다. 그 다음 모티브를 연결시키는 다양한 방법을 알려주면서 테이블 매트나 쿠션 커버 같은 리빙 소품과 가방과 숄, 헤어밴드, 스카프 등의 패션 소품 만드는 법을 알려준다."
종합 한글 펜글씨 교본,"기초부터 체계적으로 습득하는 한글 펜글씨 교본이. 모사를 통한 기본 자획 연습과 별도의 연습란을 마련하였으며, 자체별의 개별 숙련쓰기가 가능하다. 부록으로 중요 구 쓰기, 전국 시ㆍ도명 쓰기, 아라비아 숫자 필법, 전보 발신지 쓰는 법, 원고지 쓰기, 이력서 쓰기가 실려 있다."
"아무튼, 요가","뉴욕에 도착하면 당장 적응해 취직할 줄 알았는데, 막상 영어학원에 가는 것 외에는 할 수 있는 것이 없었다. 시간만 많고 돈이 없어 무엇을 할지 모르겠다는 푸념에 친구가 5불만 내면 되는 요가원이 있으니 한번 가보자고 한다. 그렇게 뉴욕에서 얼떨결에 요가를 시작해 점점 진지해진 이야기.

급기야 보통 사람들이 경험하기 힘든 단계의 무아를 경험하고는 이런 경험을 한 데에는 어떤 우주의 뜻이 있는 것은 아닌가, 초능력이 생긴 건 아닌가 혼란스럽기도 했던 이야기. 아무튼 시리즈 스물한 번째 이야기는 뉴욕에 사는 요기(yogi)의 이야기다."
케토채식,"제대로 건강해지고 싶은 사람들을 위한 안내서이다. 체중을 감량하고 염증을 가라앉히며 활력이 넘치는 몸이 되기 위해 먹어야 할 것과 먹지 말아야 할 것을 구분해 건강한 식사를 할 수 있도록 도와준다. 저자 닥터 윌 콜은 전 세계 수천 명의 환자를 치료하며 맛있는 음식을 약으로 활용하는 방법을 깨달았고, 그 내용을 고스란히 이 책에 담았다.

하루 세끼, 총 4주의 추천 식단표를 삽입해 누구나 쉽게 실천할 수 있게 도와준다. 총 칼로리의 60~75%를 지방, 15~30%를 단백질, 5~15%를 탄수화물로 구성한 영양 가득한 메뉴로, 이대로 따라하면 어렵지 않게 성공할 수 있다. 취향에 따라 메뉴를 빼거나 추가해도 좋으며 간헐적 단식을 포함시켜 나만의 식단표를 만들 수도 있다."
종이접기 매니아를 위한 Origami PRO : 고대생물 종이접기편,"종이접기 매니아를 위한 Origami PRO 시리즈. 동물이라는 주제를 좀 더 넓게 확장 시켜 고대생물-종이접기편으로 기획을 하였으며 기존 작가들 외에 박종우, 한지우 작가의 참여로 책의 완성도를 더욱 높였다. 고대의 생물들은 고생대-삽엽충과 갑주어, 중생대-공룡과 시조새, 신생대-조류와 매머드등 매우 다양한 생물이 살았고 흥미로운 분야이기에 이번 책에는 각 시대의 생물들을 포괄적으로 담아낼 수 있도록 했다."
숙면의 모든 것,"베스트셀러 《스탠퍼드식 최고의 수면법》의 저자, 스탠퍼드 대학교 니시노 세이지 교수가 알려주는 올바른 수면 상식과 습관. 전작을 통해 수면의 중요성과 어떻게 잘 것인가에 관해 이야기했다면, 이번 책을 통해 단순히 잠을 자는 것 이상으로 제대로 된 수면 습관을 들일 수 있길 바라며 제목을 ‘숙면하는 습관’이라 지었다. 이 책은 잘못된 수면 상식을 바로잡으며 어떻게 해야 수면 부채를 줄이고 숙면하는 습관을 만들 수 있을지 고심한 끝에 8장으로 나누어 다양한 상황별 수면 습관을 제시하고 있다.

또한 일반 성인을 위한 올바른 수면 습관은 물론이거니와 직장인, 학생, 노약자 등 개인에 맞춘 수면 습관도 제시한다. 남녀노소, 맥락과 상황에 따라 나누어 제시하는 수면 습관을 자신의 상황에 맞춰 취할 수 있게 구성하였다. 수면 부채에 대한 개념을 세세히 알려주고 있으며, 수면장애의 종류와 증상을 담아 수면장애에 대한 지식과 이해를 얻을 수 있도록 돕고 있다."
기억력을 지켜주는 컬러링북 : 보통 난이도,"노년층의 눈높이에 맞춘 인지 활동 프로그램 개발이 한창이다. 인지 훈련은 집중력과 기억력이 더 나빠지지 않게 하는 것이 목적이다. 생각하고, 기억하고, 말하고, 판단하고, 실행하는 모든 뇌 기능을 유지하고 향상시켜 안정적으로 살아가게 도우려는 것이다. 하지만 흔히 보는 실버 대상 교재들은 내용과 형식 모두 어린이용 학습지와 다를 게 없다.

어르신을 위한 교재는 노인의 시력과 둔한 손놀림을 고려해 난이도를 조정하고, 일상생활과 직결되는 두뇌 활동을 유도해야 한다. 지난 시간, 좋은 기억을 떠올리게 하는 소재로 건강하게 기억력을 자극하고, 집중력이 약해지는 노인들의 두뇌 활동을 활성화하는 기능에 충실해야 한다. 뇌의 인식과 자유로운 손놀림이 직결되는 컬러링은 맑은 정신을 지키고 싶은 노년부터 경증 치매 환자까지 폭넓게 사용되는 유익한 훈련법이다.

이에 발맞춰 미술 교육을 전공한 미술 치료 전문가와 어르신 문화 예술 활동 전문가, 일본 노인 복지 정책 전문가이자 사회복지학과 교수인 저자가 힘을 합쳤다. 노인을 위한 교재는 기능과 효과는 물론이고 디자인과 품격 면에서도 취향과 자존심, 성취감을 지켜드리는 것 역시 매우 중요하다."
축구를 하며 생각한 것들 (리커버 에디션),"한국을 넘어 아시아 역대 최고의 축구선수가 누구인지 묻는다면 반드시 첫 손에 꼽힐 선수는 '손세이셔널' 손흥민일 것이다. 지칠 줄 모르는 득점포와 수비수들을 무력화시키는 압도적 플레이로 젊은 나이에 이미 전 세계에 이름을 각인시킨 손흥민은 축구 실력뿐만 아니라 통통 튀는 매력과 뛰어난 패션 감각으로 늘 화제의 중심에 오르는 슈퍼스타이다.

그러나 그런 가운데서도 천진난만한 웃음을 잃지 않는 순수한 스물일곱 살 청년이기도 하다. 손흥민의 첫 번째 에세이 <축구를 하며 생각한 것들>은 그 동안 우리가 쉽게 접할 수 없었던 '인간' 손흥민의 목소리를, 소소하고 담담한 기억과 생각들을 진솔하게 꾹꾹 눌러 담았다.

어린 시절부터 제도권 축구 교육에 얽매이지 않는 지도자인 아버지 아래서 받았던 혹독한 훈련들, 함부르크-레버쿠젠-런던으로 이어지는 오랜 타향살이를 이겨내고 가는 팀마다 에이스 자리를 차지했던 인고의 시간들, 그리고 그를 만든 주변 사람들과 토트넘, 국가대표 축구팀에서 겪고 느낀 개인적인 에피소드들까지, 화려한 스포트라이트에 가려진 손흥민의 진짜 이야기를 만나 보자."
