title,summary
-10KG 밀가루 단식,"SNS와 온라인상에서 무섭게 퍼지고 있는 밀가루 단식 챌린지의 주인공인 ‘선녀’의 처음 100일 동안의 도전을 책으로 엮었다. 지금까지 여러 건강 관련 매체와 전문가들은 우리를 늙게 하고 병들게 하는 주요 요인으로 밀가루의 과다 섭취를 꼽아왔다.

밀가루는 고탄수화물 식품으로, 섭취 시 혈당을 순간적으로 빠르게 높이고 체내에도 더 빠르게 흡수된다. 그렇다보니 먹어도 계속해서 밀가루 음식이 당기는데, 결과적으로 비만에 이르게 만든다. 살이 찌는데서 그치는 게 아니다. 높아진 혈당으로 체내 인슐린 분비도 정상치보다 과하게 늘어나는데 이게 온갖 말썽을 부린다. 대부분의 건강 문제는 여기에서 출발한다.

이 책은 저자의 100일간의 도전을 1일부터 100일까지 일별로 묶은 책이다. 단순히 밀가루만 끊은 게 아니라 몸을 아예 리셋해버리기 위해 디톡스를 위한 다이어트까지 감행한 100일이다. 건강에 좋은 채소와 단백질 식품을 위주로 하되, 식단 준비가 힘들어 다이어트를 중도 포기하는 일이 없도록 시판 제품을 적극적으로 활용한 식단을 소개한다.

식단에 포함된 모든 시판제품들은 저자가 실제 100일간 섭취했던 제품을 그대로 담은 것이다. 딱 한 번 준비해 일주일 내내 쟁여두고 먹는 밀프렙 다이어트로 밀가루를 제대로 끊고 몸을 완전히 리셋할 수 있는 저자의 진짜 기록을 그대로 담았다."
백년 허리 2 : 치료편,"서울대 의대 재활의학과 정선근 교수의 스테디셀러인 백년허리1 진단편에 이은 실제적인 치료 방법을 제시하고 있는 백년허리2 치료편이다. 치료편에서 저자는 허리 통증에서 벗어날 수 있는 방법을 정확히, 구체적으로, 누구나 따라할 수 있도록 설명하고 있다. 일상생활, 운동, 작업 등 허리 아픈 사람이 겪게 되는 모든 상황에서 허리를 어떻게 사용하는 것이 옳은지를 알려준다."
백년 허리 1 : 진단편,"서울대 의대 재활의학과 정선근 교수의 스테디셀러인 '백년허리'의 개정증보판이다. 백년허리의 초판에서 고쳐야 할 부분을 대거 보충 하였을 뿐 아니라, 허리 통증은 진화의 축복이라는 요통에 대한 새로운 관점을 제시하고 있다. 요통이 축복이라는 관점은 통증에 대한 올바른 해석이 선행 되어야 한다. 저자는 독자 스스로가 그 해결책의 실마리를 찾을 수 있도록 하는 것이 집필의 목적이라고 하고 있다. 개정증보판의 1권 1장부터 7장까지는 허리 통증을 어떻게 해석해야 할지에 관한 내용을 담았다."
백년운동,"서울대 의대 재활의학과 정선근 교수가 새로운 책, ‘백년운동’을 통해서 100세 인생을 건강하고 멋지게 살고 싶은 이들에게 그 방법을 의학적으로 제시한다. 건강분야 스테디셀러인 ‘ 백년허리’ , ‘백년 목’이 허리와 목디스크 질환에 대한 새로운 치료법을 대중에게 제시한 책이라면, ‘백년운동’은 관절과 척추를 보호하면서 안전하게 운동할 수 있는 운동방법을 제시한 책이다.

사람들은 척추, 관절이 아프거나, 중년 이후 노화가 시작되면, 운동의 딜레마에 빠지게 된다. 건강에 좋은 운동을 하고 싶어도 자칫, 섣부른 운동이 몸의 회복 상태를 더 악화시키거나 부상을 동반할 수 있다는 두려움에 빠져 이러지도 저러지도 못하는 고민을 하게 되는 것이다. 그런 사람들의 고민을 해결하기 위해서 저자는 임상 경험과 연구를 토대로 방법을 제시하고 있다."
맛있고 배부른 다노 다이어트 레시피,"국내 대표 다이어트 브랜드 다노DANO에서 누적 150만 명의 팔로워들과 나눈 레시피들을 집대성한 최초의 레시피북. 8년간 15만 명 이상의 식습관을 1:1로 코칭해 온 식습관 성형 노하우와 다노만의 과학적인 영양 구성 룰을 따라 요리 초보도 단시간에 쉽고 맛있게 만들어낼 수 있는 최적의 레시피만을 엄선했다.

소문난 식단 맛집 다노의 명성에 걸맞게 과식한 다음 날, 운동 후, 치팅 데이, 디저트까지 다이어터가 가장 많이 직면하는 4가지 상황별에 맞게 골라 먹을 수 있도록 구성한 것이 이 책의 특징이다. 누구나 냉장고 사정에 맞춰 집밥을 대신할 수 있도록 한식 기반으로 메뉴를 구성했다.

또한 다이어트식은 맛없고 배고프다는 편견을 단번에 깨는 떡볶이, 피자, 스테이크, 멘보샤, 반세오 등 군침 도는 고칼로리 대체 메뉴도 다수 수록해 다이어터들이 원하는 모든 것이 담긴 레시피북을 완성시켰다. 상세한 과정컷과 설명, 먹음직스러운 사진으로 이해를 돕고 소장 가치도 높였다."
잠시 먹기를 멈추면,"세계적 명성의 비만 전문의 제이슨 펑과 저탄수화물 식단 전문가 메건 라모스 그리고 이들의 프로그램을 통해 삶을 바꾸는 기적을 경험한 평생 다이어터 이브 메이어가 단식 앞에서 머뭇거리는 사람들을 위해 각자의 전문가적 시각에서 명쾌한 해법을 제시하는 균형 잡힌 안내서를 출간했다. 이 책은 간헐적 단식의 과학적 원리, 먹어야 할 음식과 피해야 할 음식, 생활 속 딜레마와 단식의 심리학에 이르기까지, 쉽고 안전한 단식의 모든 것을 친절히 알려준다.

《잠시 먹기를 멈추면》에서 저자들은 단식이란 단순히 ‘원하는 건강을 얻기 위해 식사 간격을 벌리는 것’뿐이라고 말한다. 16/8 단식(8시간 동안만 먹고, 16시간 동안 단식), 24시간 단식(1일1식), 36시간 단식(전일 단식), EF(Extended Fast:3일 이상의 장기단식) 등 다양한 단식법이 있지만, 결국 모든 단식의 진정한 의미는 ‘덜 자주 먹는 것’이다. 저자들은 단식 라이프스타일을 성공적으로 이어나가기 위해서는 복잡하고 엄격한 방식보다는 최대한 단순하고 ‘게으른 단식(덜 자주 먹는 것)’으로 접근하라고 조언한다.

이렇게 잠시 먹기를 멈추고 식사와 다음 식사 사이의 간격을 벌리면, 우리는 음식 중독에서 벗어나 체중과 전반적인 건강을 멋지게 리부팅할 수 있게 된다. 《잠시 먹기를 멈추면》은 단식으로 건강과 행복 그리고 자기 가치에 대한 관점까지도 바꿀 수 있음을, 삶이 축제로 바뀌는 마법이 바로 간헐적 단식에 있음을 말한다."
서트푸드 다이어트,"서트푸드 다이어트는 먹고 싶은 것을 참지 않아도 되고, 운동하지 않아도 되며, 요요현상을 걱정할 필요도 없는 획기적인 다이어트다. 어떻게 이런 일이 가능할까? 서트푸드 다이어트는 우리 몸에 존재하는 살 빼는 유전자인 ‘서트인 유전자’를 활성화하는 ‘서트푸드’를 섭취함으로써 살을 빼는 것은 물론 궁극적으로 우리 몸을 영원히 살찌지 않는 몸으로 만들어 주는 다이어트다.

이 책의 저자 에이든과 글렌은 모두 영양의학 전문가로, 먹는 것을 극단적으로 제한하는 다이어트는 실패할 확률도 높을뿐더러 건강을 해치기 때문에 오래 할 수 없다고 판단했다. 그래서 영양은 풍부하면서도 지방만 태우는 효과를 가진 ‘서트인 유전자’에 주목했다. 이 책에서 언급하는 ‘서트푸드’는 이 ‘서트인 유전자’를 활성화하는 식품으로, 코코아, 커피, 녹차, 적포도주, 딸기, 호두, 케일, 자색 양파, 콩 등과 같이 우리 주변에서 쉽게 구할 수 있는 식품들로 구성되어 있다.

서트푸드 다이어트의 방식은 이렇다. 첫 일주일은 서트푸드로 만든 주스와 식사를 하여 평균 3.2kg를 감량한다. 이후부터는 자신이 먹고 싶은 요리를 만들어 먹되 서트푸드를 가미한 식단을 유지하면 된다. 이렇게 식사량을 줄이지 않으면서도 간단하게 실천할 수 있다는 장점 때문에 성공 확률이 대단히 높은 다이어트로 전 세계 셀럽들과 일반인들로부터 각광을 받고 있다."
미꽃체 손글씨 노트,"온라인 클래스 인기 강사 ‘미꽃’의 손글씨 워크북. 작가는 독학으로 시작한 손글씨 연습을 통해 예쁜 글씨와 악필 교정 효과로 입소문이 나면서 온라인 클래스 1개월 약 4만 명 추천, 수강생 4천5백 명을 돌파하며 손글씨 최고 인기 강사가 되었다. 포브스 선정 “가장 인쇄체에 가까운 글씨체 유튜버”인 작가는, 직접 만든 바르고 예쁜 손글씨 ‘미꽃체’ 쓰는 법을 정리해 이 책 《미꽃체 손글씨 노트》에서 소개한다.

‘기초 마스트 클래스’에서는 기본 선 긋기와 이응 쓰기, ‘가나다’ 쓰기부터 받침 없는 글자와 받침 있는 글자 쓰기 등 기본기를 다지는 훈련을 한다. 그다음 일상에서 메모나 카드, 손편지를 잘 쓸 수 있도록 일상 글귀와 짧은 문장을 써보는 ‘중급 마스터 클래스’, 한 편의 시와 같은 장문을 써보는 ‘고급 마스터 클래스’를 완료하면 알파벳 쓰기와 줄 노트, 무지 노트, 세로쓰기 등에 도전할 수 있는 ‘응용 마스터 클래스’로 마무리된다."
맛있게 살 빠지는 고단백 저탄수화물 다이어트 레시피,"30만 명이 선택한 최강 다이어터이며 베스트셀러 ‘고단백 저탄수화물 다이어트 레시피’ 시리즈 저자, 미니 박지우의 최신작. 밍밍한 다이어트식에 지친 다이어터를 위해 속세음식 못지않게 맛이 폭발하는 다이어트 요리를 담았다. 입맛 따라 취향 따라 골라 먹을 수 있는 101가지 레시피는 치팅데이가 따로 필요 없을 정도로 매 끼니가 치팅데이처럼 맛있다.

미니표 다이어트 요리는 간단하기로 유명하다. 요리 왕초보인 다이어터도 “미니의 레시피는 요리했다고 말하기 민망할 정도로 정말 쉽다.”고 평가할 만큼 조리법이 단순하다. 이번에도 초간단 레시피의 장점을 극대화해 재료를 썰고 가열하면 완성되는 10분 완성 요리가 대부분이다. 수많은 팔로워의 다이어트를 성공으로 이끈 새로운 요리, 쿠킹클래스 최고 인기 메뉴를 더 빠르고 쉽게, 맛깔나게 다듬어 수록했다.

그중 재료를 가위로 쓱쓱 잘라 프라이팬이나 전자레인지에 넣고 가열하면 완성되는 원팬 요리, 전자레인지 요리는 모든 다이어터에게 추천하고 싶을 만큼 간단하다. 이외에도 전 세계 집밥, 밀프렙, 도시락, 간식 등 조리법은 더욱 심플해지고 종류는 다양해진 요리들이 초보자에게는 자신감을 심어주고, 다이어트를 지속적으로 실천 가능하게 이끈다."
핏블리의 헬스 다이어트 전략집,"핏블리가 알려주는 생리학·영영학 기반 운동 전략 가이드. 저자 핏블리는 유튜브 80만 구독자가 믿고 보는 국제 트레이너 겸 스포츠 영양 코치다. 수많은 사람들이 다이어트, 몸만들기, 근육 증가 등 다양한 목적으로 저자를 찾지만 매번 그가 강조하는 건 똑같다. 운동을 시작하기 전에 영양 섭취와 근성장 원리를 알아야 한다는 것. 약간의 생리학과 영양학 이론만 알아도 스스로 몸을 관리하고 운동 목적을 효율적으로 달성할 수 있기 때문이다.

시중에 운동 전문서와 연구 자료가 넘치지만 운동을 좋아하는 사람들이 읽기에는 내용이 어렵고 방대하다. 그래서 이 책은 저자가 헬스장과 유튜브 채널을 운영하며 가장 많이 받은 질문 위주로 구성했다. 헬스와 다이어트 할 때 알아야 할 기초 생리학과 영양학부터 실전 근육 운동 전략까지 담았다. 운동 전공자와 전문가가 아닌, 운동을 좋아하는 사람이라면 누구나 쉽게 이해할 수 있다."
코코지니의 친절한 원피스 교실,"원피스를 만드는 과정에 대해 누구보다 쉽게, 조목조목 알려 주는 핸드메이드 옷 만들기 기본서이다. 옷 만들기 과정을 몸판, 소매, 목둘레, 밑단 등으로 세분하여 각 부분의 다양한 디자인을 소개하고 이에 대한 봉제법을 사진과 영상으로 상세히 설명했다. 각 부분의 봉제법이 모듈화되어 있으므로 옷을 몇 가지 만들어 보며 기본기에 익숙해지면, 여러 모듈을 조합하여 다양한 디자인의 옷을 만들 수 있게 된다.

많은 사랑을 받았던 전작 [코코지니의 친절한 재봉틀 교실]이 실용적이고 예쁜 패브릭 소품 만들기 책이었다면, 이번 책에서는 심플하고 편한 원피스 만드는 방법을 쉽게 알려 준다. 혹시 어렵더라도 책에 수록된 QR 코드를 스캔하면 상세하게 설명된 영상으로 바로 연결된다. 게다가 Part 3에서 소개한 원피스 및 일상복 총 19가지의 실물 패턴도 수록되어 있어 현장 강의가 부럽지 않은 책이 될 것이다."
골프에 미치다,"골프를 시작하는 사람에게는 정확하면서도 쉬운 이해를 돕고, 중급자들은 오랫동안 해결하지 못했던 숙제를 풀어내는 데 도움을 주고자 했다. 일반적으로 아마추어들이 어려움을 느끼는 부분을 Q&A 방식으로 서술했다. 책의 내용을 읽으면서 큐알코드를 스캔해서 동영상을 같이 보면 이해하기가 훨씬 쉬울 것이다."
천재의 식단,"전 세계 명망 있는 의사, 영양학자, 생물학자, 신경학자 등의 극찬을 받으며 출간 즉시 아마존 건강 분야 베스트셀러 1위에 오른 이 책 《천재의 식단》의 저자 맥스 루가비어는 “문제는 음식”에 있다고 단언한다. 매일 우리의 식탁 위를 채우는 나쁜 음식들이 노화를 촉진하고, 염증을 일으키고, 살을 찌우고, 인지 기능을 떨어뜨린다는 것이다.

과거 최상의 두뇌를 만들 수 있었던 완벽한 식품이 현대사회에 이르러 형편없는 식품들로 대체되면서 염증, 비만, 우울증을 비롯해 알츠하이머병과 파킨슨병 같은 퇴행성 신경질환을 일으킨다는 사실을 밝혀낸 맥스는 존스홉킨스 대학교에서 신경과학을 전공한 내과 전문의 폴 그레왈 박사와 함께 10년 동안 발로 뛰며 찾아낸 방대한 연구결과를 명쾌하게 정리했다.

그는 이 책을 통해 음식이 두뇌에 미치는 영향을 면밀하게 분석해냈음은 물론이고 뇌 기능을 최상으로 유지하는 데 효과적인 이른바 ‘지니어스 푸드’ 10가지를 공개한다. 나아가 최적의 컨디션을 만들기 위한 생활습관인 ‘지니어스 4주 플랜’을 제시함으로써 누구나 쉽고 간단하게 건강하고 행복한 삶을 꾸려나갈 수 있도록 강력하고 명확한 지침을 소개한다."
조현병의 모든 것,"정신의학자이자 조현병 연구의 대가 E. 풀러 토리가 조현병의 원인, 진단과 증상, 치료와 경과, 예후에 관한 최신 정보를 총망라한, 조현병 환자와 가족을 위한 안내서. 1983년 미국에서 처음 출간, 지금까지 7판을 거듭하며 누적 50만 부가 팔린 이 책은 지금까지 수많은 환자와 가족, 정신건강 전문가에게 도움을 주어 조현병에 관한 명실상부한 지침서라는 찬사를 받아왔다.

이 책의 원제는 ‘조현병에서 생존하기Surviving Schizophrenia’다. 조현병에 걸린 여동생을 둔, 조현병 환자의 가족이기도 한 저자는 이 책에서 입원 치료와 좋은 의사 찾는 법(6장), 항정신병약물의 종류와 구체적인 치료 계획(7장), 재활 치료(8장), 조현병의 10대 주요 문제(10장), 환자와 가족이 가져야 할 올바른 태도와 생존 전략(11장), 도움이 될 옹호 단체와 피해야 할 단체(15장) 등 조현병 환자와 가족들이 비난과 수치로 인한 재앙에서 살아남을 수 있도록 구체적인 정보와 실질적인 방법들을 소개한다."
크툴루의 부름 : 수호자 룰북,"크툴루의 부름은 H.P. 러브크래프트의 세계를 다루는 테이블 롤플레잉 게임이다. 크툴루의 부름에는 비밀, 수수께끼, 공포가 가득하다. 여러분은 용감한 탐사자가 되어 기이하고 위험한 곳들을 가고, 흉악한 음모를 밝혀내고, 크툴루 신화의 공포들에 맞선다.

이 책은 핵심 룰, 배경 정보, 지침, 주문, 괴물이 담긴 수호자 룰북이다. 다른 플레이어들에게 모험을 제시할 비밀지식의 수호자 (수호자)가 사용하게 되어 있다. 이 책이 적어도 한 권은 있어야 크툴루의 부름을 플레이할 수 있다. 다른 플레이어들, 즉 탐사자들은 탐사자 핸드북을 한 권 이상 갖고 있을 것을 권한다. 탐사자 핸드북에는 캐릭터 제작, 기능, 직업, 장비 등등에 관한 추가 자료가 포함되어 있다."
환자 혁명,"현직 의사가 기존의 의료 상식에 반기를 들면서 ‘약과 병원에 의존하지 말고 건강 주권을 회복하라’고 주장한다. ‘응급처치와 성형이 아닌 이상, 현대인의 질환 중 대부분을 차지하는 성인병 치료 성공의 열쇠는 어디까지나 환자 자신에게 달려 있다’고 강조한다. 병명은 있지만 원인이 없는, 혹은 원인을 간과하는 현대 의학의 패러다임에서 벗어나, 미국 기능의학이 주장하는 2차 소견을 제시한다.

환자라는 존재를 관중석의 구경꾼에서 필드의 플레이어로 역할을 바꾸어 준다. 의료와 질병 치료에 관한 한 수동적인 존재로서, 치료의 결과를 운에 맡기는 것에만 익숙했던 환자들을 질병 치료에 능동적으로 참여하는 존재로 이끌어내는 놀라운 힘을 갖고 있다고 말한다. 만성적인 대사질환을 이겨낼 수 있다는 희망을 선사하는 것에 그치지 않고 실질적인 정보를 제공한다."
미라클 브레인 푸드,"뇌와 장의 아주 복잡미묘한 관계에 대한 설명과 함께 정신 건강을 심리학과 영양학, 장 건강의 관점에서 집대성한 최초의 안내서다. 여전히 많은 이들이 정신 질환을 다루기 위해 약물과 심리 치료에 의존하고 있다. 물론 적절한 약물의 중요성을 폄하하려는 것은 아니다. 하지만 오늘날 정신 건강에 관한 논의에서 배제되고 있는 진실은 매우 단순하다. 바로 우리가 먹는 음식이 약물만큼이나 뇌에 깊은 영향을 미칠 수 있다는 것이다.

우마 나이두 박사는 하버드 의대를 졸업한 뒤 코넬 대학교에서 영양학을 공부하고 요리에 대한 관심으로 케임브리지 조리 기술 학교에 진학해 전문 셰프로 졸업한 독특한 이력의 심리학자다. 우마 나이두 박사는 첫 저서인 《미라클 브레인 푸드》에서 600여 개에 달하는 다양한 의·과학적 최신 연구와 직접 진행한 다양한 상담 사례를 바탕으로 음식이 정신 건강에 기여하는 방식을 설득력 있게 소개했다."
바른연애 길잡이 컬러링북,"죽은 연애 세포도 살려낸다는 인기 로맨스 웹툰 '바른연애 길잡이'의 명장면 52컷을 담은 컬러링북이다. 정파고 바름이와 츤데레 유연이의 첫 만남, 유연이의 애틋한 고백, 바름이와 유연이의 데이트 등 모두의 로망을 충족시켜 줄 달달하고 말랑말랑한 장면을 색칠해 보며 주인공들의 감정을 음미해 볼 수 있다. 왼쪽에는 웹툰 원화를 제공해 채색 시 참고할 수 있도록 했으며, 180도로 쫙 펼쳐지는 특수 제본으로 보다 편하게 컬러링북을 즐길 수 있다."
펠덴크라이스의 ATM,"수천 명의 사람들이 펠덴크라이스 메소드를 통해 건강을 회복하고 감각인지를 높일 수 있었다. 『ATM』은 오랜 시간 베스트셀러가 되었던 책이며, 어떤 연령대의 사람이라도 여기서 제시한 방법을 통해 육체적, 정신적 통합을 이루는 법을 익혀 새롭고 활기찬 삶을 누릴 수 있다. 펠덴크라이스는 현대인들에게 건강한 몸에 건강한 정신을 유지하고 평생을 살아갈 수 있게 해주는 실용적인 프로그램을 제공한다.

이 책에는 자세를 바르게 하고, 눈을 협응시키며, 상상력을 동원해서 할 수 있는 12레슨이 제시되어 있다. 또한 더 나은 습관을 형성하면서 새로운 차원의 인지를 계발시키는 방법뿐만 아니라, 자기이미지를 개선시키고 나아가 인간의 잠재력을 일깨우는 원리까지 담겨있다.

소마틱스, 자세교정, 바른자세, 내몸사용설명서, 체형교정"
노화의 종말,"노화와 유전 분야 세계 최고 권위자 데이비드 싱클레어 박사가 25년 장수 연구를 집대성해 최초로 공개하는 역작이다. 자신의 하버드 의대 연구실뿐 아니라 세계 각지의 연구자와 연구실에서 이루어져 온 주요 최신 성과를 총망라한 이 책은 수명과 장수, 인간과 생명의 패러다임까지 뒤집는 충격적인 사실과 비밀을 담고 있다.

우리는 노화를 삶의 불가피한 일부, 자연스러운 과정으로 받아들인다. 그래서 늙어 감을 부정하는 것은 자연을 거스르는 일, 인간 본성과 도리에 어긋나는 짓이라고 여긴다. 하지만 저자는 이 모든 생각이 틀렸다고 말한다. ""노화는 정상이 아니라 질병이며, 이 병은 치료 가능하다""는 것이다. ""지연하고 중단하고 역전시킬 수"" 있으며 ""노화만 해결하면 모든 장애와 질병에서 벗어나 누구나 건강한 장수를 누릴 수 있다""는 것이다.

저자는 40억 년 진화의 역사와 최신 유전학, 후성유전학, 의학, 과학에 근거해 노화의 단 한 가지 근본 원인을 밝혀낸다. 또 장수 유전자와 항노화제, 장수 약물에서부터 노화 예방 백신과 세포 재프로그래밍, 생체표지추적, 맞춤 장기 생산 등 최신 의료 기법, 저아미노산 식단과 저온 노출, 고강도 인터벌 트레이닝 등 라이프스타일 개선법까지 일상 생활습관과 최첨단 과학 의료 기술을 망라하는 놀랍고 획기적인 장수의 비법들을 공개한다."
건강 불균형 바로잡기,"세계적으로 인정받는 식이요법의 권위자 닐 바너드 박사가 제시하는 우리 몸 건강 되찾기 프로젝트. 바너드 박사는 우리가 먹는 음식을 통해 체내의 호르몬을 통제할 수 있다는 사실을 밝힌다. 이는 호르몬이 일으키는 건강 문제들도 마찬가지로 통제할 수 있다는 사실을 뜻한다. 인체의 호르몬 시스템은 음식에 민감하게 반응한다.

바너드 박사는 다양한 호르몬 관련 질환이 음식을 현명하게 골라 먹는 것만으로도 예상을 뛰어넘는 긍정적 변화를 보여줄 수 있음을 실질적 사례를 통해 보여준다. 특히 식이요법의 놀랄 만한 특징은 효과가 엄청나게 빠르다는 것이다. 생리통, 불임, 생식 능력, 만성피로, 비만, 우울증, 여드름 등 호르몬 불균형으로 인해 생긴 각종 질환이 순식간에 해결되는 모습을 각종 사례를 통해 전한다."
백년 목,"2016년을 휩쓴 건강 베스트셀러『백년 허리』 후속작으로, 전작에서 소개한 허리와 목 디스크에 대한 의 · 과학 논의를 심화 발전시켜 소개한다. 목과 허리 디스크가 발생하는 원인, 목과 허리 디스크 손상으로 발생하는 방사통과 연관통의 메커니즘, 목 디스크와 허리 디스크 구조의 해부학적, 재활 의학적, 진화적 연관성, 목과 허리 디스크의 문제를 해결하기 위해 노력해 온 의학계의 논쟁과 연구 성과 등을 들려준다.

1, 2, 3장은 목 디스크가 손상되는 이유를 설명하고 4, 5, 6장은 목 디스크 병의 증상에 대해 말한다. 7, 8, 9장은 목 디스크 병에 대한 진단과 치료 방침의 결정이 결코 간단치 않음을 알려주고 10, 11장은 목 디스크 병을 예방하고 치료하기 위해 독자들이 스스로 해야 할 것들을 알려 준다. 내용들의 알짜만 모아 ‘척추 위생’ 개념을 일상에서 실천할 수 있도록 도와줄 ‘목 디스크 살리는 척추 위생 10계명’도 제공한다."
