title,summary
치과의사도 모르는 진짜 치과 이야기,"현직 치과의사가 기존의 치과 상식에 반기를 들면서 새로운 패러다임을 제시하는 책. 20년 경력의 저자가 자신의 임상 경험과 연구를 바탕으로 충치에서 임플란트까지 치과 가기 전에 꼭 알아야 할 것들에 대해 알려준다. 저자는 책에서 어릴 때부터 치과를 자주 다님에도 불구하고 우리의 치아는 여전히 무너지고 있는 현실에서 ‘최소한의 치료와 생활의 변화만이 치아를 건강하게 할 수 있다’고 주장한다.

이 책은 충치를 제거하기에 앞서 치아라는 것은 한번 갈아내면 되돌릴 수 없기에 꼭 치료해야 하는 충치와 그냥 두고 정기적인 관찰이 필요한 충치를 나누는 방법을 설명하면서 최소한으로 치료할 것을 강조한다. 특히 금 등 비싸고 단단한 재료를 이용한 치료 방식이 갖는 위험성을 사례를 들어 설명하면서 고가의 치료 방식이 꼭 필요한 충치의 양상은 어떤 경우인지를 가르쳐준다.

저자는 얼굴과 치아의 미용적인 면에만 초점을 맞춘 치과 치료가 얼마나 큰 부작용을 초래할 수 있는지, 그리고 치아와 턱이 인체에 미치는 영향력을 간과한 치과 치료로 인해 당신이 위험할 수 있다는 것을 경고한다. 책 중간중간에 나오는 저자 가족의 치과 관련 에피소드는 읽는 재미와 설득력을 더해준다."
생체리듬의 과학,"주말에 2~3시간 늦잠 자거나, 일주일에 두세 번 야식하거나, 밤늦게까지 휴대폰을 보는 것만으로도 생체시계는 큰 혼란을 겪는다. 하지만 간단한 습관의 변화만으로도 최적의 호르몬과 소화기관, 면역 능력을 갖춰 질병을 역전시킬 수 있다. 《생체리듬의 과학》은 2017년 노벨상을 받은 주제로, 수면, 식사, 운동에 있어 타이밍을 맞추는 손쉬운 방법으로 최강의 몸을 유지하는 법을 알려준다.

그동안 과학자들은 일어나고 자는 습관을 조절하는 생체시계가 뇌의 시상하부에만 있다고 생각했지만, 사실 생체시계는 뇌뿐만 아니라 모든 신체기관에 존재한다. 우리가 자신의 유전자를 바꿀 수는 없지만, 생체시계는 어떤 유전자가 언제 작동할지를 결정한다.

아침에 접하는 첫 햇빛은 우리 뇌 시계를 재설정하며, 우리가 섭취하는 첫 음식과 마지막 음식은 내장과 간, 근육, 신장 등의 기관을 언제 작동시켜야 할지를 결정한다. 수술, 백신 예방접종, 약, 치료에도 가장 좋은 최적의 시간이 있다.

시간제한 식사법과 간단한 습관의 변화로 수면과 비만, 건강 문제를 해결한 구체적인 사례와 내 몸의 상태를 확인하는 테스트, 따라 하기 쉬운 실천 방법을 통해 밤낮이 바뀐 생활을 하는 현대인을 위한 해법을 제시한다. 판다 박사가 만든 myCircadianClock 앱을 무료로 다운받아 책과 함께 활용하면 자신의 생체리듬을 더욱 쉽게 관리할 수 있다."
정원의 발견,"지은이이자 가든 디자이너 오경아는 식물을 단지 좋아하는 것만으로 원예의 노하우가 익혀지진 않는다고 말한다. 무조건 물만 잘 준다고, 관심을 가졌다고 식물이 건강하게 자라줄 리는 만무하다는 그는, 원예가 ‘과학의 공부’임을 강조한다.

식물의 구조를 이해하는 일, 어떻게 식물이 그들의 방식으로 살아가고 있는지를 과학적으로 이해하지 않으면 결코 답을 찾을 수 없다는 것이다. 이는 작은 관심에서부터 시작하며, 여기에는 무엇보다 식물 스스로 자생력을 키울 수 있도록 돌봐주는 것이 중요함을 조언한다."
연필 스케치 마스터 컬렉션,"반세기 넘게 ‘연필 스케치의 고전’으로 사랑받은 연필 스케치 안내서이다. 1922년과 1949년에 출간되었던 아서 L. 겁틸의 연필화 책 2권을 합본한 책으로 연필화 그리는 법을 상세히 알려준다. 재료와 도구부터 명암 넣는 법, 세부 묘사 기법 등 기초 이론을 바탕으로 연필 스케치 방법을 쉽게 배울 수 있다.

연필은 연필심의 굳기와 모양, 굵기에 따라 전혀 다른 표현이 가능하다. 선의 굵기와 톤, 명암에 따라 다양한 표현을 할 수 있기 때문에 연필 한 자루만으로도 얼마든지 무궁무진한 스케치가 가능하다. 이 책은 ‘연필 스케치 교과서’로서 연필을 사용해 회화 표현의 기초를 쌓고, 아름다운 연필화 작품을 완성하도록 도와줄 것이다."
알츠하이머의 종말,"아마존 종합 베스트셀러 1위, 세계적인 신경학자가 개발한 젊고 건강한 뇌를 만드는 36가지 솔루션을 담았다. 알츠하이머를 비롯한 퇴행성 질환의 세계적인 권위자인 이 책의 저자 데일 브레드슨 박사는 30여 년이 넘는 연구 끝에 알츠하이머가 한 가지 원인 때문이 아니라 염증, 영양의 불균형, 체내에 쌓인 독성물질 등 여러 가지 원인의 복합작용을 통해 발병한다는 사실을 밝혀냈다.

그는 수만 번이 넘는 임상실험 끝에 지난 2017년 세계 최초로 영양, 호르몬, 스트레스, 수면 등 생활 습관 개선을 통해 알츠하이머를 예방하는 인지기능 회복 프로그램 ‘리코드ReCODE’를 개발해 의학계에 커다한 파장을 일으켰다. 리코드의 핵심은 이렇다. 설탕을 비롯한 첨가제가 많이 포함된 음식을 먹고, 앉아서 생활하고, 잠을 적게 자고, 운동을 하지 않는 현대인들의 생활 습관이 뇌를 망가뜨리고 있으며 이러한 생활 습관을 올바르게 개선하는 것만으로도 젊고 건강한 뇌로 되돌릴 수 있다는 것이다."
밀가루만 끊어도 100가지 병을 막을 수 있다,"식단이 서구화됨에 따라 주식인 밥보다 빵, 파스타, 피자, 라면 등 밀가루로 만든 음식을 더 즐겨 먹게 된 우리나라 사람들에게 큰 충격을 안겨줄 책이 출간되었다. 지금까지 우리가 몰랐던 밀가루에 관한 불편한 진실을 알려주고, 글루텐 질환의 심각성, 밀가루를 끊고 건강한 삶을 살 수 있는 방법을 알려준다. 국내 최초로 밀가루의 위험성을 알리고 밀가루의 주성분인 글루텐 관련 질환을 다룬다는 점에서 의의가 크다.

글루텐은 밀, 보리, 호밀 등의 곡식에 함유된 단백질로, 이러한 글루텐을 우리 몸이 받아들이지 못하고 거부반응을 일으키는 것을 글루텐 불내증이라고 한다. 이 책은 글루텐으로 인해 소장의 벽이 손상되어 소화 관련 장애를 일으키는 셀리악 병을 포함해 밀과 글루텐으로 인해 나타나는 다양한 증상과 질환들을 모두 다루고 있다. 실제로 책에 수록된 200여 개의 건강 관련 문제를 적은 목록을 보면 밀과 글루텐이 우리 몸 속속들이 광범위한 문제를 일으킬 수 있다는 사실에 깜짝 놀라게 될 것이다."
스트레스 : 당신을 병들게 하는 스트레스의 모든 것,"우리를 병들게 하는 스트레스를 다양한 갈래로 살펴보는 책이다. 평소에 과학에 관심을 보이지 않던 사람에게도 과학의 재미를 전달할 수 있도록, 다루는 주제를 흥미롭고 접근하기 쉽게 만들어졌다. 저자는 불투명한 스트레스 개념을 명확히 하고, 다양한 호르몬들과 뇌 부위들이 스트레스에 반응하여 어떻게 작용하는지를 되도록 쉽게 설명하는 것에서부터 시작한다.

그 다음, 스트레스와 특정 질환들의 관련성에 초점을 맞추어, 순환계, 에너지 저장, 성장, 생식, 면역계 등을 한 장씩 살펴본다. 또한 마지막 장에서는 스트레스 관리법과 이 관리법의 일부 원칙들을 어떻게 우리 일상생활에 적용할 수 있는지 에 대해 살펴본다."
"하루 딱 10분, 진짜 독학 캘리그래피","책만으로도 충분히 캘리그래피를 쉽고 재밌게 배워 익힐 수 있도록 ‘많이 써보는 연습’과 ‘바로 써먹는 일상 속 작품까지’ 뚝딱 완성할 수 있도록 철저하게 학습자 중심의 ‘연습과 실전’으로 체계적으로 구성되어 있다. 기본 자음과 모음, 단어와 문장, 장문까지 다양한 문구로 제대로 연습할 수 있도록 많은 연습페이지를 구성했다.

게다가, 단순하게 따라 쓰는 연습 단계에서 끝나는 것이 아니라, 배웠던 것을 바로 써먹을 수 있도록 일상 속 캘리 작품과 디지털 캘리 작품까지 완성할 수 있도록 다양한 실전페이지까지 구성했다."
요르가즘,"현대미술을 전공한 요가 강사의 생활 수련기. 이제 요가는 조금 덜 진지하고 덜 명상적이어도 괜찮지 않을까. 열거하기도 힘들 만큼 우리 주변에 흔하고 접하기 쉬운 실내 운동이 되었지만, 매체에서 보여주는 요가란 곧잘 신성한 수행으로 연결된다. 고난도 동작들과 함께 명상이 수반되는 신비로운 이미지는 여타의 실내 운동과 결을 달리하는 요가만의 특징이면서 한편으로 초심자의 진입을 주저케 하는 요소기도 하다.

현대미술을 전공하고 5년 차 요가 강사로 살고 있는 저자 황혜원은 요가가 꼭 거룩하거나 성스러운 것만은 아니라고 말한다. 동작 하나하나에 집중하며 몸을 움직일 때 온몸의 세포가 깨어나는 듯한 전율을 느껴보라고, 구태여 마음챙김에 얽매여 '요가의 맛'을 잃어선 안 된다고. 몸을 한껏 구겼다가 활짝 펼치면 몸뿐만 아니라 마음의 혈도 절로 뚫린다. 그는 어딘가 불량하고 조금은 제멋대로인 요가인의 일상을 가감 없이 드러내 보임으로써 야트막한 벽을 넘어오라고 손짓한다."
쉽게 배우는 코바늘 손뜨개 무늬 123,"처음 손뜨개를 시작하는 사람도 쉽게 따라 할 수 있는 뜨기 기법부터 국내 처음 소개되는 23가지 새로운 기법으로 손뜨개 전문가까지 모두를 만족시킬 수 있는 코바늘 손뜨개의 결정판이다. 또한 일본 최고의 작가들이 만든 각양각색의 무늬들은 보는 것만으로도 큰 즐거움을 느낄 수 있으며, 책을 따라 어느덧 새롭고 다양한 손뜨개 무늬를 만들 수 있다.

책은 일본편물문화협회 특별회원이자 《두나맘 스타일 니트》등 다수의 브랜드 상품 프로모션에 참가했던 김영희 선생님이 감수자로 참여하여, 일본 NAC 보그니팅의 노하우를 토대로 국내 실정에 맞춰 가장 간결하고 이해하기 쉬운 표현으로 정리하였다. 이제, 수예 No.1 보그사의 노하우가 담긴 ‘쉽게 배우는 수예 시리즈’로 당신의 코바늘 손뜨개의 세계가 넓어질 것이다."
게임보이 컴플리트 가이드,"수많은 명작 소프트를 탄생시킨 최강의 휴대용 게임기, 게임보이의 모든 것을 담았다. 게임보이와 게임보이 컬러로 발매된 소프트가 연대순으로 정렬되어 있고 발매시기와 퍼블리셔, 가격 등의 정보도 꼼꼼하게 기록되어 있다. 모든 소프트의 패키지 화면과 게임 화면, 게임의 특징과 의의, 비하인드 스토리 등이 간략하게 정리되어, 그 시절을 살았던 게임 팬들의 추억을 소환한다.

또한 다양한 컬러로 발매된 게임보이의 본체 정보도 충실하게 담아 마니아들의 호기심을 충족시켜준다. 책 사이사이에 게임보이의 주변기기 정보와 공략본, 게임보이 전문지, 광고지 갤러리, 특수한 소프트, 소프트 부속품, 세트 상품 등에 대한 정보를 칼럼 형식으로 담았다. 게임보이에 대한 정보라면 단 하나도 놓치기 싫다는 팬이라면 읽는 재미와 보는 재미를 모두 만끽할 수 있을 것이다."
Merry People 스페셜 아크릴물감 세트,"드로잉메리 작가의 <Merry Summer>에 이은 두 번째 컬러링 아트북. 작가의 노하우와 작품별 칠하는 법을 담은 '튜토리얼북'을 보며, 작가가 실제로 쓰는 용지(220g)에 스케치를 인쇄한 '컬러링북'에 부드럽게 칠하기만 하면 멋진 그림이 완성된다. 책에 쓰인 물감으로만 구성한 특별판으로, 전문가용 아크릴물감 구매가 부담스러운 ‘스타터’ 독자들을 위해 20ml 규격으로 주문 제작한 물감 세트(20ml×12colors)와 종이팔레트(20sheets)를 Merry Box에 담았다."
당질 제한식 다이어트,"저자는 당질 섭취를 줄이는 식이요법인 ‘당질 제한식’으로 당뇨병을 치료하는 의사다. 임상 결과 당질 제한식을 실천한 사람들이 건강해지는 것은 물론 몰라보게 날씬해지면서 당질 제한식은 신개념 다이어트 비법으로 알려지게 되었다.

당질 제한식 다이어트에서는 육식이나 생선도, 튀김이나 볶음도 마음껏 먹을 수 있다. 먹고 싶은 만큼 먹을 수 있기 때문에 배부른 다이어트라고 불린다. 종류만 제한하면 술을 마셔도 괜찮다. 맛있는 음식을 마음껏 먹을 수 있고 술까지 즐길 수 있기 때문에, 뭐든지 절제해야 하는 다이어트법과 비교하면 너무나 행복한 방법이다. 게다가 칼로리를 계산하는 번거로움도, 운동도 필요 없다. 너무나 간단하고 편하게 살을 뺄 수 있다. 그 이유는 바로 당질 제한에 있다.

지금까지는 칼로리 섭취를 줄이고, 운동으로 칼로리를 배출해야 살이 빠진다고 알고 있었다. 그러나 살이 찌고 빠지는 것을 결정하는 요인은 칼로리가 아니라 ‘당질’이라는 사실이 새롭게 밝혀졌다. 저자는 현대인에게 비만이나 당뇨병이 많은 이유는 당질이 많은 식사로 몸이 무리를 한 결과라고 강조한다. 따라서 당질 섭취를 줄이는 것만으로도 날씬해지고 건강해진다는 것이다.

또한, 당질 제한식이 체중감소에 왜 효과가 있는지, 다른 다이어트와 달리 안전하고 건강에도 좋은 이유가 무엇인지, 그 의학적 근거에 대해 이 책에서 자세하고 설명하고 있다. 그리고 당질이 많은 식품과 적은 식품은 무엇이 있는지, 외식과 간식을 선택하는 요령 등에 대해서도 잘 정리되어 있다."
돌아뜰리에의 베이비돌 앤티크옷 만들기,"빨강 머리 앤, 소공녀, 헵번 등 아름다운 이야기 속 주인공들이 입었던 사랑스러운 앤티크 의상과 소품을 9개의 테마, 33개의 아이템으로 소개한다. 앤티크한 드레스와 재킷, 바지를 비롯해 의상과 잘 어울리는 머리핀, 에이프런, 니삭스, 케이프, 보닛 등 멋진 소품이 가득하다.

기본 바느질 방법을 소개하고 있으며, 인형옷 만들 때 활용하면 좋은 원단과 부자재 그리고 도구 정보를 담았다. 또한 사이즈 측정에 어려움을 겪지 않도록 부록에는 36쪽에 달하는 실물 크기 도안을 실었다. 인형옷 만들기 초보자들도 이해하기 쉽고 보기 좋도록 구성한 실물 크기 도안을 통해 더욱 간편하게 인형옷과 소품을 만들어보자."
매일매일 시력 트레이닝 매직아이,"AR, VR, 3D 안경 없이도 입체감을 느낄 수 있는 추억의 매직아이 2018년판. 매직아이의 정식 명칭은 스트레오그램(stereogram)으로 물체의 실체적 인상을 그대로 표현하는, 입체 이미지를 말한다. 원래 입체 화면을 보기 위해선 특수하게 제작된 안경을 사용해야 하지만 매직아이는 오로지 눈의 원근감을 이용하기 때문에 아무 도구 없이도 입체감을 느낄 수 있다."
두뇌놀이 역사여행,"고조선의 단군왕검부터 독도 이야기까지 우리 역사 이야기 12가지 주요 장면을 중심으로 120개의 다양한 두뇌놀이 문제를 담고 있다. 역사 현장 다른 그림 찾기, 역사 인물 그림자 찾기 등을 통해 초등학생과 치매예방을 하고자 하는 노인 분들에게 디지털 기기가 아닌 정적인 문제로 재미와 유익이라는 두 가지 토끼를 잡을 수 있게 도와준다."
꽃을 그리는 오일파스텔 컬러링북,"그리기 초심자도 쉽게 오일파스텔 그림을 시작할 수 있도록 도와주는 컬러링북이다. 그리기 재료 중 이 책에 사용한 오일파스텔은 특유의 따뜻하고 부드러운 느낌을 가지고 있어 꽃을 그리기에 아주 매력적인 재료이다. 이전에 <처음 배우는 오일파스텔>를 출간한 바 있는 작가 구현선은 독자들에게 오일파스텔을 더 편하고 친숙하게 소개하고 싶어 이 책을 새로 선보이게 되었다. 이 컬러링북에는 구현선 작가만의 그림을 보는 즐거움과 직접 칠해 완성하는 기쁨이 함께 있다.

우선 오일파스텔을 사용하는 간단한 설명과 그림마다 사용된 오일파스텔의 색상 및 팁을 담았다. 이를 참고하여 책 뒤편에 마련된 도화지 위에 오일파스텔을 쓱쓱 칠하기만 하면 스케치를 하지 않아도 손쉽게 예쁜 꽃 그림을 완성할 수 있다. 완성한 그림은 절취선을 따라 깨끗하게 오려내 액자에 넣어 보관하거나 메시지를 담아 소중한 사람에게 선물하기에도 손색없이 아름다운 작품이 된다."
꿈꾸는 방,"행복해지는 컬러링북 두번째 권. 저자가 평소 살아보고 싶고 꿈꾸었던 집과 방의 이미지를 구체화한 작품으로, 전작에 이어 깜찍한 소녀가 각 테마마다 등장하여 현장감을 높이고, 감성을 한층 북돋운다. 마치 자신이 주인공이 된 듯 동화되어 몰입감을 높이는 효과를 고양시킨다.

커다란 창문이 있는 나무와 꽃이 만발한 집, 멋진 주방이 있는 집, 시원한 바람이 솔솔 부는 나무 위 집, 바닷가 집, 전차를 개조한 집 등 총 11가지 테마의 방이 수록되어 있다. 섬세하고 정밀한 펜화로 첫 페이지부터 마지막 페이지까지 정성스러움이 가득하다.

색연필로 직접 인테리어를 하는 느낌으로 색칠하고, 여러 색을 써서 음영을 내면 한층 생생하다. 수채 색연필로 살짝 번지는 느낌을 연출해 고급스러운 분위기도 낼 수 있다. 가구나 옷 등에 따로 무늬가 없고 배경에 여백이 있어, 각자의 취향에 따라 개성을 발휘하기에도 좋다."
With a Wreath 위드 어 리스,"동그란 모양의 탐스러운 리스를 그대로 즐길 수 있도록 200×200mm의 정사각형 판형으로 특별 제작한 컬러링북이다. 김이랑 작가가 좋아하는 꽃과 초록의 소재들로 엮은 사계절 플라워 리스를 수채화 컬러링으로 만날 수 있다.

본격적으로 리스를 그리고 채색하기에 앞서, Green, Point, Plus 등 리스를 구성하는 스무 가지의 소재를 소개한다. 그중 계절별로 어울리는 소재들을 엮어 총 열여섯 가지의 리스를 만들었다. 상큼한 봄, 청량한 여름, 소담한 가을, 차분한 겨울. 사계절을 가득 품은 플라워 리스를 수채화로 컬러링 하도록 구성했다."
너의 순간들,"인스타그램 팔로워 8만 2천 명, '클래스 101' 인물수채화 강의 크리에이터 다혜 작가의 첫 컬러링북. 다양한 소녀들의 모습을 담은 컬러링 도안뿐 아니라 다혜 작가의 드로잉, 채색팁 등을 볼 수 있는 튜토리얼도 함께 실려 있다. 얼굴 그리기 방법과 수채화+색연필 채색법, 색연필 채색법이 과정 사진, 설명과 함께 자세하고 친절하게 소개되어 있으니 이를 토대로 새로운 인물을 그려보아도 좋고, 참고하여 다양한 방법으로 색칠을 해보아도 좋다.

튜토리얼과 채색 팁 안내 다음에는 일러스트 화보들이 다량 수록되어 있다. 저자의 완성작들을 보면서 색깔 매칭에 대한 힌트를 얻을 수도 있고, 색감의 조화에 대한 아이디어와 영감도 얻을 수 있을 것이다.

봄, 여름, 가을, 겨울 사계절에 맞춰 그려진 소녀들의 그림은 각 인물의 청순, 발랄, 섹시, 단아한 모습을 모두 담고 있다. 면사포를 쓴 봄날의 소녀, 비숑 프리제를 안고 있는 흑발의 여름 소녀부터 롱 카디건이 잘 어울리는 단발머리 가을 소녀, 고양이와 눈 내리는 창가를 바라보는 겨울 소녀까지. 계절에 따라 다양한 스타일링을 한 소녀들의 모습과 소품을 구경하는 재미도 느낄 수 있다."
몸에도 미니멀리즘,"여기 한명의 여성이 있다. 야근도 마다하지 않고 일했으며 디자이너로서 나름의 성취도 일구어냈다. 물론 세상이 가르쳐준 대로 열심히 욕심껏 살았다. 교과서에서 배운 것처럼 아무거나 ‘골고루’ 먹었으며, 남들처럼 배달음식도 마다하지 않았다. 그러나 아랫배가 나오고 몸이 아프기 시작했다. 병원을 전전했다.

시중에 유행하는 다이어트를 다 시도해보았다. 닭가슴살도 먹었고 피부에 좋다는 한약도 먹어보았다. 그러나 살은 빠지는 듯 하다가 도로 쪘고, 몸은 더 아파왔으며 피부도 거칠어졌다. 어느 날 그녀는 작심한 듯 채식으로 바꾸었다. 독소가 빠져나가면서 변비도 뱃살도 여드름도 사라졌다. 몸이 날아갈 듯 가벼워졌다.

가벼워진 몸은 맑은 영혼을 불러왔으며, 삶이 바뀌기 시작했다. 음식이 단순해지자 삶도 단순해지기 시작한 것이다. 옷가지와 세간을 정리했다. 화장품을 버리고 물 세안과 물로만 머리감기를 시작했다. 잘 나가던 회사를 정리하고 ‘내가 좋아하는 일’을 시작했다. ‘끌려가던 삶’에서 ‘끌고 가는 삶’을 시작한 것이다."
하루 15분 기적의 림프 청소,"채널A ‘나는 몸신이다’에서 소개되어 장안의 화제가 되었던 ‘하루 15분 림프 청소 마사지’를 책으로 만난다. 최근 의학계에서 가장 주목하며, 부종, 피부질환, 각종 통증, 암의 원인이 되는 게 있다. 일명 체내 청소기로 불리는 ‘림프’다. 몸속의 노폐물을 모아서 없애는 청소기 역할을 하는데, 이 역할이 제대로 되지 않으면 만병이 찾아오기 때문에 아주 중요하다.

김성중, 심정묘 교수는 림프 치료 전문가로 25년간 1만여 명의 환자들을 치료하여 이 분야에서 독보적인 존재로 평가받고 있다. 이 책은 그 오랜 세월 동안 수많은 환자들을 치료하면서 얻은 림프 건강법을 이해하기 쉽게 정리한 것이다. 림프가 무엇이며 우리 몸에서 정확히 어떤 역할을 하는지, 각종 질병으로부터 벗어나는 림프 건강법 등 림프에 대한 모든 이야기를 담았다.

이 책에 소개된 ‘하루 15분 림프 청소 마사지 프로그램’은 매일 실시하는 마사지로 쉽고 간단하게 구성되어 누구나 따라할 수 있다. 또한 증상별, 통증별, 예뻐지는 림프 청소 마사지도 있어서 다양한 질환을 예방하고 치료하는 데 큰 도움이 된다. 이 책은 백세시대에 무병장수를 꿈꾼다면 반드시 읽어야 할 필수 건강지침서다."
신진대사,"신진대사가 잘 이루어지는 건강한 삶을 위해서는 건강한 영양을 섭취해야 한다. 이를 위해 인체 내에서 신진대사가 어떻게 작용하고 또 어떤 영양소가 서로 협력하는지 알아야 한다고 저자는 말한다. 신진대사의 명령체계와 장기들 간의 관계, 대사증후군의 종류와 원인 등을 그림으로 알기 쉽게 풀이해서 설명한다."
남창규 박사가 쓴 인체파동원리 : 원리편,"정통 한의학의 길을 밟은 전직 한의대교수이자 대학병원 의무부원장 출신 한의사가 의학에는 문외한인 일반인 박종부 선생의 인체파동원리를 접목해 임상하면서 연간 4만여 명, 개원 13년 만에 55만여 명의 환자를 진료한 임상기록을 토대로 쓴 가정한의보감이다."
동물과 이야기하는 여자,"애니멀 커뮤니케이터 리디아 히비가 20년 동안 수천 마리 동물들과 나눈 이야기들을 모았다. 애니멀 커뮤니케이터란 동물과 이야기하는 사람으로, 이 책에는 주인만 집을 나가면 짖어대는 개, 갑자기 대소변을 가리지 못하는 고양이, 집 나간 개 등과 저자가 대화를 나눠 문제를 해결해 주는 얘기들이 담겨 있다."
