title,summary
씨뮬 9th 수능기출 6.9.수능 평가원 3년간 모의고사 고3 수학 (2021년),"수능, 모평 모의고사를 실제 시험에 응시하듯 풀어보고 자신의 실전 능력을 진단할 수 있는 교재다. 과목별로 기출 문제를 푸는 가장 효과적인 방법을 제시하고 이를 적용하여 상세하게 설명하였다. 씨뮬 수학은 최근 3년간 실시된 수능, 모평 모의고사 9회와 2020학년도 4.7.10월 학평 모의고사 3회를 2022 수능 체제 맞춰 재구성하여 수록하였다."
New Allead 올리드 고등 수학 (상) (2021년용),"새 교육과정(2015 개정 교육과정)을 완벽하게 반영하고 신유형 문제들을 수록하여 개정한 출간한 교재이다. 새 교육과정에 맞추어 내용을 구성하고, 체계적으로 개념을 설명하여 수학의 원리를 쉽게 이해할 수 있다. 다양한 필수 예제와 풀이의 연관 개념 및 적용 방법을 제시하여 유형을 탄탄하게 학습할 수 있으며, 유제와 중단원 마무리 문제를 수준별로 구성하여 유형에 대한 적응력을 높이고 문제 해결력을 극대화할 수 있다."
메가스터디 N제 수학영역 확률과 통계 349제 (2021년),"수능 대비 예상 문제집. 수능 전문 출제진의 날카로운 예측으로 수능에서 진가를 발휘할 최적의 수능 예상 문제만을 엄선하여 수록하였다. 출제 유형별로 유형을 분석하고, 문제 해결 과정에서 유용한 가이드를 제공하며, 대단원별로 학생들에게 최신 예상 문제, 복합 유형 문제, 고난도 문제 등을 제공하여 수능을 대비할 수 있도록 하였다. 또한, 학생 스스로 약점을 파악하면서 학습 상태를 점검할 수 있도록 자기 check 표를 제공한다."
지금필수 국어영역 고난도 독서 (2021년용),국어 영역 1등급 도달을 위해 비문학 독해 전략을 학습할 수 있는 고난도 독서 교재이다. 독해 전략을 바탕으로 난도가 높은 독서 지문을 읽고 문제를 푸는 연습을 함으로써 국어 영역 고난도 독서에 대한 자신감을 기를 수 있다.
"너, 반드시 논술로 대학 간다 - 상","지금까지 나온 모든 대학의 모든 논술 기출 문제를 모조리 분석한 끝에 얻은 논술의 비밀을 공개한다. 논술 시험을 실시하는 모든 대학교(27개 대학)의 논술 문제 유형을 7가지로 분류해, 정확하고 효율적인 문제풀이를 가능하게 하고 있다. 또한 각 유형의 특징을 살린 문제 풀이 방법을 단계적으로 설명하고 있다.

아울러, 논술 초심자를 위한 논술 제시문 읽기의 8가지 비법을 제시하고 있다. 뿐만 아니라 50개에 달하는 기출 문제의 철저한 분석과 해설, 실전을 위한 지침을 수록하고 있으며, 부록에 실린 논술 시행 대학의 3개년 기출 문제 유형 및 주제 분석표도 매우 유용하다."
유형 해결의 법칙 기하 (2021년용),"전국 고등학교의 내신 기출 문제를 수집, 분석하여 유형별로 수록한 교재다. 기본 문제로 개념 확인하기, 유형별로 문제 익히기, 실전 시험에 대비하기, 교과서 속 심화 문제를 통해 응용력 강화하기 등 단계별로 학습이 가능한 내신에 최적화된 시스템으로 구성하였다. 유형별 해결 전략을 제시하여 핵심 유형을 마스터하고 해결 능력을 스스로 향상시킬 수 있다."
BON 본 N제 한국 지리 (2021년용),"2015 개정 교육과정 교과서를 체계적으로 분석하여 교과서의 내용을 빠짐없이 정리하였고, 시험의 적중률을 높였다. 또한, 족집게 전략과 대표 문항을 통해 필수 개념의 출제 경향과 대표 문제를 파악할 수 있도록 하였으며, 기출 문항과 예상 문제를 모두 다뤄 수능을 완벽하게 대비할 수 있도록 하였다. 특히 고난도 문항은 1등급을 갈랐던 기출 문항, 새로운 유형의 예상 문항을 제시하여 특수한 문항에도 잘 대처할 수 있도록 하였다."
수능 기출의 바이블 사회·문화 (2021년),"난이도별 / 수준별 N회독이 가능한 분권형 기출문제집이다.

난이도별 / 수준별 N회독이 가능한 분권형 기출문제집이다. 1권으로 교과 개념을 정리할 수 있으며 교육청 문항으로 학력을 향상 시킬 수 있다. 2권으로 평가원 출제 경향을 분석하고 수능, 평가원 문항으로 실력을 대비할 수 있다. 부록으로 교육청, 평가원 연도별 최고난도 모의고사를 제공한다. 최고난도 킬러 문항 집중 학습이 가능하다."
생강 국어 화법과 작문,생생한 국어 화법과 작문 강의를 만화로 구성한 자율학습서. 만화로 내용을 설명하고 포인트를 정리한 후 단원정리와 수능 기출문제를 수록하여 고1에서 심화까지 내신과 수능 국어 화법과 작문을 한 번에 잡을 수 있도록 구성되어 있다.
메가스터디 고등수학 개념 기본서 메가헤르츠(Mhz) 고등 수학 (하) (2021년용),"고등수학의 모든 것을 담은 개념서로서, 고등학교 수학을 처음 접하는 학생도, 내신 만점을 목표로 하는 학생도 모두가 쉽게 학습할 수 있다. 혼자서도 쉽게 이해할 수 있는 자세한 개념 설명과 시험에 자주 출제되는 핵심 유형의 예제/유제로 고등수학의 모든 것을 체계적으로 익히고, 실전 문제와 발전 문제를 통해 내신 만점에 대비할 수 있다."
리딩 마스터 Reading Master 베이직 Basic (2021년용),"쉽고 재미있게 수능 독해의 기초를 세워준다. 수능 독해에 기본이 되는 핵심 문법과 구문을 학습할 수 있도록 하였으며, 지문의 흐름을 꿰뚫는 핵심 비법을 수록하였고, 수능 & 내신 서술형 대비가 가능한 독해 연습문제로 마무리할 수 있도록 구성하였다."
TEAM PHASE 물리학 1 실전모의평가 시즌 2 (봉투) (2021년),"예상 1등급컷을 45~47 정도로 구성하였다. 모의고사로 위장한 N제가 아니므로, 시간을 재면서 풀기에 적당하다. 문제 유형과 배치를 올해 평가원 시험과 비슷하게 구성하였다. 1~3p에서 실생활 사례, 장치의 작동 원리, 실험 등의 비중을 높이고, 4p에서 전자기장 비역학의 비중을 높였다. 역학의 난이도 또한 6, 9평 정도로 구성했다."
포카칩 N제 수학 1 + 수학 2 + 기하 190제 (2021년),"수학영역 고득점을 위해 적합한 난이도로 구성되어 있다. 단원 통합형 및 다양한 해법이 가능한 문항 위주로 구성되어 있다. 자신의 부족한 개념과 오개념을 확인할 수 있으며, 수학적 아름다움과 푸는 즐거움을 느낄 수 있다."
버블티 고2 문학 신사고(이숭원) 내신 + 수능대비 1권 + 2권 세트 - 전2권 (2021년),"버블티 고2문학은 학교 시험 문제를 분석한 내신대비 교재이다. 전국 고등학교의 내신 기출문제를 작품별로 분류하고, 해당 작품별 최다 출제 문제들을 종합하고 분석하여 핵심 적중 문제들을 선별, 1권 교과서 작품편, 2권 연계 작품편으로 각각 출판하였다.

1권 교과서 작품편(987문항)에서는 교과서 단원별 순서에 따라 작품별 최다 문제들을 수록하였고, 특히 학습활동에서 간단히 언급된 작품들까지 빠짐없이 수록하여 100% 내신 대비를 할 수 있도록 구성하였다.

2권 연계 작품편(935문항)에서는 교과서 작품과 작가/주제/소재/갈래/상황별 연계 기준에 따른 교과서 외 연계 작품을 선정하여 해당 작품별 작품 분석 및 문제를 수록하였다. 2권은 학교 시험에서 교과서 외 작품이 출제되는 부분에 대한 시험대비를 할 수 있도록 하였고, 장기적으로 수능 대비를 할 수 있도록 하였다."
유난히 설명이 잘된 수학 : 확률과 통계 - 동전과 주사위,"원리와 개념에 대해 정확하고 자세하게 설명하는 '유난히 설명이 잘된 수학' 시리즈. '유난히 설명이 잘된 수학' 시리즈는 자학자습하는 학생들에게 내신은 물론 수능 대비에도 실질적인 도움을 준다. '확률과 통계' 편은 개념과 원리를 한 번 알게 되면, 쉽게 잊지 않고 스스로 생각하고 응용하여 다양한 문제들을 재미있고 자신있게 해결할 수 있도록 돕는다."
시작은 하루수능 국어영역 국어 기초 (2021년),"‘쉽고 빠르게’ 수능 국어의 기초를 쌓다! 처음 만나는 수능, 국어영역이 궁금한 분들에게 꼭 필요한 책! 수능 국어영역의 모든 과목(문학, 독서, 화법과 작문, 언어와 매체)을 한 권에 담았다. 하루 6쪽, 일주일에 5일, 4주면 완성되는 간결하고 부담 없는 구성과 만화, 그림, 퀴즈 등을 활용한 재미있는 내용으로 공부 습관을 탄탄하게 쌓고, 수능 국어에 대한 자신감도 키울 수 있다."
EBS 수능특강Q 미니모의고사 사회탐구영역 한국지리 (2021년),"3,300원으로 만나는 한국교육과정평가원 역대 감수 문항 에센스 '수능특강Q 미니모의고사'. 역대 수능 연계교재의 고퀄리티 문항을 엄선하여 15~20분 분량의 14회 미니모의고사로 구성했다. 목표 시간과 헷갈린 문항, 틀린 문항을 정리할 수 있는 학습계획표를 제공한다."
자이스토리 문제로 풀어 가는 기출 보카 고교 기본편,"절대평가 수능 분석에 따른 기출 어휘를 선정하였다. 다양한 예문으로 문제를 만들어 단어의 문장에서의 쓰임을 익히도록 했다. 어원으로 외우는 어휘, 혼동 어휘, 여러 가지 뜻을 가진 어휘 등 각 단어의 특성을 고려하여 대단원을 나눴고, 그에 맞는 유형의 문제들을 구현했다. 어원의 뜻을 학습한 후 해당 어원이 쓰인 단어의 의미를 추론하는 훈련, 문장 안에서 혼동 어휘의 의미를 구분하는 훈련, 다의어가 문장 안에서 어떤 의미로 쓰였는지를 파악하는 훈련 등을 통해 각 단어를 효과적으로 암기할 수 있다."
스스로 답을 찾는 수학 공부법,"지난 10년간 사교육의 메카 강남, 서초에서 수학을 가르치면서 수많은 아이들을 1등급으로 만든 수학 과외 전문가가 말하는 핵심 공부법을 담았다. 어떻게 하면 수학을 잘할 수 있는지에 대한 명쾌한 해답을 제시한다. 올바른 공부법과 학생의 의지만 있다면 누구나 수학 1등급은 가능하다. 공식만 달달 암기하는 수학, 문제집을 n회독 반복하는 수학, 스타 강사의 인터넷 강의만 맹신하는 수학은 이제 버려도 좋다."
The VOCA 플러스 7,"학년별로 꼭 알아야 하는 교육부 권장 표제어를 선별하였고, 학교 내신까지 확실하게 대비하는 유의어/반의어/ 참고 어휘를 수록하였다. 교재의 QR 코드를 스캔만 하면 각 Day의 어휘를 바로 들으며 학습할 수 있고, 넥서스 홈페이지에 접속하여 MP3 음원을 무료로 다운로드할 수 있다."
올림피아드 과학의 지름길 화학,"한국올림피아드 대회에 다가가기 위해 먼저 거쳐야 할 학교 및 지역 경시대회 그리고 시도에서 주관하는 경시대회를 대비하는 학습서로서 부족함이 없도록 했으며, 각 영재교육기관에서 다루는 문제와 같은 유형, 그리고 기출문제들을 다루고 있다."
대학별 논술고사 기출문제 해설집 (인문.사회계열) (2021년),"『기출문제 해설집(인문·사회계)』는 주요 대학의 논술고사 기출문제와 그에 대한 체계적인 해설 및 답안을 담고 있다. 대성의 논술 전문가들이 각 대학별 출제 경향을 면밀히 분석하여 다년간 연구·기획하고, 대성학원의 유명 인문논술 강사진이 심혈을 기울여 집필한 대입 논술 필독서이다. (건국대, 서강대, 성균관대, 연세대, 중앙대, 한국외대, 한양대)"
High School English 평가문제집 (2019년용),"2015 개정 교육과정에 따라 편찬한 'High School English’ 교과서의 핵심 내용을 간략하게 정리하고, 문제로 익히는 학생의 자기주도적 학습을 도와줄 맞춤형 평가문제집이다. 학교 시험 예상 문제를 엄선한 내신형 문제와 수능형 문제를 통해 내신과 수능을 모두 잡을 수 있다."
100발 100중 고등 영어 기출문제집 C 2학기 중간고사 능률(양현권) (2021년용),"기출문제를 종합 분석하여 출제율이 높은 문제를 다량 수록하였다. 출제 경향과 출제율을 반영해 실전 문제 및 수능형, 서술형 문제까지 완벽 대비할 수 있다. 교과서의 모든 내용이 자연스럽게 각인되는 단계별 학습 설계이며, 수업이나 자기주도 학습을 통해 학습 내용을 완벽하게 습득할 수 있는 구성이다. 또한, 풍부한 예시문과 자세한 설명을 통해 부족한 학습 보충이 가능하다."
100발 100중 고등 국어 기출문제집 A 1학기 중간고사 해냄(정민) (2021년용),"전국 고등학교의 내신 기출문제를 종합, 분석하여 핵심 적중 문제 다량 수록하였으며, 최신 출제 경향과 출제율을 100% 반영하여 등급을 가르는 서답형, 서술형 문제까지 완벽 대비할 수 있다. 또한 '지문 분석-확인 문제-기본 평가-심화 평가'로 이어지는 단계별 학습 설계로 내용을 완벽하게 습득할 수 있으며, 최종 점검 실전 모의고사도 담겨있다."
531 프로젝트 PROJECT 물리학 1 S (Speedy) (2021년용),"14강으로 구성된 단기 완성 특강서. 영역별 단기 특강서로, 물리학Ⅰ의 전반적인 내용을 빠르게 점검할 수 있으며, 시험에 자주 출제되는 필수 자료를 체계적으로 분석하였다. 또한 수능에 출제될 수 있는 다양한 유형의 문제를 제시하여 실전 감각을 키울 수 있다."
2021 합격하는 의대 인적성 면접 MMI 실전분석,"의과대학의 인적성면접 시험인 다중미니면접(MMI; Multiple Mini Interview)의 시험을 대비할 수 있도록 출간하였다. 다중미니면접의 개념과 평가방법을 정리하고 상황 판단 문제에 대한 다양한 답변을 제시하였다. 다중미니면접 기출 복원문제와 예상문제를 분석 및 수록하였으며, 면접 질문마다 참고자료를 제시하였다."
바로 VOCA 고교 기본 1500,"고등학교 1학년이 꼭 알아야 하는 필수 어휘 1500개를 50일에 완성할 수 있는 교재다. 5일마다 어원을 제시하여 어휘력을 확장할 수 있다. 표지의 QR코드를 찍으면 '바로 듣기 앱'으로 연결되어 음원도 쉽고 빠르게 확인할 수 있다. 원하는 분량, 원하는 문제 유형으로 단어 테스트를 할 수 있는 '어휘 출제 프로그램'과 우리말 뜻을 가릴 수 있는 셀로판지가 부착된 '휴대용 단어카드'도 제공한다."
랑데뷰 N제 수학 2 쉬사준킬 (2021년),"수능 대비 수학 문제집 랑데뷰N제 시리즈는 다음과 같은 난이도 구분으로 구성된다. 1단계- 쉬운3점 어려운3점 (쉬삼어삼) (오르비-전자책), 2단계 -쉬운4점 어려운 4점 (쉬사준킬) (오르비-종이책), 3단계- 킬러 (킬러극킬) (오르비-종이책). 랑데뷰 N제 수학2 쉬사준킬은 쉬운 4점과 준킬러급 난이도 변형 자작 200문항이 출제유형별로 배치되어 있다."
쎈기출0zero 고등 확률과 통계 (2021년),"개념부터 차근차근 수능 기출 공부를 시작하기 위한 수능 기출 기본서다. 개념이 기출문제에 어떻게 적용되는지, 문제를 읽고 해결의 실마리를 어떻게 찾아야 하는지 자세하게 설명하여 기출문제에 대한 탄탄한 내공을 쌓을 수 있도록 하였다. 또 쉬운 기출문제부터 어려운 기출문제까지 차례로 구성하여 점진적으로 실력을 키우고, 수능 기출 완전 학습이 이루어지도록 하였다."
씨뮬 9th 수능기출 전국연합학력평가 3년간 모의고사 한국사 고3 (2021년),"평가원에서 실시하는 대학수학능력시험과 6월, 9월 모의평가, 각 시도 교육청에서 시행한 전국연합학력평가, 입시전문 교육기관의 이투스, 종로, 비상 모의고사를 모두 수록하였다. 분석적 상세 해설, 선지 해설, 오답 피하기, 더 알아둘 개념 등 문제의 출제 의도를 정확히 이해하고 문항에 대한 자세한 분석을 확인하여 완벽한 학습이 가능하도록 구성하였다."
창의력과학 세페이드 3F 생명과학 1(상),"세페이드 과학 시리즈 무한상상 편. 과학고, 영재학교 및 특목고의 탐구력, 창의력 구술 검사 및 면접을 준비하는 학생에게 충분한 창의적 문제해결의 기회를 제공하며 과학올림피아드 포함 각종 경시대회나 중등영재교육원을 준비하는 학생에게 고등학교 물리1 수준 포함 그 이상의 기출문제와 중등Olympiad, 수능 문제까지 충분하게 제시하였고, 고등학교 내신 준비를 원하는 학생에게는 다양한 수준의 충분한 문제 제공을 통한 원리의 완전 이해를 가능하게 하여 내신 만점을 맞을 수 있도록 하였다."
홀로 공부하는 수능 수학 기출 분석 블랙홀수 수학 1 (2021년),새롭게 바뀐 수능의 성격을 이해하고 수능에서 요구하는 문제 해결의 사고 과정을 알 수 있도록 구성한 수험서다. ‘4단계 기출 분석법’을 통해 실전에서 적용할 수 있도록 하였다. 또한 친절하고 자세한 설명과 모두의 질문으로 혼자서도 학습하는 데 어려움이 없도록 하였다.
내공 고등영어독해 실력,"내공 고등영어독해 시리즈는 중고등학생들이 기본 독해력을 키움으로써 내신과 수능의 등급을 업그레이드 시킬 수 있도록 개발된 단계별 영어 독해 교재다. 개정 교과서와의 연계를 높이기 위해 2015 개정 교과서에 나온 문법을 지문에 반영함으로써 내신에 대비할 수 있도록 했으며, 별도의 수능 코너에서는 유형별 수능 문제를 풀어 보며 수능에 대비할 수 있게 구성되었다.

최신 경향에 맞는 다양하고 흥미로운 소재와 수능에 나오는 아카데믹한 소재까지 포괄하고 있는 지문을 통해 영어 독해의 즐거움을 누릴 수 있다. 또한 학교 시험 문제와 동일한 유형으로 구성된 서술형을 포함한 내신형 문제와 수능형 문제를 풀어 보며 지문의 이해도를 점검하고 시험에 대비할 수 있다."
2022 유튜브와 함께하는 사관학교 5년간 기출문제 다잡기 국.영.수 문.이과 통합편,"사관학교 5년간 기출문제를 수록한 수험서다. 빠르게 채점이 가능한 모바일 OMR와 전 문항 무료 해설 강의를 제공한다. 암기 달달 핵심 노트(과목별 암기 노트)를 PDF로 제공하며, 문제풀이 후 활용이 가능한 오답 다잡기표를 수록하였다. 새교육과정을 반영하여 2021학년도 수학 출제 영역을 문항별로 표기하였다."
워드바이트 Word BITE 핵심동사 830,"문장 구성의 가장 핵심인 동사를 집중하는 단어장이다. 자동사, 타동사, 구동사 중심으로 동사의 정확한 의미와 문장에서의 쓰임과 활용을 학습할 수 있도록 구성하였다. 수능, 내신에 자주 출제되는 동사 830개를 선별하여 수능, 내신 대비는 물론, 영어 실력 향상에 도움이 되는 고등 영단어 필독서다."
수능 Q&Q 특강 국어영역 고전 문학 (2020년용),"단기간에 수능의 핵심만 짚어주는 학습서로 수능의 윤곽을 빠르고 확실하게 잡아준다. 고전 문학 전 갈래의 개념과 특징을 분석하였으며 교과서와 기출, EBS 수록 작품 등을 종합하여 선별한 핵심 작품을 수록하였다.

갈래별로 대표 작품을 엮어 작품의 핵심이 담긴 기출문제와 출제 가능성이 높은 예상문제를 수록하였으며, 키워드를 통한 고전 문학 작품 감상 방법을 안내한다."
해법 문학 수필.극 : 11종 문학 참고서,"2009 개정 교육에 따른 11종 문학 교과서와 11종 국어 교과서를 포함하여 독서와 문법, 화법과 작문, 고전 교과서에 수록된 수필.극을 최대한 수록한 문학 참고서. 각 교과서에 수록된 수필 문학과 극 문학의 주요 작품을 포함하여 155편을 수록하여 이 한 권으로 수필.극 문학 공부를 끝낼 수 있도록 하였다."
2022 이동훈 기출 문제집 수능.평가원 수학 2 (2021년),"역대 수능, 평가원 모의고사, 실험평가, 예비평가, 예시문항 기출 중에서 2015개정 교육과정에 맞는 문항만을 수록하였다. 단, 효율적인 학습을 고려하여 단순한 계산문제, 지나치게 중복되는 기본적인 문제는 필요한 만큼만 남겼다. 그리고 일부 문항은 새 교육과정에 맞게 용어와 기호를 수정하였으나, 각 문항이 가진 출제의도가 훼손되는 변형은 일절 하지 않았다."
룩 LOOK 한국사 (2021년),"'룩(LOOK)'은 핵심 개념을 한눈에 정리하며 기본을 다지고 싶은 학생, 비주얼 자료로 쉽게 이해하며 공부의 재미를 찾고 싶은 학생을 대상으로 한 비주얼 개념서다. 한국사의 핵심 개념을 아이콘과 구조도로 한눈에 정리하여 내용을 쉽게 이해하고 오래 기억할 수 있도록 하였고, 중단원별로 다양한 유형의 문제를 제공하여 문제 해결력을 탄탄히 쌓을 수 있도록 구성하였다."
창의력과학 세페이드 3F 생명과학 1(하),"세페이드 과학 시리즈 무한상상 편. 과학고, 영재학교 및 특목고의 탐구력, 창의력 구술 검사 및 면접을 준비하는 학생에게 충분한 창의적 문제해결의 기회를 제공하며 과학올림피아드 포함 각종 경시대회나 중등영재교육원을 준비하는 학생에게 고등학교 물리1 수준 포함 그 이상의 기출문제와 중등Olympiad, 수능 문제까지 충분하게 제시하였고, 고등학교 내신 준비를 원하는 학생에게는 다양한 수준의 충분한 문제 제공을 통한 원리의 완전 이해를 가능하게 하여 내신 만점을 맞을 수 있도록 하였다."
합격자 학생부로 살펴본 Top19대학 학종 합격로드맵,"학생부종합전형에서 가장 중요한 학교생활기록부를 통째로 보여준다. 학생부에서 어떤 내용이 대학교에서는 좋은 평가를 받는지 평가요소별로 구별하여 제시하였다. 19개 주요대학에 합격한 학생들의 학교생활기록부를 보여줌으로써 학생과 교사 모두 도움을 받을 수 있다. 학생들에게는 수업시간에 어떻게 해야 깊이 있는 활동을 할 수 있는지, 교사들에게는 수업이나 수행평가를 어떻게 디자인해서 실제 수업에 적용해야 할지를 알려준다."
N기출 수능기출 문제집 수학영역 (선택과목) 기하 3점 / 4점 집중 (2021년),"<N기출 수능기출 문제집 수학영역 >은 최근 5개년 수능 및 평가원 기출 문제를 수록하였으며, 3점, 4점 기출 문제를 공통과목, 선택과목으로 분책하고 수능을 배점별, 난이도별로 대비할 수 있도록 구성하였다."
New Allead 올리드 수학 1 (2021년용),"2018년부터 적용되는 새 교육과정(2015 개정 교육과정)을 완벽하게 반영하여 출간한 교재로, 2019년에 고등학교 2학년이 되는 학생부터 학습할 수 있다. 새 교육과정에 맞추어 내용을 구성하고, 체계적으로 개념을 설명하여 수학의 원리를 쉽게 이해할 수 있다. 다양한 필수 예제와 풀이의 연관 개념 및 적용 방법을 제시하여 유형을 탄탄하게 학습할 수 있다. 유제와 중단원 마무리 문제를 수준별로 구성하여 유형에 대한 적응력을 높이고 문제 해결력을 극대화할 수 있다."
학생부종합전형 고교백서 : 학생부 + 자소서 + 면접,"최신 개정된 학생부 기재 요령을 완벽하게 반영하였다. 대학에 제대로 통하는 나만의 학생부 관리 비법과 항목별로 확실하게 점수 받는 자소서 쓰기, 본격적인 학종 시대, 더 비중이 높아진 면접 대비 등이 수록되어 있다."
100발 100중 고등 영어 기출문제집 C 2학기 중간고사 지학(민찬규) (2021년용),"기출문제를 종합 분석하여 출제율이 높은 문제를 다량 수록하였다. 출제 경향과 출제율을 반영해 실전 문제 및 수능형, 서술형 문제까지 완벽 대비할 수 있다. 교과서의 모든 내용이 자연스럽게 각인되는 단계별 학습 설계이며, 수업이나 자기주도 학습을 통해 학습 내용을 완벽하게 습득할 수 있도록 구성했다."
혼자하는 수능수학 미적분 (2020년),"평가원 문제를 대하는 기본적인 접근법을 알려준다. 2005년 이후 수능기출문제와 평가원 모의평가문제를 수록하였으며, 2015 개정교육과정에 따라 29개 논점으로 분류하였다."
