title,summary
혼자서도 쉽게 만드는 마크라메,"혼자서도 책을 보며 마크라메를 쉽게 만들 수 있도록 안내한다. 플랜트행어, 월행잉, 드림캐처, 모빌까지, 누구라도 책을 보고 마크라메를 독학할 수 있도록 초보자의 눈높이에 맞추어 자세하게 알려준다. 마치 동영상을 보듯 디테일한 사진을 실 한 올 한 올이 잘 보일 만큼 큼직하게 실었고, 과정마다 친절한 설명과 팁을 덧붙였다.

또한 매듭법을 동영상으로 더욱 쉽게 익힐 수 있도록 모든 작품 페이지마다 매듭법 QR코드를 수록했다. 한두 가지 매듭법만으로도 작품 하나를 충분히 완성할 수 있게 마크라메의 기본기를 탄탄하게 다져준다. 마크라메를 시작하는 초보자의 눈높이에 맞추어 누구나 쉽게 따라 만드는 데 중점을 두었지만, 마크라메 작품이 어느 공간에나 잘 어울릴 수 있도록 디자인을 트렌디하게 재해석하는 작업에도 심혈을 기울였다."
정통 마르세유 타로카드,타로마스터의 풍부한 상담 사례를 보강한 정통 타로카드에 대한 모든 것을 알려주는 해법서. 개정판에는 메이저 카드를 이용해 해석할 수 있는 실례 12개와 함께 메이저와 마이너 카드를 혼용해 해석하는 실례 12개를 추가했다. 같은 카드를 상황에 따라 다르게 해석하는 것에서 의미를 연결시키는 법 등 다양한 사례를 통해 실제 경험 못잖은 응용력을 키울 수 있다.
새 크레파스 봉봉,"오일파스텔 바람을 불러온 예술 베스트셀러 <크레파스 봉봉>이 더 예쁘고 새로워졌다. 따로 클래스에 가지 않아도 그림을 배울 수 있는 컬러링 아트북 <새 크레파스 봉봉>은 오일파스텔의 질감과 표정을 더욱 풍부하게 살린 4점의 새로운 작품과 기존 작품 18점으로 구성한 개정증보판.

봉봉오리 작가의 노하우가 담긴 ‘튜토리얼북’을 읽으며 ‘컬러링북’에 그리기만 하면 바로 ‘작품’이 된다. 어릴 적 그때처럼 마음껏 칠하며 자유로운 표현의 즐거움, 부드러운 그라데이션의 감동을 즐겨보자. 모든 그림에 영상 튜토리얼이 딸려 있어 누구나 쉽게 해볼 수 있다."
신개념의 TLS침법,"전통의 침술은 경락과 경혈에 기초하고 있다. 이러한 전통 침술을 현대의 과학과 접목하여 설명하려는 시도도 그간 여러 번 있었다. 또 시술 방법도 근육학과 신경학 등 해부 생리학적으로 접근하는 시도도 있었다. 하지만 전통의 경락 경혈 이론을 탈피하기에는 아직은 한계가 있는 것은 분명한 사실이다. 그럼에도 침술의 발전을 위해서는 새로운 각도의 해석과 시도는 부단히 이루어져야 한다. TLS침법은 신경학과 면역학 이론으로 고안된 신개념의 침법이다. 압통 유방점을 찾아 조이고 푸는 방식의 자극을 가해 침술의 고통은 최소화하고, 침술의 효과는 최대화되도록 고안된 침법이다."
필립 코틀러의 스포츠브랜드 마케팅,"TV 앞에 모여 앉아 경기를 시청하는 것만으로도 스포츠팬들은 즐거웠다. 쓰러져 가는 경기장이라도 선수들을 직접 볼 수 있다면 개의치 않았다. 그러나 세상이 바뀌고 스포츠가 유망 비즈니스 콘텐츠로 떠오르면서 스포츠시장은 정글이 되었다.

다양한 스포츠 콘텐츠를 경험한 팬들은 과거보다 훨씬 복잡하고 예측할 수 없는 소비 패턴을 보이며 진화하고 있다. 더이상 충성스럽지도 단순하지도 않은 ‘갈대 같은 스포츠팬’. 이들의 마음을 사로잡는 방법은 과연 무엇일까?

세계적인 마케팅 석학 필립 코틀러! 그가 열렬한 스포츠팬으로, 그리고 스포츠 비즈니스의 희망으로 우리 곁에 돌아왔다. 그는 이 책에서 감춰 둔 스포츠 광(狂)으로서의 면모를 유감없이 발휘하며, 오늘날의 스포츠 소비자를 분석하고 이들을 사로잡을 수 있는 체계적이고 참신한 전략을 쏟아 낸다.

그가 주장하는 스포츠 마케팅은 스포츠를 단순히 승패 위주의 게임으로 보는 시각에서 탈피해 스포츠 자체를 강력한 브랜드로 변화시키는 것이다. 전 세계 다양한 종목의 선수, 팀, 리그 등의 흥미로운 브랜딩 사례를 통해 진화하는 팬들을 사로잡아 보자."
줄리줄스의 코바늘 손뜨개 가랜드,"가랜드란 주로 벽에 길게 끈으로 매달아 장식하는 인테리어 소품을 뜻한다. 예를 들면 파티장에 줄줄이 매달린 알록달록한 삼각형 깃발, 꼬마전구를 활용한 전등 장식, 글자 모양 종이가 매달린 끈, 그리고 드라이플라워를 이용한 벽걸이 소품까지도 모두 가랜드라고 부를 수 있다. <줄리줄스의 코바늘 손뜨개 가랜드>는 바로 코바늘 손뜨개로 만들 수 있는 가랜드를 소개한다.

벽에 거는 장식으로서의 가랜드이지만, 그 활용법은 무척 다양하다. 책에 실린 가랜드를 응용한 감각적인 사진들은 독자들을 위한 힌트인 셈이다. 남녀노소 누구든 내키는 대로, 내 마음에 드는 색으로 떠서 다양하게 연출할 수 있는 것은 손뜨개 가랜드의 또 하나의 큰 매력이다. 브로치 같은 패션 소품, 티 코스터 등으로도 사용할 수 있기 때문에 벽에 매달아 장식했을 때와는 다른 재미를 느낄 수 있다."
치매를 산다는 것,"정신과 의사로 20년 넘게 치매노인들을 치료해온 지은이가 들려주는 치매노인들의 심리와 정신세계. 치매는 정말 두렵고 수수께끼 같은 질병일 뿐일까? 지은이는 치매에 대한 우리의 선입관 때문에 환자와 가족의 인생이 불행해진다고 지적한다. 이 책은 치매환자들이 비록 뇌가 손상되었다 해도 우리와는 조금 다를 뿐(!) 희로애락을 가진 인간이라는 점을 생생하게 보여준다.

공격성, 망상, 배회 그동안 이해할 수 없었던 증세 뒤에 감춰진 치매 환자들의 내면적 진실이 따뜻하고 담담한 문체를 통해 서술된다. 그는 책 전반에 보이는, 치매를 인생의 일부로 받아들인 환자와 가족들의 활기차고 씩씩한 모습을 통해 우리 사회가 이 '난치병'을 자연스럽게 받아들이고 담담하게 대처하는 법을 깨우쳐준다."
"삐뚤어진 얼굴, 습관 바로잡기","최근 들어 갑작스러운 턱의 통증으로 내원하는 성장기 아이들이 많아지고 있다. 스마트폰은 성장이 끝난 어른에 비해, 신체적인 변화가 큰 성장 단계의 아이들에게 특히 치명적이다. 스마트폰을 볼 때 반복적으로 취하게 되는 자세와 스마트폰을 보면서 걸을 때 나타나는 특징적인 보행 패턴이 신체의 불균형과 안면비대칭을 불러일으키기 때문이다.

실제 턱관절 장애나 안면비대칭을 고민하는 이들을 만나보면, 보통 외모 콤플렉스 외의 다른 신체 증상도 호소하는 경우가 많다. 턱관절 장애는 단순히 턱의 문제만이 아닐 수 있다. 우리 건강에 이상을 일으키는 원인일 수 있다. 얼굴비대칭 교정은 단순히 심미적으로 예뻐지기 위해서만 받는 치료가 아니라, 건강을 찾아가는 과정이다."
저녁노을 어스름,"사람으로 둔갑하여, 사람의 마을에 섞여 살아가는 신기한 동물들. 때때로 짓궂은 장난을 치기도 하지만, 마을과 거기 사는 주민들을 너무나도 좋아하는 동물들. 우리는 그들을 둔갑 동물이라고 부른다. 둔갑 동물과 사람이 만나, 서로 마음을 열어가며 훈훈한 이야기를 만들어낸다."
생활 속 면역 강화법,"면역력에 대한 기초 지식부터 시작해 암 극복에 있어서 면역력의 활용법, 내 몸의 증상으로 면역력을 파악하는 법, 면역력 강화 식사법과 생활 습관 등을 담고 있다. 면역력 강화 생활습관을 원리부터 자세하게 설명해, 습관으로 정착시킬 수 있도록 도움을 준다.

인체에 발생하는 수많은 질병은 결과적으로 ‘면역력이 제 기능을 하지 못했을 때’ 생겨나는 것이라고 할 수 있다. 따라서 면역력을 강화하는 생활을 한다면 자연이 준 애초의 수명을 온전히 누릴 수 있다. 또 아주 사소한 것만 바꿔도 면역력은 그 스스로가 알아서 강해진다고 저자는 말한다. 바르게 먹고, 잠자고, 숨 쉬는 법을 알고 매일 실천해서 습관으로 만들면 면역력에 대한 많은 문제가 해결된다."
나무로 만든 스툴,"‘스툴(stool)’이란 잠시 걸터앉아 쉴 수 있는 작은 간이 의자를 뜻한다. 앉았을 때의 편안함과 아름다운 조형감이 어우러진 작고 멋진 가구이다. 33인의 뛰어난 목공예가와 그들의 공방에서 만난, 저마다의 사연이 담긴 140여 점의 나무 스툴과 작은 의자들을 소개한다.

주방에서 요리를 할 때나 고단한 작업 중에 잠깐 쉴 수 있는 스툴, 어린이를 위해 디자인한 귀여운 동물 모양의 스툴, 몸이 불편한 부모님을 위한 가볍고 안정적인 스툴, 독특한 멋과 전통을 살린 개성 있는 디자인의 스툴, 버려진 나무를 재활용한 에코 스툴 등……. 이 책은 여러 목공예가가 각 스툴을 만들게 된 사연을 소개하며 그들이 생각하는 나무에 대한 애정, 기술적인 고민들, 소박하고 따뜻한 삶에 대한 이야기를 함께 담았다.

또한 각 장의 마지막 부분에는 책에 실린 목공예가가 직접 알려주는 DIY 코너를 실어, 목공에 관심이 있는 독자라면 누구나 책에 실린 의자와 작품들을 쉽게 만들어볼 수 있도록 했다ㅏ."
마이 디어 플라워,"사랑스러움이 가득한 핸드타이드, 감사의 마음을 담아 만드는 플라워 바스켓, 셀프 웨딩을 위한 나만의 특별한 부케와 하얗고 아름다운 화관, 싱그러운 식탁을 만드는 감각 있는 테이블 데코레이션, 여기에 일상의 공간에 생기를 불어넣어줄 미니 가드닝과 테라리움까지.

이 책에서는 그동안 많은 수강생과 인스타그램에서 사랑을 받았던 코코무드 플라워 클래스의 인기 아이템들을 모아 한 권으로 정리했다. 기초부터 차근차근, 꽃을 다루는 방법과 섬세한 손질법은 물론 꽃 구입 요령, 그리고 달콤하고 사랑스러운 감성을 담아 완성할 수 있는 코코무드만의 플라워 어레인지 노하우를 풍부하게 담았다. 사랑이 가득한 코코무드의 행복한 플라워 클래스와 함께 여러분의 일상을 더욱 눈부시고 아름답게 물들여보자."
딴뜨라 명상,"초보자도 명료하게 이해할 수 있도록 만들어진 명상 안내서이다. 명상 수련자에게 가능성을 열어 보여주고, 명상 경험을 얻기 위해 필요한 준비과정과 효과적인 방법을 제시한다.

책은 모든 상급 명상 수련을 위한 근본적인 토대로서, 본질적으로 쁘라띠야하라(감각 회수) 수련의 특성을 띤 안따르 모우나와 싸띠아난다 요가 니드라, 아자빠 자빠, 뜨라따까, 끄리야 같은 명상법, 그리고 다양한 만뜨라 수련을 담았다. 또한 스와미 싸띠아난다 사라스와띠가 지도한 수련내용을 그대로 실었다."
리넨이 있는 바느질 살롱,"리넨을 이용해 손바느질로 만들 수 있는 다양한 소품들이 담긴 DIY북. 가공을 하지 않은 천연 소재로, 그 특유의 질감과 자연스러운 느낌으로 인해 많은 인기를 얻고 있는 천 리넨. 방과 주방을 화사하게 만들어주는 인테리어 아이템, 책상 위 장식 소품, 피크닉 용품과 패션 액세서리 등 다양한 소품 48가지가 담겨 있다.

북 디자이너이자 일러스트레이터인 저자는, 자신만의 감각을 담아 다른 곳에서는 흔히 볼 수 없는 스타일의 소품들을 소개한다. 이 책에 담긴 소품들은 재봉틀이 없어도 바느질만으로 만들 수 있으며, 오히려 손바느질의 느낌을 잘 살리는 게 좋다. 단추와 라벨, 스탬프와 같은 기본적인 장식, 저자의 특기인 자수(스티치)로 인해 모든 소품이 한층 멋스럽게 완성된다."
28일 신진대사 다이어트,"날마다 세 번의 식사와 적어도 두 번의 간식까지 챙겨 먹는데도 체중은 계속 줄어드는 신진대사 다이어트. 더 이상 칼로리나 지방 함량 따위를 계산할 필요가 없다. 또 탄수화물 등 특정 식품군 섭취를 금지하는 다이어트를 실시할 필요도 없다. 대신 이미 검증된 간단한 식단 계획에 따라 단계별 음식들을 반복 섭취하기만 하면 된다.

이것은 신진대사를 활성화시키는 특수한 생리학적 변화를 목표로 세심하게 고안된 식단이다. 해일리 폼로이가 실제로 자신의 다이어트 프로그램에서 거둔 성과들을 바탕으로 만들어진 것이다. 여러 유명 인사와 운동선수들이 이미 그 효과를 입증했고, 의사의 권고로 체중을 감량해야만 했던 수많은 만성질환자들에게도 아주 효과적이었다. 그리고 이제 당신이 그것을 직접 경험해 볼 차례다.

4주간의 식단계획표와 간단한 레시피까지 수록된 이 책은 지금까지 온갖 다이어트를 시도했지만 번번이 실패를 거듭한, 상습적 다이어트 추종자들에게 특효약이 될 것이다. 그리고 신진대사 촉진을 목적으로 난생처음 다이어트를 시도하는 사람, 좀 더 날씬하고 건강한 몸을 만들기 위해 안전한 자연식 식단을 원하는 사람들에게 꼭 필요한 책이다."
천연식초를 알면 암은 없다,암은 물론 각종 병의 원인을 차단하는 천연식초의 효능과 제조법을 알려준다. 더불어 이미 병이 진행인 환자에게는 혈독을 제거하고 병마의 심장부를 깨트려 단숨에 건강을 회복할 수 있는 구체적이고도 정확한 방법을 제시한다. 5천년 조상의 얼이 서린 한국의 전통식초 속에 무병장수의 비법이 숨겨져 있음을 깨닫게 될 것이다.
치유에너지 일깨우기,"힐링타오 체계의 기초를 소개하는 책으로서 내면의 치유의 빛, 기, 혹은 생명력을 일깨우는 법을 누구나 간단하고 쉽게 따라 할 수 있도록 제시했다. 소주천은 소우주 회로인 임독맥을 여는 수련으로, 이 소주천을 완성하면 순수 건강 체질이 되고 기의 수수(收授)능력이 생겨 강력한 치유력이 배양된다.

또한, 중국계 氣전문가 만탁 치아가 그동안 비전으로 어렵게만 전수되어 왔던 소주천의 비밀을 쉽고 체계적인 방법으로 소개한다. 책을 통해 건강과 수련에 관심이 있는 사람이면 누구나 100일 만에 소주천을 완성할 수 있을 것이다."
병의 90%는 간 때문이다,"고전 한의학서 『황제내경』을 바탕으로 간 건강관리의 기본 방향을 제시해준다. 간이 안 좋아지면 나타나는 각종 질환별 자연치유법과 몸이 불편한 증상을 개선시키는 간단한 식이요법, 혈자리, 생활습관 등을 총망라했다. 오랫동안 환자들을 치료한 저자의 경험을 토대로 간을 튼튼하게 회복시켜 전신 건강을 지키는 방법을 알려준다.

‘침묵의 장기’라는 별명을 갖고 있듯이 간은 병이 상당 기간 진행되기 전까지는 증상이 없는 경우도 많아 단순한 감기 몸살이나 과로로 인한 피로, 위장병으로 오인할 때도 많다. 그러다 치료시기를 놓쳐버리면 간경화, 지방간 등 직접적인 질환뿐만 아니라 당뇨, 고혈압 등의 만성질환까지 이어질 수 있다. 간을 회복시켜주는 보양식을 처방해주고 생활 습관의 개선으로 더 큰 병을 예방할 수 있는 방법을 알려준다."
사계절 손뜨개,"만드는 재미와 착용하는 즐거움, 선물하는 행복까지 3종 세트를 가져다줄 손뜨개 책이 출간됐다. 책에서는 코바늘, 대바늘, 색색의 실만 있으면 누구나 만들 수 있는 패션&인테리어 소품 30개를 소개한다. 책 앞쪽에 수록된 대바늘뜨기, 코바늘뜨기 기법을 익혀 하나하나 따라 만들다 보면 집안 곳곳을 세련된 파스텔 톤으로 꾸밀 수 있는 것은 물론, 통통 튀는 액세서리와 가방으로 패션 위너까지 될 수 있다."
"Hello, 아로마테라피","아로마테라피에서 ‘안전한 사용의 기본’은 화학적 성분을 확인하는 것부터가 시작이다. 이 책에서는 각 에센셜 오일의 주요 성분을 화학 그래프로 제시하여 화학적 경향성을 한눈에 볼 수 있도록 하였다. 특히 자연의 에너지를 이용하는 아로마테라피스트들은 ‘어떤 증상이 몸에 나타나면 그 사람의 심리적 조건이나, 신체 내외 환경 등에 변화가 생겼다’는 전체론적 관점에서 출발하여, 이 세상에 오직 한 사람만을 위한 처방이 되도록 충분히 듣고 이해를 하도록 도와준다."
이웅용의 강아지 심리백과,"강아지 입양부터 훈련과 건강관리까지 모든 궁금증을 해결해주는 애견 지침서. 강아지 입양 전 준비, 데려온 첫날부터 생후 1년까지의 의식주 관리, 예의바른 강아지로 키우는 기본·응용 훈련, 주요 문제행동 교정법, 질병의 증상과 대처법, 응급처치, 미용관리까지 강아지를 키울 때 알아야 할 정보와 지식을 포인트만 콕 집어 알려준다. 또한 보호자들이 오랜 시간을 들여서 훈련시키거나 애견스쿨에 가야만 배울 수 있었던 특별한 훈련 방법을 본문에 삽입된 QR코드를 통해 연결된 동영상으로 쉽게 익힐 수 있도록 구성했다."
폐경기 여성의 몸 여성의 지혜,"저자 크리스티안 노스럽 박사는 <여성의 몸 여성의 지혜 Women's bodies, Women's Wisdom>로 세계적인 명성을 얻은 베스트셀러 저자이다. 그녀는 이 책에서 여성들의 주된 질병의 원인은 삶의 근본적인 여건에 뿌리를 두고 있다고 주장한다.

그리고 첨단 의학기술과 자연을 이용한 대체요법을 접목시킴으로써 독자들에게 자신의 몸에 적합한 치료법을 선택할 수 있는 방법을 안내한다. 첫 저서인 <여성의 몸 여성의 지혜>는 전세계 13개 언어로 번역되어 130만 부가 팔리는 대성공을 거두었다."
옷 갈아입는 아미무스 코바늘 손뜨개 인형,"아미무스 인형과 함께하는 신나는 코바늘 손뜨개 인형 옷 갈아입히기 놀이. “아미무스”는 손뜨개 여자아이 인형을 뜻하는 일본의 “아미구루미 무스메”를 줄인 말이다. 누구나 쉽게 코바늘 손뜨개로 아미, 미무, 무스 세 인형의 바디를 만들 수 있도록 상세한 과정 사진과 도안을 제공하며, 인형의 머리카락 심는 방법도 자세히 알려준다.

세 인형의 바디만이 아니라 각각의 인형에 어울리는 다양한 옷, 소품까지 직접 만드는 방법과 도안까지 모두 담았다. 또한 계절마다 달라지는 마미무스의 예쁜 옷들과 간지 나는 소품들을 만들어주세요. 크리스마스, 핼러윈, 공주, 동물의상을 입은 아미무스, 웨이트리스, 꽂집주인, 파티시에, 유치원 가는 아미무스, 파자마와 룸웨어를 입은 아미무스 등 패셔니스트 아미무스와 함께 옷 갈아입히기 놀이를 마음껏 즐겨볼 수 있다."
사계절 야생화 자수,"핸드메이드 시크릿 레시피 시리즈. 이 책은 리넨 위에서 바늘과 실을 통해 피어난 사계절의 야생화를 색감이면 색감, 디테일이면 디테일 어느 것 하나 놓치지 않는 토츠카식 자수와 만나 더욱 아름답게 표현해냈다. 108개의 야생화 자수 도안은 모두 100% 실제 크기로 수록하였으며, 여러 개의 도안이 모여 하나의 멋진 작품이 되는 작은 도안부터, 하나만으로도 눈길을 사로잡는 대형 도안까지 다양하게 수록되어 있어 자수 초급자와 중고급자까지 모두 만족할 수 있도록 구성되었다.

또한, 각 계절에 피는 야생화의 모티브는 물론 액자와 가방, 양산과 쿠션, 그리고 테이블센터까지 자수를 이용한 생활 소품을 소개해 활용도를 높였다. 자주 사용하는 기본 스티치 방법과 수를 놓기 전 알아두면 좋은 기초 지식 역시 탄탄하게 수록하였으며, 맨 뒷장에는 퀼트 & 자수 No.1 쇼핑몰 엔조이퀼트의 2,000원 할인 쿠폰도 수록되어 있어 유용하게 활용할 수 있다."
요가니드라 워크북,"비하르요가대학교의 싸띠아난다 요가니드라를 토대로 하고 있으며, 비하르요가의 내면요가를 응용하여 실제로 요가니드라를 안내하고자 하는 사람들을 위한 워크북이다. 저자는 요가니드라를 배우고자 하는 사람들을 위해 자신의 실제 경험을 바탕으로 좀 더 쉽고 체계적인 방법을 소개한다.

몸과 마음의 이완을 넘어 영혼의 이완을 다루고 있는데, 먼저 긴장과 이완에 대한 현대인의 그릇된 이해를 지적하고, 이완의 깊은 이해와 이완을 가져오기 위한 주요 원리를 제시한다. 저자는 요가니드라의 실시경험과 다양한 체험을 토대로 누구나 쉽게 요가니드라를 안내할 수 있도록 체계적으로 정리하였다. 학생의 경우 최대한의 학습효과를 가져오기 위해 이완학습법이 필요하며, 직장인은 생산적이고 효율적인 업무를 위해 이완훈련이 필요하다. 또한 무의식의 긴장을 치료하기 위한 상담에서도, 다양한 질병을 치료하기 위한 자가치료 방법으로도 이완이 필요하다. 이러한 이완을 훈련하기 위한 방법으로 요가니드라를 어떻게 실시하고 안내해야 하는지를 세심하게 알려준다."
Get Style 1,"기초부터 고급까지 다양한 기술을 응용하여 자기만의 스타일을 찾을 수 있게 길잡이 역할을 해주는 유용한 애견미용 서적. 초심자부터 현직 미용사분들까지 애견미용의 다양한 스타일의 이해를 돕기 위한 목적을 가지고 만들게 되었다. 유명 애견미용샵 원장님이 전하는 애견미용 테크닉과 노하우, 푸들과 비숑의 다양한 스타일 커트과정, 개성을 살려 장점을 부각시키고 단점을 보완하는 커트 방법 알아가기 등이 담겨있다."
"야생화 자수, 그림이 되다","이 책은 야생화 자수 실용서입니다. 쉬운 방법으로 풍성한 자수 작품을 수놓는 방법을 자세히 안내합니다. 글, 삽화, 사진 등을 다양하게 수록하여 누구나 쉽게 이해하고, 따라할 수 있도록 하였습니다. 특히 작품 안에 우리 전통 자수 기법과 서양 자수 기법을 혼용하여 색다르면서도 조화로운 작품을 만드는 방법을 소개하고자 하였습니다. 곤충이나 동물 등의 도안을 곁들여 활용할 수 있도록 하였고, 자수를 놓아 만든 소품 사진을 실어 디자인 아이디어를 제공하고자 하였습니다.

이 책은 모든 사람이 쉽게 자수를 접할 수 있기를 바라는 마음으로 만들어졌습니다.
크게 3부로 나뉘어 있습니다.

‘I 자수의 기초 배우기’에는 자수 작품을 만들기 위한 기초적인 내용이 담겨 있습니다. 재료와 도구, 도구 사용법, 수놓기의 시작부터 작품을 완성하기까지 필요한 내용을 안내하였습니다. 특히 이 책에서 사용하는 스티치 기법 모두를 삽화로 제시하였습니다. 이 장에는 다음 부를 위한 기본을 다지고, 책 속의 작품은 물론, 다른 자수 작품을 만들 때에도 활용할 수 있는 내용을 담았습니다.

‘II 자수 작품 만들기’에는 28가지의 야생화 작품을 수놓는 과정을 사진과 글로 자세히 실었습니다. 또한 야생화와 곁들여 표현할 수 있는 병아리, 개구리, 꽃신 등의 자수 도안과 과정을 수록하여 더욱 풍부한 야생화 작품을 만들 수 있도록 하였습니다. 완성 작품과 실물 크기의 도안도 함께 제시하여 책과 똑같은 작품뿐 아니라, 이를 활용한 다양한 작품을 만들 수 있도록 하였습니다. 특히 도안에는 각 부분마다 필요한 실색과 스티치 기법을 일일이 표기하여 도안만으로도 작품을 만들기에 모자람이 없도록 하였습니다.

‘III 자수 소품 보기’에는 ‘II 자수 작품 만들기’의 작품을 활용하여 만든 소품 사진들을 실었습니다. 이 책에서 아이디어를 얻어, 더욱 다양한 소품에 자수를 활용할 수 있을 것입니다."
