title,summary
죽은 민중의 시대 안병무를 다시 본다,"다섯 연구자가 안병무 10주기(2006년 10월 19일)를 앞두고 ‘안병무 다시 읽기’라는 공통된 문제의식 아래 2년여에 걸쳐 연구와 토론을 거친 끝에 집필했다. 안병무는 민중신학 개척자의 한 사람이자, 민중신학이 세계적으로 주목을 받는 데에 결정적으로 기여한 한국의 대표적인 민중신학자이다.

‘다시 읽기’라는 문제 설정에 맞게 안병무를 1970~1980년대 사회, 문화적 맥락에서 읽는 게 아니라, ‘지금 우리’의 시공간에서, 지금 이 시대의 맥락을 주요 변수로 보았다. 안병무의 글을 그 자체의 시공간에서 이탈시켜 우리 자신의 시공간 속 문제의식과 대면시켰다.

안병무 신학의 가장 중요한 특징이 자기 시대의 문제의식에서 신학적 사유를 출발한 데 있는 것처럼, 지은이들도 우리 시대의 맥락 속에서 안병무를 재위치시킴으로써 ‘안병무 다시 읽기’라는 담론을 시도했다."
보현행원 염불성불,"서방정토에 왕생해야 비로소 십대원왕이 원만해진다. 국내에서는 처음으로 화엄경 보현행원품을 정토법문으로 해설한 정토서적이다. 화엄경 보현행원품 경문과 정공 큰스님께서 1992년 3월 싱가포르 불교거사림에서 강연한 《보현대사 행원의 계시》를 텍스트로 번역하되, 경명 제목과 게송부분 주석의 경우 자주 법사께서 강술하신 《대방광불화엄경입부사의해탈경계보현행원품 친문기》를 보충하여 정토행자이자 번역가인 허만항 거사가 번역하였다."
"왕실, 권력 그리고 불화","왕실의 내탕금을 바탕으로 왕, 비빈, 대군 등 왕실 구성원의 발원 및 후원으로 이루어진 왕실불화는 한 시대의 미술 양식을 주도했다. 따라서 왕실발원 불화는 단순히 종교미술이라는 수준을 넘어 왕실의 불교정책 및 불교에 대한 인식, 불사 후원, 불교와의 관계 등을 파악할 수 있다는 점에서 고려, 조선시대를 이해하는 시금석이라 할 수 있다. 이 책에서는 이러한 왕실 불화를 통해 고려, 조선시대를 들여다본다."
가스펠 프로젝트 신약 3 : 십자가와 부활 (저.고학년 지도자용 팩),"연대기적 흐름에서 “예수 그리스도 중심으로” 성경 66권을 조명하는 3년 과정 성경공부 교재,《가스펠 프로젝트 _ 신약3 십자가와 부활》의 초등 저고학년 지도자용 패키지이다. 초등학생 눈높이에 맞춘 복음적 교육 목표에 따라 다양한 시청각 자료와 활동 자료를 담았다. 모든 설교는 예수 그리스도와 연결하여 복음 초청으로 이어지며 게임과 퀴즈 코드로 구성한 다양한 활동을 통해 성경의 메시지와 핵심 교리를 익힐 수 있다.

12권 시리즈 중 아홉 번째 책인 《가스펠 프로젝트 _ 신약3 십자가와 부활》에서는 복음서와 이사야를 통해 하나님의 구원 계획을 발견한다. 예수님은 제자들과 마지막 만찬을 나누며 새 언약을 약속하셨다.

십자가의 죽음과 부활을 통해 우리를 죄에서 구원하셨다. 십자가에서 죽으시고 부활하신 예수님은 제자들에게 나타나 지상 명령과 다시 오실 것을 선포하셨다. 하나님이 약속하신 대로 예수님은 구원자로 오셔서 우리를 죄에서 구원하셨다. 예수님이 다시 오시는 그날, 우리는 영원히 하나님과 함께하게 될 것이다."
IQ EQ가 쑥쑥 자라는 성경인물 스티커북 : 노아,"IQ EQ 성경 인물 스티커북 노아편. IQ EQ 성경 스티커북은 지혜로운 성경을 배울 뿐 아니라 다양한 활동을 통해 창의력, 사고력, 집중력, 추리력을 높여준다. 창의력 생생한 그림과 함께 성경 이야기를 읽으며, 사고력 주어진 활동과 문제를 풀어가는 과정 속에 생각하는 능력이 생긴다. 집중력 색칠하기, 미로 찾기를 하다 보면 자연스럽게 소근육이 발달하고 집중력이 자란다. 추리력 페이지마다 제시된 문제를 해결하며 상상력과 함께 추리력을 기를 수 있다."
선으로 푼 근본교리,"저자 백운 스님은 삶 속에서 보살행을 실천하고, 생활 속에서 깨달음을 얻도록 참선을 지도하고 있다. 백운 스님의 육성법문을 옮긴 책이다. 최대한 선의 종지를 벗어나지 않는 한도 내에서 스님의 본뜻을 드러내기 위해 구어체로 기술하였다. 누구나 쉽게 선 법문을 통해 깨달아 들어 갈 수 있는 언하대오의 방편을 열어둠으로써, 간화선 이전의 조사선 가풍과 법등을 되살리는 불씨가 될 것이다."
주일 성서일과에 따른 말씀 묵상 : 교회력(나해),"교회력에 의한 성서일과를 따른 묵상집이다. 교회력은 그리스도의 생애를 기준으로 한해를 분할하여 그 생애를 기념하고 참여할 수 있게 하는 교회의 전례력으로서 대림절(강림절)을 시작으로 성탄절, 주현절(현현절), 사순절, 부활절, 성령강림절에 이른다. 4세기경 이 교회력을 따라 낭독되는 성서본문의 일람표가 만들어졌는데 그것을 ‘교회력에 의한 성서일과’라고 한다.

성서일과는 독서를 의미하는 라틴어 ‘렉시오’에서 유래한 말로, 공적인 예배에서 회중들에게 낭독하기 위해 질서 있게 정리한 성구집을 일컫는다. 이와 같은 성서일과에는 네 편의 복음서뿐만 아니라 그리스도의 구원 사업과 관련된 구신약성서 전체에 걸쳐 있는 본문들이 포함되어 있다.

저자는 교회력에 의한 성서일과가 설교 강단에서 회복되어야 하고 신자들의 삶 속에 정착되어야 한다고 본다. 그렇게 함으로써 설교자 개인의 성향이나 의도에 따라 강단이 편중되는 과오를 범하지 않을 수 있고 복음이 낡은 과거에 머물러 있는 것이 아니라 오늘의 사건이 될 수 있다고 말한다.

* 주일 성서일과는 3년을 주기(‘가’해, ‘나’해, ‘다’해)로 되풀이되며, 오는 대림절과 함께 새로 시작되는 2014-2015년 교회력의 주일 성독(聖讀)은 ‘나’해에 따라 진행된다."
개혁주의 무천년설,"킴 리들바거는 명확하고 이해하기 쉬운 방법으로 무천년설을 천년왕국에 대한 역사적 개신교의 입장으로서 제시하고 변호한다. 무천년주의자들은 천년왕국을 그리스도의 재림 이후 지상에 임할 그리스도의 통치에 대한 미래적인 소망으로 생각하지 않고, 그리스도의 천상 통치 가운데 현재하는 실재로 믿는다.

리들바거는 종말론이 복잡하고 논쟁적인 주제라는 사실을 인식하면서, 핵심 용어들을 정의하고, 다양한 관점들을 개관하면서, 관련된 성경 주제들을 다룬다. 그런 후에 리들바거는 천년왕국에 대한 논쟁에서 중요하게 다루는 본문들인 다니엘 9장, 마태복음 24장, 로마서 11장, 요한계시록 20장에 대해 논의한다.

마지막으로 리들바거는 주요한 천년왕국 입장들(세대주의적 전천년설, 역사적 전천년설, 후천년설, 과거주의) 각각이 직면한 주요 문제들을 평가하고, 독자들에게 각 입장들이 끼치는 영향들에 대해 아는 것이 중요하다는 것을 상기시켜준다."
기독교 심리학,"심리학은 인본주의로부터 출발하였다. 신본주의에 기초한 기독교는 심리학과 서로 어울리지 않아 보인다. 하지만 전인(全人)으로서 영혼 돌봄(Soul Care)의 문제는 심리학이라는 학문을 포함하고 있다. 이러한 관점에서 기독교와 심리학은 갈등과 통합의 과정을 겪고 있다.

심리학은 다소 실천적인 영역을 다룬다. 하지만 학문적 근거는 상당히 중요하다. 기초가 견고해야 지속성과 효율성이 있기 때문이다. 저자는 학문의 기초 위에서 실천적인 영역까지 다룬다. 내면을 다루는 도서는 그동안 많이 나왔지만 심리학이라는 학문을 신학 혹은 성경의 관점에서 종합적으로 다룬 책은 찾아보기 어렵다.

이 책은 기독교와 심리학, 학문과 삶의 ‘통합’과 ‘균형’을 이루었다. ‘통합’을 이루기 위하여 양 끝을 알아야 한다. ‘균형’을 잡기 위하여 중간지점을 찾아야 한다. 에릭 L. 존슨의 『기독교 심리학』은 성경이라는 중심을 잡고, 심리학이라는 방대한 학문의 분야를 총체적으로 다루었다는 점에서 충분한 가치가 있다."
죄인은 죽어서 어디로 가는가,"성경은 모든 사람이 죄인이며, 죄를 지으면 죄의 삯을 받는다는 것을 분명히 말하고 있다. 구원받지 않고 죽은 모든 죄인들은 지옥으로 갈 것이다. 이 책은 죽음 이후의 세계에 대해서 설명하고 있으며, 죽음과 심판과 지옥이야말로 죄인들이 직면한 가장 실제적인 문제임을 알려 준다."
키워드로 읽는 성경,"성경읽기, 성경공부, 설교 준비를 위해서는 필요한 책이다. 한 페이지로 보는 성경 각 권의 배경사와 성경 각 권의 구조를 정확하게 파악하고 이해할 수 있는 ‘대키워드’와 ‘소키워드’ 분류가 특징이다."
난강망 : 전통 구전 명리학,자연론에 기초하여 글자 간의 자의(뜻)를 자연의 이치에 비유하여 쉽고 정확하게 설명하고 있는 책이다.
교부들의 성경 주해 신약성경 13,"<교부들의 성경 주해> 구약성경 13권. 신.구약 성경 전권에 대한 교부들의 사상과 신앙을 그 정수만 뽑아 현대어로 옮겨 엮은 29권의 방대한 총서다. 이 총서는 현대 독자들이 고대 그리스도교 시대에 활동한 교부들의 핵심 사상에 스스로 다가가 심취해 볼 기회를 제공한다.

교부 시대는 로마의 클레멘스(재위 92년경~101년)부터 다마스쿠스의 요한(650년경~750년)에 이르기까지 그 해당 시기를 말한다. 따라서 이 총서는 신약성경이 마무리되는 시기부터 존자 베다를 포함하는 8세기 중엽까지, 7세기에 걸쳐 이루어진 성경 해석을 다루고 있다."
하나님의 눈으로 나를 찾다,"그리스도 안에서 찾는 성경적 자존감. 하나님이 없는 그 모든 노력과 해답은 그저 듣기 좋은 허울이며 허상에 불과하다고 강력히 이야기한다. 우리는 우리를 만드신 분보다 우리를 더 잘 알지 못하며 알 수도 없다. 그것은 마치 사용설명서 없이 처음 보는 전자제품을 이해하려 하는 것과 같다는 것이다.

그러나 염려하지 마라. 우리가 그리스도를 따르는 자들이며 그의 제자라면 우리의 정체성은 이미 결정되어 있다! 우리는 우리가 했던 일이나, 혹은 하지 못했던 일에 의해 규정되지 않는다. 오직 내 안에 사시는 분, 그의 놀랍고 영광스런 임재에 의해 규정된다. 하나님의 눈으로 ‘나’의 진정한 정체성을 찾으라. 그것은 하나님이 우리에게 알려주기 원하시는 삶의 기쁨과 자유이며, 우리를 확신과 용기의 삶으로 이끌 것이다."
역무백서,"무속인 초보자들이 이해하기 쉽고 응용할 수 있도록 만들었다. 음양 오행 기원설, 10간과 12지, 제합 및 각종 신살, 각종 신살과 각 성들으 작용운세 등의 내용을 담았다."
랄프 윈터의 비서구 선교운동사,"제국주의의 쇠퇴와 비서구 국가들의 선진화 시기인 1945년부터 1969년까지의 25년 동안, 비서구권에는 모두의 예상을 뒤엎고 놀라운 변화가 일어났다. 윈터는 바로 그 시기의 변화를 정확히 짚어 낸다. 그 시기의 변화는 바로 세계 기독교의 주도권이 서구권에서 비서구권으로 넘어간 것이다.

선교사들이 물러간 이후에도 비서구권의 선교는 전혀 쇠퇴하지 않았고, 하나님이 놀라운 부흥을 일으키셨다. 비서구권에 수많은 교회가 생겨나기 시작했으며, 지상명령의 대업을 성취하기 위한 일꾼들이 일어나기 시작했다. 현시대의 새로운 선교의 흐름이나 이슈를 다루는 것은 아니지만, 이 책이 다루는 격동 25년을 통해 우리는 미래 선교의 변화를 헤아리고 가늠하는 지혜를 얻을 수 있다."
하루를 예수님과 함께,"성서의 길에 따라 그리스도께서 하신 생각과 말씀과 행동을 꿰뚫어보고, 이들을 우리 자신의 것이 되게 하게끔 인도해 주는 책. 어떻게 하면 또 하나의 그리스도가 되는지를, 결국에는 그분의 제자임을 고백한 모든 이들의 소명이 무엇인지를 가르쳐 준다."
성경 : 비교할 수 없는 책,"시대를 사는 그리스도인 시리즈. 현대 사회에서 그 권위가 실추되고 있으나 여전히 진리와 지혜의 보고이며 빛과 힘과 위로를 주는 '비교할 수 없는 책' 성경을 탐구한다. 시대를 사는 그리스도인은 하나님의 말씀에 계속 거하고 그것에 반응하며 그것을 해석하고 설명해야 할 긴박한 필요가 있다. 복음주의 거장 존 스토트는 이 책에서 ""수정 같은 명료성과 반짝이는 문장들""로 교리 및 제자도에 관한 ""타협 없는 진리""를 드러내며 ""현대 세계와 통찰력 넘치는 대화를"" 나눈다."
요한계시록.쓰다,쓰다 시리즈. 나의 손을 거쳐 필사한 구절들을 한번 더 묵상하며 되새긴다. 이제는 꾸미기까지 하여 완전히 내것(나만의 책)으로 만들 수 있다. 공간 활용에 자유로운 이 모눈(grid) 노트가 나만의 필사책을 만드는 것에 도움을 줄 것이다.
선택이란 무엇인가,"비교신학 시리즈 7권. 하나님은 언제 선택하시는가에 대한 다섯 가지의 일반적인 관점들을 대조적으로 잘 보여 주는 책이 나왔다. 이 관점들은 교회 역사를 통해 가장 성경에 충실한 사상들로 분류되어 지금까지 발전되어 온 사상들이다. 기고자들은 각 장에서 자신들의 입장에서 체계적으로 기술하고 있으며, 주요한 성경적, 역사적, 신학적 이슈들을 집중적으로 다룬다. 이에 더하여 각 기고자들은 각자의 입장에서 다른 입장들에 대한 간략한 비평을 한다."
로마카톨릭과 성경,"로마카톨릭은 교회의 권위를 성경 위에 둔다. 로마카톨릭은 성도들의 손에서 성경을 빼앗아버렸으며, 하나님의 말씀을 파괴시키려는 많은 노력을 기울였다. 이 책은 원문비평학이라는 학문을 누구나 쉽게 알 수 있도록 평이한 설명과 만화 스타일로 제작하였다.

성경의 기록, 성경의 번역, 그리고 중세 시대와 종교개혁 시대를 지나 오늘날의 배교의 역사까지 교회사를 관통하되, 성경의 역사를 중심으로 다루어 놓았다. 그리고 성경 변개와 배교의 중심에 로마카톨릭이 있다는 것도 자세하게 밝혀 놓았다."
[브라운] 로고스 히브리어 분해대조성경 세트 - 전4권 - 단본.무색인,"한글성경과 히브리어원어 성경을 대조해놓고 문법을 분해하여 해당 단어에 대한 이해도를 높임으로써 히브리어성경을 보다 쉽게 읽고 그 의미들을 알 수 있게 만든성경이다. 모세오경,역사서,선지서,시가서 등 총4권으로 구성되어 있으며 모세오경은 창세기,출애굽기,레위기,민수기,신명기 까지 역사서는 여호수아부터 에스더 까지이며 선지서는 이사야부터 말라기까지 시가서는 욥기부터 아가서 까지이다."
합(合) 그리고 형(刑) 충(沖) 파(破) 해(害) 이야기,"합(合) 형(刑) 충(沖) 파(破) 해(害)의 깊은 의미를 전달하고 원진(怨嗔)이나 기타의 보조 프로그램을 함께 전하고자 한다. 다양하게 감추어둔 비밀스런 뜻을 읽어낼 수 있는 곳이 지장간(地藏干)이요, 이를 쉽게 풀어내는 열쇠가 합(合) 형(刑) 충(沖) 파(破) 해(害)라는 것이고 부족하다고 하여 감각적인 힌트를 주기 위하여 곁들여진 것이 신살(神殺)과 12운성(十二運星)이다.

이러한 것을 깊이 연구하고 이를 응용하여 글자 속의 비밀의 문을 열어서 이 세상의 이치와 자신의 가야할 길을 알 수만 있다면 역(易)은 다른 그 어떤 학문과도 견줄 수 없는 최고의 학문이 된다고 자부할 수가 있을 것이다."
어느 겁쟁이 목사의 공황장애 일기,"공황장애 10년차 목사가 말하는 공황장애. 목사인 저자에게 공황장애가 생겼다. 저자는 처음에는 기독교인으로서, 목사로서 신앙으로 공황장애를 극복해야 한다고, 이겨내야 한다고 생각했지만, 그것이 오히려 또다른 스트레스로 다가옴을 느끼게 되었다. 믿음이 부족해서 공황장애가 나에게 찾아온 게 아니고, 열심히 살려다가 갖게 된 질병이니 움츠러들고 숨기기보다는 목사로서 같은 마음의 병을 안고 있는 사람들을 격려해야겠다는 사명을 가지고 이 책을 집필하게 되었다."
하인리히 불링거의 교회론,불링거의 『교회론』을 통해 공교회에 대한 선명한 이해를 모든 목회자들과 신자들에게 알리고자 한다. 한국 교회에 펼쳐지고 있는 심각한 위기를 떠올리며 이에 대한 한 해결책으로서 취리히 종교개혁자인 하인리히 불링거의 보편 교회의 개념을 주목하게 하려는 것이다. 불링거가 하나님의 거룩한 교회를 대하는 자세와 우리가 대하는 자세가 얼마나 큰 차이가 있는가를 깊이 인식하게 될 것이다.
"다름, 또 하나의 선물","서로가 다르다는 사실을 받아들이고 이해하는 일이 쉽지 않은 우리에게 장바니에는 ‘다름’이 왜 축복이 되는지, 자신의 체험을 통하여 알게 해 주며 타인을 받아들이고 서로 다름을 극복하여 평등과 평화와 치유를 경험하도록 초대하고 있다.

민족, 국가, 종교, 출신 등이 서로 다른 사람들이 만났을 때‘다름’을 극복하고 이해하면서 그 안에서 치유와 평화를 일구어 내는 데 기여한다."
천 번의 순종,"<천 개의 심장> 이시온 최전방 선교사가 가슴으로 전하는 도전. 그의 심장은 예수 심장을 이식한 것이다. 그 심장의 주인이신 예수님은 십자가에 죽기까지 순종을 마다하지 않으셨다. 그분의 순종을 좇아 천 번이 아니라 만 번이라도, 끝까지 순종하는 삶을 살고자 늘 마음을 다잡는 그다.

하나뿐인 생명이지만 예수님의 십자가 순종이 아니었으면 살아가지 못할 인생임이 자명함을 알게 된 고3의 어느 날 이후, 그는 예수의 사람이 됐다. 잦은 부상으로 인해 어려서부터 품어왔던 축구선수의 꿈을 접고 선교단체 간사의 길로 인도함 받아 선교사로 헌신, 케냐에서 사역하다 선교동원가로 활약했다. 여러 나라를 탐방하다 그의 눈과 심장에 심겨진 아프간으로 향했고, 그곳에서 지금의 아내도 만났다. 테러의 공포로 위험하고 불안한 그 땅에서, 함께할 수 없는 가족은 한국에 남겨둔 채 교회는커녕 세상에도 자유롭게 알릴 수 없는 선교사역에 10여 년 동안 묵묵히 순종했다.

그 사역을 마무리하고 새로운 길을 떠날 준비를 위해 한국으로 들어와 잠시 시간을 보내는 동안, 그는 너무나 변해버린 이 세대의 모습에 깊은 탄식을 감추지 못했다. 이 세대를 향한 하나님의 마음에 집중하게 되었다. 그리고 이 책을 통해 그분의 마음을 함께 나누고자 한다."
성경이 살아나는 비블리오드라마,비블리오드라마를 통해 울고 웃고 만나며 살아있는 성경을 경험하게 만든다. 무조건 사역자의 성경의 가르침만을 주입하는 시대는 지났다. 스스로 성경 속에서 자기를 발견하고 하나님의 음성을 듣고자 노력하는 사람들에게 비블리오드라마는 열려있다. 설교와 성경을 역동적으로 전달하고자 하는 사역자에게 비블리오드라마는 놀라운 길을 제시하고 있다.
"찰스 스윈돌의 신약 인사이트 디모데전·후서, 디도서","이 시대 최고의 강해 설교자이자 성경 교사로 손꼽히는 찰스 스윈돌은 지난 50여 년간의 깊고도 진지한 성경 연구를 그의 필생의 결실로 담아내기 위해 신약 전권에 대한 통찰력 넘치는 해석서를 기획했다. 이 신약 인사이트 시리즈는 성경 본문에 대한 분명한 해석과 새로운 통찰을 제시하고, 흥미롭고 풍성한 이야기로 성경을 전달할 수 있도록 어렵고 난해하지 않은 언어로 독자들을 인도한다."
주역과 만나다 - 하,"『주역』은 한마디로 ‘변화變化’의 책이다. 변화는 밤하늘을 화려하게 수놓는 일월성신의 규칙적 운동과 땅에서 펼쳐지는 다양한 기후 현상 등으로 나타난다. 변화의 외연을 넓혀 살핀다면, 역사와 문명을 비롯한 생명권 전체에서 일어나는 시공의 문제로 확대될 것이다. 「십익十翼」은 생명의 시간표와 좌표를 읽 을 수 있는 내용과 체제로 이루어졌으며, 자연 계에서 관찰되는 변화의 과정에서 인간의 행 위법칙을 도출한 일종의 ‘도덕 형이상학’이다."
"참나, 명상으로 다가가다","20대부터 자신을 옭아맨 무상(無常)에서 벗어나기 위해 끊임없이 노력한 저자가 세속의 고민을 해결하고 행복을 얻고자 불교 공부와 수행을 통해 ‘참나’를 찾은 결과를 정리한 책이다. 재가불자의 길을 걸어온 저자는 어려운 불교 교리를 그림과 표로 쉽게 풀어냈으며 불교 가르침의 체계와 내용을 파악하기 쉽도록 수준에 따라 분류하여 논의를 전개하고 정리하였다.

이 책에서는 생사를 어떻게 극복할 수 있고, 우리의 마음은 어떻게 이루어져 있으며, 어떻게 괴로움에서 벗어날 수 있는지, 그리고 ‘나’와 ‘이 세상’의 실상은 무엇인지 등에 대해 논의하여 참나를 되찾는 기반을 다진다. 참나를 찾아가는 과정은 우리 모두의 삶의 고민 해결과 밀접히 연계되어 있다. 저자는 진리에 눈을 뜬 순간 삶은 180도 달라진다고 말한다."
대적,"모든 그리스도인이 피할 수 없는 '영적 전쟁'에서 우리의 대적을 다루는 책이다. 우리가 맞서 싸워야 할 적은 누구이며 그의 특징에 대해서 심도 있게 다룰 뿐만 아니라 그에 따른 그리스도인의 자세와 전투 기술을 깊이 있게 서술한다.

기도의 대가 '에드워드 바운즈' 목사가 작성한 원고를 바탕으로 출간된 이 책은 영적 전쟁에 대한 통찰을 제시하여 모든 그리스도인에게 명확한 대적관을 심어주며 이 전투를 치르는 데 있어 하나님과 그분의 말씀만을 신뢰하도록 해준다."
처음성경 성구사전,"국내 한글 성구 사전 중 유일하게 개역개정과 개역한글을 같이 수록한 사전이다. 360,000절이 수록되었으며, 스트롱 코드 번호를 이용해 누구나 쉽게 원어를 찾아 볼 수 있다. 한글 성경의 같은 단어들을 한 번에 찾아 볼 수 있으며 그 단어들이 원어에서 같은 의미로 사용되었는지 또는 다른 의미로 사용되었는지 알 수 있게 만들었다."
죽음을 극복하는 길,신론적이며 유물주의적인 사상이 만연되어 있는 이 시대에 기독교의 신관(神觀)과 창조신앙 및 그 밖의 중요한 사상을 흔들거나 부인하려는 서양의 현대 몇몇 과학자들의 사상과 이론에 맞서고 있다. 우리나라 구약학계의 권위자인 저자는 이 책에서 창세기를 중심으로 한 구약 성서 본문들에 대한 철저한 주석을 토대로 기독교의 기본 신앙을 명쾌하고도 확신에 넘치게 변증하고 있다.
사주 속의 신명이야기,"최초로 역학 속에서 신명을 읽을 수 있는 필독서이다. 역학의 기본을 알 수 있으며, 또한 신명의 세계가 보이고 신명의 때를 알 수가 있다. 신명 가리를 정확하게 할 수 있으며 역학속의 신명(神命)을 통변 할 수도 있다. 그리고 무속인도 역학을 통변 할 수 있다. 이 책 한권이면 통변에 자신감을 가질 수 있으며 자연을 이해할 수도 있다."
손에 잡히는 성경 개관,"성격 66권에 대한 각 권의 문학적 특징, 신학적 메시지, 하나님의 구속사 이야기, 역사적 배경들을 담았다. 수록된 300개가 넘는 각종 컬러지도, 도표, 사진 및 그림은 성경을 이해하는 데 큰 도움을 준다."
하나님은 나를 사랑하세요,나를 특별하게 창조하신 하나님께서는 실수하고 잘못할 때도 변함없이 나를 사랑한다. 그리고 나를 위해 하나뿐인 아들 예수님을 이 땅에 보내 주셨다. 주니어 아가페의 <처음 배우는 하나님 성품> 시리즈는 어린이 보드 그림책으로 따뜻한 그림과 함께 하나님이 어떤 분인지를 알려 준다.
