title,summary
씨뮬 9th 수능기출 전국연합학력평가 3년간 모의고사 생활과 윤리 고3 (2021년),"평가원에서 실시하는 대학수학능력시험과 6월, 9월 모의평가, 각 시도 교육청에서 시행한 전국연합학력평가, 입시전문 교육기관의 이투스, 종로, 비상 모의고사를 모두 수록하였다. 분석적 상세 해설, 선지 해설, 오답 피하기, 더 알아둘 개념 등 문제의 출제 의도를 정확히 이해하고 문항에 대한 자세한 분석을 확인하여 완벽한 학습이 가능하도록 구성하였다."
영어독해 고난도 200제,"수능, 사관학교, 경찰대학의 영어독해 시험은 출제 유형이 대동소이하고 어휘나 독해 난이도에서 큰 차이가 없을 뿐 아니라 출제 경향에서 서로 영향을 주는 측면도 있으므로 이 한 권으로 준비하면서 시너지 효과를 거둘 수 있도록 했다.

지문에는 시대를 초월한 가치를 가지는 고전은 물론 시의성이 최대한 반영된 최신 문장을 골고루 포함하였다. 또 글의 성격도 정치, 경제, 사회, 문화, 문학, 과학, 예술, 철학, 시사, 군사 등 출제 가능성이 있는 전 분야를 망라해 이 한 권만 제대로 공부하면 어떤 성격의 지문이 나와도 당황하지 않고 풀 수 있도록 하였다."
2022 어텐션 수학 기출문제집 수학 2 (2021년),"2015 개정 교육과정에 맞춰 2011학년도~2021학년도 평가원/수능 전문항을 수록했다. 문항의 정렬은 단원별, 출제년도 순으로 배치했다. 빠른답안과 더불어 해설지는 딱딱한 줄 글 형태가 아닌 문제 위에 직접 필기하여 작성했다. 교육부에서 제시하는 과목별 성격, 목표, 내용체계를 수록하였으며, 단원별 학습요소와 성취기준 및 유의사항을 수록하여 해당단원을 공부함에 있어 학생들에게 철저한 가이드라인을 제시한다."
버블티 고2 문학 해냄(조정래) 내신대비 1권 교과서 작품편 (2021년),"학교 시험 문제를 분석한 내신대비 교재이다. 전국 고등학교의 내신 기출문제를 작품별로 분류하고, 해당 작품별 최다 출제 문제들을 종합하고 분석하여 핵심 적중 문제들을 선별, 1권 교과서작품편, 2권 연계작품편으로 각각 출판하였다."
100발 100중 고등 영어 기출문제집 B 1학기 기말고사 천재(김태영) (2021년용),"기출문제를 종합 분석하여 출제율이 높은 문제를 다량 수록하였다. 출제 경향과 출제율을 반영해 실전 문제 및 수능형, 서술형 문제까지 완벽 대비할 수 있다. 교과서의 모든 내용이 자연스럽게 각인되는 단계별 학습 설계이며, 수업이나 자기주도 학습을 통해 학습 내용을 완벽하게 습득할 수 있는 구성이다. 또한, 풍부한 예시문과 자세한 설명을 통해 부족한 학습 보충이 가능하다."
"간호사, 그들이 사는 세상","간호사로 할 수 있는 다양한 길이 있다는 것은 알고 있었지만, 롤모델이 없어 그저 막막하기만 했던 그때 그 시절의 기억을 떠올리며 이 시대에 ‘간호’를 매개로 살아가게 될 간호사들이 비슷한 고민으로 방황하지 않기 바라며 기획한 책이다.

저자는 간호사를 꿈꾸는 학생들과 진로를 고민하는 간호사들에게 더 넓고 방대한 간호사의 길을 보여주려고 한다. 흔히 ‘간호사’라고 하면 병동에서 유니폼을 입고 환자를 간호하는 모습을 떠올리게 되지만, 간호사의 업무는 병동에 국한되지 않는다. 병원에서 근무한다고 해도 간호사는 병원 내 수십 개 부서에 배치되어 다양한 일을 하고 있다. 이뿐만이 아니다. 임상 간호사 경력을 기반으로 병원이 아닌 사회 여러 기관에서 자신의 역량을 발휘하며 사회에 공헌할 수 있는 일이 많다."
적중선택 EBS 완벽분석 최종점검 파이널 봉투모의고사 국어 언어와 매체 (2021년),2021년 EBS연계 교재를 완전분석 하여 개발된 실전형 봉투모의고사다. 짧은 시간에 3회분을 풀 수 있게 만들었다.
바른 생각과 바른 습관으로,"지문을 읽어내는 일관된 '바른 생각'을 문제를 풀어내는 일관된 '바른 습관'으로 나아갈 수 있는 사고과정과 해설지, 풀이과정을 제시하는 교재다. 수록된 사고과정을 수험기간 끝까지 같이할 바생바습 월간지와 6, 9월 모의고사 분석지 등을 제공한다."
2022 강민철의 기출분석 언어(문법) (2021년),"기출문제와 수능특강 언어 파트를 철저하게 분석하여 수능에 필요한 고등학교 수준의 필수적인 언어(문법) 개념들을 일목요연하게 정리하였다. 각각의 언어(문법) 개념들을 통합적으로 이해하고 정리할 수 있도록 강민철 선생님만의 방식으로 언어(문법) 개념들을 배치하였다. 2014학년도~2021학년도까지 수능, 평가원 기출문제 모두 수록하고 자세하고 친절하게 해설하였다."
La Vida 생명과학 1 기출문제집 (상)편 (2021년),"2014학년도 이후 평가원 모의평가(예비시행 포함), 교육청 학력평가 문항 중 2015 개정 교육과정에 맞는 4단원, 5단원 문항을 선별하였다. 비유전 단원의 경우 기출 문제에서 자주 출제된 개념들을 정리했고, 해설은 결과를 나열하는 것이 아니라, 시험장에서 사용할 수 있는 풀이 과정을 담았다. 또한 Comment를 통해 문제를 풀 때 떠올려야 하는 생각이나 다양한 팁을 함께 수록했다."
2022 SPICA 물리학 2 N제 (2021년),"개정 교육과정 기준으로 쓰여진, 내신, 논술이 아닌 오로지 수능 대비에 최적화된 문제집이다. 수능 과학탐구 영역 시험의 성격에 맞게 핵심 교과 내용을 소재로 분석, 추론 능력 등이 필요한 문제들을 담았다. 교과서 중심의 개념 학습과 기출 문제 풀이 학습을 완벽하게 끝낸 학생이라면 교과서와 기출의 핵심에 대한 이해를 점검하는 한편, 기출로는 부족할 수 있는 부분까지도 채울 수 있다."
적중선택 EBS 완벽분석 최종점검 파이널 봉투모의고사 수학 미적분 (2021년),2021년 EBS연계 교재를 완전분석 하여 개발된 실전형 봉투모의고사다. 짧은 시간에 3회분을 풀 수 있게 만들었다.
La Vida 생명과학 1 기출문제집 (하)편 (2021년),"2014학년도 이후 평가원 모의평가(예비시행 포함), 교육청 학력평가 문항 중 2015 개정 교육과정에 맞는 1~3단원 문항을 선별하였다. 기출 문제에서 자주 출제된 개념들을 정리했고, 해설은 결과를 나열하는 것이 아니라, 시험장에서 사용할 수 있는 풀이 과정을 담았다. 과거 문항 중 발문의 표현 방식이 최근의 평가원 문항과 다르거나 있어야 할 조건이 누락된 경우, 표현을 수정/추가하여 현재 평가원 문항의 표현 방식을 따르도록 했다. 여러 단원의 개념이 복합된 문항의 경우, 해당 문제를 푸는 데 필요한 개념 중 가장 뒤에 있는 단원에 배치하였다."
P.I.R.A.M 피램 수능 국어 생각 워크북 문학편 (2021년),"수능 국어가 변했다. 유형이 변했고, 문제의 순서가 변했다. 나아가 더 깊은 이해력, 더 높은 사고력을 요구하고 있다. <생각 워크북>은 생각의 전개에 없는 10개년 기출을 생각의 전개 목차대로 편집한 교재다. 생각의 전개에서 배운 내용을 추가 기출을 통해 완벽하게 정리할 수 있다."
고등학교 국어 내신 100점 기출문제집 금성(류수열) (하) (2021년),"고등국어 내신100점 기출문제집은 고등 1학년 국어 내신대비 교재이다. 전국 고등학교 기출문제를 분석하고, 출제 유형별로 분류하여 가장 많이 출제된 문제들을 엄선, 수록한 100% 학교 기출문제집으로 편집, 출판하였다. 소단원 핵심정리 - 핵심 출제 유형 - 교과서 분석 노트 - 소단원 예상문제 - 단원 종합문제로 구성되어 있다."
2022 기출의 파급효과 : 영어 (상) (2021년),"평가원이 절대평가 시행 체제에서 출제한 문제들에 대하여 한줄씩 구문 해설 및 독해 해설이 실려 있다. ""내가 풀어보니 이것이 맞다 혹은 효율적이다""가 아닌 ""평가원이 이 유형을 이렇게 바라보니 이렇게 풀어야 한다""를 제시하였다. 평가원의 보도자료를 제시하고 같이 해석해보며 풀이 방법을 만들어 간다."
KICE Process 바생바습 심화,"단순 개념에서 벗어나 이제는 실전적이고, 효율적인 하나의 공식을 이용할 수 있도록 체계적으로 구성하였다."
2022 규토 라이트 N제 미적분 (2021년),규토 라이트 N제는 기출문제와 개념 간의 격차를 최소화하고 1등급으로 도약하기 위한 탄탄한 base를 만들어 주기위해 기획한 교재이다. 학생들이 처음 개념을 학습한 뒤 막상 기출문제를 풀면 그 방대한 양과 난이도에 압도당하기 쉽다. 이를 최소화하기 위해 4단계로 구성하였고 책에 적혀 있는 규토 라이트 N제 100% 공부법으로 꾸준히 학습하다보면 역으로 기출문제를 압도할 수 있다.
EBS 고등 예비과정 한국사 (2021년용),"2015 개정 교육과정에 따른 교과서의 기본 개념들을 이해하기 쉽게 정리하였다. 엄선한 문제들을 풀어 봄으로써 내신은 물론 수능까지 든든하게 대비할 수 있으며, 개념 체크를 통해 개념을 다지고, 기본 문제를 통해 학교 시험에 대비할 수 있다."
MAPL 마플교과서 수학 (상) (2021년용),"개념서와 문제집이 한 권으로 이루어진 단권화 교재다. 반복적인 문제의 흐름과 확인, 변형, 발전문제의 심화된 고난도 문제를 통해 수학의 힘을 기를 수 있다. 학교 내신뿐만 아니라 전국연합모의고사 대비, 평가원모의고사 및 수능을 대비하는 복합적인 사고력을 기를 수 있다."
강성태 66일 공부법,"유튜브 1억 7천만뷰 돌파, 대한민국 자타공인 1등 공부 멘토로 자리매김한 강성태 공신닷컴 대표. 십여 년간 교육현장에서 수험생들을 만나온 온 저자는 공신에게는 공부법에 앞서 더 중요한 것이 공부 습관이며 이를 따로 정리해 알려 줄 필요성을 느껴 <강성태 66일 공부법>을 펴냈다. 특히 20만부 기념 개정증보판으로 출간한 이번 책은 실제 66일 공부법 실천자들의 사례를 토대로 해 더욱 현실적이고 구체적인 공부 조언을 강화한 것이 특징이다.

이 책은 공부 습관을 만드는 법과 공부법, 두 측면에서 학생들이 꼭 실천해야 하는 방법들을 구체적으로 담았다. 이 방법들은 모두 저자가 교육 현장에서 시행착오를 거치며 그 성과를 증명한 것들이라 신뢰할 수 있다. 이번만큼은 공부 습관을 확실히 잡고 싶은 청소년·공시생·취준생 등 모든 수험생들에게 이 책은 새로운 공부 출발점이자 유용한 길잡이가 될 것이다."
EBS 어휘가 독해다! : 수능 국어 어휘 (2021년용),"수능에 반드시 필요하고 자주 나오는 개념어, 주제어 집중 학습 가능 수능 문항 순서에 맞게 화법·작문·언어, 문학, 독서 순으로 구성하였다. '친절한 샘'이 정리해 주는 연관 어휘, '어휘 더하기'를 통해 다의어, 동음이의어까지 익힐 수 있다. 어휘의 뜻, 용례를 확인하는 문제 풀이로 화법·작문·언어(문법)와 문학의 개념어, 독서(비문학)의 실전 어휘를 확인, 기출 지문의 낯선 어휘를 스스로 정리하고 학습하여 기출 지문의 문항 해결이 가능하다."
100% 실전대비 MP3 고교영어듣기 24회 모의고사 1학년 (2021년),"전국 16개 시·도 교육청 공동 주관 고교영어듣기 능력 평가 완벽 반영, 서울시 고교영어듣기 문제를 반영하였다. 최신 기출문제 유형 완벽 재현! 총 24회, 480문제로 고교 내신 영어를 완벽 대비한다. 수능 듣기에 나오는 모든 유형 대비가 가능하며, 만점을 위한 고난도 문제를 수록하였다. 또한, 영국 성우 녹음이 포함되어 미국식, 영국식 영어 발음을 동시에 학습할 수 있다."
Xistory 자이스토리 전국연합학력평가 고1 국어 (2021년),"2017년 11월과 2018~2020년에 치러진 학력평가 모의고사 12회분을 수록하여 학력평가의 출제 유형과 출제 원리를 파악할 수 있다. 또한 학습 계획표에 따라 정해진 시간에 모의고사를 풀어본 후 왜 정답인지, 왜 오답인지를 명쾌하게 해결해 주는 입체 첨삭 해설을 꼼꼼히 본다면 국어 1등급에 도달할 수 있다."
개념 SSEN 쎈 고등 수학 1 (2021년용),"사전식 개념 기본서로서 개념을 체계적으로 나누고 각 개념별로 완전 학습이 이루어질 수 있도록 하였다. 군더더기 없이 간략하고, 수학적으로 엄밀한 개념 정리와 구체적이고 쉬운 설명을 함께 제공하여 학습자가 개념을 쉽게 이해하고 명확하게 정리할 수 있도록 하였다. 또한 개념과 관련된 대표유형을 연달아 구성하여 학습한 개념을 바로 대표유형과 유제를 통해 확인할 수 있으며, 3단계로 제공되는 중단원 연습 문제를 통해 응용력과 문제 해결력을 키울 수 있도록 하였다."
High School English 1 자습서 (2021년용),"High School English I 교과서(김성곤 외 8인)의 자습서로 교과서의 핵심 내용을 이해할 수 있으며 중간고사 및 기말고사를 통해 내신을 완벽하게 대비할 수 있다. 교과서 내용이 한 눈에 들어오도록 구성하였으며, 정답 및 예시 답안을 제시하고, 주요 어휘 및 표현 정리와 구문 설명을 통해 교과서 본문의 내용을 이해하기 쉽게 해설하였다. 한눈에 파악할 수 있으며 영영 정의와 함께 제시된 주요 어휘 뜻풀이를 통해, 어휘의 의미를 정확하게 파악할 수 있다."
올씀(ALL씀) 서술형 시리즈 3 : RANK 77,"<올씀(ALL씀) 서술형 시리즈>는 단계적으로 서술형을 해결하기 위해 최적화된 구성으로 <1권 : 기본 문장 PATTERN>, <2권 : 그래머 KNOWHOW>, < 3권 : 고등서술형 RANK 77> 순으로 학습하면 된다.

<올씀(ALL씀) 고등 서술형 RANK 77>에서는 고등 내신 서술형을 집중적으로 해결하기 위해, 실제 전국 216개 고교 의 최근 4개년 기출문제를 완벽 분석하여 담았다. 내신 1등급을 가르는 고등 서술형 문제에 전략적으로 접근하도록 가장 시험에 잘 나오는 빈도 순으로 목차를 구성하고, 포인트별 해결 방법을 제시한다."
수력충전 고등 수학 1 (2021년용),"개념을 깔끔하게 정리하여 단원의 중요 핵심 개념을 한눈에 파악할 수 있게 하였고, 반드시 알아야 하는 기본적인 개념과 원리가 설명되어 있다. 유형별로 나누어 가장 기본적인 문제를 반복적으로 풀 수 있게 하였으며, 유형 마지막에 개념을 다시 한 번 체크할 수 있도록 구성하였다. 또한, 그 단원에 속하는 개념을 적용하여 해결 가능하도록 문제를 구성하였다."
EBS 개념완성 문항편 과학탐구영역 화학 1 (2021년용),"교과서에서 꼭 학습해야 할 핵심 내용을 설명하고 핵심 개념 체크를 통해 학습한 내용을 점검할 수 있도록 구성하였다. 교과서 내용을 학습한 후 시험대비를 위해 출제 빈도가 높은, 꼭 풀어 봐야 할 문제들로 구성하였고, 내신평가의 서술형 문제와 단답형 문제에 대비할 수 있는 우수하고 유용한 문제들로 구성하였다."
Xistory 자이스토리 영어 어법.어휘 실전 (2021년),"최신 15개년 수능, 평가원 전 문항, 학평 우수 문항을 수록한 교재다. 최신 4개년 경찰대, 사관학교 전 문항을 실었고, 공부한 어법.어휘를 바로 적용하는 개념 확인 문제를 제공한다. 1등급, 2등급 킬러 문제 집중 학습 + 특강 해설을 수록하였다. 매력적 오답, 함정, 주의, 꿀팁 입체 분석 첨삭 해설을 실었고, 특별부록으로 휴대용 단어장을 제공한다."
진짜 잘 이해되는 고교 영문법 1 (2021년용),"고교 영문법의 기본 체계를 잡아주는 이해하기 쉬운 영문법 교재로 영문법의 기본 개념과 핵심 문법 내용을 이해하기 쉽도록 친절하게 설명하였으며, 내신형 및 서술형, 수능 문법 내용들로 내신 및 수능 어법 문항을 대비한다. 또한 학습한 문법 내용들을 누적시킨 TEST 문항들로 구성된 Workbook을 제공한다."
EBS 자투리 시간 활용백서 수능에 잘 나오는 사자성어 (2021년용),"<자투리 시간 활용 백서> 시리즈. 자투리 시간만으로 충분히 효과적인 학습을 할 수 있는 핸드북이다. 수능에 단골로 출제되는 사자성어만을 골라 공부하기 쉽게 정리한 교재로, 등하교 시간이나 친구를 기다리는 시간, 쉬는 시간을 활용하여 조금씩 천천히 공부해도 수능 사자성어는 완벽히 마스터할 수 있다."
EBS 개념완성 문항편 과학탐구영역 생명과학 1 (2021년용),"교과서에서 꼭 학습해야 할 핵심 내용을 설명하고 핵심 개념 체크를 통해 학습한 내용을 점검할 수 있도록 구성하였다. 핵심 개념 체크에서는 출제 예상 문제, 서답형 문제, 대단원 종합 문제, 고난도 문제를 제공한다."
EBS 올림포스 국어 (2021년),"국어 교과서에서 다루는 필수 작품들과 지문들을 엄선하여 다양한 문항 유형을 제시, 내신과 수능을 모두 대비할 수 있도록 구성하였다. 다양한 수행 평가 유형을 접하고 직접 익힐 수 있도록 특화된 ‘수행 평가’ 코너를 제공한다. 개념과 유형을 익히고 실전으로 테스트한다. 차근차근 따라가면 ‘국어’가 쉬워질 수 있도록 친절하고 명료하게 구성하였다."
빠른 독해 바른 독해 : 유형독해,"문제의 유형과 글을 읽는 목적에 따른 전략적인 접근을 목표로 구성되었다. 단순히 답을 찾는 요령을 알려주기보다는 글의 구성을 한눈에 파악하여 핵심 내용을 빠르게 찾고 글의 논리를 바르게 이해할 수 있는 능력을 갖출 수 있도록 구성하였다. 특히, 이번 개정판에서는, 최신 수능 경향에 맞춰 적용예제와 독해 지문들을 대폭 교체하고, 난이도가 높고 수능 지문에서 비중이 큰 빈칸 추론 유형 등에 대한 대비를 강화
하였다. 또한 지문 수를 정비하고, 내신 대비를 위한 <서술형 문제>를 보완하였다."
2021 마더텅 전국연합 학력평가 기출문제집 고2 영어 독해 (2021년),"학교 시험에 자주 출제되는 유형을 분석하여 적용한 유형별 기출문제집이다. 최신 수능에 최적화된 풍부하고 다양한 문항 구성, 총 478문항 수록하였다. 직독직해 훈련을 위한 끊어읽기 해설을 제공하고, 지문 이해를 돕는 친절한 첨삭해설 및 사진을 수록하였다."
EBS 2022학년도 뉴수능 스타트 국어영역 국어 (2021년),"2015 개정 교과서와 2022학년도 수능 예시 문항 및 최근 기출 문제를 체계적으로 분석하여 2022학년도 수능 국어영역을 철저하게 대비할 수 있다. 새로운 수능에 딱 맞는 개념, 유형별 문제, 실전 대비 문제를 제시하였다."
EBS 올림포스 기하 (2021년용),"내신과 수능을 위한 EBS 대표교재, 교과서 기본 개념 정리부터 내신과 수능까지 완벽 대비"
창비 고등 문학 자습서 (2021년용),"2015 개정 교육 과정에 따라 만든 창비 고등학교 문학 교과서의 자습서이다. 교과서의 중요 요소를 수록하여 학습자 스스로 공부할 수 있게 하였다. 교과서 내용을 잘 이해할 수 있도록 바탕글을 상세하게 설명하고 교과서 학습 활동에 대한 길잡이와 예시 답을 제시하였다. 또한 ‘지문 확인 문제, 소단원 핵심 문제, 작품 더 읽기 확인 문제, 중단원 핵심 문제’를 통해 각 단원에서 공부한 내용을 단계별로 확인해 볼 수 있게 하였다."
수능만만 어법어휘 모의고사 345제,"수험생들이 고전하는 유형 중 하나인 어법성 판단 유형과 어휘 관련 유형의 실전 문제 345개를 통해 수능 어법 및 어휘 문제에 대비할 수 있는 실전 모의고사 교재다. 최신 수능 출제 경향을 철저히 분석.반영한 실전 문항 345제 및 자주 출제되는 핵심 어법 포인트만을 정리한 친절한 문법 설명이 실려 있다. 출제가 예상되는 중요 어휘들을 품사별로 정리한 핵심 어휘 리스트를 수록하였으며, 본문에 나온 중요 어휘들을 휴대하며 학습할 수 있는 부록 어휘 암기장을 제공한다."
EBS 올림포스 전국연합학력평가 기출문제집 영어독해 고2 (2021년),"기출로 개념 잡고 내신 잡자! 신개념 개념+기출 기본서 <올림포스 전국연합학력평가 기출문제집>. 올림포스의 완벽한 개념과 검증된 전국연합학력평가의 문항이 만났다. 대표 기출 유형 수록부터 꼼꼼한 경향 분석, 상세한 해설, 풀이까지 제공한다."
1등급 만들기 화학 1 545제 (2021년용),"전국 고등학교의 기출 문제에서 뽑은 고빈출 유형 및 고난도, 통합형 문제를 수록하여 실제 시험에서의 문제 해결 능력을 기를 수 있도록 구성하였다."
능률 Grammar Zone 종합편 Workbook,"그래머존은 살아있는 예문과 자세한 문법 설명의 전(全)단계 문법 기본서다. 대대적인 개편을 거쳐 원어민처럼 영어를 사용하고픈 중고등 고급 학습자 및 성인을 위한 문법 레퍼런스로 탈바꿈한 종합편의 워크북으로, 다양한 유형의 문제를 풍부하게 수록하였다.

G-ZONE에서 학습한 내용을 점검할 수 있는 풍부한 연습 문제와, 일정 분량 학습 후 실력 점검이 가능하도록 실전 TEST 6회를 수록하였으며, 체계적인 설계로 문법 사항 확인부터 서술형 대비 및 쓰기 연습까지 학습한다."
Xistory 자이스토리 전국연합학력평가 고1 수학 (2021년),최신 4개년 전국연합학력평가 문항을 모의고사로 수록한 연도별 기출 교재다. 개정교육과정에 맞지 않는 문항은 교육과정에 맞도록 재구성하여 2016~2020년도 학력평가 문항들을 수록하였다.
EBS 국어 독해의 원리 현대 소설 (2021년용),"예비 고1~고2 학생들을 대상으로 문학 작품과 독서(비문학) 지문을 독해하는 방법을 정리한 수험서다. 독해 방법을 6가지 원리로 정리, 작품과 지문을 독해할 때 필요한 요소들을 한 번에 학습할 수 있다. 현대시, 현대 소설, 고전 시가, 고전 산문, 독서(비문학) 5권으로 구성하여 영역별로 집중 학습이 가능하다. 원리 익히기’에서 원리를 익히고, ‘원리 다지기’에서 원리를 적용하여 학습하는 단계별 구성으로, 작품과 지문마다 세세한 설명과 풍부한 보충 자료들을 제공하여 깊이 있는 학습이 가능하다. 내신형 문제, 단답형 문제, 서술형 문제, 수능형 문제 등 다양한 유형의 문항을 배치하여 내신과 수능을 동시에 대비할 수 있다."
EBS 단기특강 영어영역 영어독해 유형편 (2021년),"단기간에 내신을 끝내는 국어.영어.수학 단기 내신 교재이다. 완벽 개정하여 더 효율적인 분량으로 내신 학습에만 집중할 수 있다. 보충수업, 자습용으로 선택하기에 딱 좋은 체제와 분량으로, 방과 후 학습, 방학 학습에 최적화된 단기 학습서이다."
2021 마더텅 전국연합 학력평가 기출문제집 고1 수학 (상) (2021년),"중간.기말고사와 전국연합 학력평가 대비를 위한 기출문제집이다. 2004~2020년 최신 17개년 고1, 고2 전국연합 학력평가 중 2021년 교육과정에 맞는 우수 문항을 선별했고 학교 시험 대비를 위한 기본 개념 문제와 서술형 문제 등 총 1,459문항을 수록했다."
리얼 오리지널 전국연합 3개년 모의고사 고1 영어 (2021년),"[ALL NEW] 실제 시험지 크기와 느낌을 100% 그대로 살려 8절 크기로 제작했으며, 최근 3년간 시행된 3월, 6월, 9월, 11월 전국연합 학력평가 기출 문제를 12회 수록했다. 특히 「해설을 2배로 업그레이드」하여 듣기 PART는 [한줄 해석], 독해 PART는 [끊어 읽기+직독직해]를 수록했다. 별권 부록으로 회차별 [영단어장+단어 TEST] 핸드북을 제공하며, 실전 느낌을 높여주는 OMR카드도 무료 제공한다. 또한 문제 풀이 후 빠른 정답과 등급 컷을 통해 자신의 실력을 바로 확인할 수 있다."
